projects/hipblaslt/library/src/amd_detail/rocblaslt/src/Tensile/Logic/asm_full/gfx1151/GridBased/gfx1151_Cijk_Ailk_Bljk_HHS_BH_Bias_HAS_SAV_UserArgs.yaml
- {MinimumRequiredVersion: 5.0.0}
- gfx1151
- gfx1151
- [Device 1536]
    SolutionIndex: 0
    SolutionNameMin: Cijk_Ailk_Bljk_HHS_BH_Bias_HA_S_SAV_UserArgs_MT64x16x32_MI16x16x1_CMS_SN_LDSB0_AFC1_AG0_AFEM1_AFEM1_ASEM1_CLR1_CADS0_DTLA0_DTLB0_DTVA0_DTVB0_DTVSM0_DPLBn1_EPS0_ELFLR0_EMLLn1_FDSI0_GRPM1_GRVWA1_GRVWB1_GSU4_GSUAMB_GSUC0_GSUWGMRR0_GLS0_ISA1151_IU1_LDSTI0_LBSPPA2048_LBSPPB128_LBSPPM0_LPA16_LPB16_LPM0_LRVW16_LWPMn1_MIAV1_MIWT1_1_MO40_MGRIPMn1_NTn1_NTA0_NTB0_NTC0_NTD0_NTM0_NEPBS0_NLCA1_NLCB1_ONLL1_PGR2_PLR1_PKA0_SGROBn1_SIA3_SS0_SU32_SUM1_SUS256_SPO0_SRVW0_SSO0_SVW1_SK0_SKFTR0_SKXCCM0_SGRO0_TIN0_TLDS1_TLDSM1_ULSGRO0_USL1_UIOFGRO0_USFGROn1_VSn1_VWA1_VWB1_WSGRA0_WSGRB0_WS32_WG64_2_1_WGM8_WGMXCC1_WGMXCCGn1
    SolutionIndex: 1
    SolutionNameMin: Cijk_Ailk_Bljk_HHS_BH_Bias_HA_S_SAV_UserArgs_MT32x32x32_MI16x16x1_CMS_SN_LDSB0_AFC1_AG0_AFEM1_AFEM1_ASEM1_CLR1_CADS0_DTLA0_DTLB0_DTVA0_DTVB0_DTVSM0_DPLBn1_EPS0_ELFLR0_EMLLn1_FDSI0_GRPM1_GRVWA2_GRVWB8_GSU1_GSUAMB_GSUC0_GSUWGMRR0_GLS0_ISA1151_IU1_LDSTI0_LBSPPA1024_LBSPPB1024_LBSPPM0_LPA16_LPB16_LPM0_LRVW16_LWPMn1_MIAV1_MIWT1_1_MO40_MGRIPMn1_NTn1_NTA0_NTB0_NTC0_NTD0_NTM0_NEPBS0_NLCA1_NLCB1_ONLL1_PGR2_PLR1_PKA0_SGROBn1_SIA3_SS0_SU32_SUM1_SUS256_SPO0_SRVW0_SSO0_SVW1_SK0_SKFTR0_SKXCCM0_SGRO0_TIN0_TLDS0_TLDSM1_ULSGRO0_USL1_UIOFGRO0_USFGROn1_VSn1_VWA1_VWB1_WSGRA0_WSGRB0_WS32_WG32_4_1_WGM8_WGMXCC1_WGMXCCGn1
    SolutionIndex: 2
    SolutionNameMin: Cijk_Ailk_Bljk_HHS_BH_Bias_HA_S_SAV_UserArgs_MT32x32x32_MI16x16x1_CMS_SN_LDSB0_AFC1_AG0_AFEM1_AFEM1_ASEM1_CLR1_CADS0_DTLA0_DTLB0_DTVA0_DTVB0_DTVSM0_DPLBn1_EPS0_ELFLR0_EMLLn1_FDSI0_GRPM1_GRVWA2_GRVWB8_GSU1_GSUAMB_GSUC0_GSUWGMRR0_GLS0_ISA1151_IU1_LDSTI0_LBSPPA1024_LBSPPB128_LBSPPM0_LPA16_LPB16_LPM0_LRVW16_LWPMn1_MIAV1_MIWT1_1_MO40_MGRIPMn1_NTn1_NTA0_NTB0_NTC0_NTD0_NTM0_NEPBS0_NLCA1_NLCB1_ONLL1_PGR2_PLR1_PKA0_SGROBn1_SIA3_SS0_SU32_SUM1_SUS256_SPO0_SRVW0_SSO0_SVW1_SK0_SKFTR0_SKXCCM0_SGRO0_TIN0_TLDS1_TLDSM1_ULSGRO0_USL1_UIOFGRO0_USFGROn1_VSn1_VWA1_VWB1_WSGRA0_WSGRB0_WS32_WG32_4_1_WGM8_WGMXCC1_WGMXCCGn1
    SolutionIndex: 3
    SolutionNameMin: Cijk_Ailk_Bljk_HHS_BH_Bias_HA_S_SAV_UserArgs_MT32x32x32_MI16x16x1_CMS_SN_LDSB0_AFC1_AG0_AFEM1_AFEM1_ASEM1_CLR1_CADS0_DTLA0_DTLB0_DTVA0_DTVB0_DTVSM0_DPLBn1_EPS0_ELFLR0_EMLLn1_FDSI0_GRPM1_GRVWA1_GRVWB1_GSU1_GSUAMB_GSUC0_GSUWGMRR0_GLS0_ISA1151_IU1_LDSTI0_LBSPPA1024_LBSPPB128_LBSPPM0_LPA16_LPB16_LPM0_LRVW16_LWPMn1_MIAV1_MIWT1_1_MO40_MGRIPMn1_NTn1_NTA0_NTB0_NTC0_NTD0_NTM0_NEPBS0_NLCA1_NLCB1_ONLL1_PGR2_PLR1_PKA0_SGROBn1_SIA3_SS0_SU32_SUM1_SUS256_SPO0_SRVW0_SSO0_SVW1_SK0_SKFTR0_SKXCCM0_SGRO0_TIN0_TLDS1_TLDSM1_ULSGRO0_USL1_UIOFGRO0_USFGROn1_VSn1_VWA1_VWB1_WSGRA0_WSGRB0_WS32_WG32_4_1_WGM8_WGMXCC1_WGMXCCGn1
    SolutionIndex: 4
    SolutionNameMin: Cijk_Ailk_Bljk_HHS_BH_Bias_HA_S_SAV_UserArgs_MT16x64x32_MI16x16x1_CMS_SN_LDSB0_AFC1_AG0_AFEM1_AFEM1_ASEM1_CLR1_CADS0_DTLA0_DTLB0_DTVA0_DTVB0_DTVSM0_DPLBn1_EPS0_ELFLR0_EMLLn1_FDSI0_GRPM1_GRVWA1_GRVWB8_GSU1_GSUAMB_GSUC0_GSUWGMRR0_GLS0_ISA1151_IU1_LDSTI0_LBSPPA512_LBSPPB2048_LBSPPM0_LPA16_LPB16_LPM0_LRVW16_LWPMn1_MIAV1_MIWT1_1_MO40_MGRIPMn1_NTn1_NTA0_NTB0_NTC0_NTD0_NTM0_NEPBS0_NLCA1_NLCB1_ONLL1_PGR2_PLR1_PKA0_SGROBn1_SIA3_SS0_SU32_SUM1_SUS256_SPO0_SRVW0_SSO0_SVW1_SK0_SKFTR0_SKXCCM0_SGRO0_TIN0_TLDS0_TLDSM1_ULSGRO0_USL1_UIOFGRO0_USFGROn1_VSn1_VWA1_VWB1_WSGRA0_WSGRB0_WS32_WG16_8_1_WGM8_WGMXCC1_WGMXCCGn1
    SolutionIndex: 5
    SolutionNameMin: Cijk_Ailk_Bljk_HHS_BH_Bias_HA_S_SAV_UserArgs_MT32x32x64_MI16x16x1_CMS_SN_LDSB0_AFC1_AG0_AFEM1_AFEM1_ASEM1_CLR1_CADS0_DTLA0_DTLB0_DTVA0_DTVB0_DTVSM0_DPLBn1_EPS0_ELFLR0_EMLLn1_FDSI0_GRPM1_GRVWA1_GRVWB1_GSU1_GSUAMB_GSUC0_GSUWGMRR0_GLS0_ISA1151_IU1_LDSTI0_LBSPPA1024_LBSPPB128_LBSPPM0_LPA16_LPB16_LPM0_LRVW16_LWPMn1_MIAV1_MIWT1_1_MO40_MGRIPMn1_NTn1_NTA0_NTB0_NTC0_NTD0_NTM0_NEPBS0_NLCA1_NLCB1_ONLL1_PGR2_PLR1_PKA0_SGROBn1_SIA3_SS0_SU32_SUM1_SUS256_SPO0_SRVW0_SSO0_SVW1_SK0_SKFTR0_SKXCCM0_SGRO0_TIN0_TLDS1_TLDSM1_ULSGRO0_USL1_UIOFGRO0_USFGROn1_VSn1_VWA1_VWB1_WSGRA0_WSGRB0_WS32_WG32_4_1_WGM8_WGMXCC1_WGMXCCGn1
    SolutionIndex: 6
    SolutionNameMin: Cijk_Ailk_Bljk_HHS_BH_Bias_HA_S_SAV_UserArgs_MT64x16x32_MI16x16x1_CMS_SN_LDSB0_AFC1_AG0_AFEM1_AFEM1_ASEM1_CLR1_CADS0_DTLA0_DTLB0_DTVA0_DTVB0_DTVSM0_DPLBn1_EPS0_ELFLR0_EMLLn1_FDSI0_GRPM1_GRVWA8_GRVWB4_GSU1_GSUAMB_GSUC0_GSUWGMRR0_GLS0_ISA1151_IU1_LDSTI0_LBSPPA2048_LBSPPB512_LBSPPM0_LPA16_LPB16_LPM0_LRVW16_LWPMn1_MIAV1_MIWT1_1_MO40_MGRIPMn1_NTn1_NTA0_NTB0_NTC0_NTD0_NTM0_NEPBS0_NLCA1_NLCB1_ONLL1_PGR2_PLR1_PKA0_SGROBn1_SIA3_SS1_SU32_SUM1_SUS256_SPO0_SRVW0_SSO0_SVW1_SK0_SKFTR0_SKXCCM0_SGRO0_TIN0_TLDS0_TLDSM1_ULSGRO0_USL1_UIOFGRO0_USFGROn1_VSn1_VWA1_VWB1_WSGRA0_WSGRB0_WS32_WG64_2_1_WGM8_WGMXCC1_WGMXCCGn1
    SolutionIndex: 7
    SolutionNameMin: Cijk_Ailk_Bljk_HHS_BH_Bias_HA_S_SAV_UserArgs_MT64x16x32_MI16x16x1_CMS_SN_LDSB0_AFC1_AG0_AFEM1_AFEM1_ASEM1_CLR1_CADS0_DTLA0_DTLB0_DTVA0_DTVB0_DTVSM0_DPLBn1_EPS0_ELFLR0_EMLLn1_FDSI0_GRPM1_GRVWA8_GRVWB4_GSU1_GSUAMB_GSUC0_GSUWGMRR0_GLS0_ISA1151_IU1_LDSTI0_LBSPPA2048_LBSPPB128_LBSPPM0_LPA16_LPB16_LPM0_LRVW16_LWPMn1_MIAV1_MIWT1_1_MO40_MGRIPMn1_NTn1_NTA0_NTB0_NTC0_NTD0_NTM0_NEPBS0_NLCA1_NLCB1_ONLL1_PGR2_PLR1_PKA0_SGROBn1_SIA3_SS1_SU32_SUM1_SUS256_SPO0_SRVW0_SSO0_SVW1_SK0_SKFTR0_SKXCCM0_SGRO0_TIN0_TLDS1_TLDSM1_ULSGRO0_USL1_UIOFGRO0_USFGROn1_VSn1_VWA1_VWB1_WSGRA0_WSGRB0_WS32_WG64_2_1_WGM8_WGMXCC1_WGMXCCGn1
    SolutionIndex: 8
    SolutionNameMin: Cijk_Ailk_Bljk_HHS_BH_Bias_HA_S_SAV_UserArgs_MT64x16x32_MI16x16x1_CMS_SN_LDSB0_AFC1_AG0_AFEM1_AFEM1_ASEM1_CLR1_CADS0_DTLA0_DTLB0_DTVA0_DTVB0_DTVSM0_DPLBn1_EPS0_ELFLR0_EMLLn1_FDSI0_GRPM1_GRVWA1_GRVWB4_GSU1_GSUAMB_GSUC0_GSUWGMRR0_GLS0_ISA1151_IU1_LDSTI0_LBSPPA2048_LBSPPB512_LBSPPM0_LPA16_LPB16_LPM0_LRVW16_LWPMn1_MIAV1_MIWT1_1_MO40_MGRIPMn1_NTn1_NTA0_NTB0_NTC0_NTD0_NTM0_NEPBS0_NLCA1_NLCB1_ONLL1_PGR2_PLR1_PKA0_SGROBn1_SIA3_SS1_SU32_SUM1_SUS256_SPO0_SRVW0_SSO0_SVW1_SK0_SKFTR0_SKXCCM0_SGRO0_TIN0_TLDS0_TLDSM1_ULSGRO0_USL1_UIOFGRO0_USFGROn1_VSn1_VWA1_VWB1_WSGRA0_WSGRB0_WS32_WG64_2_1_WGM8_WGMXCC1_WGMXCCGn1
    SolutionIndex: 9
    SolutionNameMin: Cijk_Ailk_Bljk_HHS_BH_Bias_HA_S_SAV_UserArgs_MT64x16x32_MI16x16x1_CMS_SN_LDSB0_AFC1_AG0_AFEM1_AFEM1_ASEM1_CLR1_CADS0_DTLA0_DTLB0_DTVA0_DTVB0_DTVSM0_DPLBn1_EPS0_ELFLR0_EMLLn1_FDSI0_GRPM1_GRVWA1_GRVWB4_GSU1_GSUAMB_GSUC0_GSUWGMRR0_GLS0_ISA1151_IU1_LDSTI0_LBSPPA2048_LBSPPB128_LBSPPM0_LPA16_LPB16_LPM0_LRVW16_LWPMn1_MIAV1_MIWT1_1_MO40_MGRIPMn1_NTn1_NTA0_NTB0_NTC0_NTD0_NTM0_NEPBS0_NLCA1_NLCB1_ONLL1_PGR2_PLR1_PKA0_SGROBn1_SIA3_SS1_SU32_SUM1_SUS256_SPO0_SRVW0_SSO0_SVW1_SK0_SKFTR0_SKXCCM0_SGRO0_TIN0_TLDS1_TLDSM1_ULSGRO0_USL1_UIOFGRO0_USFGROn1_VSn1_VWA1_VWB1_WSGRA0_WSGRB0_WS32_WG64_2_1_WGM8_WGMXCC1_WGMXCCGn1
    SolutionIndex: 10
    SolutionNameMin: Cijk_Ailk_Bljk_HHS_BH_Bias_HA_S_SAV_UserArgs_MT64x16x32_MI16x16x1_CMS_SN_LDSB0_AFC1_AG0_AFEM1_AFEM1_ASEM1_CLR1_CADS0_DTLA0_DTLB0_DTVA0_DTVB0_DTVSM0_DPLBn1_EPS0_ELFLR0_EMLLn1_FDSI0_GRPM1_GRVWA8_GRVWB1_GSU1_GSUAMB_GSUC0_GSUWGMRR0_GLS0_ISA1151_IU1_LDSTI0_LBSPPA2048_LBSPPB512_LBSPPM0_LPA16_LPB16_LPM0_LRVW16_LWPMn1_MIAV1_MIWT1_1_MO40_MGRIPMn1_NTn1_NTA0_NTB0_NTC0_NTD0_NTM0_NEPBS0_NLCA1_NLCB1_ONLL1_PGR2_PLR1_PKA0_SGROBn1_SIA3_SS1_SU32_SUM1_SUS256_SPO0_SRVW0_SSO0_SVW1_SK0_SKFTR0_SKXCCM0_SGRO0_TIN0_TLDS0_TLDSM1_ULSGRO0_USL1_UIOFGRO0_USFGROn1_VSn1_VWA1_VWB1_WSGRA0_WSGRB0_WS32_WG64_2_1_WGM8_WGMXCC1_WGMXCCGn1
    SolutionIndex: 11
    SolutionNameMin: Cijk_Ailk_Bljk_HHS_BH_Bias_HA_S_SAV_UserArgs_MT64x16x32_MI16x16x1_CMS_SN_LDSB0_AFC1_AG0_AFEM1_AFEM1_ASEM1_CLR1_CADS0_DTLA0_DTLB0_DTVA0_DTVB0_DTVSM0_DPLBn1_EPS0_ELFLR0_EMLLn1_FDSI0_GRPM1_GRVWA8_GRVWB1_GSU1_GSUAMB_GSUC0_GSUWGMRR0_GLS0_ISA1151_IU1_LDSTI0_LBSPPA2048_LBSPPB128_LBSPPM0_LPA16_LPB16_LPM0_LRVW16_LWPMn1_MIAV1_MIWT1_1_MO40_MGRIPMn1_NTn1_NTA0_NTB0_NTC0_NTD0_NTM0_NEPBS0_NLCA1_NLCB1_ONLL1_PGR2_PLR1_PKA0_SGROBn1_SIA3_SS1_SU32_SUM1_SUS256_SPO0_SRVW0_SSO0_SVW1_SK0_SKFTR0_SKXCCM0_SGRO0_TIN0_TLDS1_TLDSM1_ULSGRO0_USL1_UIOFGRO0_USFGROn1_VSn1_VWA1_VWB1_WSGRA0_WSGRB0_WS32_WG64_2_1_WGM8_WGMXCC1_WGMXCCGn1
    SolutionIndex: 12
    SolutionNameMin: Cijk_Ailk_Bljk_HHS_BH_Bias_HA_S_SAV_UserArgs_MT64x16x32_MI16x16x1_CMS_SN_LDSB0_AFC1_AG0_AFEM1_AFEM1_ASEM1_CLR1_CADS0_DTLA0_DTLB0_DTVA0_DTVB0_DTVSM0_DPLBn1_EPS0_ELFLR0_EMLLn1_FDSI0_GRPM1_GRVWA1_GRVWB1_GSU1_GSUAMB_GSUC0_GSUWGMRR0_GLS0_ISA1151_IU1_LDSTI0_LBSPPA2048_LBSPPB128_LBSPPM0_LPA16_LPB16_LPM0_LRVW16_LWPMn1_MIAV1_MIWT1_1_MO40_MGRIPMn1_NTn1_NTA0_NTB0_NTC0_NTD0_NTM0_NEPBS0_NLCA1_NLCB1_ONLL1_PGR2_PLR1_PKA0_SGROBn1_SIA3_SS1_SU32_SUM1_SUS256_SPO0_SRVW0_SSO0_SVW1_SK0_SKFTR0_SKXCCM0_SGRO0_TIN0_TLDS1_TLDSM1_ULSGRO0_USL1_UIOFGRO0_USFGROn1_VSn1_VWA1_VWB1_WSGRA0_WSGRB0_WS32_WG64_2_1_WGM8_WGMXCC1_WGMXCCGn1
    SolutionIndex: 13
    SolutionNameMin: Cijk_Ailk_Bljk_HHS_BH_Bias_HA_S_SAV_UserArgs_MT64x16x32_MI16x16x1_CMS_SN_LDSB0_AFC1_AG0_AFEM1_AFEM1_ASEM1_CLR1_CADS0_DTLA0_DTLB0_DTVA0_DTVB0_DTVSM0_DPLBn1_EPS0_ELFLR0_EMLLn1_FDSI0_GRPM1_GRVWA8_GRVWB4_GSU4_GSUAMB_GSUC0_GSUWGMRR0_GLS0_ISA1151_IU1_LDSTI0_LBSPPA2048_LBSPPB128_LBSPPM0_LPA16_LPB16_LPM0_LRVW16_LWPMn1_MIAV1_MIWT1_1_MO40_MGRIPMn1_NTn1_NTA0_NTB0_NTC0_NTD0_NTM0_NEPBS0_NLCA1_NLCB1_ONLL1_PGR2_PLR1_PKA0_SGROBn1_SIA3_SS1_SU32_SUM1_SUS256_SPO0_SRVW0_SSO0_SVW1_SK0_SKFTR0_SKXCCM0_SGRO0_TIN0_TLDS1_TLDSM1_ULSGRO0_USL1_UIOFGRO0_USFGROn1_VSn1_VWA1_VWB1_WSGRA0_WSGRB0_WS32_WG64_2_1_WGM8_WGMXCC1_WGMXCCGn1
    SolutionIndex: 14
    SolutionNameMin: Cijk_Ailk_Bljk_HHS_BH_Bias_HA_S_SAV_UserArgs_MT256x16x32_MI16x16x1_CMS_SN_LDSB1_AFC1_AG0_AFEM1_AFEM1_ASEM1_CLR1_CADS0_DTLA0_DTLB0_DTVA0_DTVB0_DTVSM0_DPLBn1_EPS0_ELFLR0_EMLLn1_FDSI0_GRPM1_GRVWA8_GRVWB4_GSU1_GSUAMB_GSUC0_GSUWGMRR0_GLS0_ISA1151_IU1_LDSTI0_LBSPPA8192_LBSPPB512_LBSPPM0_LPA16_LPB16_LPM0_LRVW16_LWPMn1_MIAV1_MIWT4_1_MO40_MGRIPMn1_NTn1_NTA0_NTB0_NTC0_NTD0_NTM0_NEPBS0_NLCA1_NLCB1_ONLL1_PGR2_PLR1_PKA0_SGROBn1_SIA3_SS1_SU32_SUM1_SUS256_SPO0_SRVW0_SSO0_SVW1_SK0_SKFTR0_SKXCCM0_SGRO0_TIN0_TLDS0_TLDSM1_ULSGRO0_USL1_UIOFGRO0_USFGROn1_VSn1_VWA1_VWB1_WSGRA0_WSGRB0_WS32_WG64_2_1_WGM8_WGMXCC1_WGMXCCGn1
    SolutionIndex: 15
    SolutionNameMin: Cijk_Ailk_Bljk_HHS_BH_Bias_HA_S_SAV_UserArgs_MT256x16x32_MI16x16x1_CMS_SN_LDSB1_AFC1_AG0_AFEM1_AFEM1_ASEM1_CLR1_CADS0_DTLA0_DTLB0_DTVA0_DTVB0_DTVSM0_DPLBn1_EPS0_ELFLR0_EMLLn1_FDSI0_GRPM1_GRVWA8_GRVWB4_GSU1_GSUAMB_GSUC0_GSUWGMRR0_GLS0_ISA1151_IU1_LDSTI0_LBSPPA8192_LBSPPB128_LBSPPM0_LPA16_LPB16_LPM0_LRVW16_LWPMn1_MIAV1_MIWT4_1_MO40_MGRIPMn1_NTn1_NTA0_NTB0_NTC0_NTD0_NTM0_NEPBS0_NLCA1_NLCB1_ONLL1_PGR2_PLR1_PKA0_SGROBn1_SIA3_SS1_SU32_SUM1_SUS256_SPO0_SRVW0_SSO0_SVW1_SK0_SKFTR0_SKXCCM0_SGRO0_TIN0_TLDS1_TLDSM1_ULSGRO0_USL1_UIOFGRO0_USFGROn1_VSn1_VWA1_VWB1_WSGRA0_WSGRB0_WS32_WG64_2_1_WGM8_WGMXCC1_WGMXCCGn1
    SolutionIndex: 16
    SolutionNameMin: Cijk_Ailk_Bljk_HHS_BH_Bias_HA_S_SAV_UserArgs_MT32x32x32_MI16x16x1_CMS_SN_LDSB0_AFC1_AG0_AFEM1_AFEM1_ASEM1_CLR1_CADS0_DTLA0_DTLB0_DTVA0_DTVB0_DTVSM0_DPLBn1_EPS0_ELFLR0_EMLLn1_FDSI0_GRPM1_GRVWA8_GRVWB8_GSU1_GSUAMB_GSUC0_GSUWGMRR0_GLS0_ISA1151_IU1_LDSTI0_LBSPPA1024_LBSPPB128_LBSPPM0_LPA16_LPB16_LPM0_LRVW16_LWPMn1_MIAV1_MIWT1_1_MO40_MGRIPMn1_NTn1_NTA0_NTB0_NTC0_NTD0_NTM0_NEPBS0_NLCA1_NLCB1_ONLL1_PGR2_PLR1_PKA0_SGROBn1_SIA3_SS1_SU32_SUM1_SUS256_SPO0_SRVW0_SSO0_SVW1_SK0_SKFTR0_SKXCCM0_SGRO0_TIN0_TLDS1_TLDSM1_ULSGRO0_USL1_UIOFGRO0_USFGROn1_VSn1_VWA1_VWB1_WSGRA0_WSGRB0_WS32_WG32_4_1_WGM8_WGMXCC1_WGMXCCGn1
    SolutionIndex: 17
    SolutionNameMin: Cijk_Ailk_Bljk_HHS_BH_Bias_HA_S_SAV_UserArgs_MT32x32x32_MI16x16x1_CMS_SN_LDSB0_AFC1_AG0_AFEM1_AFEM1_ASEM1_CLR1_CADS0_DTLA0_DTLB0_DTVA0_DTVB0_DTVSM0_DPLBn1_EPS0_ELFLR0_EMLLn1_FDSI0_GRPM1_GRVWA1_GRVWB8_GSU1_GSUAMB_GSUC0_GSUWGMRR0_GLS0_ISA1151_IU1_LDSTI0_LBSPPA1024_LBSPPB1024_LBSPPM0_LPA16_LPB16_LPM0_LRVW16_LWPMn1_MIAV1_MIWT1_1_MO40_MGRIPMn1_NTn1_NTA0_NTB0_NTC0_NTD0_NTM0_NEPBS0_NLCA1_NLCB1_ONLL1_PGR2_PLR1_PKA0_SGROBn1_SIA3_SS1_SU32_SUM1_SUS256_SPO0_SRVW0_SSO0_SVW1_SK0_SKFTR0_SKXCCM0_SGRO0_TIN0_TLDS0_TLDSM1_ULSGRO0_USL1_UIOFGRO0_USFGROn1_VSn1_VWA1_VWB1_WSGRA0_WSGRB0_WS32_WG32_4_1_WGM8_WGMXCC1_WGMXCCGn1
    SolutionIndex: 18
    SolutionNameMin: Cijk_Ailk_Bljk_HHS_BH_Bias_HA_S_SAV_UserArgs_MT32x32x32_MI16x16x1_CMS_SN_LDSB0_AFC1_AG0_AFEM1_AFEM1_ASEM1_CLR1_CADS0_DTLA0_DTLB0_DTVA0_DTVB0_DTVSM0_DPLBn1_EPS0_ELFLR0_EMLLn1_FDSI0_GRPM1_GRVWA1_GRVWB8_GSU1_GSUAMB_GSUC0_GSUWGMRR0_GLS0_ISA1151_IU1_LDSTI0_LBSPPA1024_LBSPPB128_LBSPPM0_LPA16_LPB16_LPM0_LRVW16_LWPMn1_MIAV1_MIWT1_1_MO40_MGRIPMn1_NTn1_NTA0_NTB0_NTC0_NTD0_NTM0_NEPBS0_NLCA1_NLCB1_ONLL1_PGR2_PLR1_PKA0_SGROBn1_SIA3_SS1_SU32_SUM1_SUS256_SPO0_SRVW0_SSO0_SVW1_SK0_SKFTR0_SKXCCM0_SGRO0_TIN0_TLDS1_TLDSM1_ULSGRO0_USL1_UIOFGRO0_USFGROn1_VSn1_VWA1_VWB1_WSGRA0_WSGRB0_WS32_WG32_4_1_WGM8_WGMXCC1_WGMXCCGn1
    SolutionIndex: 19
    SolutionNameMin: Cijk_Ailk_Bljk_HHS_BH_Bias_HA_S_SAV_UserArgs_MT32x32x32_MI16x16x1_CMS_SN_LDSB0_AFC1_AG0_AFEM1_AFEM1_ASEM1_CLR1_CADS0_DTLA0_DTLB0_DTVA0_DTVB0_DTVSM0_DPLBn1_EPS0_ELFLR0_EMLLn1_FDSI0_GRPM1_GRVWA1_GRVWB1_GSU1_GSUAMB_GSUC0_GSUWGMRR0_GLS0_ISA1151_IU1_LDSTI0_LBSPPA1024_LBSPPB128_LBSPPM0_LPA16_LPB16_LPM0_LRVW16_LWPMn1_MIAV1_MIWT1_1_MO40_MGRIPMn1_NTn1_NTA0_NTB0_NTC0_NTD0_NTM0_NEPBS0_NLCA1_NLCB1_ONLL1_PGR2_PLR1_PKA0_SGROBn1_SIA3_SS1_SU32_SUM1_SUS256_SPO0_SRVW0_SSO0_SVW1_SK0_SKFTR0_SKXCCM0_SGRO0_TIN0_TLDS1_TLDSM1_ULSGRO0_USL1_UIOFGRO0_USFGROn1_VSn1_VWA1_VWB1_WSGRA0_WSGRB0_WS32_WG32_4_1_WGM8_WGMXCC1_WGMXCCGn1
    SolutionIndex: 20
    SolutionNameMin: Cijk_Ailk_Bljk_HHS_BH_Bias_HA_S_SAV_UserArgs_MT32x32x32_MI16x16x1_CMS_SN_LDSB0_AFC1_AG0_AFEM1_AFEM1_ASEM1_CLR1_CADS0_DTLA0_DTLB0_DTVA0_DTVB0_DTVSM0_DPLBn1_EPS0_ELFLR0_EMLLn1_FDSI0_GRPM1_GRVWA8_GRVWB8_GSU4_GSUAMB_GSUC0_GSUWGMRR0_GLS0_ISA1151_IU1_LDSTI0_LBSPPA1024_LBSPPB128_LBSPPM0_LPA16_LPB16_LPM0_LRVW16_LWPMn1_MIAV1_MIWT1_1_MO40_MGRIPMn1_NTn1_NTA0_NTB0_NTC0_NTD0_NTM0_NEPBS0_NLCA1_NLCB1_ONLL1_PGR2_PLR1_PKA0_SGROBn1_SIA3_SS1_SU32_SUM1_SUS256_SPO0_SRVW0_SSO0_SVW1_SK0_SKFTR0_SKXCCM0_SGRO0_TIN0_TLDS1_TLDSM1_ULSGRO0_USL1_UIOFGRO0_USFGROn1_VSn1_VWA1_VWB1_WSGRA0_WSGRB0_WS32_WG32_4_1_WGM8_WGMXCC1_WGMXCCGn1
    SolutionIndex: 21
    SolutionNameMin: Cijk_Ailk_Bljk_HHS_BH_Bias_HA_S_SAV_UserArgs_MT64x32x32_MI16x16x1_CMS_SN_LDSB0_AFC1_AG0_AFEM1_AFEM1_ASEM1_CLR1_CADS0_DTLA0_DTLB0_DTVA0_DTVB0_DTVSM0_DPLBn1_EPS0_ELFLR0_EMLLn1_FDSI0_GRPM1_GRVWA8_GRVWB8_GSU1_GSUAMB_GSUC0_GSUWGMRR0_GLS0_ISA1151_IU1_LDSTI0_LBSPPA2048_LBSPPB1024_LBSPPM0_LPA16_LPB16_LPM0_LRVW16_LWPMn1_MIAV1_MIWT2_1_MO40_MGRIPMn1_NTn1_NTA0_NTB0_NTC0_NTD0_NTM0_NEPBS0_NLCA1_NLCB1_ONLL1_PGR2_PLR1_PKA0_SGROBn1_SIA3_SS1_SU32_SUM1_SUS256_SPO0_SRVW0_SSO0_SVW1_SK0_SKFTR0_SKXCCM0_SGRO0_TIN0_TLDS0_TLDSM1_ULSGRO0_USL1_UIOFGRO0_USFGROn1_VSn1_VWA1_VWB1_WSGRA0_WSGRB0_WS32_WG32_4_1_WGM8_WGMXCC1_WGMXCCGn1
    SolutionIndex: 22
    SolutionNameMin: Cijk_Ailk_Bljk_HHS_BH_Bias_HA_S_SAV_UserArgs_MT64x32x32_MI16x16x1_CMS_SN_LDSB0_AFC1_AG0_AFEM1_AFEM1_ASEM1_CLR1_CADS0_DTLA0_DTLB0_DTVA0_DTVB0_DTVSM0_DPLBn1_EPS0_ELFLR0_EMLLn1_FDSI0_GRPM1_GRVWA8_GRVWB8_GSU1_GSUAMB_GSUC0_GSUWGMRR0_GLS0_ISA1151_IU1_LDSTI0_LBSPPA2048_LBSPPB128_LBSPPM0_LPA16_LPB16_LPM0_LRVW16_LWPMn1_MIAV1_MIWT2_1_MO40_MGRIPMn1_NTn1_NTA0_NTB0_NTC0_NTD0_NTM0_NEPBS0_NLCA1_NLCB1_ONLL1_PGR2_PLR1_PKA0_SGROBn1_SIA3_SS1_SU32_SUM1_SUS256_SPO0_SRVW0_SSO0_SVW1_SK0_SKFTR0_SKXCCM0_SGRO0_TIN0_TLDS1_TLDSM1_ULSGRO0_USL1_UIOFGRO0_USFGROn1_VSn1_VWA1_VWB1_WSGRA0_WSGRB0_WS32_WG32_4_1_WGM8_WGMXCC1_WGMXCCGn1
    SolutionIndex: 23
    SolutionNameMin: Cijk_Ailk_Bljk_HHS_BH_Bias_HA_S_SAV_UserArgs_MT64x32x32_MI16x16x1_CMS_SN_LDSB0_AFC1_AG0_AFEM1_AFEM1_ASEM1_CLR1_CADS0_DTLA0_DTLB0_DTVA0_DTVB0_DTVSM0_DPLBn1_EPS0_ELFLR0_EMLLn1_FDSI0_GRPM1_GRVWA1_GRVWB8_GSU1_GSUAMB_GSUC0_GSUWGMRR0_GLS0_ISA1151_IU1_LDSTI0_LBSPPA2048_LBSPPB1024_LBSPPM0_LPA16_LPB16_LPM0_LRVW16_LWPMn1_MIAV1_MIWT2_1_MO40_MGRIPMn1_NTn1_NTA0_NTB0_NTC0_NTD0_NTM0_NEPBS0_NLCA1_NLCB1_ONLL1_PGR2_PLR1_PKA0_SGROBn1_SIA3_SS1_SU32_SUM1_SUS256_SPO0_SRVW0_SSO0_SVW1_SK0_SKFTR0_SKXCCM0_SGRO0_TIN0_TLDS0_TLDSM1_ULSGRO0_USL1_UIOFGRO0_USFGROn1_VSn1_VWA1_VWB1_WSGRA0_WSGRB0_WS32_WG32_4_1_WGM8_WGMXCC1_WGMXCCGn1
    SolutionIndex: 24
    SolutionNameMin: Cijk_Ailk_Bljk_HHS_BH_Bias_HA_S_SAV_UserArgs_MT64x32x32_MI16x16x1_CMS_SN_LDSB0_AFC1_AG0_AFEM1_AFEM1_ASEM1_CLR1_CADS0_DTLA0_DTLB0_DTVA0_DTVB0_DTVSM0_DPLBn1_EPS0_ELFLR0_EMLLn1_FDSI0_GRPM1_GRVWA1_GRVWB8_GSU1_GSUAMB_GSUC0_GSUWGMRR0_GLS0_ISA1151_IU1_LDSTI0_LBSPPA2048_LBSPPB128_LBSPPM0_LPA16_LPB16_LPM0_LRVW16_LWPMn1_MIAV1_MIWT2_1_MO40_MGRIPMn1_NTn1_NTA0_NTB0_NTC0_NTD0_NTM0_NEPBS0_NLCA1_NLCB1_ONLL1_PGR2_PLR1_PKA0_SGROBn1_SIA3_SS1_SU32_SUM1_SUS256_SPO0_SRVW0_SSO0_SVW1_SK0_SKFTR0_SKXCCM0_SGRO0_TIN0_TLDS1_TLDSM1_ULSGRO0_USL1_UIOFGRO0_USFGROn1_VSn1_VWA1_VWB1_WSGRA0_WSGRB0_WS32_WG32_4_1_WGM8_WGMXCC1_WGMXCCGn1
    SolutionIndex: 25
    SolutionNameMin: Cijk_Ailk_Bljk_HHS_BH_Bias_HA_S_SAV_UserArgs_MT64x32x32_MI16x16x1_CMS_SN_LDSB0_AFC1_AG0_AFEM1_AFEM1_ASEM1_CLR1_CADS0_DTLA0_DTLB0_DTVA0_DTVB0_DTVSM0_DPLBn1_EPS0_ELFLR0_EMLLn1_FDSI0_GRPM1_GRVWA1_GRVWB1_GSU1_GSUAMB_GSUC0_GSUWGMRR0_GLS0_ISA1151_IU1_LDSTI0_LBSPPA2048_LBSPPB128_LBSPPM0_LPA16_LPB16_LPM0_LRVW16_LWPMn1_MIAV1_MIWT2_1_MO40_MGRIPMn1_NTn1_NTA0_NTB0_NTC0_NTD0_NTM0_NEPBS0_NLCA1_NLCB1_ONLL1_PGR2_PLR1_PKA0_SGROBn1_SIA3_SS1_SU32_SUM1_SUS256_SPO0_SRVW0_SSO0_SVW1_SK0_SKFTR0_SKXCCM0_SGRO0_TIN0_TLDS1_TLDSM1_ULSGRO0_USL1_UIOFGRO0_USFGROn1_VSn1_VWA1_VWB1_WSGRA0_WSGRB0_WS32_WG32_4_1_WGM8_WGMXCC1_WGMXCCGn1
    SolutionIndex: 26
    SolutionNameMin: Cijk_Ailk_Bljk_HHS_BH_Bias_HA_S_SAV_UserArgs_MT64x32x32_MI16x16x1_CMS_SN_LDSB0_AFC1_AG0_AFEM1_AFEM1_ASEM1_CLR1_CADS0_DTLA0_DTLB0_DTVA0_DTVB0_DTVSM0_DPLBn1_EPS0_ELFLR0_EMLLn1_FDSI0_GRPM1_GRVWA8_GRVWB8_GSU4_GSUAMB_GSUC0_GSUWGMRR0_GLS0_ISA1151_IU1_LDSTI0_LBSPPA2048_LBSPPB128_LBSPPM0_LPA16_LPB16_LPM0_LRVW16_LWPMn1_MIAV1_MIWT2_1_MO40_MGRIPMn1_NTn1_NTA0_NTB0_NTC0_NTD0_NTM0_NEPBS0_NLCA1_NLCB1_ONLL1_PGR2_PLR1_PKA0_SGROBn1_SIA3_SS1_SU32_SUM1_SUS256_SPO0_SRVW0_SSO0_SVW1_SK0_SKFTR0_SKXCCM0_SGRO0_TIN0_TLDS1_TLDSM1_ULSGRO0_USL1_UIOFGRO0_USFGROn1_VSn1_VWA1_VWB1_WSGRA0_WSGRB0_WS32_WG32_4_1_WGM8_WGMXCC1_WGMXCCGn1
    SolutionIndex: 27
    SolutionNameMin: Cijk_Ailk_Bljk_HHS_BH_Bias_HA_S_SAV_UserArgs_MT96x32x32_MI16x16x1_CMS_SN_LDSB0_AFC1_AG0_AFEM1_AFEM1_ASEM1_CLR1_CADS0_DTLA0_DTLB0_DTVA0_DTVB0_DTVSM0_DPLBn1_EPS0_ELFLR0_EMLLn1_FDSI0_GRPM1_GRVWA8_GRVWB8_GSU1_GSUAMB_GSUC0_GSUWGMRR0_GLS0_ISA1151_IU1_LDSTI0_LBSPPA3072_LBSPPB128_LBSPPM0_LPA16_LPB16_LPM0_LRVW16_LWPMn1_MIAV1_MIWT3_1_MO40_MGRIPMn1_NTn1_NTA0_NTB0_NTC0_NTD0_NTM0_NEPBS0_NLCA3_NLCB1_ONLL1_PGR2_PLR1_PKA0_SGROBn1_SIA3_SS1_SU32_SUM1_SUS256_SPO0_SRVW0_SSO0_SVW1_SK0_SKFTR0_SKXCCM0_SGRO0_TIN0_TLDS1_TLDSM1_ULSGRO0_USL1_UIOFGRO0_USFGROn1_VSn1_VWA1_VWB1_WSGRA0_WSGRB0_WS32_WG32_4_1_WGM8_WGMXCC1_WGMXCCGn1
    SolutionIndex: 28
    SolutionNameMin: Cijk_Ailk_Bljk_HHS_BH_Bias_HA_S_SAV_UserArgs_MT96x32x32_MI16x16x1_CMS_SN_LDSB0_AFC1_AG0_AFEM1_AFEM1_ASEM1_CLR1_CADS0_DTLA0_DTLB0_DTVA0_DTVB0_DTVSM0_DPLBn1_EPS0_ELFLR0_EMLLn1_FDSI0_GRPM1_GRVWA8_GRVWB8_GSU4_GSUAMB_GSUC0_GSUWGMRR0_GLS0_ISA1151_IU1_LDSTI0_LBSPPA3072_LBSPPB128_LBSPPM0_LPA16_LPB16_LPM0_LRVW16_LWPMn1_MIAV1_MIWT3_1_MO40_MGRIPMn1_NTn1_NTA0_NTB0_NTC0_NTD0_NTM0_NEPBS0_NLCA3_NLCB1_ONLL1_PGR2_PLR1_PKA0_SGROBn1_SIA3_SS1_SU32_SUM1_SUS256_SPO0_SRVW0_SSO0_SVW1_SK0_SKFTR0_SKXCCM0_SGRO0_TIN0_TLDS1_TLDSM1_ULSGRO0_USL1_UIOFGRO0_USFGROn1_VSn1_VWA1_VWB1_WSGRA0_WSGRB0_WS32_WG32_4_1_WGM8_WGMXCC1_WGMXCCGn1
    SolutionIndex: 29
    SolutionNameMin: Cijk_Ailk_Bljk_HHS_BH_Bias_HA_S_SAV_UserArgs_MT64x48x32_MI16x16x1_CMS_SN_LDSB0_AFC1_AG0_AFEM1_AFEM1_ASEM1_CLR1_CADS0_DTLA0_DTLB0_DTVA0_DTVB0_DTVSM0_DPLBn1_EPS0_ELFLR0_EMLLn1_FDSI0_GRPM1_GRVWA8_GRVWB4_GSU1_GSUAMB_GSUC0_GSUWGMRR0_GLS0_ISA1151_IU1_LDSTI0_LBSPPA2048_LBSPPB128_LBSPPM0_LPA16_LPB16_LPM0_LRVW16_LWPMn1_MIAV1_MIWT1_3_MO40_MGRIPMn1_NTn1_NTA0_NTB0_NTC0_NTD0_NTM0_NEPBS0_NLCA1_NLCB1_ONLL1_PGR2_PLR1_PKA0_SGROBn1_SIA3_SS1_SU32_SUM1_SUS256_SPO0_SRVW0_SSO0_SVW1_SK0_SKFTR0_SKXCCM0_SGRO0_TIN0_TLDS1_TLDSM1_ULSGRO0_USL1_UIOFGRO0_USFGROn1_VSn1_VWA1_VWB1_WSGRA0_WSGRB0_WS32_WG64_2_1_WGM8_WGMXCC1_WGMXCCGn1
    SolutionIndex: 30
    SolutionNameMin: Cijk_Ailk_Bljk_HHS_BH_Bias_HA_S_SAV_UserArgs_MT64x48x32_MI16x16x1_CMS_SN_LDSB0_AFC1_AG0_AFEM1_AFEM1_ASEM1_CLR1_CADS0_DTLA0_DTLB0_DTVA0_DTVB0_DTVSM0_DPLBn1_EPS0_ELFLR0_EMLLn1_FDSI0_GRPM1_GRVWA1_GRVWB4_GSU1_GSUAMB_GSUC0_GSUWGMRR0_GLS0_ISA1151_IU1_LDSTI0_LBSPPA2048_LBSPPB128_LBSPPM0_LPA16_LPB16_LPM0_LRVW16_LWPMn1_MIAV1_MIWT1_3_MO40_MGRIPMn1_NTn1_NTA0_NTB0_NTC0_NTD0_NTM0_NEPBS0_NLCA1_NLCB1_ONLL1_PGR2_PLR1_PKA0_SGROBn1_SIA3_SS1_SU32_SUM1_SUS256_SPO0_SRVW0_SSO0_SVW1_SK0_SKFTR0_SKXCCM0_SGRO0_TIN0_TLDS1_TLDSM1_ULSGRO0_USL1_UIOFGRO0_USFGROn1_VSn1_VWA1_VWB1_WSGRA0_WSGRB0_WS32_WG64_2_1_WGM8_WGMXCC1_WGMXCCGn1
    SolutionIndex: 31
    SolutionNameMin: Cijk_Ailk_Bljk_HHS_BH_Bias_HA_S_SAV_UserArgs_MT64x48x32_MI16x16x1_CMS_SN_LDSB0_AFC1_AG0_AFEM1_AFEM1_ASEM1_CLR1_CADS0_DTLA0_DTLB0_DTVA0_DTVB0_DTVSM0_DPLBn1_EPS0_ELFLR0_EMLLn1_FDSI0_GRPM1_GRVWA1_GRVWB1_GSU1_GSUAMB_GSUC0_GSUWGMRR0_GLS0_ISA1151_IU1_LDSTI0_LBSPPA2048_LBSPPB128_LBSPPM0_LPA16_LPB16_LPM0_LRVW16_LWPMn1_MIAV1_MIWT1_3_MO40_MGRIPMn1_NTn1_NTA0_NTB0_NTC0_NTD0_NTM0_NEPBS0_NLCA1_NLCB1_ONLL1_PGR2_PLR1_PKA0_SGROBn1_SIA3_SS1_SU32_SUM1_SUS256_SPO0_SRVW0_SSO0_SVW1_SK0_SKFTR0_SKXCCM0_SGRO0_TIN0_TLDS1_TLDSM1_ULSGRO0_USL1_UIOFGRO0_USFGROn1_VSn1_VWA1_VWB1_WSGRA0_WSGRB0_WS32_WG64_2_1_WGM8_WGMXCC1_WGMXCCGn1
    SolutionIndex: 32
    SolutionNameMin: Cijk_Ailk_Bljk_HHS_BH_Bias_HA_S_SAV_UserArgs_MT128x48x32_MI16x16x1_CMS_SN_LDSB0_AFC1_AG0_AFEM1_AFEM1_ASEM1_CLR1_CADS0_DTLA0_DTLB0_DTVA0_DTVB0_DTVSM0_DPLBn1_EPS0_ELFLR0_EMLLn1_FDSI0_GRPM1_GRVWA8_GRVWB4_GSU1_GSUAMB_GSUC0_GSUWGMRR0_GLS0_ISA1151_IU1_LDSTI0_LBSPPA4096_LBSPPB1536_LBSPPM0_LPA16_LPB16_LPM0_LRVW16_LWPMn1_MIAV1_MIWT2_3_MO40_MGRIPMn1_NTn1_NTA0_NTB0_NTC0_NTD0_NTM0_NEPBS0_NLCA1_NLCB1_ONLL1_PGR2_PLR1_PKA0_SGROBn1_SIA3_SS1_SU32_SUM1_SUS256_SPO0_SRVW0_SSO0_SVW1_SK0_SKFTR0_SKXCCM0_SGRO0_TIN0_TLDS0_TLDSM1_ULSGRO0_USL1_UIOFGRO0_USFGROn1_VSn1_VWA1_VWB1_WSGRA0_WSGRB0_WS32_WG64_2_1_WGM8_WGMXCC1_WGMXCCGn1
    SolutionIndex: 33
    SolutionNameMin: Cijk_Ailk_Bljk_HHS_BH_Bias_HA_S_SAV_UserArgs_MT128x48x32_MI16x16x1_CMS_SN_LDSB0_AFC1_AG0_AFEM1_AFEM1_ASEM1_CLR1_CADS0_DTLA0_DTLB0_DTVA0_DTVB0_DTVSM0_DPLBn1_EPS0_ELFLR0_EMLLn1_FDSI0_GRPM1_GRVWA8_GRVWB4_GSU1_GSUAMB_GSUC0_GSUWGMRR0_GLS0_ISA1151_IU1_LDSTI0_LBSPPA4096_LBSPPB128_LBSPPM0_LPA16_LPB16_LPM0_LRVW16_LWPMn1_MIAV1_MIWT2_3_MO40_MGRIPMn1_NTn1_NTA0_NTB0_NTC0_NTD0_NTM0_NEPBS0_NLCA1_NLCB1_ONLL1_PGR2_PLR1_PKA0_SGROBn1_SIA3_SS1_SU32_SUM1_SUS256_SPO0_SRVW0_SSO0_SVW1_SK0_SKFTR0_SKXCCM0_SGRO0_TIN0_TLDS1_TLDSM1_ULSGRO0_USL1_UIOFGRO0_USFGROn1_VSn1_VWA1_VWB1_WSGRA0_WSGRB0_WS32_WG64_2_1_WGM8_WGMXCC1_WGMXCCGn1
    SolutionIndex: 35
    SolutionNameMin: Cijk_Ailk_Bljk_HHS_BH_Bias_HA_S_SAV_UserArgs_MT16x64x32_MI16x16x1_CMS_SN_LDSB0_AFC1_AG0_AFEM1_AFEM1_ASEM1_CLR1_CADS0_DTLA0_DTLB0_DTVA0_DTVB0_DTVSM0_DPLBn1_EPS0_ELFLR0_EMLLn1_FDSI0_GRPM1_GRVWA4_GRVWB8_GSU1_GSUAMB_GSUC0_GSUWGMRR0_GLS0_ISA1151_IU1_LDSTI0_LBSPPA512_LBSPPB2048_LBSPPM0_LPA16_LPB16_LPM0_LRVW16_LWPMn1_MIAV1_MIWT1_1_MO40_MGRIPMn1_NTn1_NTA0_NTB0_NTC0_NTD0_NTM0_NEPBS0_NLCA1_NLCB1_ONLL1_PGR2_PLR1_PKA0_SGROBn1_SIA3_SS1_SU32_SUM1_SUS256_SPO0_SRVW0_SSO0_SVW1_SK0_SKFTR0_SKXCCM0_SGRO0_TIN0_TLDS0_TLDSM1_ULSGRO0_USL1_UIOFGRO0_USFGROn1_VSn1_VWA1_VWB1_WSGRA0_WSGRB0_WS32_WG16_8_1_WGM8_WGMXCC1_WGMXCCGn1
    SolutionIndex: 36
    SolutionNameMin: Cijk_Ailk_Bljk_HHS_BH_Bias_HA_S_SAV_UserArgs_MT16x64x32_MI16x16x1_CMS_SN_LDSB0_AFC1_AG0_AFEM1_AFEM1_ASEM1_CLR1_CADS0_DTLA0_DTLB0_DTVA0_DTVB0_DTVSM0_DPLBn1_EPS0_ELFLR0_EMLLn1_FDSI0_GRPM1_GRVWA1_GRVWB1_GSU1_GSUAMB_GSUC0_GSUWGMRR0_GLS0_ISA1151_IU1_LDSTI0_LBSPPA512_LBSPPB128_LBSPPM0_LPA16_LPB16_LPM0_LRVW16_LWPMn1_MIAV1_MIWT1_1_MO40_MGRIPMn1_NTn1_NTA0_NTB0_NTC0_NTD0_NTM0_NEPBS0_NLCA1_NLCB1_ONLL1_PGR2_PLR1_PKA0_SGROBn1_SIA3_SS1_SU32_SUM1_SUS256_SPO0_SRVW0_SSO0_SVW1_SK0_SKFTR0_SKXCCM0_SGRO0_TIN0_TLDS1_TLDSM1_ULSGRO0_USL1_UIOFGRO0_USFGROn1_VSn1_VWA1_VWB1_WSGRA0_WSGRB0_WS32_WG16_8_1_WGM8_WGMXCC1_WGMXCCGn1
    SolutionIndex: 37
    SolutionNameMin: Cijk_Ailk_Bljk_HHS_BH_Bias_HA_S_SAV_UserArgs_MT32x64x32_MI16x16x1_CMS_SN_LDSB0_AFC1_AG0_AFEM1_AFEM1_ASEM1_CLR1_CADS0_DTLA0_DTLB0_DTVA0_DTVB0_DTVSM0_DPLBn1_EPS0_ELFLR0_EMLLn1_FDSI0_GRPM1_GRVWA1_GRVWB1_GSU1_GSUAMB_GSUC0_GSUWGMRR0_GLS0_ISA1151_IU1_LDSTI0_LBSPPA1024_LBSPPB128_LBSPPM0_LPA16_LPB16_LPM0_LRVW16_LWPMn1_MIAV1_MIWT2_1_MO40_MGRIPMn1_NTn1_NTA0_NTB0_NTC0_NTD0_NTM0_NEPBS0_NLCA1_NLCB1_ONLL1_PGR2_PLR1_PKA0_SGROBn1_SIA3_SS1_SU32_SUM1_SUS256_SPO0_SRVW0_SSO0_SVW1_SK0_SKFTR0_SKXCCM0_SGRO0_TIN0_TLDS1_TLDSM1_ULSGRO0_USL1_UIOFGRO0_USFGROn1_VSn1_VWA1_VWB1_WSGRA0_WSGRB0_WS32_WG16_8_1_WGM8_WGMXCC1_WGMXCCGn1
    SolutionIndex: 38
    SolutionNameMin: Cijk_Ailk_Bljk_HHS_BH_Bias_HA_S_SAV_UserArgs_MT64x80x32_MI16x16x1_CMS_SN_LDSB0_AFC1_AG0_AFEM1_AFEM1_ASEM1_CLR1_CADS0_DTLA0_DTLB0_DTVA0_DTVB0_DTVSM0_DPLBn1_EPS0_ELFLR0_EMLLn1_FDSI0_GRPM1_GRVWA8_GRVWB4_GSU1_GSUAMB_GSUC0_GSUWGMRR0_GLS0_ISA1151_IU1_LDSTI0_LBSPPA2048_LBSPPB128_LBSPPM0_LPA16_LPB16_LPM0_LRVW16_LWPMn1_MIAV1_MIWT1_5_MO40_MGRIPMn1_NTn1_NTA0_NTB0_NTC0_NTD0_NTM0_NEPBS0_NLCA1_NLCB1_ONLL1_PGR2_PLR1_PKA0_SGROBn1_SIA3_SS1_SU32_SUM1_SUS256_SPO0_SRVW0_SSO0_SVW1_SK0_SKFTR0_SKXCCM0_SGRO0_TIN0_TLDS1_TLDSM1_ULSGRO0_USL1_UIOFGRO0_USFGROn1_VSn1_VWA1_VWB1_WSGRA0_WSGRB0_WS32_WG64_2_1_WGM8_WGMXCC1_WGMXCCGn1
    SolutionIndex: 39
    SolutionNameMin: Cijk_Ailk_Bljk_HHS_BH_Bias_HA_S_SAV_UserArgs_MT32x96x32_MI16x16x1_CMS_SN_LDSB0_AFC1_AG0_AFEM1_AFEM1_ASEM1_CLR1_CADS0_DTLA0_DTLB0_DTVA0_DTVB0_DTVSM0_DPLBn1_EPS0_ELFLR0_EMLLn1_FDSI0_GRPM1_GRVWA8_GRVWB8_GSU1_GSUAMB_GSUC0_GSUWGMRR0_GLS0_ISA1151_IU1_LDSTI0_LBSPPA1024_LBSPPB128_LBSPPM0_LPA16_LPB16_LPM0_LRVW16_LWPMn1_MIAV1_MIWT1_3_MO40_MGRIPMn1_NTn1_NTA0_NTB0_NTC0_NTD0_NTM0_NEPBS0_NLCA1_NLCB1_ONLL1_PGR2_PLR1_PKA0_SGROBn1_SIA3_SS1_SU32_SUM1_SUS256_SPO0_SRVW0_SSO0_SVW1_SK0_SKFTR0_SKXCCM0_SGRO0_TIN0_TLDS1_TLDSM1_ULSGRO0_USL1_UIOFGRO0_USFGROn1_VSn1_VWA1_VWB1_WSGRA0_WSGRB0_WS32_WG32_4_1_WGM8_WGMXCC1_WGMXCCGn1
    SolutionIndex: 40
    SolutionNameMin: Cijk_Ailk_Bljk_HHS_BH_Bias_HA_S_SAV_UserArgs_MT64x96x32_MI16x16x1_CMS_SN_LDSB0_AFC1_AG0_AFEM1_AFEM1_ASEM1_CLR1_CADS0_DTLA0_DTLB0_DTVA0_DTVB0_DTVSM0_DPLBn1_EPS0_ELFLR0_EMLLn1_FDSI0_GRPM1_GRVWA8_GRVWB8_GSU1_GSUAMB_GSUC0_GSUWGMRR0_GLS0_ISA1151_IU1_LDSTI0_LBSPPA2048_LBSPPB3072_LBSPPM0_LPA16_LPB16_LPM0_LRVW16_LWPMn1_MIAV1_MIWT2_3_MO40_MGRIPMn1_NTn1_NTA0_NTB0_NTC0_NTD0_NTM0_NEPBS0_NLCA1_NLCB1_ONLL1_PGR2_PLR1_PKA0_SGROBn1_SIA3_SS1_SU32_SUM1_SUS256_SPO0_SRVW0_SSO0_SVW1_SK0_SKFTR0_SKXCCM0_SGRO0_TIN0_TLDS0_TLDSM1_ULSGRO0_USL1_UIOFGRO0_USFGROn1_VSn1_VWA1_VWB1_WSGRA0_WSGRB0_WS32_WG32_4_1_WGM8_WGMXCC1_WGMXCCGn1
    SolutionIndex: 41
    SolutionNameMin: Cijk_Ailk_Bljk_HHS_BH_Bias_HA_S_SAV_UserArgs_MT64x96x32_MI16x16x1_CMS_SN_LDSB0_AFC1_AG0_AFEM1_AFEM1_ASEM1_CLR1_CADS0_DTLA0_DTLB0_DTVA0_DTVB0_DTVSM0_DPLBn1_EPS0_ELFLR0_EMLLn1_FDSI0_GRPM1_GRVWA8_GRVWB8_GSU1_GSUAMB_GSUC0_GSUWGMRR0_GLS0_ISA1151_IU1_LDSTI0_LBSPPA2048_LBSPPB128_LBSPPM0_LPA16_LPB16_LPM0_LRVW16_LWPMn1_MIAV1_MIWT2_3_MO40_MGRIPMn1_NTn1_NTA0_NTB0_NTC0_NTD0_NTM0_NEPBS0_NLCA1_NLCB1_ONLL1_PGR2_PLR1_PKA0_SGROBn1_SIA3_SS1_SU32_SUM1_SUS256_SPO0_SRVW0_SSO0_SVW1_SK0_SKFTR0_SKXCCM0_SGRO0_TIN0_TLDS1_TLDSM1_ULSGRO0_USL1_UIOFGRO0_USFGROn1_VSn1_VWA1_VWB1_WSGRA0_WSGRB0_WS32_WG32_4_1_WGM8_WGMXCC1_WGMXCCGn1
    SolutionIndex: 42
    SolutionNameMin: Cijk_Ailk_Bljk_HHS_BH_Bias_HA_S_SAV_UserArgs_MT64x96x32_MI16x16x1_CMS_SN_LDSB0_AFC1_AG0_AFEM1_AFEM1_ASEM1_CLR1_CADS0_DTLA0_DTLB0_DTVA0_DTVB0_DTVSM0_DPLBn1_EPS0_ELFLR0_EMLLn1_FDSI0_GRPM1_GRVWA1_GRVWB8_GSU1_GSUAMB_GSUC0_GSUWGMRR0_GLS0_ISA1151_IU1_LDSTI0_LBSPPA2048_LBSPPB128_LBSPPM0_LPA16_LPB16_LPM0_LRVW16_LWPMn1_MIAV1_MIWT2_3_MO40_MGRIPMn1_NTn1_NTA0_NTB0_NTC0_NTD0_NTM0_NEPBS0_NLCA1_NLCB1_ONLL1_PGR2_PLR1_PKA0_SGROBn1_SIA3_SS1_SU32_SUM1_SUS256_SPO0_SRVW0_SSO0_SVW1_SK0_SKFTR0_SKXCCM0_SGRO0_TIN0_TLDS1_TLDSM1_ULSGRO0_USL1_UIOFGRO0_USFGROn1_VSn1_VWA1_VWB1_WSGRA0_WSGRB0_WS32_WG32_4_1_WGM8_WGMXCC1_WGMXCCGn1
    SolutionIndex: 43
    SolutionNameMin: Cijk_Ailk_Bljk_HHS_BH_Bias_HA_S_SAV_UserArgs_MT64x96x32_MI16x16x1_CMS_SN_LDSB0_AFC1_AG0_AFEM1_AFEM1_ASEM1_CLR1_CADS0_DTLA0_DTLB0_DTVA0_DTVB0_DTVSM0_DPLBn1_EPS0_ELFLR0_EMLLn1_FDSI0_GRPM1_GRVWA8_GRVWB8_GSU2_GSUAMB_GSUC0_GSUWGMRR0_GLS0_ISA1151_IU1_LDSTI0_LBSPPA2048_LBSPPB128_LBSPPM0_LPA16_LPB16_LPM0_LRVW16_LWPMn1_MIAV1_MIWT2_3_MO40_MGRIPMn1_NTn1_NTA0_NTB0_NTC0_NTD0_NTM0_NEPBS0_NLCA1_NLCB1_ONLL1_PGR2_PLR1_PKA0_SGROBn1_SIA3_SS1_SU32_SUM1_SUS256_SPO0_SRVW0_SSO0_SVW1_SK0_SKFTR0_SKXCCM0_SGRO0_TIN0_TLDS1_TLDSM1_ULSGRO0_USL1_UIOFGRO0_USFGROn1_VSn1_VWA1_VWB1_WSGRA0_WSGRB0_WS32_WG32_4_1_WGM8_WGMXCC1_WGMXCCGn1
    SolutionIndex: 45
    SolutionNameMin: Cijk_Ailk_Bljk_HHS_BH_Bias_HA_S_SAV_UserArgs_MT64x96x32_MI16x16x1_CMS_SN_LDSB0_AFC1_AG0_AFEM1_AFEM1_ASEM1_CLR1_CADS0_DTLA0_DTLB0_DTVA0_DTVB0_DTVSM0_DPLBn1_EPS0_ELFLR0_EMLLn1_FDSI0_GRPM1_GRVWA8_GRVWB8_GSU4_GSUAMB_GSUC0_GSUWGMRR0_GLS0_ISA1151_IU1_LDSTI0_LBSPPA2048_LBSPPB128_LBSPPM0_LPA16_LPB16_LPM0_LRVW16_LWPMn1_MIAV1_MIWT2_3_MO40_MGRIPMn1_NTn1_NTA0_NTB0_NTC0_NTD0_NTM0_NEPBS0_NLCA1_NLCB1_ONLL1_PGR2_PLR1_PKA0_SGROBn1_SIA3_SS1_SU32_SUM1_SUS256_SPO0_SRVW0_SSO0_SVW1_SK0_SKFTR0_SKXCCM0_SGRO0_TIN0_TLDS1_TLDSM1_ULSGRO0_USL1_UIOFGRO0_USFGROn1_VSn1_VWA1_VWB1_WSGRA0_WSGRB0_WS32_WG32_4_1_WGM8_WGMXCC1_WGMXCCGn1
    SolutionIndex: 46
    SolutionNameMin: Cijk_Ailk_Bljk_HHS_BH_Bias_HA_S_SAV_UserArgs_MT64x96x32_MI16x16x1_CMS_SN_LDSB0_AFC1_AG0_AFEM1_AFEM1_ASEM1_CLR1_CADS0_DTLA0_DTLB0_DTVA0_DTVB0_DTVSM0_DPLBn1_EPS0_ELFLR0_EMLLn1_FDSI0_GRPM1_GRVWA1_GRVWB8_GSU4_GSUAMB_GSUC0_GSUWGMRR0_GLS0_ISA1151_IU1_LDSTI0_LBSPPA2048_LBSPPB128_LBSPPM0_LPA16_LPB16_LPM0_LRVW16_LWPMn1_MIAV1_MIWT2_3_MO40_MGRIPMn1_NTn1_NTA0_NTB0_NTC0_NTD0_NTM0_NEPBS0_NLCA1_NLCB1_ONLL1_PGR2_PLR1_PKA0_SGROBn1_SIA3_SS1_SU32_SUM1_SUS256_SPO0_SRVW0_SSO0_SVW1_SK0_SKFTR0_SKXCCM0_SGRO0_TIN0_TLDS1_TLDSM1_ULSGRO0_USL1_UIOFGRO0_USFGROn1_VSn1_VWA1_VWB1_WSGRA0_WSGRB0_WS32_WG32_4_1_WGM8_WGMXCC1_WGMXCCGn1
    SolutionIndex: 47
    SolutionNameMin: Cijk_Ailk_Bljk_HHS_BH_Bias_HA_S_SAV_UserArgs_MT96x96x32_MI16x16x1_CMS_SN_LDSB0_AFC1_AG0_AFEM1_AFEM1_ASEM1_CLR1_CADS0_DTLA0_DTLB0_DTVA0_DTVB0_DTVSM0_DPLBn1_EPS0_ELFLR0_EMLLn1_FDSI0_GRPM1_GRVWA8_GRVWB8_GSU1_GSUAMB_GSUC0_GSUWGMRR0_GLS0_ISA1151_IU1_LDSTI0_LBSPPA3072_LBSPPB128_LBSPPM0_LPA16_LPB16_LPM0_LRVW16_LWPMn1_MIAV1_MIWT3_3_MO40_MGRIPMn1_NTn1_NTA0_NTB0_NTC0_NTD0_NTM0_NEPBS0_NLCA3_NLCB1_ONLL1_PGR2_PLR1_PKA0_SGROBn1_SIA3_SS1_SU32_SUM1_SUS256_SPO0_SRVW0_SSO0_SVW1_SK0_SKFTR0_SKXCCM0_SGRO0_TIN0_TLDS1_TLDSM1_ULSGRO0_USL1_UIOFGRO0_USFGROn1_VSn1_VWA1_VWB1_WSGRA0_WSGRB0_WS32_WG32_4_1_WGM8_WGMXCC1_WGMXCCGn1
    SolutionIndex: 48
    SolutionNameMin: Cijk_Ailk_Bljk_HHS_BH_Bias_HA_S_SAV_UserArgs_MT96x96x32_MI16x16x1_CMS_SN_LDSB0_AFC1_AG0_AFEM1_AFEM1_ASEM1_CLR1_CADS0_DTLA0_DTLB0_DTVA0_DTVB0_DTVSM0_DPLBn1_EPS0_ELFLR0_EMLLn1_FDSI0_GRPM1_GRVWA1_GRVWB8_GSU1_GSUAMB_GSUC0_GSUWGMRR0_GLS0_ISA1151_IU1_LDSTI0_LBSPPA3072_LBSPPB128_LBSPPM0_LPA16_LPB16_LPM0_LRVW16_LWPMn1_MIAV1_MIWT3_3_MO40_MGRIPMn1_NTn1_NTA0_NTB0_NTC0_NTD0_NTM0_NEPBS0_NLCA3_NLCB1_ONLL1_PGR2_PLR1_PKA0_SGROBn1_SIA3_SS1_SU32_SUM1_SUS256_SPO0_SRVW0_SSO0_SVW1_SK0_SKFTR0_SKXCCM0_SGRO0_TIN0_TLDS1_TLDSM1_ULSGRO0_USL1_UIOFGRO0_USFGROn1_VSn1_VWA1_VWB1_WSGRA0_WSGRB0_WS32_WG32_4_1_WGM8_WGMXCC1_WGMXCCGn1
    SolutionIndex: 50
    SolutionNameMin: Cijk_Ailk_Bljk_HHS_BH_Bias_HA_S_SAV_UserArgs_MT96x96x32_MI16x16x1_CMS_SN_LDSB0_AFC1_AG0_AFEM1_AFEM1_ASEM1_CLR1_CADS0_DTLA0_DTLB0_DTVA0_DTVB0_DTVSM0_DPLBn1_EPS0_ELFLR0_EMLLn1_FDSI0_GRPM1_GRVWA8_GRVWB8_GSU4_GSUAMB_GSUC0_GSUWGMRR0_GLS0_ISA1151_IU1_LDSTI0_LBSPPA3072_LBSPPB128_LBSPPM0_LPA16_LPB16_LPM0_LRVW16_LWPMn1_MIAV1_MIWT3_3_MO40_MGRIPMn1_NTn1_NTA0_NTB0_NTC0_NTD0_NTM0_NEPBS0_NLCA3_NLCB1_ONLL1_PGR2_PLR1_PKA0_SGROBn1_SIA3_SS1_SU32_SUM1_SUS256_SPO0_SRVW0_SSO0_SVW1_SK0_SKFTR0_SKXCCM0_SGRO0_TIN0_TLDS1_TLDSM1_ULSGRO0_USL1_UIOFGRO0_USFGROn1_VSn1_VWA1_VWB1_WSGRA0_WSGRB0_WS32_WG32_4_1_WGM8_WGMXCC1_WGMXCCGn1
    SolutionIndex: 52
    SolutionNameMin: Cijk_Ailk_Bljk_HHS_BH_Bias_HA_S_SAV_UserArgs_MT64x112x32_MI16x16x1_CMS_SN_LDSB0_AFC1_AG0_AFEM1_AFEM1_ASEM1_CLR1_CADS0_DTLA0_DTLB0_DTVA0_DTVB0_DTVSM0_DPLBn1_EPS0_ELFLR0_EMLLn1_FDSI0_GRPM1_GRVWA8_GRVWB4_GSU1_GSUAMB_GSUC0_GSUWGMRR0_GLS0_ISA1151_IU1_LDSTI0_LBSPPA2048_LBSPPB128_LBSPPM0_LPA16_LPB16_LPM0_LRVW16_LWPMn1_MIAV1_MIWT1_7_MO40_MGRIPMn1_NTn1_NTA0_NTB0_NTC0_NTD0_NTM0_NEPBS0_NLCA1_NLCB1_ONLL1_PGR2_PLR1_PKA0_SGROBn1_SIA3_SS1_SU32_SUM1_SUS256_SPO0_SRVW0_SSO0_SVW1_SK0_SKFTR0_SKXCCM0_SGRO0_TIN0_TLDS1_TLDSM1_ULSGRO0_USL1_UIOFGRO0_USFGROn1_VSn1_VWA1_VWB1_WSGRA0_WSGRB0_WS32_WG64_2_1_WGM8_WGMXCC1_WGMXCCGn1
    SolutionIndex: 53
    SolutionNameMin: Cijk_Ailk_Bljk_HHS_BH_Bias_HA_S_SAV_UserArgs_MT64x112x32_MI16x16x1_CMS_SN_LDSB0_AFC1_AG0_AFEM1_AFEM1_ASEM1_CLR1_CADS0_DTLA0_DTLB0_DTVA0_DTVB0_DTVSM0_DPLBn1_EPS0_ELFLR0_EMLLn1_FDSI0_GRPM1_GRVWA1_GRVWB4_GSU1_GSUAMB_GSUC0_GSUWGMRR0_GLS0_ISA1151_IU1_LDSTI0_LBSPPA2048_LBSPPB128_LBSPPM0_LPA16_LPB16_LPM0_LRVW16_LWPMn1_MIAV1_MIWT1_7_MO40_MGRIPMn1_NTn1_NTA0_NTB0_NTC0_NTD0_NTM0_NEPBS0_NLCA1_NLCB1_ONLL1_PGR2_PLR1_PKA0_SGROBn1_SIA3_SS1_SU32_SUM1_SUS256_SPO0_SRVW0_SSO0_SVW1_SK0_SKFTR0_SKXCCM0_SGRO0_TIN0_TLDS1_TLDSM1_ULSGRO0_USL1_UIOFGRO0_USFGROn1_VSn1_VWA1_VWB1_WSGRA0_WSGRB0_WS32_WG64_2_1_WGM8_WGMXCC1_WGMXCCGn1
    SolutionIndex: 54
    SolutionNameMin: Cijk_Ailk_Bljk_HHS_BH_Bias_HA_S_SAV_UserArgs_MT32x160x32_MI16x16x1_CMS_SN_LDSB0_AFC1_AG0_AFEM1_AFEM1_ASEM1_CLR1_CADS0_DTLA0_DTLB0_DTVA0_DTVB0_DTVSM0_DPLBn1_EPS0_ELFLR0_EMLLn1_FDSI0_GRPM1_GRVWA8_GRVWB8_GSU1_GSUAMB_GSUC0_GSUWGMRR0_GLS0_ISA1151_IU1_LDSTI0_LBSPPA1024_LBSPPB128_LBSPPM0_LPA16_LPB16_LPM0_LRVW16_LWPMn1_MIAV1_MIWT1_5_MO40_MGRIPMn1_NTn1_NTA0_NTB0_NTC0_NTD0_NTM0_NEPBS0_NLCA1_NLCB1_ONLL1_PGR2_PLR1_PKA0_SGROBn1_SIA3_SS1_SU32_SUM1_SUS256_SPO0_SRVW0_SSO0_SVW1_SK0_SKFTR0_SKXCCM0_SGRO0_TIN0_TLDS1_TLDSM1_ULSGRO0_USL1_UIOFGRO0_USFGROn1_VSn1_VWA1_VWB1_WSGRA0_WSGRB0_WS32_WG32_4_1_WGM8_WGMXCC1_WGMXCCGn1
    SolutionIndex: 55
    SolutionNameMin: Cijk_Ailk_Bljk_HHS_BH_Bias_HA_S_SAV_UserArgs_MT64x16x64_MI16x16x1_CMS_SN_LDSB0_AFC1_AG0_AFEM1_AFEM1_ASEM1_CLR1_CADS0_DTLA0_DTLB0_DTVA0_DTVB0_DTVSM0_DPLBn1_EPS0_ELFLR0_EMLLn1_FDSI0_GRPM1_GRVWA8_GRVWB8_GSU1_GSUAMB_GSUC0_GSUWGMRR0_GLS0_ISA1151_IU1_LDSTI0_LBSPPA2048_LBSPPB512_LBSPPM0_LPA16_LPB16_LPM0_LRVW16_LWPMn1_MIAV1_MIWT1_1_MO40_MGRIPMn1_NTn1_NTA0_NTB0_NTC0_NTD0_NTM0_NEPBS0_NLCA1_NLCB1_ONLL1_PGR2_PLR1_PKA0_SGROBn1_SIA3_SS1_SU32_SUM1_SUS256_SPO0_SRVW0_SSO0_SVW1_SK0_SKFTR0_SKXCCM0_SGRO0_TIN0_TLDS0_TLDSM1_ULSGRO0_USL1_UIOFGRO0_USFGROn1_VSn1_VWA1_VWB1_WSGRA0_WSGRB0_WS32_WG64_2_1_WGM8_WGMXCC1_WGMXCCGn1
    SolutionIndex: 56
    SolutionNameMin: Cijk_Ailk_Bljk_HHS_BH_Bias_HA_S_SAV_UserArgs_MT64x16x64_MI16x16x1_CMS_SN_LDSB0_AFC1_AG0_AFEM1_AFEM1_ASEM1_CLR1_CADS0_DTLA0_DTLB0_DTVA0_DTVB0_DTVSM0_DPLBn1_EPS0_ELFLR0_EMLLn1_FDSI0_GRPM1_GRVWA8_GRVWB8_GSU1_GSUAMB_GSUC0_GSUWGMRR0_GLS0_ISA1151_IU1_LDSTI0_LBSPPA2048_LBSPPB128_LBSPPM0_LPA16_LPB16_LPM0_LRVW16_LWPMn1_MIAV1_MIWT1_1_MO40_MGRIPMn1_NTn1_NTA0_NTB0_NTC0_NTD0_NTM0_NEPBS0_NLCA1_NLCB1_ONLL1_PGR2_PLR1_PKA0_SGROBn1_SIA3_SS1_SU32_SUM1_SUS256_SPO0_SRVW0_SSO0_SVW1_SK0_SKFTR0_SKXCCM0_SGRO0_TIN0_TLDS1_TLDSM1_ULSGRO0_USL1_UIOFGRO0_USFGROn1_VSn1_VWA1_VWB1_WSGRA0_WSGRB0_WS32_WG64_2_1_WGM8_WGMXCC1_WGMXCCGn1
    SolutionIndex: 57
    SolutionNameMin: Cijk_Ailk_Bljk_HHS_BH_Bias_HA_S_SAV_UserArgs_MT64x16x64_MI16x16x1_CMS_SN_LDSB0_AFC1_AG0_AFEM1_AFEM1_ASEM1_CLR1_CADS0_DTLA0_DTLB0_DTVA0_DTVB0_DTVSM0_DPLBn1_EPS0_ELFLR0_EMLLn1_FDSI0_GRPM1_GRVWA1_GRVWB8_GSU1_GSUAMB_GSUC0_GSUWGMRR0_GLS0_ISA1151_IU1_LDSTI0_LBSPPA2048_LBSPPB512_LBSPPM0_LPA16_LPB16_LPM0_LRVW16_LWPMn1_MIAV1_MIWT1_1_MO40_MGRIPMn1_NTn1_NTA0_NTB0_NTC0_NTD0_NTM0_NEPBS0_NLCA1_NLCB1_ONLL1_PGR2_PLR1_PKA0_SGROBn1_SIA3_SS1_SU32_SUM1_SUS256_SPO0_SRVW0_SSO0_SVW1_SK0_SKFTR0_SKXCCM0_SGRO0_TIN0_TLDS0_TLDSM1_ULSGRO0_USL1_UIOFGRO0_USFGROn1_VSn1_VWA1_VWB1_WSGRA0_WSGRB0_WS32_WG64_2_1_WGM8_WGMXCC1_WGMXCCGn1
    SolutionIndex: 58
    SolutionNameMin: Cijk_Ailk_Bljk_HHS_BH_Bias_HA_S_SAV_UserArgs_MT64x16x64_MI16x16x1_CMS_SN_LDSB0_AFC1_AG0_AFEM1_AFEM1_ASEM1_CLR1_CADS0_DTLA0_DTLB0_DTVA0_DTVB0_DTVSM0_DPLBn1_EPS0_ELFLR0_EMLLn1_FDSI0_GRPM1_GRVWA8_GRVWB1_GSU1_GSUAMB_GSUC0_GSUWGMRR0_GLS0_ISA1151_IU1_LDSTI0_LBSPPA2048_LBSPPB128_LBSPPM0_LPA16_LPB16_LPM0_LRVW16_LWPMn1_MIAV1_MIWT1_1_MO40_MGRIPMn1_NTn1_NTA0_NTB0_NTC0_NTD0_NTM0_NEPBS0_NLCA1_NLCB1_ONLL1_PGR2_PLR1_PKA0_SGROBn1_SIA3_SS1_SU32_SUM1_SUS256_SPO0_SRVW0_SSO0_SVW1_SK0_SKFTR0_SKXCCM0_SGRO0_TIN0_TLDS1_TLDSM1_ULSGRO0_USL1_UIOFGRO0_USFGROn1_VSn1_VWA1_VWB1_WSGRA0_WSGRB0_WS32_WG64_2_1_WGM8_WGMXCC1_WGMXCCGn1
    SolutionIndex: 59
    SolutionNameMin: Cijk_Ailk_Bljk_HHS_BH_Bias_HA_S_SAV_UserArgs_MT64x16x64_MI16x16x1_CMS_SN_LDSB0_AFC1_AG0_AFEM1_AFEM1_ASEM1_CLR1_CADS0_DTLA0_DTLB0_DTVA0_DTVB0_DTVSM0_DPLBn1_EPS0_ELFLR0_EMLLn1_FDSI0_GRPM1_GRVWA8_GRVWB8_GSU4_GSUAMB_GSUC0_GSUWGMRR0_GLS0_ISA1151_IU1_LDSTI0_LBSPPA2048_LBSPPB128_LBSPPM0_LPA16_LPB16_LPM0_LRVW16_LWPMn1_MIAV1_MIWT1_1_MO40_MGRIPMn1_NTn1_NTA0_NTB0_NTC0_NTD0_NTM0_NEPBS0_NLCA1_NLCB1_ONLL1_PGR2_PLR1_PKA0_SGROBn1_SIA3_SS1_SU32_SUM1_SUS256_SPO0_SRVW0_SSO0_SVW1_SK0_SKFTR0_SKXCCM0_SGRO0_TIN0_TLDS1_TLDSM1_ULSGRO0_USL1_UIOFGRO0_USFGROn1_VSn1_VWA1_VWB1_WSGRA0_WSGRB0_WS32_WG64_2_1_WGM8_WGMXCC1_WGMXCCGn1
    SolutionIndex: 60
    SolutionNameMin: Cijk_Ailk_Bljk_HHS_BH_Bias_HA_S_SAV_UserArgs_MT32x32x64_MI16x16x1_CMS_SN_LDSB0_AFC1_AG0_AFEM1_AFEM1_ASEM1_CLR1_CADS0_DTLA0_DTLB0_DTVA0_DTVB0_DTVSM0_DPLBn1_EPS0_ELFLR0_EMLLn1_FDSI0_GRPM1_GRVWA1_GRVWB1_GSU1_GSUAMB_GSUC0_GSUWGMRR0_GLS0_ISA1151_IU1_LDSTI0_LBSPPA1024_LBSPPB1024_LBSPPM0_LPA16_LPB16_LPM0_LRVW16_LWPMn1_MIAV1_MIWT1_1_MO40_MGRIPMn1_NTn1_NTA0_NTB0_NTC0_NTD0_NTM0_NEPBS0_NLCA1_NLCB1_ONLL1_PGR2_PLR1_PKA0_SGROBn1_SIA3_SS1_SU32_SUM1_SUS256_SPO0_SRVW0_SSO0_SVW1_SK0_SKFTR0_SKXCCM0_SGRO0_TIN0_TLDS0_TLDSM1_ULSGRO0_USL1_UIOFGRO0_USFGROn1_VSn1_VWA1_VWB1_WSGRA0_WSGRB0_WS32_WG32_4_1_WGM8_WGMXCC1_WGMXCCGn1
    SolutionIndex: 61
    SolutionNameMin: Cijk_Ailk_Bljk_HHS_BH_Bias_HA_S_SAV_UserArgs_MT32x32x64_MI16x16x1_CMS_SN_LDSB0_AFC1_AG0_AFEM1_AFEM1_ASEM1_CLR1_CADS0_DTLA0_DTLB0_DTVA0_DTVB0_DTVSM0_DPLBn1_EPS0_ELFLR0_EMLLn1_FDSI0_GRPM1_GRVWA1_GRVWB1_GSU1_GSUAMB_GSUC0_GSUWGMRR0_GLS0_ISA1151_IU1_LDSTI0_LBSPPA1024_LBSPPB128_LBSPPM0_LPA16_LPB16_LPM0_LRVW16_LWPMn1_MIAV1_MIWT1_1_MO40_MGRIPMn1_NTn1_NTA0_NTB0_NTC0_NTD0_NTM0_NEPBS0_NLCA1_NLCB1_ONLL1_PGR2_PLR1_PKA0_SGROBn1_SIA3_SS1_SU32_SUM1_SUS256_SPO0_SRVW0_SSO0_SVW1_SK0_SKFTR0_SKXCCM0_SGRO0_TIN0_TLDS1_TLDSM1_ULSGRO0_USL1_UIOFGRO0_USFGROn1_VSn1_VWA1_VWB1_WSGRA0_WSGRB0_WS32_WG32_4_1_WGM8_WGMXCC1_WGMXCCGn1
    SolutionIndex: 62
    SolutionNameMin: Cijk_Ailk_Bljk_HHS_BH_Bias_HA_S_SAV_UserArgs_MT32x32x64_MI16x16x1_CMS_SN_LDSB0_AFC1_AG0_AFEM1_AFEM1_ASEM1_CLR1_CADS0_DTLA0_DTLB0_DTVA0_DTVB0_DTVSM0_DPLBn1_EPS0_ELFLR0_EMLLn1_FDSI0_GRPM1_GRVWA1_GRVWB8_GSU4_GSUAMB_GSUC0_GSUWGMRR0_GLS0_ISA1151_IU1_LDSTI0_LBSPPA1024_LBSPPB1024_LBSPPM0_LPA16_LPB16_LPM0_LRVW16_LWPMn1_MIAV1_MIWT1_1_MO40_MGRIPMn1_NTn1_NTA0_NTB0_NTC0_NTD0_NTM0_NEPBS0_NLCA1_NLCB1_ONLL1_PGR2_PLR1_PKA0_SGROBn1_SIA3_SS1_SU32_SUM1_SUS256_SPO0_SRVW0_SSO0_SVW1_SK0_SKFTR0_SKXCCM0_SGRO0_TIN0_TLDS0_TLDSM1_ULSGRO0_USL1_UIOFGRO0_USFGROn1_VSn1_VWA1_VWB1_WSGRA0_WSGRB0_WS32_WG32_4_1_WGM8_WGMXCC1_WGMXCCGn1
    SolutionIndex: 63
    SolutionNameMin: Cijk_Ailk_Bljk_HHS_BH_Bias_HA_S_SAV_UserArgs_MT64x32x64_MI16x16x1_CMS_SN_LDSB0_AFC1_AG0_AFEM1_AFEM1_ASEM1_CLR1_CADS0_DTLA0_DTLB0_DTVA0_DTVB0_DTVSM0_DPLBn1_EPS0_ELFLR0_EMLLn1_FDSI0_GRPM1_GRVWA8_GRVWB8_GSU1_GSUAMB_GSUC0_GSUWGMRR0_GLS0_ISA1151_IU1_LDSTI0_LBSPPA2048_LBSPPB1024_LBSPPM0_LPA16_LPB16_LPM0_LRVW16_LWPMn1_MIAV1_MIWT2_1_MO40_MGRIPMn1_NTn1_NTA0_NTB0_NTC0_NTD0_NTM0_NEPBS0_NLCA1_NLCB1_ONLL1_PGR2_PLR1_PKA0_SGROBn1_SIA3_SS1_SU32_SUM1_SUS256_SPO0_SRVW0_SSO0_SVW1_SK0_SKFTR0_SKXCCM0_SGRO0_TIN0_TLDS0_TLDSM1_ULSGRO0_USL1_UIOFGRO0_USFGROn1_VSn1_VWA1_VWB1_WSGRA0_WSGRB0_WS32_WG32_4_1_WGM8_WGMXCC1_WGMXCCGn1
    SolutionIndex: 64
    SolutionNameMin: Cijk_Ailk_Bljk_HHS_BH_Bias_HA_S_SAV_UserArgs_MT64x32x64_MI16x16x1_CMS_SN_LDSB0_AFC1_AG0_AFEM1_AFEM1_ASEM1_CLR1_CADS0_DTLA0_DTLB0_DTVA0_DTVB0_DTVSM0_DPLBn1_EPS0_ELFLR0_EMLLn1_FDSI0_GRPM1_GRVWA8_GRVWB1_GSU1_GSUAMB_GSUC0_GSUWGMRR0_GLS0_ISA1151_IU1_LDSTI0_LBSPPA2048_LBSPPB128_LBSPPM0_LPA16_LPB16_LPM0_LRVW16_LWPMn1_MIAV1_MIWT2_1_MO40_MGRIPMn1_NTn1_NTA0_NTB0_NTC0_NTD0_NTM0_NEPBS0_NLCA1_NLCB1_ONLL1_PGR2_PLR1_PKA0_SGROBn1_SIA3_SS1_SU32_SUM1_SUS256_SPO0_SRVW0_SSO0_SVW1_SK0_SKFTR0_SKXCCM0_SGRO0_TIN0_TLDS1_TLDSM1_ULSGRO0_USL1_UIOFGRO0_USFGROn1_VSn1_VWA1_VWB1_WSGRA0_WSGRB0_WS32_WG32_4_1_WGM8_WGMXCC1_WGMXCCGn1
    SolutionIndex: 65
    SolutionNameMin: Cijk_Ailk_Bljk_HHS_BH_Bias_HA_S_SAV_UserArgs_MT64x32x64_MI16x16x1_CMS_SN_LDSB0_AFC1_AG0_AFEM1_AFEM1_ASEM1_CLR1_CADS0_DTLA0_DTLB0_DTVA0_DTVB0_DTVSM0_DPLBn1_EPS0_ELFLR0_EMLLn1_FDSI0_GRPM1_GRVWA8_GRVWB8_GSU4_GSUAMB_GSUC0_GSUWGMRR0_GLS0_ISA1151_IU1_LDSTI0_LBSPPA2048_LBSPPB1024_LBSPPM0_LPA16_LPB16_LPM0_LRVW16_LWPMn1_MIAV1_MIWT2_1_MO40_MGRIPMn1_NTn1_NTA0_NTB0_NTC0_NTD0_NTM0_NEPBS0_NLCA1_NLCB1_ONLL1_PGR2_PLR1_PKA0_SGROBn1_SIA3_SS1_SU32_SUM1_SUS256_SPO0_SRVW0_SSO0_SVW1_SK0_SKFTR0_SKXCCM0_SGRO0_TIN0_TLDS0_TLDSM1_ULSGRO0_USL1_UIOFGRO0_USFGROn1_VSn1_VWA1_VWB1_WSGRA0_WSGRB0_WS32_WG32_4_1_WGM8_WGMXCC1_WGMXCCGn1
    SolutionIndex: 66
    SolutionNameMin: Cijk_Ailk_Bljk_HHS_BH_Bias_HA_S_SAV_UserArgs_MT64x32x64_MI16x16x1_CMS_SN_LDSB0_AFC1_AG0_AFEM1_AFEM1_ASEM1_CLR1_CADS0_DTLA0_DTLB0_DTVA0_DTVB0_DTVSM0_DPLBn1_EPS0_ELFLR0_EMLLn1_FDSI0_GRPM1_GRVWA8_GRVWB1_GSU4_GSUAMB_GSUC0_GSUWGMRR0_GLS0_ISA1151_IU1_LDSTI0_LBSPPA2048_LBSPPB128_LBSPPM0_LPA16_LPB16_LPM0_LRVW16_LWPMn1_MIAV1_MIWT2_1_MO40_MGRIPMn1_NTn1_NTA0_NTB0_NTC0_NTD0_NTM0_NEPBS0_NLCA1_NLCB1_ONLL1_PGR2_PLR1_PKA0_SGROBn1_SIA3_SS1_SU32_SUM1_SUS256_SPO0_SRVW0_SSO0_SVW1_SK0_SKFTR0_SKXCCM0_SGRO0_TIN0_TLDS1_TLDSM1_ULSGRO0_USL1_UIOFGRO0_USFGROn1_VSn1_VWA1_VWB1_WSGRA0_WSGRB0_WS32_WG32_4_1_WGM8_WGMXCC1_WGMXCCGn1
    SolutionIndex: 67
    SolutionNameMin: Cijk_Ailk_Bljk_HHS_BH_Bias_HA_S_SAV_UserArgs_MT64x48x64_MI16x16x1_CMS_SN_LDSB0_AFC1_AG0_AFEM1_AFEM1_ASEM1_CLR1_CADS0_DTLA0_DTLB0_DTVA0_DTVB0_DTVSM0_DPLBn1_EPS0_ELFLR0_EMLLn1_FDSI0_GRPM1_GRVWA8_GRVWB8_GSU1_GSUAMB_GSUC0_GSUWGMRR0_GLS0_ISA1151_IU1_LDSTI0_LBSPPA2048_LBSPPB128_LBSPPM0_LPA16_LPB16_LPM0_LRVW16_LWPMn1_MIAV1_MIWT1_3_MO40_MGRIPMn1_NTn1_NTA0_NTB0_NTC0_NTD0_NTM0_NEPBS0_NLCA1_NLCB1_ONLL1_PGR2_PLR1_PKA0_SGROBn1_SIA3_SS1_SU32_SUM1_SUS256_SPO0_SRVW0_SSO0_SVW1_SK0_SKFTR0_SKXCCM0_SGRO0_TIN0_TLDS1_TLDSM1_ULSGRO0_USL1_UIOFGRO0_USFGROn1_VSn1_VWA1_VWB1_WSGRA0_WSGRB0_WS32_WG64_2_1_WGM8_WGMXCC1_WGMXCCGn1
    SolutionIndex: 68
    SolutionNameMin: Cijk_Ailk_Bljk_HHS_BH_Bias_HA_S_SAV_UserArgs_MT16x64x64_MI16x16x1_CMS_SN_LDSB0_AFC1_AG0_AFEM1_AFEM1_ASEM1_CLR1_CADS0_DTLA0_DTLB0_DTVA0_DTVB0_DTVSM0_DPLBn1_EPS0_ELFLR0_EMLLn1_FDSI0_GRPM1_GRVWA8_GRVWB8_GSU1_GSUAMB_GSUC0_GSUWGMRR0_GLS0_ISA1151_IU1_LDSTI0_LBSPPA512_LBSPPB2048_LBSPPM0_LPA16_LPB16_LPM0_LRVW16_LWPMn1_MIAV1_MIWT1_1_MO40_MGRIPMn1_NTn1_NTA0_NTB0_NTC0_NTD0_NTM0_NEPBS0_NLCA1_NLCB1_ONLL1_PGR2_PLR1_PKA0_SGROBn1_SIA3_SS1_SU32_SUM1_SUS256_SPO0_SRVW0_SSO0_SVW1_SK0_SKFTR0_SKXCCM0_SGRO0_TIN0_TLDS0_TLDSM1_ULSGRO0_USL1_UIOFGRO0_USFGROn1_VSn1_VWA1_VWB1_WSGRA0_WSGRB0_WS32_WG16_8_1_WGM8_WGMXCC1_WGMXCCGn1
    SolutionIndex: 69
    SolutionNameMin: Cijk_Ailk_Bljk_HHS_BH_Bias_HA_S_SAV_UserArgs_MT128x80x64_MI16x16x1_SN_LDSB1_AFC1_AG0_AFEM1_AFEM1_ASEM1_CLR0_CADS0_DTLA0_DTLB0_DTVA0_DTVB0_DTVSM0_DPLB0_EPS0_ELFLR0_EMLLn1_FDSI0_GRPM1_GRVWA8_GRVWB8_GSU1_GSUAMB_GSUC0_GSUWGMRR0_GLS0_ISA1151_IU1_K1_LDSTI0_LBSPPA4096_LBSPPB128_LBSPPM0_LPA8_LPB8_LPM0_LRVW16_LWPMn1_MIAV1_MIWT2_5_MO40_MGRIPM1_NTn1_NTA0_NTB0_NTC0_NTD0_NTM0_NEPBS0_NLCA1_NLCB1_ONLL1_PGR2_PLR0_PKA0_SGROB0_SIA3_SS1_SU32_SUM0_SUS256_SPO0_SRVW0_SSO0_SVW1_SK0_SKFTR0_SKXCCM0_SGRO0_TIN0_TLDS1_TLDSMn1_ULSGRO0_USL1_UIOFGRO0_USFGROn1_VSn1_VWA1_VWB1_WSGRA0_WSGRB0_WS32_WG64_2_1_WGM8_WGMXCC1_WGMXCCGn1
    SolutionIndex: 70
    SolutionNameMin: Cijk_Ailk_Bljk_HHS_BH_Bias_HA_S_SAV_UserArgs_MT96x128x64_MI16x16x1_SN_LDSB0_AFC1_AG0_AFEM1_AFEM1_ASEM1_CLR0_CADS0_DTLA0_DTLB0_DTVA0_DTVB0_DTVSM0_DPLB0_EPS0_ELFLR0_EMLLn1_FDSI0_GRPM1_GRVWA8_GRVWB8_GSU1_GSUAMB_GSUC0_GSUWGMRR0_GLS0_ISA1151_IU1_K1_LDSTI0_LBSPPA3072_LBSPPB128_LBSPPM0_LPA8_LPB8_LPM0_LRVW16_LWPMn1_MIAV1_MIWT3_4_MO40_MGRIPM1_NTn1_NTA0_NTB0_NTC0_NTD0_NTM0_NEPBS0_NLCA3_NLCB1_ONLL1_PGR2_PLR0_PKA0_SGROB0_SIA1_SS1_SU32_SUM0_SUS256_SPO0_SRVW0_SSO0_SVW1_SK0_SKFTR0_SKXCCM0_SGRO0_TIN0_TLDS1_TLDSMn1_ULSGRO0_USL1_UIOFGRO0_USFGROn1_VSn1_VWA1_VWB1_WSGRA0_WSGRB0_WS32_WG32_4_1_WGM8_WGMXCC1_WGMXCCGn1
    SolutionIndex: 71
    SolutionNameMin: Cijk_Ailk_Bljk_HHS_BH_Bias_HA_S_SAV_UserArgs_MT128x96x64_MI16x16x1_SN_LDSB1_AFC1_AG0_AFEM1_AFEM1_ASEM1_CLR0_CADS0_DTLA0_DTLB0_DTVA0_DTVB0_DTVSM0_DPLB0_EPS0_ELFLR0_EMLLn1_FDSI0_GRPM1_GRVWA8_GRVWB8_GSU1_GSUAMB_GSUC0_GSUWGMRR0_GLS0_ISA1151_IU1_K1_LDSTI0_LBSPPA4096_LBSPPB128_LBSPPM0_LPA8_LPB8_LPM0_LRVW16_LWPMn1_MIAV1_MIWT2_6_MO40_MGRIPM1_NTn1_NTA0_NTB0_NTC0_NTD0_NTM0_NEPBS0_NLCA1_NLCB1_ONLL1_PGR2_PLR0_PKA0_SGROB0_SIA3_SS1_SU32_SUM0_SUS256_SPO0_SRVW0_SSO0_SVW1_SK0_SKFTR0_SKXCCM0_SGRO0_TIN0_TLDS1_TLDSMn1_ULSGRO0_USL1_UIOFGRO0_USFGROn1_VSn1_VWA1_VWB1_WSGRA0_WSGRB0_WS32_WG64_2_1_WGM8_WGMXCC1_WGMXCCGn1
    SolutionIndex: 72
    SolutionNameMin: Cijk_Ailk_Bljk_HHS_BH_Bias_HA_S_SAV_UserArgs_MT96x128x64_MI16x16x1_SN_LDSB1_AFC1_AG0_AFEM1_AFEM1_ASEM1_CLR0_CADS0_DTLA0_DTLB0_DTVA0_DTVB0_DTVSM0_DPLB0_EPS0_ELFLR0_EMLLn1_FDSI0_GRPM1_GRVWA8_GRVWB8_GSU1_GSUAMB_GSUC0_GSUWGMRR0_GLS0_ISA1151_IU1_K1_LDSTI0_LBSPPA3072_LBSPPB128_LBSPPM0_LPA8_LPB8_LPM0_LRVW16_LWPMn1_MIAV1_MIWT3_4_MO40_MGRIPM1_NTn1_NTA0_NTB0_NTC0_NTD0_NTM0_NEPBS0_NLCA3_NLCB1_ONLL1_PGR2_PLR0_PKA0_SGROB0_SIA3_SS1_SU32_SUM0_SUS256_SPO0_SRVW0_SSO0_SVW1_SK0_SKFTR0_SKXCCM0_SGRO0_TIN0_TLDS1_TLDSMn1_ULSGRO0_USL1_UIOFGRO0_USFGROn1_VSn1_VWA1_VWB1_WSGRA0_WSGRB0_WS32_WG32_4_1_WGM8_WGMXCC1_WGMXCCGn1
    SolutionIndex: 73
    SolutionNameMin: Cijk_Ailk_Bljk_HHS_BH_Bias_HA_S_SAV_UserArgs_MT128x112x64_MI16x16x1_SN_LDSB0_AFC1_AG0_AFEM1_AFEM1_ASEM1_CLR0_CADS0_DTLA0_DTLB0_DTVA0_DTVB0_DTVSM0_DPLB0_EPS0_ELFLR0_EMLLn1_FDSI0_GRPM1_GRVWA8_GRVWB8_GSU1_GSUAMB_GSUC0_GSUWGMRR0_GLS0_ISA1151_IU1_K1_LDSTI0_LBSPPA4096_LBSPPB128_LBSPPM0_LPA8_LPB8_LPM0_LRVW16_LWPMn1_MIAV1_MIWT2_7_MO40_MGRIPM1_NTn1_NTA0_NTB0_NTC0_NTD0_NTM0_NEPBS0_NLCA1_NLCB1_ONLL1_PGR0_PLR0_PKA0_SGROB0_SIA1_SS1_SU32_SUM0_SUS256_SPO0_SRVW0_SSO0_SVW1_SK0_SKFTR0_SKXCCM0_SGRO0_TIN0_TLDS1_TLDSMn1_ULSGRO0_USL1_UIOFGRO0_USFGROn1_VSn1_VWA1_VWB1_WSGRA0_WSGRB0_WS32_WG64_2_1_WGM8_WGMXCC1_WGMXCCGn1
    SolutionIndex: 74
    SolutionNameMin: Cijk_Ailk_Bljk_HHS_BH_Bias_HA_S_SAV_UserArgs_MT64x96x32_MI16x16x1_SN_LDSB0_AFC1_AG0_AFEM1_AFEM1_ASEM1_CLR0_CADS0_DTLA0_DTLB0_DTVA0_DTVB0_DTVSM0_DPLB0_EPS0_ELFLR0_EMLLn1_FDSI0_GRPM1_GRVWA8_GRVWB8_GSU1_GSUAMB_GSUC0_GSUWGMRR0_GLS0_ISA1151_IU1_K1_LDSTI0_LBSPPA2048_LBSPPB3072_LBSPPM0_LPA8_LPB8_LPM0_LRVW16_LWPMn1_MIAV1_MIWT2_3_MO40_MGRIPM1_NTn1_NTA0_NTB0_NTC0_NTD0_NTM0_NEPBS0_NLCA1_NLCB1_ONLL1_PGR2_PLR1_PKA0_SGROB0_SIA1_SS1_SU32_SUM0_SUS256_SPO0_SRVW0_SSO0_SVW1_SK0_SKFTR0_SKXCCM0_SGRO0_TIN0_TLDS0_TLDSMn1_ULSGRO0_USL1_UIOFGRO0_USFGROn1_VSn1_VWA1_VWB1_WSGRA0_WSGRB0_WS32_WG32_4_1_WGM8_WGMXCC1_WGMXCCGn1
    SolutionIndex: 75
    SolutionNameMin: Cijk_Ailk_Bljk_HHS_BH_Bias_HA_S_SAV_UserArgs_MT128x64x32_MI16x16x1_SN_LDSB0_AFC1_AG0_AFEM1_AFEM1_ASEM1_CLR0_CADS0_DTLA0_DTLB0_DTVA0_DTVB0_DTVSM0_DPLB0_EPS0_ELFLR0_EMLLn1_FDSI0_GRPM1_GRVWA8_GRVWB8_GSU1_GSUAMB_GSUC0_GSUWGMRR0_GLS0_ISA1151_IU1_K1_LDSTI0_LBSPPA4096_LBSPPB2048_LBSPPM0_LPA8_LPB8_LPM0_LRVW16_LWPMn1_MIAV1_MIWT2_4_MO40_MGRIPM1_NTn1_NTA0_NTB0_NTC0_NTD0_NTM0_NEPBS0_NLCA1_NLCB1_ONLL1_PGR2_PLR0_PKA0_SGROB0_SIA1_SS1_SU32_SUM0_SUS256_SPO0_SRVW0_SSO0_SVW1_SK0_SKFTR0_SKXCCM0_SGRO0_TIN0_TLDS0_TLDSMn1_ULSGRO0_USL1_UIOFGRO0_USFGROn1_VSn1_VWA1_VWB1_WSGRA0_WSGRB0_WS32_WG64_2_1_WGM8_WGMXCC1_WGMXCCGn1
    SolutionIndex: 76
    SolutionNameMin: Cijk_Ailk_Bljk_HHS_BH_Bias_HA_S_SAV_UserArgs_MT128x32x64_MI16x16x1_SN_LDSB0_AFC1_AG0_AFEM1_AFEM1_ASEM1_CLR0_CADS0_DTLA0_DTLB0_DTVA0_DTVB0_DTVSM0_DPLB0_EPS0_ELFLR0_EMLLn1_FDSI0_GRPM1_GRVWA8_GRVWB8_GSU1_GSUAMB_GSUC0_GSUWGMRR0_GLS0_ISA1151_IU1_K1_LDSTI0_LBSPPA4096_LBSPPB1024_LBSPPM0_LPA8_LPB8_LPM0_LRVW16_LWPMn1_MIAV1_MIWT2_2_MO40_MGRIPM1_NTn1_NTA0_NTB0_NTC0_NTD0_NTM0_NEPBS0_NLCA1_NLCB1_ONLL1_PGR2_PLR1_PKA0_SGROB0_SIA3_SS1_SU32_SUM0_SUS256_SPO0_SRVW0_SSO0_SVW1_SK0_SKFTR0_SKXCCM0_SGRO0_TIN0_TLDS0_TLDSMn1_ULSGRO0_USL1_UIOFGRO0_USFGROn1_VSn1_VWA1_VWB1_WSGRA0_WSGRB0_WS32_WG64_2_1_WGM8_WGMXCC1_WGMXCCGn1
    SolutionIndex: 77
    SolutionNameMin: Cijk_Ailk_Bljk_HHS_BH_Bias_HA_S_SAV_UserArgs_MT128x64x64_MI16x16x1_SN_LDSB0_AFC1_AG0_AFEM1_AFEM1_ASEM1_CLR0_CADS0_DTLA0_DTLB0_DTVA0_DTVB0_DTVSM0_DPLB0_EPS0_ELFLR0_EMLLn1_FDSI0_GRPM1_GRVWA8_GRVWB8_GSU1_GSUAMB_GSUC0_GSUWGMRR0_GLS0_ISA1151_IU1_K1_LDSTI0_LBSPPA4096_LBSPPB2048_LBSPPM0_LPA8_LPB8_LPM0_LRVW16_LWPMn1_MIAV1_MIWT4_2_MO40_MGRIPM1_NTn1_NTA0_NTB0_NTC0_NTD0_NTM0_NEPBS0_NLCA1_NLCB1_ONLL1_PGR1_PLR0_PKA0_SGROB0_SIA1_SS1_SU32_SUM0_SUS256_SPO0_SRVW0_SSO0_SVW1_SK0_SKFTR0_SKXCCM0_SGRO0_TIN0_TLDS0_TLDSMn1_ULSGRO0_USL1_UIOFGRO0_USFGROn1_VSn1_VWA1_VWB1_WSGRA0_WSGRB0_WS32_WG32_4_1_WGM8_WGMXCC1_WGMXCCGn1
    SolutionIndex: 78
    SolutionNameMin: Cijk_Ailk_Bljk_HHS_BH_Bias_HA_S_SAV_UserArgs_MT128x64x64_MI16x16x1_SN_LDSB0_AFC1_AG0_AFEM1_AFEM1_ASEM1_CLR0_CADS0_DTLA0_DTLB0_DTVA0_DTVB0_DTVSM0_DPLB0_EPS0_ELFLR0_EMLLn1_FDSI0_GRPM1_GRVWA8_GRVWB8_GSU1_GSUAMB_GSUC0_GSUWGMRR0_GLS0_ISA1151_IU1_K1_LDSTI0_LBSPPA4096_LBSPPB2048_LBSPPM0_LPA8_LPB8_LPM0_LRVW16_LWPMn1_MIAV1_MIWT2_4_MO40_MGRIPM1_NTn1_NTA0_NTB0_NTC0_NTD0_NTM0_NEPBS0_NLCA1_NLCB1_ONLL1_PGR1_PLR0_PKA0_SGROB0_SIA1_SS1_SU32_SUM0_SUS256_SPO0_SRVW0_SSO0_SVW1_SK0_SKFTR0_SKXCCM0_SGRO0_TIN0_TLDS0_TLDSMn1_ULSGRO0_USL1_UIOFGRO0_USFGROn1_VSn1_VWA1_VWB1_WSGRA0_WSGRB0_WS32_WG64_2_1_WGM8_WGMXCC1_WGMXCCGn1
    SolutionIndex: 79
    SolutionNameMin: Cijk_Ailk_Bljk_HHS_BH_Bias_HA_S_SAV_UserArgs_MT128x96x32_MI16x16x1_SN_LDSB0_AFC1_AG0_AFEM1_AFEM1_ASEM1_CLR0_CADS0_DTLA0_DTLB0_DTVA0_DTVB0_DTVSM0_DPLB0_EPS0_ELFLR0_EMLLn1_FDSI0_GRPM1_GRVWA8_GRVWB8_GSU1_GSUAMB_GSUC0_GSUWGMRR0_GLS0_ISA1151_IU1_K1_LDSTI0_LBSPPA4096_LBSPPB3072_LBSPPM0_LPA8_LPB8_LPM0_LRVW16_LWPMn1_MIAV1_MIWT4_3_MO40_MGRIPM1_NTn1_NTA0_NTB0_NTC0_NTD0_NTM0_NEPBS0_NLCA1_NLCB1_ONLL1_PGR1_PLR0_PKA0_SGROB0_SIA1_SS1_SU32_SUM0_SUS256_SPO0_SRVW0_SSO0_SVW1_SK0_SKFTR0_SKXCCM0_SGRO0_TIN0_TLDS0_TLDSMn1_ULSGRO0_USL1_UIOFGRO0_USFGROn1_VSn1_VWA1_VWB1_WSGRA0_WSGRB0_WS32_WG32_4_1_WGM8_WGMXCC1_WGMXCCGn1
    SolutionIndex: 80
    SolutionNameMin: Cijk_Ailk_Bljk_HHS_BH_Bias_HA_S_SAV_UserArgs_MT32x16x32_MI16x16x1_SN_LDSB0_AFC1_AG0_AFEM1_AFEM1_ASEM1_CLR0_CADS0_DTLA0_DTLB0_DTVA0_DTVB0_DTVSM0_DPLB0_EPS0_ELFLR0_EMLLn1_FDSI0_GRPM1_GRVWA8_GRVWB8_GSU1_GSUAMB_GSUC0_GSUWGMRR0_GLS0_ISA1151_IU1_K1_LDSTI0_LBSPPA1024_LBSPPB512_LBSPPM0_LPA8_LPB8_LPM0_LRVW16_LWPMn1_MIAV1_MIWT1_1_MO40_MGRIPM1_NTn1_NTA0_NTB0_NTC0_NTD0_NTM0_NEPBS0_NLCA1_NLCB1_ONLL1_PGR2_PLR1_PKA0_SGROB0_SIA3_SS1_SU32_SUM0_SUS256_SPO0_SRVW0_SSO0_SVW1_SK0_SKFTR0_SKXCCM0_SGRO0_TIN0_TLDS0_TLDSMn1_ULSGRO0_USL1_UIOFGRO0_USFGROn1_VSn1_VWA1_VWB1_WSGRA0_WSGRB0_WS32_WG32_2_1_WGM8_WGMXCC1_WGMXCCGn1
    SolutionIndex: 81
    SolutionNameMin: Cijk_Ailk_Bljk_HHS_BH_Bias_HA_S_SAV_UserArgs_MT64x32x64_MI16x16x1_SN_LDSB0_AFC1_AG0_AFEM1_AFEM1_ASEM1_CLR0_CADS0_DTLA0_DTLB0_DTVA0_DTVB0_DTVSM0_DPLB0_EPS0_ELFLR0_EMLLn1_FDSI0_GRPM1_GRVWA8_GRVWB8_GSU1_GSUAMB_GSUC0_GSUWGMRR0_GLS0_ISA1151_IU1_K1_LDSTI0_LBSPPA2048_LBSPPB1024_LBSPPM0_LPA8_LPB8_LPM0_LRVW16_LWPMn1_MIAV1_MIWT2_1_MO40_MGRIPM1_NTn1_NTA0_NTB0_NTC0_NTD0_NTM0_NEPBS0_NLCA1_NLCB1_ONLL1_PGR2_PLR1_PKA0_SGROB0_SIA1_SS1_SU32_SUM0_SUS256_SPO0_SRVW0_SSO0_SVW1_SK0_SKFTR0_SKXCCM0_SGRO0_TIN0_TLDS0_TLDSMn1_ULSGRO0_USL1_UIOFGRO0_USFGROn1_VSn1_VWA1_VWB1_WSGRA0_WSGRB0_WS32_WG32_4_1_WGM8_WGMXCC1_WGMXCCGn1
    SolutionIndex: 82
    SolutionNameMin: Cijk_Ailk_Bljk_HHS_BH_Bias_HA_S_SAV_UserArgs_MT64x32x32_MI16x16x1_SN_LDSB0_AFC1_AG0_AFEM1_AFEM1_ASEM1_CLR0_CADS0_DTLA0_DTLB0_DTVA0_DTVB0_DTVSM0_DPLB0_EPS0_ELFLR0_EMLLn1_FDSI0_GRPM1_GRVWA8_GRVWB8_GSU1_GSUAMB_GSUC0_GSUWGMRR0_GLS0_ISA1151_IU1_K1_LDSTI0_LBSPPA2048_LBSPPB1024_LBSPPM0_LPA8_LPB8_LPM0_LRVW16_LWPMn1_MIAV1_MIWT2_1_MO40_MGRIPM1_NTn1_NTA0_NTB0_NTC0_NTD0_NTM0_NEPBS0_NLCA1_NLCB1_ONLL1_PGR2_PLR1_PKA0_SGROB0_SIA1_SS1_SU32_SUM0_SUS256_SPO0_SRVW0_SSO0_SVW1_SK0_SKFTR0_SKXCCM0_SGRO0_TIN0_TLDS0_TLDSMn1_ULSGRO0_USL1_UIOFGRO0_USFGROn1_VSn1_VWA1_VWB1_WSGRA0_WSGRB0_WS32_WG32_4_1_WGM8_WGMXCC1_WGMXCCGn1
    SolutionIndex: 83
    SolutionNameMin: Cijk_Ailk_Bljk_HHS_BH_Bias_HA_S_SAV_UserArgs_MT128x32x64_MI16x16x1_SN_LDSB0_AFC1_AG0_AFEM1_AFEM1_ASEM1_CLR0_CADS0_DTLA0_DTLB0_DTVA0_DTVB0_DTVSM0_DPLB0_EPS0_ELFLR0_EMLLn1_FDSI0_GRPM1_GRVWA8_GRVWB8_GSU1_GSUAMB_GSUC0_GSUWGMRR0_GLS0_ISA1151_IU1_K1_LDSTI0_LBSPPA4096_LBSPPB1024_LBSPPM0_LPA8_LPB8_LPM0_LRVW16_LWPMn1_MIAV1_MIWT2_2_MO40_MGRIPM1_NTn1_NTA0_NTB0_NTC0_NTD0_NTM0_NEPBS0_NLCA1_NLCB1_ONLL1_PGR2_PLR1_PKA0_SGROB0_SIA1_SS1_SU32_SUM0_SUS256_SPO0_SRVW0_SSO0_SVW1_SK0_SKFTR0_SKXCCM0_SGRO0_TIN0_TLDS0_TLDSMn1_ULSGRO0_USL1_UIOFGRO0_USFGROn1_VSn1_VWA1_VWB1_WSGRA0_WSGRB0_WS32_WG64_2_1_WGM8_WGMXCC1_WGMXCCGn1
    SolutionIndex: 84
    SolutionNameMin: Cijk_Ailk_Bljk_HHS_BH_Bias_HA_S_SAV_UserArgs_MT64x64x64_MI16x16x1_SN_LDSB0_AFC1_AG0_AFEM1_AFEM1_ASEM1_CLR0_CADS0_DTLA0_DTLB0_DTVA0_DTVB0_DTVSM0_DPLB0_EPS0_ELFLR0_EMLLn1_FDSI0_GRPM1_GRVWA8_GRVWB8_GSU1_GSUAMB_GSUC0_GSUWGMRR0_GLS0_ISA1151_IU1_K1_LDSTI0_LBSPPA2048_LBSPPB2048_LBSPPM0_LPA8_LPB8_LPM0_LRVW16_LWPMn1_MIAV1_MIWT2_2_MO40_MGRIPM1_NTn1_NTA0_NTB0_NTC0_NTD0_NTM0_NEPBS0_NLCA1_NLCB1_ONLL1_PGR2_PLR1_PKA0_SGROB0_SIA1_SS1_SU32_SUM0_SUS256_SPO0_SRVW0_SSO0_SVW1_SK0_SKFTR0_SKXCCM0_SGRO0_TIN0_TLDS0_TLDSMn1_ULSGRO0_USL1_UIOFGRO0_USFGROn1_VSn1_VWA1_VWB1_WSGRA0_WSGRB0_WS32_WG32_4_1_WGM8_WGMXCC1_WGMXCCGn1
    SolutionIndex: 85
    SolutionNameMin: Cijk_Ailk_Bljk_HHS_BH_Bias_HA_S_SAV_UserArgs_MT128x32x32_MI16x16x1_SN_LDSB0_AFC1_AG0_AFEM1_AFEM1_ASEM1_CLR0_CADS0_DTLA0_DTLB0_DTVA0_DTVB0_DTVSM0_DPLB0_EPS0_ELFLR0_EMLLn1_FDSI0_GRPM1_GRVWA8_GRVWB8_GSU1_GSUAMB_GSUC0_GSUWGMRR0_GLS0_ISA1151_IU1_K1_LDSTI0_LBSPPA4096_LBSPPB1024_LBSPPM0_LPA8_LPB8_LPM0_LRVW16_LWPMn1_MIAV1_MIWT2_2_MO40_MGRIPM1_NTn1_NTA0_NTB0_NTC0_NTD0_NTM0_NEPBS0_NLCA1_NLCB1_ONLL1_PGR2_PLR1_PKA0_SGROB0_SIA1_SS1_SU32_SUM0_SUS256_SPO0_SRVW0_SSO0_SVW1_SK0_SKFTR0_SKXCCM0_SGRO0_TIN0_TLDS0_TLDSMn1_ULSGRO0_USL1_UIOFGRO0_USFGROn1_VSn1_VWA1_VWB1_WSGRA0_WSGRB0_WS32_WG64_2_1_WGM8_WGMXCC1_WGMXCCGn1
    SolutionIndex: 87
    SolutionNameMin: Cijk_Ailk_Bljk_HHS_BH_Bias_HA_S_SAV_UserArgs_MT128x64x32_MI16x16x1_SN_LDSB0_AFC1_AG0_AFEM1_AFEM1_ASEM1_CLR0_CADS0_DTLA0_DTLB0_DTVA0_DTVB0_DTVSM0_DPLB0_EPS0_ELFLR0_EMLLn1_FDSI0_GRPM1_GRVWA8_GRVWB8_GSU1_GSUAMB_GSUC0_GSUWGMRR0_GLS0_ISA1151_IU1_K1_LDSTI0_LBSPPA4096_LBSPPB2048_LBSPPM0_LPA8_LPB8_LPM0_LRVW16_LWPMn1_MIAV1_MIWT4_2_MO40_MGRIPM1_NTn1_NTA0_NTB0_NTC0_NTD0_NTM0_NEPBS0_NLCA1_NLCB1_ONLL1_PGR2_PLR0_PKA0_SGROB0_SIA1_SS1_SU32_SUM0_SUS256_SPO0_SRVW0_SSO0_SVW1_SK0_SKFTR0_SKXCCM0_SGRO0_TIN0_TLDS0_TLDSMn1_ULSGRO0_USL1_UIOFGRO0_USFGROn1_VSn1_VWA1_VWB1_WSGRA0_WSGRB0_WS32_WG32_4_1_WGM8_WGMXCC1_WGMXCCGn1
    SolutionIndex: 88
    SolutionNameMin: Cijk_Ailk_Bljk_HHS_BH_Bias_HA_S_SAV_UserArgs_MT128x64x64_MI16x16x1_SN_LDSB0_AFC1_AG0_AFEM1_AFEM1_ASEM1_CLR0_CADS0_DTLA0_DTLB0_DTVA0_DTVB0_DTVSM0_DPLB0_EPS0_ELFLR0_EMLLn1_FDSI0_GRPM1_GRVWA8_GRVWB8_GSU1_GSUAMB_GSUC0_GSUWGMRR0_GLS0_ISA1151_IU1_K1_LDSTI0_LBSPPA4096_LBSPPB2048_LBSPPM0_LPA8_LPB8_LPM0_LRVW16_LWPMn1_MIAV1_MIWT4_2_MO40_MGRIPM1_NTn1_NTA0_NTB0_NTC0_NTD0_NTM0_NEPBS0_NLCA1_NLCB1_ONLL1_PGR2_PLR0_PKA0_SGROB0_SIA1_SS1_SU32_SUM0_SUS256_SPO0_SRVW0_SSO0_SVW1_SK0_SKFTR0_SKXCCM0_SGRO0_TIN0_TLDS0_TLDSMn1_ULSGRO0_USL1_UIOFGRO0_USFGROn1_VSn1_VWA1_VWB1_WSGRA0_WSGRB0_WS32_WG32_4_1_WGM8_WGMXCC1_WGMXCCGn1
    SolutionIndex: 89
    SolutionNameMin: Cijk_Ailk_Bljk_HHS_BH_Bias_HA_S_SAV_UserArgs_MT128x64x64_MI16x16x1_SN_LDSB0_AFC1_AG0_AFEM1_AFEM1_ASEM1_CLR0_CADS0_DTLA0_DTLB0_DTVA0_DTVB0_DTVSM0_DPLB0_EPS0_ELFLR0_EMLLn1_FDSI0_GRPM1_GRVWA8_GRVWB8_GSU1_GSUAMB_GSUC0_GSUWGMRR0_GLS0_ISA1151_IU1_K1_LDSTI0_LBSPPA4096_LBSPPB2048_LBSPPM0_LPA8_LPB8_LPM0_LRVW16_LWPMn1_MIAV1_MIWT2_4_MO40_MGRIPM1_NTn1_NTA0_NTB0_NTC0_NTD0_NTM0_NEPBS0_NLCA1_NLCB1_ONLL1_PGR2_PLR0_PKA0_SGROB0_SIA1_SS1_SU32_SUM0_SUS256_SPO0_SRVW0_SSO0_SVW1_SK0_SKFTR0_SKXCCM0_SGRO0_TIN0_TLDS0_TLDSMn1_ULSGRO0_USL1_UIOFGRO0_USFGROn1_VSn1_VWA1_VWB1_WSGRA0_WSGRB0_WS32_WG64_2_1_WGM8_WGMXCC1_WGMXCCGn1
    SolutionIndex: 90
    SolutionNameMin: Cijk_Ailk_Bljk_HHS_BH_Bias_HA_S_SAV_UserArgs_MT128x64x32_MI16x16x1_SN_LDSB0_AFC1_AG0_AFEM1_AFEM1_ASEM1_CLR0_CADS0_DTLA0_DTLB0_DTVA0_DTVB0_DTVSM0_DPLB0_EPS0_ELFLR0_EMLLn1_FDSI0_GRPM1_GRVWA8_GRVWB8_GSU1_GSUAMB_GSUC0_GSUWGMRR0_GLS0_ISA1151_IU1_K1_LDSTI0_LBSPPA4096_LBSPPB2048_LBSPPM0_LPA8_LPB8_LPM0_LRVW16_LWPMn1_MIAV1_MIWT2_4_MO40_MGRIPM1_NTn1_NTA0_NTB0_NTC0_NTD0_NTM0_NEPBS0_NLCA1_NLCB1_ONLL1_PGR1_PLR0_PKA0_SGROB0_SIA3_SS1_SU32_SUM0_SUS256_SPO0_SRVW0_SSO0_SVW1_SK0_SKFTR0_SKXCCM0_SGRO0_TIN0_TLDS0_TLDSMn1_ULSGRO0_USL1_UIOFGRO0_USFGROn1_VSn1_VWA1_VWB1_WSGRA0_WSGRB0_WS32_WG64_2_1_WGM8_WGMXCC1_WGMXCCGn1
    SolutionIndex: 91
    SolutionNameMin: Cijk_Ailk_Bljk_HHS_BH_Bias_HA_S_SAV_UserArgs_MT128x64x64_MI16x16x1_SN_LDSB1_AFC1_AG0_AFEM1_AFEM1_ASEM1_CLR0_CADS0_DTLA0_DTLB0_DTVA0_DTVB0_DTVSM0_DPLB0_EPS0_ELFLR0_EMLLn1_FDSI0_GRPM1_GRVWA8_GRVWB8_GSU1_GSUAMB_GSUC0_GSUWGMRR0_GLS0_ISA1151_IU1_K1_LDSTI0_LBSPPA4096_LBSPPB2048_LBSPPM0_LPA8_LPB8_LPM0_LRVW16_LWPMn1_MIAV1_MIWT2_4_MO40_MGRIPM1_NTn1_NTA0_NTB0_NTC0_NTD0_NTM0_NEPBS0_NLCA1_NLCB1_ONLL1_PGR2_PLR0_PKA0_SGROB0_SIA3_SS1_SU32_SUM0_SUS256_SPO0_SRVW0_SSO0_SVW1_SK0_SKFTR0_SKXCCM0_SGRO0_TIN0_TLDS0_TLDSMn1_ULSGRO0_USL1_UIOFGRO0_USFGROn1_VSn1_VWA1_VWB1_WSGRA0_WSGRB0_WS32_WG64_2_1_WGM8_WGMXCC1_WGMXCCGn1
    SolutionIndex: 92
    SolutionNameMin: Cijk_Ailk_Bljk_HHS_BH_Bias_HA_S_SAV_UserArgs_MT128x64x32_MI16x16x1_SN_LDSB1_AFC1_AG0_AFEM1_AFEM1_ASEM1_CLR0_CADS0_DTLA0_DTLB0_DTVA0_DTVB0_DTVSM0_DPLB0_EPS0_ELFLR0_EMLLn1_FDSI0_GRPM1_GRVWA8_GRVWB8_GSU1_GSUAMB_GSUC0_GSUWGMRR0_GLS0_ISA1151_IU1_K1_LDSTI0_LBSPPA4096_LBSPPB2048_LBSPPM0_LPA8_LPB8_LPM0_LRVW16_LWPMn1_MIAV1_MIWT2_4_MO40_MGRIPM1_NTn1_NTA0_NTB0_NTC0_NTD0_NTM0_NEPBS0_NLCA1_NLCB1_ONLL1_PGR1_PLR0_PKA0_SGROB0_SIA3_SS1_SU32_SUM0_SUS256_SPO0_SRVW0_SSO0_SVW1_SK0_SKFTR0_SKXCCM0_SGRO0_TIN0_TLDS0_TLDSMn1_ULSGRO0_USL1_UIOFGRO0_USFGROn1_VSn1_VWA1_VWB1_WSGRA0_WSGRB0_WS32_WG64_2_1_WGM8_WGMXCC1_WGMXCCGn1
    SolutionIndex: 93
    SolutionNameMin: Cijk_Ailk_Bljk_HHS_BH_Bias_HA_S_SAV_UserArgs_MT128x96x32_MI16x16x1_SN_LDSB0_AFC1_AG0_AFEM1_AFEM1_ASEM1_CLR0_CADS0_DTLA0_DTLB0_DTVA0_DTVB0_DTVSM0_DPLB0_EPS0_ELFLR0_EMLLn1_FDSI0_GRPM1_GRVWA8_GRVWB8_GSU1_GSUAMB_GSUC0_GSUWGMRR0_GLS0_ISA1151_IU1_K1_LDSTI0_LBSPPA4096_LBSPPB3072_LBSPPM0_LPA8_LPB8_LPM0_LRVW16_LWPMn1_MIAV1_MIWT4_3_MO40_MGRIPM1_NTn1_NTA0_NTB0_NTC0_NTD0_NTM0_NEPBS0_NLCA1_NLCB1_ONLL1_PGR2_PLR0_PKA0_SGROB0_SIA1_SS1_SU32_SUM0_SUS256_SPO0_SRVW0_SSO0_SVW1_SK0_SKFTR0_SKXCCM0_SGRO0_TIN0_TLDS0_TLDSMn1_ULSGRO0_USL1_UIOFGRO0_USFGROn1_VSn1_VWA1_VWB1_WSGRA0_WSGRB0_WS32_WG32_4_1_WGM8_WGMXCC1_WGMXCCGn1
    SolutionIndex: 94
    SolutionNameMin: Cijk_Ailk_Bljk_HHS_BH_Bias_HA_S_SAV_UserArgs_MT128x64x32_MI16x16x1_SN_LDSB1_AFC1_AG0_AFEM1_AFEM1_ASEM1_CLR0_CADS0_DTLA0_DTLB0_DTVA0_DTVB0_DTVSM0_DPLB0_EPS0_ELFLR0_EMLLn1_FDSI0_GRPM1_GRVWA8_GRVWB8_GSU1_GSUAMB_GSUC0_GSUWGMRR0_GLS0_ISA1151_IU1_K1_LDSTI0_LBSPPA4096_LBSPPB2048_LBSPPM0_LPA8_LPB8_LPM0_LRVW16_LWPMn1_MIAV1_MIWT4_2_MO40_MGRIPM1_NTn1_NTA0_NTB0_NTC0_NTD0_NTM0_NEPBS0_NLCA1_NLCB1_ONLL1_PGR1_PLR0_PKA0_SGROB0_SIA3_SS1_SU32_SUM0_SUS256_SPO0_SRVW0_SSO0_SVW1_SK0_SKFTR0_SKXCCM0_SGRO0_TIN0_TLDS0_TLDSMn1_ULSGRO0_USL1_UIOFGRO0_USFGROn1_VSn1_VWA1_VWB1_WSGRA0_WSGRB0_WS32_WG32_4_1_WGM8_WGMXCC1_WGMXCCGn1
    SolutionIndex: 95
    SolutionNameMin: Cijk_Ailk_Bljk_HHS_BH_Bias_HA_S_SAV_UserArgs_MT64x96x32_MI16x16x1_SN_LDSB1_AFC1_AG0_AFEM1_AFEM1_ASEM1_CLR0_CADS0_DTLA0_DTLB0_DTVA0_DTVB0_DTVSM0_DPLB0_EPS0_ELFLR0_EMLLn1_FDSI0_GRPM1_GRVWA8_GRVWB8_GSU1_GSUAMB_GSUC0_GSUWGMRR0_GLS0_ISA1151_IU1_K1_LDSTI0_LBSPPA2048_LBSPPB3072_LBSPPM0_LPA8_LPB8_LPM0_LRVW16_LWPMn1_MIAV1_MIWT2_3_MO40_MGRIPM1_NTn1_NTA0_NTB0_NTC0_NTD0_NTM0_NEPBS0_NLCA1_NLCB1_ONLL1_PGR2_PLR0_PKA0_SGROB0_SIA3_SS1_SU32_SUM0_SUS256_SPO0_SRVW0_SSO0_SVW1_SK0_SKFTR0_SKXCCM0_SGRO0_TIN0_TLDS0_TLDSMn1_ULSGRO0_USL1_UIOFGRO0_USFGROn1_VSn1_VWA1_VWB1_WSGRA0_WSGRB0_WS32_WG32_4_1_WGM8_WGMXCC1_WGMXCCGn1
    SolutionIndex: 96
    SolutionNameMin: Cijk_Ailk_Bljk_HHS_BH_Bias_HA_S_SAV_UserArgs_MT128x64x32_MI16x16x1_SN_LDSB1_AFC1_AG0_AFEM1_AFEM1_ASEM1_CLR0_CADS0_DTLA0_DTLB0_DTVA0_DTVB0_DTVSM0_DPLB0_EPS0_ELFLR0_EMLLn1_FDSI0_GRPM1_GRVWA8_GRVWB8_GSU1_GSUAMB_GSUC0_GSUWGMRR0_GLS0_ISA1151_IU1_K1_LDSTI0_LBSPPA4096_LBSPPB2048_LBSPPM0_LPA8_LPB8_LPM0_LRVW16_LWPMn1_MIAV1_MIWT4_2_MO40_MGRIPM1_NTn1_NTA0_NTB0_NTC0_NTD0_NTM0_NEPBS0_NLCA1_NLCB1_ONLL1_PGR2_PLR0_PKA0_SGROB0_SIA3_SS1_SU32_SUM0_SUS256_SPO0_SRVW0_SSO0_SVW1_SK0_SKFTR0_SKXCCM0_SGRO0_TIN0_TLDS0_TLDSMn1_ULSGRO0_USL1_UIOFGRO0_USFGROn1_VSn1_VWA1_VWB1_WSGRA0_WSGRB0_WS32_WG32_4_1_WGM8_WGMXCC1_WGMXCCGn1
    SolutionIndex: 97
    SolutionNameMin: Cijk_Ailk_Bljk_HHS_BH_Bias_HA_S_SAV_UserArgs_MT128x96x32_MI16x16x1_SN_LDSB1_AFC1_AG0_AFEM1_AFEM1_ASEM1_CLR0_CADS0_DTLA0_DTLB0_DTVA0_DTVB0_DTVSM0_DPLB0_EPS0_ELFLR0_EMLLn1_FDSI0_GRPM1_GRVWA8_GRVWB8_GSU1_GSUAMB_GSUC0_GSUWGMRR0_GLS0_ISA1151_IU1_K1_LDSTI0_LBSPPA4096_LBSPPB3072_LBSPPM0_LPA8_LPB8_LPM0_LRVW16_LWPMn1_MIAV1_MIWT4_3_MO40_MGRIPM1_NTn1_NTA0_NTB0_NTC0_NTD0_NTM0_NEPBS0_NLCA1_NLCB1_ONLL1_PGR2_PLR0_PKA0_SGROB0_SIA3_SS1_SU32_SUM0_SUS256_SPO0_SRVW0_SSO0_SVW1_SK0_SKFTR0_SKXCCM0_SGRO0_TIN0_TLDS0_TLDSMn1_ULSGRO0_USL1_UIOFGRO0_USFGROn1_VSn1_VWA1_VWB1_WSGRA0_WSGRB0_WS32_WG32_4_1_WGM8_WGMXCC1_WGMXCCGn1
    SolutionIndex: 98
    SolutionNameMin: Cijk_Ailk_Bljk_HHS_BH_Bias_HA_S_SAV_UserArgs_MT64x96x32_MI16x16x1_SN_LDSB1_AFC1_AG0_AFEM1_AFEM1_ASEM1_CLR0_CADS0_DTLA0_DTLB0_DTVA0_DTVB0_DTVSM0_DPLB0_EPS0_ELFLR0_EMLLn1_FDSI0_GRPM1_GRVWA8_GRVWB8_GSU1_GSUAMB_GSUC0_GSUWGMRR0_GLS0_ISA1151_IU1_K1_LDSTI0_LBSPPA2048_LBSPPB3072_LBSPPM0_LPA8_LPB8_LPM0_LRVW16_LWPMn1_MIAV1_MIWT2_3_MO40_MGRIPM1_NTn1_NTA0_NTB0_NTC0_NTD0_NTM0_NEPBS0_NLCA1_NLCB1_ONLL1_PGR1_PLR0_PKA0_SGROB0_SIA3_SS1_SU32_SUM0_SUS256_SPO0_SRVW0_SSO0_SVW1_SK0_SKFTR0_SKXCCM0_SGRO0_TIN0_TLDS0_TLDSMn1_ULSGRO0_USL1_UIOFGRO0_USFGROn1_VSn1_VWA1_VWB1_WSGRA0_WSGRB0_WS32_WG32_4_1_WGM8_WGMXCC1_WGMXCCGn1
    SolutionIndex: 99
    SolutionNameMin: Cijk_Ailk_Bljk_HHS_BH_Bias_HA_S_SAV_UserArgs_MT128x96x32_MI16x16x1_SN_LDSB1_AFC1_AG0_AFEM1_AFEM1_ASEM1_CLR0_CADS0_DTLA0_DTLB0_DTVA0_DTVB0_DTVSM0_DPLB0_EPS0_ELFLR0_EMLLn1_FDSI0_GRPM1_GRVWA8_GRVWB8_GSU1_GSUAMB_GSUC0_GSUWGMRR0_GLS0_ISA1151_IU1_K1_LDSTI0_LBSPPA4096_LBSPPB3072_LBSPPM0_LPA8_LPB8_LPM0_LRVW16_LWPMn1_MIAV1_MIWT4_3_MO40_MGRIPM1_NTn1_NTA0_NTB0_NTC0_NTD0_NTM0_NEPBS0_NLCA1_NLCB1_ONLL1_PGR1_PLR0_PKA0_SGROB0_SIA3_SS1_SU32_SUM0_SUS256_SPO0_SRVW0_SSO0_SVW1_SK0_SKFTR0_SKXCCM0_SGRO0_TIN0_TLDS0_TLDSMn1_ULSGRO0_USL1_UIOFGRO0_USFGROn1_VSn1_VWA1_VWB1_WSGRA0_WSGRB0_WS32_WG32_4_1_WGM8_WGMXCC1_WGMXCCGn1
    SolutionIndex: 100
    SolutionNameMin: Cijk_Ailk_Bljk_HHS_BH_Bias_HA_S_SAV_UserArgs_MT128x32x32_MI16x16x1_SN_LDSB0_AFC1_AG0_AFEM1_AFEM1_ASEM1_CLR0_CADS0_DTLA0_DTLB0_DTVA0_DTVB0_DTVSM0_DPLB0_EPS0_ELFLR0_EMLLn1_FDSI0_GRPM1_GRVWA8_GRVWB8_GSU1_GSUAMB_GSUC0_GSUWGMRR0_GLS0_ISA1151_IU1_K1_LDSTI0_LBSPPA4096_LBSPPB1024_LBSPPM0_LPA8_LPB8_LPM0_LRVW16_LWPMn1_MIAV1_MIWT2_2_MO40_MGRIPM1_NTn1_NTA0_NTB0_NTC0_NTD0_NTM0_NEPBS0_NLCA1_NLCB1_ONLL1_PGR2_PLR1_PKA0_SGROB0_SIA3_SS1_SU32_SUM0_SUS256_SPO0_SRVW0_SSO0_SVW1_SK0_SKFTR0_SKXCCM0_SGRO0_TIN0_TLDS0_TLDSMn1_ULSGRO0_USL1_UIOFGRO0_USFGROn1_VSn1_VWA1_VWB1_WSGRA0_WSGRB0_WS32_WG64_2_1_WGM8_WGMXCC1_WGMXCCGn1
    SolutionIndex: 101
    SolutionNameMin: Cijk_Ailk_Bljk_HHS_BH_Bias_HA_S_SAV_UserArgs_MT128x64x64_MI16x16x1_SN_LDSB1_AFC1_AG0_AFEM1_AFEM1_ASEM1_CLR0_CADS0_DTLA0_DTLB0_DTVA0_DTVB0_DTVSM0_DPLB0_EPS0_ELFLR0_EMLLn1_FDSI0_GRPM1_GRVWA8_GRVWB8_GSU1_GSUAMB_GSUC0_GSUWGMRR0_GLS0_ISA1151_IU1_K1_LDSTI0_LBSPPA4096_LBSPPB2048_LBSPPM0_LPA8_LPB8_LPM0_LRVW16_LWPMn1_MIAV1_MIWT2_4_MO40_MGRIPM1_NTn1_NTA0_NTB0_NTC0_NTD0_NTM0_NEPBS0_NLCA1_NLCB1_ONLL1_PGR1_PLR0_PKA0_SGROB0_SIA3_SS1_SU32_SUM0_SUS256_SPO0_SRVW0_SSO0_SVW1_SK0_SKFTR0_SKXCCM0_SGRO0_TIN0_TLDS0_TLDSMn1_ULSGRO0_USL1_UIOFGRO0_USFGROn1_VSn1_VWA1_VWB1_WSGRA0_WSGRB0_WS32_WG64_2_1_WGM8_WGMXCC1_WGMXCCGn1
    SolutionIndex: 102
    SolutionNameMin: Cijk_Ailk_Bljk_HHS_BH_Bias_HA_S_SAV_UserArgs_MT128x64x32_MI16x16x1_SN_LDSB0_AFC1_AG0_AFEM1_AFEM1_ASEM1_CLR0_CADS0_DTLA0_DTLB0_DTVA0_DTVB0_DTVSM0_DPLB0_EPS0_ELFLR0_EMLLn1_FDSI0_GRPM1_GRVWA8_GRVWB8_GSU1_GSUAMB_GSUC0_GSUWGMRR0_GLS0_ISA1151_IU1_K1_LDSTI0_LBSPPA4096_LBSPPB2048_LBSPPM0_LPA8_LPB8_LPM0_LRVW16_LWPMn1_MIAV1_MIWT2_4_MO40_MGRIPM1_NTn1_NTA0_NTB0_NTC0_NTD0_NTM0_NEPBS0_NLCA1_NLCB1_ONLL1_PGR1_PLR0_PKA0_SGROB0_SIA1_SS1_SU32_SUM0_SUS256_SPO0_SRVW0_SSO0_SVW1_SK0_SKFTR0_SKXCCM0_SGRO0_TIN0_TLDS0_TLDSMn1_ULSGRO0_USL1_UIOFGRO0_USFGROn1_VSn1_VWA1_VWB1_WSGRA0_WSGRB0_WS32_WG64_2_1_WGM8_WGMXCC1_WGMXCCGn1
    SolutionIndex: 103
    SolutionNameMin: Cijk_Ailk_Bljk_HHS_BH_Bias_HA_S_SAV_UserArgs_MT128x64x32_MI16x16x1_SN_LDSB0_AFC1_AG0_AFEM1_AFEM1_ASEM1_CLR0_CADS0_DTLA0_DTLB0_DTVA0_DTVB0_DTVSM0_DPLB0_EPS0_ELFLR0_EMLLn1_FDSI0_GRPM1_GRVWA8_GRVWB8_GSU1_GSUAMB_GSUC0_GSUWGMRR0_GLS0_ISA1151_IU1_K1_LDSTI0_LBSPPA4096_LBSPPB2048_LBSPPM0_LPA8_LPB8_LPM0_LRVW16_LWPMn1_MIAV1_MIWT4_2_MO40_MGRIPM1_NTn1_NTA0_NTB0_NTC0_NTD0_NTM0_NEPBS0_NLCA1_NLCB1_ONLL1_PGR1_PLR0_PKA0_SGROB0_SIA1_SS1_SU32_SUM0_SUS256_SPO0_SRVW0_SSO0_SVW1_SK0_SKFTR0_SKXCCM0_SGRO0_TIN0_TLDS0_TLDSMn1_ULSGRO0_USL1_UIOFGRO0_USFGROn1_VSn1_VWA1_VWB1_WSGRA0_WSGRB0_WS32_WG32_4_1_WGM8_WGMXCC1_WGMXCCGn1
    SolutionIndex: 104
    SolutionNameMin: Cijk_Ailk_Bljk_HHS_BH_Bias_HA_S_SAV_UserArgs_MT128x64x32_MI16x16x1_SN_LDSB1_AFC1_AG0_AFEM1_AFEM1_ASEM1_CLR0_CADS0_DTLA0_DTLB0_DTVA0_DTVB0_DTVSM0_DPLB0_EPS0_ELFLR0_EMLLn1_FDSI0_GRPM1_GRVWA8_GRVWB8_GSU1_GSUAMB_GSUC0_GSUWGMRR0_GLS0_ISA1151_IU1_K1_LDSTI0_LBSPPA4096_LBSPPB2048_LBSPPM0_LPA8_LPB8_LPM0_LRVW16_LWPMn1_MIAV1_MIWT2_4_MO40_MGRIPM1_NTn1_NTA0_NTB0_NTC0_NTD0_NTM0_NEPBS0_NLCA1_NLCB1_ONLL1_PGR2_PLR0_PKA0_SGROB0_SIA3_SS1_SU32_SUM0_SUS256_SPO0_SRVW0_SSO0_SVW1_SK0_SKFTR0_SKXCCM0_SGRO0_TIN0_TLDS0_TLDSMn1_ULSGRO0_USL1_UIOFGRO0_USFGROn1_VSn1_VWA1_VWB1_WSGRA0_WSGRB0_WS32_WG64_2_1_WGM8_WGMXCC1_WGMXCCGn1
    SolutionIndex: 105
    SolutionNameMin: Cijk_Ailk_Bljk_HHS_BH_Bias_HA_S_SAV_UserArgs_MT128x48x32_MI16x16x1_SN_LDSB1_AFC1_AG0_AFEM1_AFEM1_ASEM1_CLR0_CADS0_DTLA0_DTLB0_DTVA0_DTVB0_DTVSM0_DPLB0_EPS0_ELFLR0_EMLLn1_FDSI0_GRPM1_GRVWA8_GRVWB4_GSU1_GSUAMB_GSUC0_GSUWGMRR0_GLS0_ISA1151_IU1_K1_LDSTI0_LBSPPA4096_LBSPPB1536_LBSPPM0_LPA8_LPB8_LPM0_LRVW16_LWPMn1_MIAV1_MIWT2_3_MO40_MGRIPM1_NTn1_NTA0_NTB0_NTC0_NTD0_NTM0_NEPBS0_NLCA1_NLCB1_ONLL1_PGR2_PLR0_PKA0_SGROB0_SIA3_SS1_SU32_SUM0_SUS256_SPO0_SRVW0_SSO0_SVW1_SK0_SKFTR0_SKXCCM0_SGRO0_TIN0_TLDS0_TLDSMn1_ULSGRO0_USL1_UIOFGRO0_USFGROn1_VSn1_VWA1_VWB1_WSGRA0_WSGRB0_WS32_WG64_2_1_WGM8_WGMXCC1_WGMXCCGn1
    SolutionIndex: 106
    SolutionNameMin: Cijk_Ailk_Bljk_HHS_BH_Bias_HA_S_SAV_UserArgs_MT32x16x32_MI16x16x1_SN_LDSB0_AFC1_AG0_AFEM1_AFEM1_ASEM1_CLR0_CADS0_DTLA0_DTLB0_DTVA0_DTVB0_DTVSM0_DPLB0_EPS0_ELFLR0_EMLLn1_FDSI0_GRPM1_GRVWA8_GRVWB8_GSU1_GSUAMB_GSUC0_GSUWGMRR0_GLS0_ISA1151_IU1_K1_LDSTI0_LBSPPA1024_LBSPPB512_LBSPPM0_LPA8_LPB8_LPM0_LRVW16_LWPMn1_MIAV1_MIWT1_1_MO40_MGRIPM1_NTn1_NTA0_NTB0_NTC0_NTD0_NTM0_NEPBS0_NLCA1_NLCB1_ONLL1_PGR2_PLR1_PKA0_SGROB0_SIA1_SS1_SU32_SUM0_SUS256_SPO0_SRVW0_SSO0_SVW1_SK0_SKFTR0_SKXCCM0_SGRO0_TIN0_TLDS0_TLDSMn1_ULSGRO0_USL1_UIOFGRO0_USFGROn1_VSn1_VWA1_VWB1_WSGRA0_WSGRB0_WS32_WG32_2_1_WGM8_WGMXCC1_WGMXCCGn1
    SolutionIndex: 107
    SolutionNameMin: Cijk_Ailk_Bljk_HHS_BH_Bias_HA_S_SAV_UserArgs_MT64x16x128_MI16x16x1_SN_LDSB0_AFC1_AG0_AFEM1_AFEM1_ASEM1_CLR0_CADS0_DTLA0_DTLB0_DTVA0_DTVB0_DTVSM0_DPLB0_EPS0_ELFLR0_EMLLn1_FDSI0_GRPM1_GRVWA8_GRVWB8_GSU1_GSUAMB_GSUC0_GSUWGMRR0_GLS0_ISA1151_IU1_K1_LDSTI0_LBSPPA2048_LBSPPB512_LBSPPM0_LPA8_LPB8_LPM0_LRVW16_LWPMn1_MIAV1_MIWT1_1_MO40_MGRIPM1_NTn1_NTA0_NTB0_NTC0_NTD0_NTM0_NEPBS0_NLCA1_NLCB1_ONLL1_PGR2_PLR0_PKA0_SGROB0_SIA1_SS1_SU32_SUM0_SUS256_SPO0_SRVW0_SSO0_SVW1_SK0_SKFTR0_SKXCCM0_SGRO0_TIN0_TLDS0_TLDSMn1_ULSGRO0_USL1_UIOFGRO0_USFGROn1_VSn1_VWA1_VWB1_WSGRA0_WSGRB0_WS32_WG64_2_1_WGM8_WGMXCC1_WGMXCCGn1
    SolutionIndex: 109
    SolutionNameMin: Cijk_Ailk_Bljk_HHS_BH_Bias_HA_S_SAV_UserArgs_MT64x32x128_MI16x16x1_SN_LDSB0_AFC1_AG0_AFEM1_AFEM1_ASEM1_CLR0_CADS0_DTLA0_DTLB0_DTVA0_DTVB0_DTVSM0_DPLB0_EPS0_ELFLR0_EMLLn1_FDSI0_GRPM1_GRVWA8_GRVWB8_GSU1_GSUAMB_GSUC0_GSUWGMRR0_GLS0_ISA1151_IU1_K1_LDSTI0_LBSPPA2048_LBSPPB1024_LBSPPM0_LPA8_LPB8_LPM0_LRVW16_LWPMn1_MIAV1_MIWT2_1_MO40_MGRIPM1_NTn1_NTA0_NTB0_NTC0_NTD0_NTM0_NEPBS0_NLCA1_NLCB1_ONLL1_PGR2_PLR1_PKA0_SGROB0_SIA1_SS1_SU32_SUM0_SUS256_SPO0_SRVW0_SSO0_SVW1_SK0_SKFTR0_SKXCCM0_SGRO0_TIN0_TLDS0_TLDSMn1_ULSGRO0_USL1_UIOFGRO0_USFGROn1_VSn1_VWA1_VWB1_WSGRA0_WSGRB0_WS32_WG32_4_1_WGM8_WGMXCC1_WGMXCCGn1
    SolutionIndex: 110
    SolutionNameMin: Cijk_Ailk_Bljk_HHS_BH_Bias_HA_S_SAV_UserArgs_MT64x16x64_MI16x16x1_SN_LDSB0_AFC1_AG0_AFEM1_AFEM1_ASEM1_CLR0_CADS0_DTLA0_DTLB0_DTVA0_DTVB0_DTVSM0_DPLB0_EPS0_ELFLR0_EMLLn1_FDSI0_GRPM1_GRVWA8_GRVWB8_GSU1_GSUAMB_GSUC0_GSUWGMRR0_GLS0_ISA1151_IU1_K1_LDSTI0_LBSPPA2048_LBSPPB512_LBSPPM0_LPA8_LPB8_LPM0_LRVW16_LWPMn1_MIAV1_MIWT1_1_MO40_MGRIPM1_NTn1_NTA0_NTB0_NTC0_NTD0_NTM0_NEPBS0_NLCA1_NLCB1_ONLL1_PGR2_PLR1_PKA0_SGROB0_SIA1_SS1_SU32_SUM0_SUS256_SPO0_SRVW0_SSO0_SVW1_SK0_SKFTR0_SKXCCM0_SGRO0_TIN0_TLDS0_TLDSMn1_ULSGRO0_USL1_UIOFGRO0_USFGROn1_VSn1_VWA1_VWB1_WSGRA0_WSGRB0_WS32_WG64_2_1_WGM8_WGMXCC1_WGMXCCGn1
    SolutionIndex: 112
    SolutionNameMin: Cijk_Ailk_Bljk_HHS_BH_Bias_HA_S_SAV_UserArgs_MT64x48x128_MI16x16x1_SN_LDSB0_AFC1_AG0_AFEM1_AFEM1_ASEM1_CLR0_CADS0_DTLA0_DTLB0_DTVA0_DTVB0_DTVSM0_DPLB0_EPS0_ELFLR0_EMLLn1_FDSI0_GRPM1_GRVWA8_GRVWB8_GSU1_GSUAMB_GSUC0_GSUWGMRR0_GLS0_ISA1151_IU1_K1_LDSTI0_LBSPPA2048_LBSPPB1536_LBSPPM0_LPA8_LPB8_LPM0_LRVW16_LWPMn1_MIAV1_MIWT1_3_MO40_MGRIPM1_NTn1_NTA0_NTB0_NTC0_NTD0_NTM0_NEPBS0_NLCA1_NLCB1_ONLL1_PGR2_PLR1_PKA0_SGROB0_SIA1_SS1_SU32_SUM0_SUS256_SPO0_SRVW0_SSO0_SVW1_SK0_SKFTR0_SKXCCM0_SGRO0_TIN0_TLDS0_TLDSMn1_ULSGRO0_USL1_UIOFGRO0_USFGROn1_VSn1_VWA1_VWB1_WSGRA0_WSGRB0_WS32_WG64_2_1_WGM8_WGMXCC1_WGMXCCGn1
    SolutionIndex: 113
    SolutionNameMin: Cijk_Ailk_Bljk_HHS_BH_Bias_HA_S_SAV_UserArgs_MT64x48x128_MI16x16x1_SN_LDSB0_AFC1_AG0_AFEM1_AFEM1_ASEM1_CLR0_CADS0_DTLA0_DTLB0_DTVA0_DTVB0_DTVSM0_DPLB0_EPS0_ELFLR0_EMLLn1_FDSI0_GRPM1_GRVWA8_GRVWB8_GSU1_GSUAMB_GSUC0_GSUWGMRR0_GLS0_ISA1151_IU1_K1_LDSTI0_LBSPPA2048_LBSPPB1536_LBSPPM0_LPA8_LPB8_LPM0_LRVW16_LWPMn1_MIAV1_MIWT1_3_MO40_MGRIPM1_NTn1_NTA0_NTB0_NTC0_NTD0_NTM0_NEPBS0_NLCA1_NLCB1_ONLL1_PGR1_PLR1_PKA0_SGROB0_SIA3_SS1_SU32_SUM0_SUS256_SPO0_SRVW0_SSO0_SVW1_SK0_SKFTR0_SKXCCM0_SGRO0_TIN0_TLDS0_TLDSMn1_ULSGRO0_USL1_UIOFGRO0_USFGROn1_VSn1_VWA1_VWB1_WSGRA0_WSGRB0_WS32_WG64_2_1_WGM8_WGMXCC1_WGMXCCGn1
    SolutionIndex: 115
    SolutionNameMin: Cijk_Ailk_Bljk_HHS_BH_Bias_HA_S_SAV_UserArgs_MT64x64x128_MI16x16x1_SN_LDSB1_AFC1_AG0_AFEM1_AFEM1_ASEM1_CLR0_CADS0_DTLA0_DTLB0_DTVA0_DTVB0_DTVSM0_DPLB0_EPS0_ELFLR0_EMLLn1_FDSI0_GRPM1_GRVWA8_GRVWB8_GSU1_GSUAMB_GSUC0_GSUWGMRR0_GLS0_ISA1151_IU1_K1_LDSTI0_LBSPPA2048_LBSPPB2048_LBSPPM0_LPA8_LPB8_LPM0_LRVW16_LWPMn1_MIAV1_MIWT2_2_MO40_MGRIPM1_NTn1_NTA0_NTB0_NTC0_NTD0_NTM0_NEPBS0_NLCA1_NLCB1_ONLL1_PGR2_PLR0_PKA0_SGROB0_SIA3_SS1_SU32_SUM0_SUS256_SPO0_SRVW0_SSO0_SVW1_SK0_SKFTR0_SKXCCM0_SGRO0_TIN0_TLDS0_TLDSMn1_ULSGRO0_USL1_UIOFGRO0_USFGROn1_VSn1_VWA1_VWB1_WSGRA0_WSGRB0_WS32_WG32_4_1_WGM8_WGMXCC1_WGMXCCGn1
    SolutionIndex: 116
    SolutionNameMin: Cijk_Ailk_Bljk_HHS_BH_Bias_HA_S_SAV_UserArgs_MT64x64x128_MI16x16x1_SN_LDSB1_AFC1_AG0_AFEM1_AFEM1_ASEM1_CLR0_CADS0_DTLA0_DTLB0_DTVA0_DTVB0_DTVSM0_DPLB0_EPS0_ELFLR0_EMLLn1_FDSI0_GRPM1_GRVWA8_GRVWB8_GSU1_GSUAMB_GSUC0_GSUWGMRR0_GLS0_ISA1151_IU1_K1_LDSTI0_LBSPPA2048_LBSPPB2048_LBSPPM0_LPA8_LPB8_LPM0_LRVW16_LWPMn1_MIAV1_MIWT2_2_MO40_MGRIPM1_NTn1_NTA0_NTB0_NTC0_NTD0_NTM0_NEPBS0_NLCA1_NLCB1_ONLL1_PGR2_PLR1_PKA0_SGROB0_SIA3_SS1_SU32_SUM0_SUS256_SPO0_SRVW0_SSO0_SVW1_SK0_SKFTR0_SKXCCM0_SGRO0_TIN0_TLDS0_TLDSMn1_ULSGRO0_USL1_UIOFGRO0_USFGROn1_VSn1_VWA1_VWB1_WSGRA0_WSGRB0_WS32_WG32_4_1_WGM8_WGMXCC1_WGMXCCGn1
    SolutionIndex: 117
    SolutionNameMin: Cijk_Ailk_Bljk_HHS_BH_Bias_HA_S_SAV_UserArgs_MT64x96x32_MI16x16x1_SN_LDSB0_AFC1_AG0_AFEM1_AFEM1_ASEM1_CLR0_CADS0_DTLA0_DTLB0_DTVA0_DTVB0_DTVSM0_DPLB0_EPS0_ELFLR0_EMLLn1_FDSI0_GRPM1_GRVWA8_GRVWB8_GSU1_GSUAMB_GSUC0_GSUWGMRR0_GLS0_ISA1151_IU1_K1_LDSTI0_LBSPPA2048_LBSPPB3072_LBSPPM0_LPA8_LPB8_LPM0_LRVW16_LWPMn1_MIAV1_MIWT2_3_MO40_MGRIPM1_NTn1_NTA0_NTB0_NTC0_NTD0_NTM0_NEPBS0_NLCA1_NLCB1_ONLL1_PGR2_PLR0_PKA0_SGROB0_SIA1_SS1_SU32_SUM0_SUS256_SPO0_SRVW0_SSO0_SVW1_SK0_SKFTR0_SKXCCM0_SGRO0_TIN0_TLDS0_TLDSMn1_ULSGRO0_USL1_UIOFGRO0_USFGROn1_VSn1_VWA1_VWB1_WSGRA0_WSGRB0_WS32_WG32_4_1_WGM8_WGMXCC1_WGMXCCGn1
    SolutionIndex: 118
    SolutionNameMin: Cijk_Ailk_Bljk_HHS_BH_Bias_HA_S_SAV_UserArgs_MT64x96x32_MI16x16x1_SN_LDSB0_AFC1_AG0_AFEM1_AFEM1_ASEM1_CLR0_CADS0_DTLA0_DTLB0_DTVA0_DTVB0_DTVSM0_DPLB0_EPS0_ELFLR0_EMLLn1_FDSI0_GRPM1_GRVWA8_GRVWB8_GSU1_GSUAMB_GSUC0_GSUWGMRR0_GLS0_ISA1151_IU1_K1_LDSTI0_LBSPPA2048_LBSPPB3072_LBSPPM0_LPA8_LPB8_LPM0_LRVW16_LWPMn1_MIAV1_MIWT2_3_MO40_MGRIPM1_NTn1_NTA0_NTB0_NTC0_NTD0_NTM0_NEPBS0_NLCA1_NLCB1_ONLL1_PGR2_PLR1_PKA0_SGROB0_SIA3_SS1_SU32_SUM0_SUS256_SPO0_SRVW0_SSO0_SVW1_SK0_SKFTR0_SKXCCM0_SGRO0_TIN0_TLDS0_TLDSMn1_ULSGRO0_USL1_UIOFGRO0_USFGROn1_VSn1_VWA1_VWB1_WSGRA0_WSGRB0_WS32_WG32_4_1_WGM8_WGMXCC1_WGMXCCGn1
    SolutionIndex: 121
    SolutionNameMin: Cijk_Ailk_Bljk_HHS_BH_Bias_HA_S_SAV_UserArgs_MT128x48x64_MI16x16x1_SN_LDSB0_AFC1_AG0_AFEM1_AFEM1_ASEM1_CLR0_CADS0_DTLA0_DTLB0_DTVA0_DTVB0_DTVSM0_DPLB0_EPS0_ELFLR0_EMLLn1_FDSI0_GRPM1_GRVWA8_GRVWB8_GSU1_GSUAMB_GSUC0_GSUWGMRR0_GLS0_ISA1151_IU1_K1_LDSTI0_LBSPPA4096_LBSPPB1536_LBSPPM0_LPA8_LPB8_LPM0_LRVW16_LWPMn1_MIAV1_MIWT2_3_MO40_MGRIPM1_NTn1_NTA0_NTB0_NTC0_NTD0_NTM0_NEPBS0_NLCA1_NLCB1_ONLL1_PGR2_PLR0_PKA0_SGROB0_SIA1_SS1_SU32_SUM0_SUS256_SPO0_SRVW0_SSO0_SVW1_SK0_SKFTR0_SKXCCM0_SGRO0_TIN0_TLDS0_TLDSMn1_ULSGRO0_USL1_UIOFGRO0_USFGROn1_VSn1_VWA1_VWB1_WSGRA0_WSGRB0_WS32_WG64_2_1_WGM8_WGMXCC1_WGMXCCGn1
    SolutionIndex: 122
    SolutionNameMin: Cijk_Ailk_Bljk_HHS_BH_Bias_HA_S_SAV_UserArgs_MT128x32x32_MI16x16x1_SN_LDSB0_AFC1_AG0_AFEM1_AFEM1_ASEM1_CLR0_CADS0_DTLA0_DTLB0_DTVA0_DTVB0_DTVSM0_DPLB0_EPS0_ELFLR0_EMLLn1_FDSI0_GRPM1_GRVWA8_GRVWB8_GSU1_GSUAMB_GSUC0_GSUWGMRR0_GLS0_ISA1151_IU1_K1_LDSTI0_LBSPPA4096_LBSPPB1024_LBSPPM0_LPA8_LPB8_LPM0_LRVW16_LWPMn1_MIAV1_MIWT2_2_MO40_MGRIPM1_NTn1_NTA0_NTB0_NTC0_NTD0_NTM0_NEPBS0_NLCA1_NLCB1_ONLL1_PGR1_PLR1_PKA0_SGROB0_SIA1_SS1_SU32_SUM0_SUS256_SPO0_SRVW0_SSO0_SVW1_SK0_SKFTR0_SKXCCM0_SGRO0_TIN0_TLDS0_TLDSMn1_ULSGRO0_USL1_UIOFGRO0_USFGROn1_VSn1_VWA1_VWB1_WSGRA0_WSGRB0_WS32_WG64_2_1_WGM8_WGMXCC1_WGMXCCGn1
    SolutionIndex: 123
    SolutionNameMin: Cijk_Ailk_Bljk_HHS_BH_Bias_HA_S_SAV_UserArgs_MT128x48x64_MI16x16x1_SN_LDSB0_AFC1_AG0_AFEM1_AFEM1_ASEM1_CLR0_CADS0_DTLA0_DTLB0_DTVA0_DTVB0_DTVSM0_DPLB0_EPS0_ELFLR0_EMLLn1_FDSI0_GRPM1_GRVWA8_GRVWB8_GSU1_GSUAMB_GSUC0_GSUWGMRR0_GLS0_ISA1151_IU1_K1_LDSTI0_LBSPPA4096_LBSPPB1536_LBSPPM0_LPA8_LPB8_LPM0_LRVW16_LWPMn1_MIAV1_MIWT2_3_MO40_MGRIPM1_NTn1_NTA0_NTB0_NTC0_NTD0_NTM0_NEPBS0_NLCA1_NLCB1_ONLL1_PGR1_PLR0_PKA0_SGROB0_SIA1_SS1_SU32_SUM0_SUS256_SPO0_SRVW0_SSO0_SVW1_SK0_SKFTR0_SKXCCM0_SGRO0_TIN0_TLDS0_TLDSMn1_ULSGRO0_USL1_UIOFGRO0_USFGROn1_VSn1_VWA1_VWB1_WSGRA0_WSGRB0_WS32_WG64_2_1_WGM8_WGMXCC1_WGMXCCGn1
    SolutionIndex: 124
    SolutionNameMin: Cijk_Ailk_Bljk_HHS_BH_Bias_HA_S_SAV_UserArgs_MT128x32x32_MI16x16x1_SN_LDSB1_AFC1_AG0_AFEM1_AFEM1_ASEM1_CLR0_CADS0_DTLA0_DTLB0_DTVA0_DTVB0_DTVSM0_DPLB0_EPS0_ELFLR0_EMLLn1_FDSI0_GRPM1_GRVWA8_GRVWB8_GSU1_GSUAMB_GSUC0_GSUWGMRR0_GLS0_ISA1151_IU1_K1_LDSTI0_LBSPPA4096_LBSPPB1024_LBSPPM0_LPA8_LPB8_LPM0_LRVW16_LWPMn1_MIAV1_MIWT2_2_MO40_MGRIPM1_NTn1_NTA0_NTB0_NTC0_NTD0_NTM0_NEPBS0_NLCA1_NLCB1_ONLL1_PGR1_PLR0_PKA0_SGROB0_SIA3_SS1_SU32_SUM0_SUS256_SPO0_SRVW0_SSO0_SVW1_SK0_SKFTR0_SKXCCM0_SGRO0_TIN0_TLDS0_TLDSMn1_ULSGRO0_USL1_UIOFGRO0_USFGROn1_VSn1_VWA1_VWB1_WSGRA0_WSGRB0_WS32_WG64_2_1_WGM8_WGMXCC1_WGMXCCGn1
    SolutionIndex: 125
    SolutionNameMin: Cijk_Ailk_Bljk_HHS_BH_Bias_HA_S_SAV_UserArgs_MT16x16x128_MI16x16x1_SN_LDSB0_AFC1_AG0_AFEM1_AFEM1_ASEM1_CLR0_CADS0_DTLA0_DTLB0_DTVA0_DTVB0_DTVSM0_DPLB0_EPS0_ELFLR0_EMLLn1_FDSI0_GRPM1_GRVWA8_GRVWB8_GSU1_GSUAMB_GSUC0_GSUWGMRR0_GLS0_ISA1151_IU1_K1_LDSTI0_LBSPPA512_LBSPPB512_LBSPPM0_LPA8_LPB8_LPM0_LRVW16_LWPMn1_MIAV1_MIWT1_1_MO40_MGRIPM1_NTn1_NTA0_NTB0_NTC0_NTD0_NTM0_NEPBS0_NLCA1_NLCB1_ONLL1_PGR1_PLR1_PKA0_SGROB0_SIA3_SS1_SU32_SUM0_SUS256_SPO0_SRVW0_SSO0_SVW1_SK0_SKFTR0_SKXCCM0_SGRO0_TIN0_TLDS0_TLDSMn1_ULSGRO0_USL1_UIOFGRO0_USFGROn1_VSn1_VWA1_VWB1_WSGRA0_WSGRB0_WS32_WG16_2_1_WGM8_WGMXCC1_WGMXCCGn1
    SolutionIndex: 126
    SolutionNameMin: Cijk_Ailk_Bljk_HHS_BH_Bias_HA_S_SAV_UserArgs_MT128x32x32_MI16x16x1_SN_LDSB1_AFC1_AG0_AFEM1_AFEM1_ASEM1_CLR0_CADS0_DTLA0_DTLB0_DTVA0_DTVB0_DTVSM0_DPLB0_EPS0_ELFLR0_EMLLn1_FDSI0_GRPM1_GRVWA8_GRVWB8_GSU1_GSUAMB_GSUC0_GSUWGMRR0_GLS0_ISA1151_IU1_K1_LDSTI0_LBSPPA4096_LBSPPB1024_LBSPPM0_LPA8_LPB8_LPM0_LRVW16_LWPMn1_MIAV1_MIWT2_2_MO40_MGRIPM1_NTn1_NTA0_NTB0_NTC0_NTD0_NTM0_NEPBS0_NLCA1_NLCB1_ONLL1_PGR2_PLR0_PKA0_SGROB0_SIA3_SS1_SU32_SUM0_SUS256_SPO0_SRVW0_SSO0_SVW1_SK0_SKFTR0_SKXCCM0_SGRO0_TIN0_TLDS0_TLDSMn1_ULSGRO0_USL1_UIOFGRO0_USFGROn1_VSn1_VWA1_VWB1_WSGRA0_WSGRB0_WS32_WG64_2_1_WGM8_WGMXCC1_WGMXCCGn1
    SolutionIndex: 127
    SolutionNameMin: Cijk_Ailk_Bljk_HHS_BH_Bias_HA_S_SAV_UserArgs_MT32x16x128_MI16x16x1_SN_LDSB0_AFC1_AG0_AFEM1_AFEM1_ASEM1_CLR0_CADS0_DTLA0_DTLB0_DTVA0_DTVB0_DTVSM0_DPLB0_EPS0_ELFLR0_EMLLn1_FDSI0_GRPM1_GRVWA8_GRVWB8_GSU1_GSUAMB_GSUC0_GSUWGMRR0_GLS0_ISA1151_IU1_K1_LDSTI0_LBSPPA1024_LBSPPB512_LBSPPM0_LPA8_LPB8_LPM0_LRVW16_LWPMn1_MIAV1_MIWT1_1_MO40_MGRIPM1_NTn1_NTA0_NTB0_NTC0_NTD0_NTM0_NEPBS0_NLCA1_NLCB1_ONLL1_PGR1_PLR1_PKA0_SGROB0_SIA1_SS1_SU32_SUM0_SUS256_SPO0_SRVW0_SSO0_SVW1_SK0_SKFTR0_SKXCCM0_SGRO0_TIN0_TLDS0_TLDSMn1_ULSGRO0_USL1_UIOFGRO0_USFGROn1_VSn1_VWA1_VWB1_WSGRA0_WSGRB0_WS32_WG32_2_1_WGM8_WGMXCC1_WGMXCCGn1
    SolutionIndex: 128
    SolutionNameMin: Cijk_Ailk_Bljk_HHS_BH_Bias_HA_S_SAV_UserArgs_MT32x16x128_MI16x16x1_SN_LDSB0_AFC1_AG0_AFEM1_AFEM1_ASEM1_CLR0_CADS0_DTLA0_DTLB0_DTVA0_DTVB0_DTVSM0_DPLB0_EPS0_ELFLR0_EMLLn1_FDSI0_GRPM1_GRVWA8_GRVWB8_GSU1_GSUAMB_GSUC0_GSUWGMRR0_GLS0_ISA1151_IU1_K1_LDSTI0_LBSPPA1024_LBSPPB512_LBSPPM0_LPA8_LPB8_LPM0_LRVW16_LWPMn1_MIAV1_MIWT1_1_MO40_MGRIPM1_NTn1_NTA0_NTB0_NTC0_NTD0_NTM0_NEPBS0_NLCA1_NLCB1_ONLL1_PGR2_PLR1_PKA0_SGROB0_SIA1_SS1_SU32_SUM0_SUS256_SPO0_SRVW0_SSO0_SVW1_SK0_SKFTR0_SKXCCM0_SGRO0_TIN0_TLDS0_TLDSMn1_ULSGRO0_USL1_UIOFGRO0_USFGROn1_VSn1_VWA1_VWB1_WSGRA0_WSGRB0_WS32_WG32_2_1_WGM8_WGMXCC1_WGMXCCGn1
    SolutionIndex: 130
    SolutionNameMin: Cijk_Ailk_Bljk_HHS_BH_Bias_HA_S_SAV_UserArgs_MT64x32x64_MI16x16x1_SN_LDSB0_AFC1_AG0_AFEM1_AFEM1_ASEM1_CLR0_CADS0_DTLA0_DTLB0_DTVA0_DTVB0_DTVSM0_DPLB0_EPS0_ELFLR0_EMLLn1_FDSI0_GRPM1_GRVWA8_GRVWB8_GSU1_GSUAMB_GSUC0_GSUWGMRR0_GLS0_ISA1151_IU1_K1_LDSTI0_LBSPPA2048_LBSPPB1024_LBSPPM0_LPA8_LPB8_LPM0_LRVW16_LWPMn1_MIAV1_MIWT2_1_MO40_MGRIPM1_NTn1_NTA0_NTB0_NTC0_NTD0_NTM0_NEPBS0_NLCA1_NLCB1_ONLL1_PGR2_PLR0_PKA0_SGROB0_SIA3_SS1_SU32_SUM0_SUS256_SPO0_SRVW0_SSO0_SVW1_SK0_SKFTR0_SKXCCM0_SGRO0_TIN0_TLDS0_TLDSMn1_ULSGRO0_USL1_UIOFGRO0_USFGROn1_VSn1_VWA1_VWB1_WSGRA0_WSGRB0_WS32_WG32_4_1_WGM8_WGMXCC1_WGMXCCGn1
    SolutionIndex: 131
    SolutionNameMin: Cijk_Ailk_Bljk_HHS_BH_Bias_HA_S_SAV_UserArgs_MT32x16x64_MI16x16x1_SN_LDSB0_AFC1_AG0_AFEM1_AFEM1_ASEM1_CLR0_CADS0_DTLA0_DTLB0_DTVA0_DTVB0_DTVSM0_DPLB0_EPS0_ELFLR0_EMLLn1_FDSI0_GRPM1_GRVWA8_GRVWB8_GSU1_GSUAMB_GSUC0_GSUWGMRR0_GLS0_ISA1151_IU1_K1_LDSTI0_LBSPPA1024_LBSPPB512_LBSPPM0_LPA8_LPB8_LPM0_LRVW16_LWPMn1_MIAV1_MIWT1_1_MO40_MGRIPM1_NTn1_NTA0_NTB0_NTC0_NTD0_NTM0_NEPBS0_NLCA1_NLCB1_ONLL1_PGR2_PLR1_PKA0_SGROB0_SIA1_SS1_SU32_SUM0_SUS256_SPO0_SRVW0_SSO0_SVW1_SK0_SKFTR0_SKXCCM0_SGRO0_TIN0_TLDS0_TLDSMn1_ULSGRO0_USL1_UIOFGRO0_USFGROn1_VSn1_VWA1_VWB1_WSGRA0_WSGRB0_WS32_WG32_2_1_WGM8_WGMXCC1_WGMXCCGn1
    SolutionIndex: 132
    SolutionNameMin: Cijk_Ailk_Bljk_HHS_BH_Bias_HA_S_SAV_UserArgs_MT64x16x128_MI16x16x1_SN_LDSB0_AFC1_AG0_AFEM1_AFEM1_ASEM1_CLR0_CADS0_DTLA0_DTLB0_DTVA0_DTVB0_DTVSM0_DPLB0_EPS0_ELFLR0_EMLLn1_FDSI0_GRPM1_GRVWA8_GRVWB8_GSU1_GSUAMB_GSUC0_GSUWGMRR0_GLS0_ISA1151_IU1_K1_LDSTI0_LBSPPA2048_LBSPPB512_LBSPPM0_LPA8_LPB8_LPM0_LRVW16_LWPMn1_MIAV1_MIWT1_1_MO40_MGRIPM1_NTn1_NTA0_NTB0_NTC0_NTD0_NTM0_NEPBS0_NLCA1_NLCB1_ONLL1_PGR2_PLR1_PKA0_SGROB0_SIA3_SS1_SU32_SUM0_SUS256_SPO0_SRVW0_SSO0_SVW1_SK0_SKFTR0_SKXCCM0_SGRO0_TIN0_TLDS0_TLDSMn1_ULSGRO0_USL1_UIOFGRO0_USFGROn1_VSn1_VWA1_VWB1_WSGRA0_WSGRB0_WS32_WG64_2_1_WGM8_WGMXCC1_WGMXCCGn1
    SolutionIndex: 133
    SolutionNameMin: Cijk_Ailk_Bljk_HHS_BH_Bias_HA_S_SAV_UserArgs_MT16x16x64_MI16x16x1_SN_LDSB0_AFC1_AG0_AFEM1_AFEM1_ASEM1_CLR0_CADS0_DTLA0_DTLB0_DTVA0_DTVB0_DTVSM0_DPLB0_EPS0_ELFLR0_EMLLn1_FDSI0_GRPM1_GRVWA8_GRVWB8_GSU1_GSUAMB_GSUC0_GSUWGMRR0_GLS0_ISA1151_IU1_K1_LDSTI0_LBSPPA512_LBSPPB512_LBSPPM0_LPA8_LPB8_LPM0_LRVW16_LWPMn1_MIAV1_MIWT1_1_MO40_MGRIPM1_NTn1_NTA0_NTB0_NTC0_NTD0_NTM0_NEPBS0_NLCA1_NLCB1_ONLL1_PGR1_PLR0_PKA0_SGROB0_SIA3_SS1_SU32_SUM0_SUS256_SPO0_SRVW0_SSO0_SVW1_SK0_SKFTR0_SKXCCM0_SGRO0_TIN0_TLDS0_TLDSMn1_ULSGRO0_USL1_UIOFGRO0_USFGROn1_VSn1_VWA1_VWB1_WSGRA0_WSGRB0_WS32_WG16_2_1_WGM8_WGMXCC1_WGMXCCGn1
    SolutionIndex: 134
    SolutionNameMin: Cijk_Ailk_Bljk_HHS_BH_Bias_HA_S_SAV_UserArgs_MT64x16x64_MI16x16x1_SN_LDSB0_AFC1_AG0_AFEM1_AFEM1_ASEM1_CLR0_CADS0_DTLA0_DTLB0_DTVA0_DTVB0_DTVSM0_DPLB0_EPS0_ELFLR0_EMLLn1_FDSI0_GRPM1_GRVWA8_GRVWB8_GSU1_GSUAMB_GSUC0_GSUWGMRR0_GLS0_ISA1151_IU1_K1_LDSTI0_LBSPPA2048_LBSPPB512_LBSPPM0_LPA8_LPB8_LPM0_LRVW16_LWPMn1_MIAV1_MIWT1_1_MO40_MGRIPM1_NTn1_NTA0_NTB0_NTC0_NTD0_NTM0_NEPBS0_NLCA1_NLCB1_ONLL1_PGR2_PLR1_PKA0_SGROB0_SIA3_SS1_SU32_SUM0_SUS256_SPO0_SRVW0_SSO0_SVW1_SK0_SKFTR0_SKXCCM0_SGRO0_TIN0_TLDS0_TLDSMn1_ULSGRO0_USL1_UIOFGRO0_USFGROn1_VSn1_VWA1_VWB1_WSGRA0_WSGRB0_WS32_WG64_2_1_WGM8_WGMXCC1_WGMXCCGn1
    SolutionIndex: 135
    SolutionNameMin: Cijk_Ailk_Bljk_HHS_BH_Bias_HA_S_SAV_UserArgs_MT32x32x64_MI16x16x1_SN_LDSB0_AFC1_AG0_AFEM1_AFEM1_ASEM1_CLR0_CADS0_DTLA0_DTLB0_DTVA0_DTVB0_DTVSM0_DPLB0_EPS0_ELFLR0_EMLLn1_FDSI0_GRPM1_GRVWA8_GRVWB8_GSU1_GSUAMB_GSUC0_GSUWGMRR0_GLS0_ISA1151_IU1_K1_LDSTI0_LBSPPA1024_LBSPPB1024_LBSPPM0_LPA8_LPB8_LPM0_LRVW16_LWPMn1_MIAV1_MIWT1_1_MO40_MGRIPM1_NTn1_NTA0_NTB0_NTC0_NTD0_NTM0_NEPBS0_NLCA1_NLCB1_ONLL1_PGR1_PLR1_PKA0_SGROB0_SIA1_SS1_SU32_SUM0_SUS256_SPO0_SRVW0_SSO0_SVW1_SK0_SKFTR0_SKXCCM0_SGRO0_TIN0_TLDS0_TLDSMn1_ULSGRO0_USL1_UIOFGRO0_USFGROn1_VSn1_VWA1_VWB1_WSGRA0_WSGRB0_WS32_WG32_4_1_WGM8_WGMXCC1_WGMXCCGn1
    SolutionIndex: 136
    SolutionNameMin: Cijk_Ailk_Bljk_HHS_BH_Bias_HA_S_SAV_UserArgs_MT32x16x16_MI16x16x1_SN_LDSB0_AFC1_AG0_AFEM1_AFEM1_ASEM1_CLR0_CADS0_DTLA0_DTLB0_DTVA0_DTVB0_DTVSM0_DPLB0_EPS0_ELFLR0_EMLLn1_FDSI0_GRPM1_GRVWA8_GRVWB4_GSU1_GSUAMB_GSUC0_GSUWGMRR0_GLS0_ISA1151_IU1_K1_LDSTI0_LBSPPA1024_LBSPPB512_LBSPPM0_LPA8_LPB8_LPM0_LRVW16_LWPMn1_MIAV1_MIWT1_1_MO40_MGRIPM1_NTn1_NTA0_NTB0_NTC0_NTD0_NTM0_NEPBS0_NLCA1_NLCB1_ONLL1_PGR2_PLR0_PKA0_SGROB0_SIA3_SS1_SU32_SUM0_SUS256_SPO0_SRVW0_SSO0_SVW1_SK0_SKFTR0_SKXCCM0_SGRO0_TIN0_TLDS0_TLDSMn1_ULSGRO0_USL1_UIOFGRO0_USFGROn1_VSn1_VWA1_VWB1_WSGRA0_WSGRB0_WS32_WG32_2_1_WGM8_WGMXCC1_WGMXCCGn1
    SolutionIndex: 137
    SolutionNameMin: Cijk_Ailk_Bljk_HHS_BH_Bias_HA_S_SAV_UserArgs_MT16x16x64_MI16x16x1_SN_LDSB0_AFC1_AG0_AFEM1_AFEM1_ASEM1_CLR0_CADS0_DTLA0_DTLB0_DTVA0_DTVB0_DTVSM0_DPLB0_EPS0_ELFLR0_EMLLn1_FDSI0_GRPM1_GRVWA8_GRVWB8_GSU1_GSUAMB_GSUC0_GSUWGMRR0_GLS0_ISA1151_IU1_K1_LDSTI0_LBSPPA512_LBSPPB512_LBSPPM0_LPA8_LPB8_LPM0_LRVW16_LWPMn1_MIAV1_MIWT1_1_MO40_MGRIPM1_NTn1_NTA0_NTB0_NTC0_NTD0_NTM0_NEPBS0_NLCA1_NLCB1_ONLL1_PGR2_PLR1_PKA0_SGROB0_SIA1_SS1_SU32_SUM0_SUS256_SPO0_SRVW0_SSO0_SVW1_SK0_SKFTR0_SKXCCM0_SGRO0_TIN0_TLDS0_TLDSMn1_ULSGRO0_USL1_UIOFGRO0_USFGROn1_VSn1_VWA1_VWB1_WSGRA0_WSGRB0_WS32_WG16_2_1_WGM8_WGMXCC1_WGMXCCGn1
    SolutionIndex: 138
    SolutionNameMin: Cijk_Ailk_Bljk_HHS_BH_Bias_HA_S_SAV_UserArgs_MT32x16x128_MI16x16x1_SN_LDSB0_AFC1_AG0_AFEM1_AFEM1_ASEM1_CLR0_CADS0_DTLA0_DTLB0_DTVA0_DTVB0_DTVSM0_DPLB0_EPS0_ELFLR0_EMLLn1_FDSI0_GRPM1_GRVWA8_GRVWB8_GSU1_GSUAMB_GSUC0_GSUWGMRR0_GLS0_ISA1151_IU1_K1_LDSTI0_LBSPPA1024_LBSPPB512_LBSPPM0_LPA8_LPB8_LPM0_LRVW16_LWPMn1_MIAV1_MIWT1_1_MO40_MGRIPM1_NTn1_NTA0_NTB0_NTC0_NTD0_NTM0_NEPBS0_NLCA1_NLCB1_ONLL1_PGR2_PLR1_PKA0_SGROB0_SIA3_SS1_SU32_SUM0_SUS256_SPO0_SRVW0_SSO0_SVW1_SK0_SKFTR0_SKXCCM0_SGRO0_TIN0_TLDS0_TLDSMn1_ULSGRO0_USL1_UIOFGRO0_USFGROn1_VSn1_VWA1_VWB1_WSGRA0_WSGRB0_WS32_WG32_2_1_WGM8_WGMXCC1_WGMXCCGn1
    SolutionIndex: 139
    SolutionNameMin: Cijk_Ailk_Bljk_HHS_BH_Bias_HA_S_SAV_UserArgs_MT32x16x64_MI16x16x1_SN_LDSB0_AFC1_AG0_AFEM1_AFEM1_ASEM1_CLR0_CADS0_DTLA0_DTLB0_DTVA0_DTVB0_DTVSM0_DPLB0_EPS0_ELFLR0_EMLLn1_FDSI0_GRPM1_GRVWA8_GRVWB8_GSU1_GSUAMB_GSUC0_GSUWGMRR0_GLS0_ISA1151_IU1_K1_LDSTI0_LBSPPA1024_LBSPPB512_LBSPPM0_LPA8_LPB8_LPM0_LRVW16_LWPMn1_MIAV1_MIWT1_1_MO40_MGRIPM1_NTn1_NTA0_NTB0_NTC0_NTD0_NTM0_NEPBS0_NLCA1_NLCB1_ONLL1_PGR2_PLR1_PKA0_SGROB0_SIA3_SS1_SU32_SUM0_SUS256_SPO0_SRVW0_SSO0_SVW1_SK0_SKFTR0_SKXCCM0_SGRO0_TIN0_TLDS0_TLDSMn1_ULSGRO0_USL1_UIOFGRO0_USFGROn1_VSn1_VWA1_VWB1_WSGRA0_WSGRB0_WS32_WG32_2_1_WGM8_WGMXCC1_WGMXCCGn1
    SolutionIndex: 140
    SolutionNameMin: Cijk_Ailk_Bljk_HHS_BH_Bias_HA_S_SAV_UserArgs_MT16x16x64_MI16x16x1_SN_LDSB0_AFC1_AG0_AFEM1_AFEM1_ASEM1_CLR0_CADS0_DTLA0_DTLB0_DTVA0_DTVB0_DTVSM0_DPLB0_EPS0_ELFLR0_EMLLn1_FDSI0_GRPM1_GRVWA8_GRVWB8_GSU1_GSUAMB_GSUC0_GSUWGMRR0_GLS0_ISA1151_IU1_K1_LDSTI0_LBSPPA512_LBSPPB512_LBSPPM0_LPA8_LPB8_LPM0_LRVW16_LWPMn1_MIAV1_MIWT1_1_MO40_MGRIPM1_NTn1_NTA0_NTB0_NTC0_NTD0_NTM0_NEPBS0_NLCA1_NLCB1_ONLL1_PGR1_PLR1_PKA0_SGROB0_SIA1_SS1_SU32_SUM0_SUS256_SPO0_SRVW0_SSO0_SVW1_SK0_SKFTR0_SKXCCM0_SGRO0_TIN0_TLDS0_TLDSMn1_ULSGRO0_USL1_UIOFGRO0_USFGROn1_VSn1_VWA1_VWB1_WSGRA0_WSGRB0_WS32_WG16_2_1_WGM8_WGMXCC1_WGMXCCGn1
    SolutionIndex: 141
    SolutionNameMin: Cijk_Ailk_Bljk_HHS_BH_Bias_HA_S_SAV_UserArgs_MT32x16x32_MI16x16x1_SN_LDSB1_AFC1_AG0_AFEM1_AFEM1_ASEM1_CLR0_CADS0_DTLA0_DTLB0_DTVA0_DTVB0_DTVSM0_DPLB0_EPS0_ELFLR0_EMLLn1_FDSI0_GRPM1_GRVWA8_GRVWB8_GSU1_GSUAMB_GSUC0_GSUWGMRR0_GLS0_ISA1151_IU1_K1_LDSTI0_LBSPPA1024_LBSPPB512_LBSPPM0_LPA8_LPB8_LPM0_LRVW16_LWPMn1_MIAV1_MIWT1_1_MO40_MGRIPM1_NTn1_NTA0_NTB0_NTC0_NTD0_NTM0_NEPBS0_NLCA1_NLCB1_ONLL1_PGR2_PLR1_PKA0_SGROB0_SIA3_SS1_SU32_SUM0_SUS256_SPO0_SRVW0_SSO0_SVW1_SK0_SKFTR0_SKXCCM0_SGRO0_TIN0_TLDS0_TLDSMn1_ULSGRO0_USL1_UIOFGRO0_USFGROn1_VSn1_VWA1_VWB1_WSGRA0_WSGRB0_WS32_WG32_2_1_WGM8_WGMXCC1_WGMXCCGn1
    SolutionIndex: 142
    SolutionNameMin: Cijk_Ailk_Bljk_HHS_BH_Bias_HA_S_SAV_UserArgs_MT64x32x32_MI16x16x1_SN_LDSB0_AFC1_AG0_AFEM1_AFEM1_ASEM1_CLR0_CADS0_DTLA0_DTLB0_DTVA0_DTVB0_DTVSM0_DPLB0_EPS0_ELFLR0_EMLLn1_FDSI0_GRPM1_GRVWA8_GRVWB8_GSU1_GSUAMB_GSUC0_GSUWGMRR0_GLS0_ISA1151_IU1_K1_LDSTI0_LBSPPA2048_LBSPPB1024_LBSPPM0_LPA8_LPB8_LPM0_LRVW16_LWPMn1_MIAV1_MIWT2_1_MO40_MGRIPM1_NTn1_NTA0_NTB0_NTC0_NTD0_NTM0_NEPBS0_NLCA1_NLCB1_ONLL1_PGR1_PLR1_PKA0_SGROB0_SIA1_SS1_SU32_SUM0_SUS256_SPO0_SRVW0_SSO0_SVW1_SK0_SKFTR0_SKXCCM0_SGRO0_TIN0_TLDS0_TLDSMn1_ULSGRO0_USL1_UIOFGRO0_USFGROn1_VSn1_VWA1_VWB1_WSGRA0_WSGRB0_WS32_WG32_4_1_WGM8_WGMXCC1_WGMXCCGn1
    SolutionIndex: 144
    SolutionNameMin: Cijk_Ailk_Bljk_HHS_BH_Bias_HA_S_SAV_UserArgs_MT16x16x64_MI16x16x1_SN_LDSB0_AFC1_AG0_AFEM1_AFEM1_ASEM1_CLR0_CADS0_DTLA0_DTLB0_DTVA0_DTVB0_DTVSM0_DPLB0_EPS0_ELFLR0_EMLLn1_FDSI0_GRPM1_GRVWA8_GRVWB8_GSU1_GSUAMB_GSUC0_GSUWGMRR0_GLS0_ISA1151_IU1_K1_LDSTI0_LBSPPA512_LBSPPB512_LBSPPM0_LPA8_LPB8_LPM0_LRVW16_LWPMn1_MIAV1_MIWT1_1_MO40_MGRIPM1_NTn1_NTA0_NTB0_NTC0_NTD0_NTM0_NEPBS0_NLCA1_NLCB1_ONLL1_PGR2_PLR0_PKA0_SGROB0_SIA3_SS1_SU32_SUM0_SUS256_SPO0_SRVW0_SSO0_SVW1_SK0_SKFTR0_SKXCCM0_SGRO0_TIN0_TLDS0_TLDSMn1_ULSGRO0_USL1_UIOFGRO0_USFGROn1_VSn1_VWA1_VWB1_WSGRA0_WSGRB0_WS32_WG16_2_1_WGM8_WGMXCC1_WGMXCCGn1
    SolutionIndex: 145
    SolutionNameMin: Cijk_Ailk_Bljk_HHS_BH_Bias_HA_S_SAV_UserArgs_MT64x16x64_MI16x16x1_SN_LDSB0_AFC1_AG0_AFEM1_AFEM1_ASEM1_CLR0_CADS0_DTLA0_DTLB0_DTVA0_DTVB0_DTVSM0_DPLB0_EPS0_ELFLR0_EMLLn1_FDSI0_GRPM1_GRVWA8_GRVWB8_GSU1_GSUAMB_GSUC0_GSUWGMRR0_GLS0_ISA1151_IU1_K1_LDSTI0_LBSPPA2048_LBSPPB512_LBSPPM0_LPA8_LPB8_LPM0_LRVW16_LWPMn1_MIAV1_MIWT1_1_MO40_MGRIPM1_NTn1_NTA0_NTB0_NTC0_NTD0_NTM0_NEPBS0_NLCA1_NLCB1_ONLL1_PGR1_PLR1_PKA0_SGROB0_SIA3_SS1_SU32_SUM0_SUS256_SPO0_SRVW0_SSO0_SVW1_SK0_SKFTR0_SKXCCM0_SGRO0_TIN0_TLDS0_TLDSMn1_ULSGRO0_USL1_UIOFGRO0_USFGROn1_VSn1_VWA1_VWB1_WSGRA0_WSGRB0_WS32_WG64_2_1_WGM8_WGMXCC1_WGMXCCGn1
    SolutionIndex: 146
    SolutionNameMin: Cijk_Ailk_Bljk_HHS_BH_Bias_HA_S_SAV_UserArgs_MT128x64x16_MI16x16x1_SN_LDSB0_AFC1_AG0_AFEM1_AFEM1_ASEM1_CLR0_CADS0_DTLA0_DTLB0_DTVA0_DTVB0_DTVSM0_DPLB0_EPS0_ELFLR0_EMLLn1_FDSI0_GRPM1_GRVWA8_GRVWB8_GSU1_GSUAMB_GSUC0_GSUWGMRR0_GLS0_ISA1151_IU1_K1_LDSTI0_LBSPPA4096_LBSPPB2048_LBSPPM0_LPA8_LPB8_LPM0_LRVW16_LWPMn1_MIAV1_MIWT4_2_MO40_MGRIPM1_NTn1_NTA0_NTB0_NTC0_NTD0_NTM0_NEPBS0_NLCA1_NLCB1_ONLL1_PGR2_PLR0_PKA0_SGROB0_SIA1_SS1_SU32_SUM0_SUS256_SPO0_SRVW0_SSO0_SVW1_SK0_SKFTR0_SKXCCM0_SGRO0_TIN0_TLDS0_TLDSMn1_ULSGRO0_USL1_UIOFGRO0_USFGROn1_VSn1_VWA1_VWB1_WSGRA0_WSGRB0_WS32_WG32_4_1_WGM8_WGMXCC1_WGMXCCGn1
    SolutionIndex: 147
    SolutionNameMin: Cijk_Ailk_Bljk_HHS_BH_Bias_HA_S_SAV_UserArgs_MT32x16x128_MI16x16x1_SN_LDSB0_AFC1_AG0_AFEM1_AFEM1_ASEM1_CLR0_CADS0_DTLA0_DTLB0_DTVA0_DTVB0_DTVSM0_DPLB0_EPS0_ELFLR0_EMLLn1_FDSI0_GRPM1_GRVWA8_GRVWB8_GSU1_GSUAMB_GSUC0_GSUWGMRR0_GLS0_ISA1151_IU1_K1_LDSTI0_LBSPPA1024_LBSPPB512_LBSPPM0_LPA8_LPB8_LPM0_LRVW16_LWPMn1_MIAV1_MIWT1_1_MO40_MGRIPM1_NTn1_NTA0_NTB0_NTC0_NTD0_NTM0_NEPBS0_NLCA1_NLCB1_ONLL1_PGR2_PLR0_PKA0_SGROB0_SIA1_SS1_SU32_SUM0_SUS256_SPO0_SRVW0_SSO0_SVW1_SK0_SKFTR0_SKXCCM0_SGRO0_TIN0_TLDS0_TLDSMn1_ULSGRO0_USL1_UIOFGRO0_USFGROn1_VSn1_VWA1_VWB1_WSGRA0_WSGRB0_WS32_WG32_2_1_WGM8_WGMXCC1_WGMXCCGn1
    SolutionIndex: 148
    SolutionNameMin: Cijk_Ailk_Bljk_HHS_BH_Bias_HA_S_SAV_UserArgs_MT64x16x64_MI16x16x1_SN_LDSB0_AFC1_AG0_AFEM1_AFEM1_ASEM1_CLR0_CADS0_DTLA0_DTLB0_DTVA0_DTVB0_DTVSM0_DPLB0_EPS0_ELFLR0_EMLLn1_FDSI0_GRPM1_GRVWA8_GRVWB8_GSU1_GSUAMB_GSUC0_GSUWGMRR0_GLS0_ISA1151_IU1_K1_LDSTI0_LBSPPA2048_LBSPPB512_LBSPPM0_LPA8_LPB8_LPM0_LRVW16_LWPMn1_MIAV1_MIWT1_1_MO40_MGRIPM1_NTn1_NTA0_NTB0_NTC0_NTD0_NTM0_NEPBS0_NLCA1_NLCB1_ONLL1_PGR1_PLR1_PKA0_SGROB0_SIA1_SS1_SU32_SUM0_SUS256_SPO0_SRVW0_SSO0_SVW1_SK0_SKFTR0_SKXCCM0_SGRO0_TIN0_TLDS0_TLDSMn1_ULSGRO0_USL1_UIOFGRO0_USFGROn1_VSn1_VWA1_VWB1_WSGRA0_WSGRB0_WS32_WG64_2_1_WGM8_WGMXCC1_WGMXCCGn1
    SolutionIndex: 149
    SolutionNameMin: Cijk_Ailk_Bljk_HHS_BH_Bias_HA_S_SAV_UserArgs_MT64x32x64_MI16x16x1_SN_LDSB0_AFC1_AG0_AFEM1_AFEM1_ASEM1_CLR0_CADS0_DTLA0_DTLB0_DTVA0_DTVB0_DTVSM0_DPLB0_EPS0_ELFLR0_EMLLn1_FDSI0_GRPM1_GRVWA8_GRVWB8_GSU1_GSUAMB_GSUC0_GSUWGMRR0_GLS0_ISA1151_IU1_K1_LDSTI0_LBSPPA2048_LBSPPB1024_LBSPPM0_LPA8_LPB8_LPM0_LRVW16_LWPMn1_MIAV1_MIWT2_1_MO40_MGRIPM1_NTn1_NTA0_NTB0_NTC0_NTD0_NTM0_NEPBS0_NLCA1_NLCB1_ONLL1_PGR1_PLR1_PKA0_SGROB0_SIA1_SS1_SU32_SUM0_SUS256_SPO0_SRVW0_SSO0_SVW1_SK0_SKFTR0_SKXCCM0_SGRO0_TIN0_TLDS0_TLDSMn1_ULSGRO0_USL1_UIOFGRO0_USFGROn1_VSn1_VWA1_VWB1_WSGRA0_WSGRB0_WS32_WG32_4_1_WGM8_WGMXCC1_WGMXCCGn1
    SolutionIndex: 150
    SolutionNameMin: Cijk_Ailk_Bljk_HHS_BH_Bias_HA_S_SAV_UserArgs_MT64x32x64_MI16x16x1_SN_LDSB0_AFC1_AG0_AFEM1_AFEM1_ASEM1_CLR0_CADS0_DTLA0_DTLB0_DTVA0_DTVB0_DTVSM0_DPLB0_EPS0_ELFLR0_EMLLn1_FDSI0_GRPM1_GRVWA8_GRVWB8_GSU1_GSUAMB_GSUC0_GSUWGMRR0_GLS0_ISA1151_IU1_K1_LDSTI0_LBSPPA2048_LBSPPB1024_LBSPPM0_LPA8_LPB8_LPM0_LRVW16_LWPMn1_MIAV1_MIWT2_1_MO40_MGRIPM1_NTn1_NTA0_NTB0_NTC0_NTD0_NTM0_NEPBS0_NLCA1_NLCB1_ONLL1_PGR2_PLR1_PKA0_SGROB0_SIA3_SS1_SU32_SUM0_SUS256_SPO0_SRVW0_SSO0_SVW1_SK0_SKFTR0_SKXCCM0_SGRO0_TIN0_TLDS0_TLDSMn1_ULSGRO0_USL1_UIOFGRO0_USFGROn1_VSn1_VWA1_VWB1_WSGRA0_WSGRB0_WS32_WG32_4_1_WGM8_WGMXCC1_WGMXCCGn1
    SolutionIndex: 151
    SolutionNameMin: Cijk_Ailk_Bljk_HHS_BH_Bias_HA_S_SAV_UserArgs_MT64x64x32_MI16x16x1_SN_LDSB0_AFC1_AG0_AFEM1_AFEM1_ASEM1_CLR0_CADS0_DTLA0_DTLB0_DTVA0_DTVB0_DTVSM0_DPLB0_EPS0_ELFLR0_EMLLn1_FDSI0_GRPM1_GRVWA8_GRVWB8_GSU1_GSUAMB_GSUC0_GSUWGMRR0_GLS0_ISA1151_IU1_K1_LDSTI0_LBSPPA2048_LBSPPB2048_LBSPPM0_LPA8_LPB8_LPM0_LRVW16_LWPMn1_MIAV1_MIWT2_2_MO40_MGRIPM1_NTn1_NTA0_NTB0_NTC0_NTD0_NTM0_NEPBS0_NLCA1_NLCB1_ONLL1_PGR2_PLR1_PKA0_SGROB0_SIA1_SS1_SU32_SUM0_SUS256_SPO0_SRVW0_SSO0_SVW1_SK0_SKFTR0_SKXCCM0_SGRO0_TIN0_TLDS0_TLDSMn1_ULSGRO0_USL1_UIOFGRO0_USFGROn1_VSn1_VWA1_VWB1_WSGRA0_WSGRB0_WS32_WG32_4_1_WGM8_WGMXCC1_WGMXCCGn1
    SolutionIndex: 152
    SolutionNameMin: Cijk_Ailk_Bljk_HHS_BH_Bias_HA_S_SAV_UserArgs_MT64x64x64_MI16x16x1_SN_LDSB1_AFC1_AG0_AFEM1_AFEM1_ASEM1_CLR0_CADS0_DTLA0_DTLB0_DTVA0_DTVB0_DTVSM0_DPLB0_EPS0_ELFLR0_EMLLn1_FDSI0_GRPM1_GRVWA8_GRVWB8_GSU1_GSUAMB_GSUC0_GSUWGMRR0_GLS0_ISA1151_IU1_K1_LDSTI0_LBSPPA2048_LBSPPB2048_LBSPPM0_LPA8_LPB8_LPM0_LRVW16_LWPMn1_MIAV1_MIWT2_2_MO40_MGRIPM1_NTn1_NTA0_NTB0_NTC0_NTD0_NTM0_NEPBS0_NLCA1_NLCB1_ONLL1_PGR2_PLR0_PKA0_SGROB0_SIA3_SS1_SU32_SUM0_SUS256_SPO0_SRVW0_SSO0_SVW1_SK0_SKFTR0_SKXCCM0_SGRO0_TIN0_TLDS0_TLDSMn1_ULSGRO0_USL1_UIOFGRO0_USFGROn1_VSn1_VWA1_VWB1_WSGRA0_WSGRB0_WS32_WG32_4_1_WGM8_WGMXCC1_WGMXCCGn1
    SolutionIndex: 153
    SolutionNameMin: Cijk_Ailk_Bljk_HHS_BH_Bias_HA_S_SAV_UserArgs_MT32x16x64_MI16x16x1_SN_LDSB0_AFC1_AG0_AFEM1_AFEM1_ASEM1_CLR0_CADS0_DTLA0_DTLB0_DTVA0_DTVB0_DTVSM0_DPLB0_EPS0_ELFLR0_EMLLn1_FDSI0_GRPM1_GRVWA8_GRVWB8_GSU1_GSUAMB_GSUC0_GSUWGMRR0_GLS0_ISA1151_IU1_K1_LDSTI0_LBSPPA1024_LBSPPB512_LBSPPM0_LPA8_LPB8_LPM0_LRVW16_LWPMn1_MIAV1_MIWT1_1_MO40_MGRIPM1_NTn1_NTA0_NTB0_NTC0_NTD0_NTM0_NEPBS0_NLCA1_NLCB1_ONLL1_PGR2_PLR0_PKA0_SGROB0_SIA1_SS1_SU32_SUM0_SUS256_SPO0_SRVW0_SSO0_SVW1_SK0_SKFTR0_SKXCCM0_SGRO0_TIN0_TLDS0_TLDSMn1_ULSGRO0_USL1_UIOFGRO0_USFGROn1_VSn1_VWA1_VWB1_WSGRA0_WSGRB0_WS32_WG32_2_1_WGM8_WGMXCC1_WGMXCCGn1
- - - [64, 64, 1, 64]
    - [2, 111.551]
  - - [256, 256, 1, 256]
    - [130, 4725.98]
  - - [320, 64, 1, 64]
    - [36, 582.542]
  - - [576, 64, 1, 64]
    - [16, 1025.78]
  - - [832, 64, 1, 64]
    - [21, 1390.97]
  - - [1088, 64, 1, 64]
    - [22, 1782.58]
  - - [1344, 64, 1, 64]
    - [142, 2001.83]
  - - [1600, 64, 1, 64]
    - [21, 2340.57]
  - - [1856, 64, 1, 64]
    - [21, 2715.06]
  - - [2112, 64, 1, 64]
    - [84, 2983.02]
  - - [2368, 64, 1, 64]
    - [22, 3031.04]
  - - [2624, 64, 1, 64]
    - [21, 3307.05]
  - - [2880, 64, 1, 64]
    - [21, 3469.55]
  - - [3136, 64, 1, 64]
    - [21, 3777.96]
  - - [3392, 64, 1, 64]
    - [152, 4086.36]
  - - [3648, 64, 1, 64]
    - [124, 4394.77]
  - - [3904, 64, 1, 64]
    - [124, 4264.21]
  - - [64, 320, 1, 64]
    - [11, 595.782]
  - - [320, 320, 1, 64]
    - [149, 2340.57]
  - - [576, 320, 1, 64]
    - [27, 3521.34]
  - - [832, 320, 1, 64]
    - [54, 4605.23]
  - - [1088, 320, 1, 64]
    - [152, 5434.69]
  - - [1344, 320, 1, 64]
    - [92, 6185.42]
  - - [1600, 320, 1, 64]
    - [92, 6619.8]
  - - [1856, 320, 1, 64]
    - [69, 7309.78]
  - - [2112, 320, 1, 64]
    - [104, 8009.96]
  - - [2368, 320, 1, 64]
    - [92, 9064.79]
  - - [2624, 320, 1, 64]
    - [124, 7845.19]
  - - [2880, 320, 1, 64]
    - [124, 8548.17]
  - - [3136, 320, 1, 64]
    - [73, 8858.66]
  - - [3392, 320, 1, 64]
    - [105, 8793.44]
  - - [3648, 320, 1, 64]
    - [152, 8587.48]
  - - [3904, 320, 1, 64]
    - [90, 8983.59]
  - - [64, 576, 1, 64]
    - [144, 1025.78]
  - - [320, 576, 1, 64]
    - [21, 3574.69]
  - - [576, 576, 1, 64]
    - [47, 5662.31]
  - - [832, 576, 1, 64]
    - [117, 6892.33]
  - - [1088, 576, 1, 64]
    - [95, 7864.32]
  - - [1344, 576, 1, 64]
    - [104, 9175.04]
  - - [1600, 576, 1, 64]
    - [71, 9362.29]
  - - [1856, 576, 1, 64]
    - [97, 9844.54]
  - - [2112, 576, 1, 64]
    - [95, 9671.65]
  - - [2368, 576, 1, 64]
    - [47, 9540.32]
  - - [2624, 576, 1, 64]
    - [92, 10182.2]
  - - [2880, 576, 1, 64]
    - [92, 10408.7]
  - - [3136, 576, 1, 64]
    - [71, 10654.9]
  - - [64, 832, 1, 64]
    - [22, 1363.15]
  - - [320, 832, 1, 64]
    - [31, 4668.32]
  - - [576, 832, 1, 64]
    - [95, 6389.76]
  - - [832, 832, 1, 64]
    - [104, 8054.97]
  - - [1088, 832, 1, 64]
    - [99, 8519.68]
  - - [1344, 832, 1, 64]
    - [99, 9939.63]
  - - [1600, 832, 1, 64]
    - [92, 9260.52]
  - - [1856, 832, 1, 64]
    - [94, 10294.6]
  - - [2112, 832, 1, 64]
    - [71, 10412.9]
  - - [64, 1088, 1, 64]
    - [24, 1591.59]
  - - [320, 1088, 1, 64]
    - [117, 5641.07]
  - - [576, 1088, 1, 64]
    - [72, 7496.83]
  - - [832, 1088, 1, 64]
    - [124, 8276.26]
  - - [1088, 1088, 1, 64]
    - [103, 8609.05]
  - - [1344, 1088, 1, 64]
    - [92, 10117.3]
  - - [1600, 1088, 1, 64]
    - [71, 10461.1]
  - - [64, 1344, 1, 64]
    - [31, 2001.83]
  - - [320, 1344, 1, 64]
    - [53, 6713.44]
  - - [576, 1344, 1, 64]
    - [95, 8397.49]
  - - [832, 1344, 1, 64]
    - [99, 9871.08]
  - - [1088, 1344, 1, 64]
    - [104, 10009.1]
  - - [1344, 1344, 1, 64]
    - [72, 11010.0]
  - - [64, 1600, 1, 64]
    - [25, 2259.86]
  - - [320, 1600, 1, 64]
    - [95, 6553.6]
  - - [576, 1600, 1, 64]
    - [72, 8803.34]
  - - [832, 1600, 1, 64]
    - [92, 9260.52]
  - - [1088, 1600, 1, 64]
    - [72, 10363.8]
  - - [64, 1856, 1, 64]
    - [84, 2667.43]
  - - [320, 1856, 1, 64]
    - [98, 7757.32]
  - - [576, 1856, 1, 64]
    - [99, 9183.84]
  - - [832, 1856, 1, 64]
    - [91, 9594.98]
  - - [64, 2112, 1, 64]
    - [84, 2932.46]
  - - [320, 2112, 1, 64]
    - [95, 8084.81]
  - - [576, 2112, 1, 64]
    - [95, 9855.29]
  - - [832, 2112, 1, 64]
    - [71, 10710.5]
  - - [64, 2368, 1, 64]
    - [84, 3233.11]
  - - [320, 2368, 1, 64]
    - [95, 8082.77]
  - - [576, 2368, 1, 64]
    - [92, 9093.12]
  - - [64, 2624, 1, 64]
    - [29, 3307.05]
  - - [320, 2624, 1, 64]
    - [95, 8667.66]
  - - [576, 2624, 1, 64]
    - [92, 9721.72]
  - - [64, 2880, 1, 64]
    - [31, 3629.69]
  - - [320, 2880, 1, 64]
    - [95, 8610.57]
  - - [576, 2880, 1, 64]
    - [72, 10015.9]
  - - [64, 3136, 1, 64]
    - [151, 3723.2]
  - - [320, 3136, 1, 64]
    - [95, 8797.98]
  - - [576, 3136, 1, 64]
    - [72, 10704.2]
  - - [64, 3392, 1, 64]
    - [151, 3859.34]
  - - [320, 3392, 1, 64]
    - [98, 8793.44]
  - - [64, 3648, 1, 64]
    - [98, 4269.2]
  - - [320, 3648, 1, 64]
    - [95, 9457.09]
  - - [64, 3904, 1, 64]
    - [31, 4381.04]
  - - [320, 3904, 1, 64]
    - [152, 8786.15]
  - - [64, 64, 1, 256]
    - [125, 427.99]
  - - [320, 64, 1, 256]
    - [11, 2056.03]
  - - [576, 64, 1, 256]
    - [11, 3199.05]
  - - [832, 64, 1, 256]
    - [56, 4009.26]
  - - [1088, 64, 1, 256]
    - [130, 5166.9]
  - - [1344, 64, 1, 256]
    - [27, 5181.2]
  - - [1600, 64, 1, 256]
    - [64, 6168.09]
  - - [1856, 64, 1, 256]
    - [22, 7154.99]
  - - [2112, 64, 1, 256]
    - [115, 8238.81]
  - - [2368, 64, 1, 256]
    - [84, 8526.88]
  - - [2624, 64, 1, 256]
    - [27, 8267.62]
  - - [2880, 64, 1, 256]
    - [27, 9343.75]
  - - [3136, 64, 1, 256]
    - [152, 9694.38]
  - - [3392, 64, 1, 256]
    - [100, 10485.8]
  - - [3648, 64, 1, 256]
    - [100, 10867.1]
  - - [3904, 64, 1, 256]
    - [152, 10072.9]
  - - [64, 320, 1, 256]
    - [110, 2016.49]
  - - [320, 320, 1, 256]
    - [27, 6316.72]
  - - [576, 320, 1, 256]
    - [27, 9343.75]
  - - [832, 320, 1, 256]
    - [146, 11265.7]
  - - [1088, 320, 1, 256]
    - [69, 13818.4]
  - - [1344, 320, 1, 256]
    - [33, 14778.6]
  - - [64, 576, 1, 256]
    - [148, 3199.05]
  - - [320, 576, 1, 256]
    - [41, 9830.4]
  - - [576, 576, 1, 256]
    - [47, 15166.9]
  - - [832, 576, 1, 256]
    - [47, 17039.4]
  - - [64, 832, 1, 256]
    - [16, 3951.16]
  - - [320, 832, 1, 256]
    - [41, 10993.1]
  - - [576, 832, 1, 256]
    - [47, 16691.6]
  - - [64, 1088, 1, 256]
    - [150, 5166.9]
  - - [320, 1088, 1, 256]
    - [41, 14147.5]
  - - [64, 1344, 1, 256]
    - [29, 5370.76]
  - - [320, 1344, 1, 256]
    - [41, 14979.7]
  - - [64, 1600, 1, 256]
    - [64, 6168.09]
  - - [64, 1856, 1, 256]
    - [64, 7154.99]
  - - [64, 2112, 1, 256]
    - [84, 7522.39]
  - - [64, 2368, 1, 256]
    - [116, 8526.88]
  - - [64, 2624, 1, 256]
    - [29, 8429.73]
  - - [64, 2880, 1, 256]
    - [29, 9532.51]
  - - [64, 3136, 1, 256]
    - [41, 9257.7]
  - - [64, 3392, 1, 256]
    - [41, 10485.8]
  - - [64, 3648, 1, 256]
    - [41, 11835.4]
  - - [64, 3904, 1, 256]
    - [29, 9765.36]
  - - [64, 64, 1, 512]
    - [125, 748.983]
  - - [320, 64, 1, 512]
    - [56, 3495.25]
  - - [576, 64, 1, 512]
    - [109, 5316.72]
  - - [832, 64, 1, 512]
    - [84, 6196.13]
  - - [1088, 64, 1, 512]
    - [116, 7667.01]
  - - [1344, 64, 1, 512]
    - [27, 7794.72]
  - - [1600, 64, 1, 512]
    - [27, 8962.19]
  - - [1856, 64, 1, 512]
    - [27, 10136.2]
  - - [2112, 64, 1, 512]
    - [151, 11253.0]
  - - [2368, 64, 1, 512]
    - [85, 12415.1]
  - - [2624, 64, 1, 512]
    - [27, 11698.4]
  - - [2880, 64, 1, 512]
    - [27, 12839.7]
  - - [3136, 64, 1, 512]
    - [85, 13090.5]
  - - [3392, 64, 1, 512]
    - [85, 14069.5]
  - - [3648, 64, 1, 512]
    - [85, 15131.3]
  - - [64, 320, 1, 512]
    - [128, 3554.49]
  - - [320, 320, 1, 512]
    - [67, 9039.45]
  - - [576, 320, 1, 512]
    - [27, 12927.6]
  - - [64, 576, 1, 512]
    - [56, 5101.18]
  - - [320, 576, 1, 512]
    - [41, 13677.1]
  - - [64, 832, 1, 512]
    - [67, 6267.35]
  - - [64, 1088, 1, 512]
    - [130, 7427.41]
  - - [64, 1344, 1, 512]
    - [29, 7864.32]
  - - [64, 1600, 1, 512]
    - [29, 9039.45]
  - - [64, 1856, 1, 512]
    - [39, 10221.4]
  - - [64, 2112, 1, 512]
    - [84, 10406.9]
  - - [64, 2368, 1, 512]
    - [116, 10777.0]
  - - [64, 2624, 1, 512]
    - [67, 12196.2]
  - - [64, 2880, 1, 512]
    - [41, 13677.1]
  - - [64, 3136, 1, 512]
    - [38, 12765.3]
  - - [64, 3392, 1, 512]
    - [41, 15122.3]
  - - [64, 3648, 1, 512]
    - [42, 15036.2]
  - - [64, 64, 1, 1024]
    - [13, 1165.08]
  - - [320, 64, 1, 1024]
    - [127, 5309.25]
  - - [576, 64, 1, 1024]
    - [81, 7122.4]
  - - [832, 64, 1, 1024]
    - [27, 8261.51]
  - - [1088, 64, 1, 1024]
    - [84, 10259.4]
  - - [1344, 64, 1, 1024]
    - [27, 9952.59]
  - - [1600, 64, 1, 1024]
    - [27, 11586.5]
  - - [1856, 64, 1, 1024]
    - [27, 13221.2]
  - - [64, 320, 1, 1024]
    - [133, 5309.25]
  - - [320, 320, 1, 1024]
    - [43, 12633.4]
  - - [64, 576, 1, 1024]
    - [109, 7190.24]
  - - [64, 832, 1, 1024]
    - [67, 8724.15]
  - - [64, 1088, 1, 1024]
    - [22, 9701.11]
  - - [64, 1344, 1, 1024]
    - [41, 10241.9]
  - - [64, 1600, 1, 1024]
    - [29, 11915.6]
  - - [64, 1856, 1, 1024]
    - [41, 12939.9]
  - - [64, 64, 1, 2048]
    - [20, 1766.02]
  - - [320, 64, 1, 2048]
    - [138, 7358.43]
  - - [576, 64, 1, 2048]
    - [81, 9151.21]
  - - [832, 64, 1, 2048]
    - [50, 10744.0]
  - - [64, 320, 1, 2048]
    - [138, 7358.43]
  - - [64, 576, 1, 2048]
    - [56, 8778.78]
  - - [64, 832, 1, 2048]
    - [46, 11359.6]
  - - [64, 64, 1, 4096]
    - [20, 3257.71]
  - - [320, 64, 1, 4096]
    - [131, 9586.98]
  - - [64, 320, 1, 4096]
    - [65, 9372.75]
  - - [192, 64, 1, 64]
    - [16, 365.782]
  - - [448, 64, 1, 64]
    - [8, 734.003]
  - - [704, 64, 1, 64]
    - [19, 1153.43]
  - - [960, 64, 1, 64]
    - [22, 1572.86]
  - - [1216, 64, 1, 64]
    - [21, 1992.29]
  - - [1472, 64, 1, 64]
    - [21, 2079.07]
  - - [1728, 64, 1, 64]
    - [22, 2527.82]
  - - [1984, 64, 1, 64]
    - [151, 2500.45]
  - - [64, 192, 1, 64]
    - [36, 365.782]
  - - [192, 192, 1, 64]
    - [16, 1025.78]
  - - [320, 192, 1, 64]
    - [29, 1604.96]
  - - [448, 192, 1, 64]
    - [29, 2038.9]
  - - [576, 192, 1, 64]
    - [29, 2621.44]
  - - [704, 192, 1, 64]
    - [84, 2932.46]
  - - [832, 192, 1, 64]
    - [29, 3465.63]
  - - [960, 192, 1, 64]
    - [39, 3629.69]
  - - [1088, 192, 1, 64]
    - [40, 3932.16]
  - - [1216, 192, 1, 64]
    - [41, 4460.36]
  - - [1344, 192, 1, 64]
    - [31, 4587.52]
  - - [1472, 192, 1, 64]
    - [95, 4698.17]
  - - [1600, 192, 1, 64]
    - [95, 5041.23]
  - - [1728, 192, 1, 64]
    - [47, 5738.83]
  - - [1856, 192, 1, 64]
    - [42, 6081.74]
  - - [1984, 192, 1, 64]
    - [41, 5946.19]
  - - [192, 320, 1, 64]
    - [16, 1572.86]
  - - [448, 320, 1, 64]
    - [84, 3008.21]
  - - [704, 320, 1, 64]
    - [152, 4369.07]
  - - [960, 320, 1, 64]
    - [38, 5386.52]
  - - [1216, 320, 1, 64]
    - [124, 6000.89]
  - - [1472, 320, 1, 64]
    - [96, 6699.24]
  - - [1728, 320, 1, 64]
    - [96, 7007.81]
  - - [1984, 320, 1, 64]
    - [75, 7739.49]
  - - [64, 448, 1, 64]
    - [7, 797.83]
  - - [192, 448, 1, 64]
    - [27, 2038.9]
  - - [320, 448, 1, 64]
    - [84, 3110.18]
  - - [448, 448, 1, 64]
    - [21, 3723.2]
  - - [576, 448, 1, 64]
    - [53, 4463.53]
  - - [704, 448, 1, 64]
    - [53, 4983.97]
  - - [832, 448, 1, 64]
    - [53, 5890.15]
  - - [960, 448, 1, 64]
    - [53, 6632.56]
  - - [1088, 448, 1, 64]
    - [152, 6498.99]
  - - [1216, 448, 1, 64]
    - [53, 7188.69]
  - - [1344, 448, 1, 64]
    - [75, 7410.61]
  - - [1472, 448, 1, 64]
    - [101, 7888.82]
  - - [1600, 448, 1, 64]
    - [96, 8417.47]
  - - [1728, 448, 1, 64]
    - [104, 9090.87]
  - - [1856, 448, 1, 64]
    - [73, 8514.44]
  - - [1984, 448, 1, 64]
    - [71, 8554.17]
  - - [192, 576, 1, 64]
    - [29, 2621.44]
  - - [448, 576, 1, 64]
    - [30, 4718.59]
  - - [704, 576, 1, 64]
    - [42, 6179.11]
  - - [960, 576, 1, 64]
    - [47, 8043.05]
  - - [1216, 576, 1, 64]
    - [92, 8620.5]
  - - [1472, 576, 1, 64]
    - [71, 8823.38]
  - - [1728, 576, 1, 64]
    - [99, 9232.03]
  - - [1984, 576, 1, 64]
    - [99, 10677.1]
  - - [64, 704, 1, 64]
    - [106, 1176.97]
  - - [192, 704, 1, 64]
    - [84, 3035.35]
  - - [320, 704, 1, 64]
    - [151, 4179.11]
  - - [448, 704, 1, 64]
    - [152, 5046.27]
  - - [576, 704, 1, 64]
    - [151, 6035.41]
  - - [704, 704, 1, 64]
    - [152, 6608.21]
  - - [832, 704, 1, 64]
    - [103, 7497.32]
  - - [960, 704, 1, 64]
    - [92, 7864.32]
  - - [1088, 704, 1, 64]
    - [101, 8379.65]
  - - [1216, 704, 1, 64]
    - [71, 8766.1]
  - - [1344, 704, 1, 64]
    - [73, 8528.91]
  - - [1472, 704, 1, 64]
    - [99, 9085.26]
  - - [1600, 704, 1, 64]
    - [105, 8955.23]
  - - [1728, 704, 1, 64]
    - [75, 8897.92]
  - - [1856, 704, 1, 64]
    - [101, 9611.95]
  - - [1984, 704, 1, 64]
    - [92, 9611.95]
  - - [192, 832, 1, 64]
    - [84, 3525.38]
  - - [448, 832, 1, 64]
    - [152, 5748.22]
  - - [704, 832, 1, 64]
    - [95, 7497.32]
  - - [960, 832, 1, 64]
    - [95, 8244.85]
  - - [1216, 832, 1, 64]
    - [99, 9316.48]
  - - [1472, 832, 1, 64]
    - [87, 9114.08]
  - - [1728, 832, 1, 64]
    - [92, 10001.4]
  - - [1984, 832, 1, 64]
    - [92, 10256.7]
  - - [64, 960, 1, 64]
    - [21, 1572.86]
  - - [192, 960, 1, 64]
    - [31, 3744.91]
  - - [320, 960, 1, 64]
    - [31, 5173.89]
  - - [448, 960, 1, 64]
    - [40, 6255.71]
  - - [576, 960, 1, 64]
    - [47, 8135.5]
  - - [704, 960, 1, 64]
    - [95, 8084.81]
  - - [832, 960, 1, 64]
    - [95, 8519.68]
  - - [960, 960, 1, 64]
    - [71, 9216.0]
  - - [1088, 960, 1, 64]
    - [97, 9220.24]
  - - [1216, 960, 1, 64]
    - [99, 10028.3]
  - - [1344, 960, 1, 64]
    - [47, 9383.56]
  - - [1472, 960, 1, 64]
    - [47, 9672.69]
  - - [1600, 960, 1, 64]
    - [69, 10402.5]
  - - [1728, 960, 1, 64]
    - [92, 10307.6]
  - - [1856, 960, 1, 64]
    - [71, 11125.1]
  - - [1984, 960, 1, 64]
    - [71, 11445.7]
  - - [192, 1088, 1, 64]
    - [152, 3819.81]
  - - [448, 1088, 1, 64]
    - [92, 6239.03]
  - - [704, 1088, 1, 64]
    - [71, 7843.35]
  - - [960, 1088, 1, 64]
    - [73, 9284.27]
  - - [1216, 1088, 1, 64]
    - [47, 9153.79]
  - - [1472, 1088, 1, 64]
    - [104, 9999.83]
  - - [1728, 1088, 1, 64]
    - [99, 9944.14]
  - - [64, 1216, 1, 64]
    - [23, 1811.18]
  - - [192, 1216, 1, 64]
    - [151, 4209.07]
  - - [320, 1216, 1, 64]
    - [151, 5859.69]
  - - [448, 1216, 1, 64]
    - [95, 7043.47]
  - - [576, 1216, 1, 64]
    - [72, 8301.23]
  - - [704, 1216, 1, 64]
    - [71, 8908.63]
  - - [832, 1216, 1, 64]
    - [97, 8993.0]
  - - [960, 1216, 1, 64]
    - [95, 9517.33]
  - - [1088, 1216, 1, 64]
    - [92, 9153.79]
  - - [1216, 1216, 1, 64]
    - [92, 10286.3]
  - - [1344, 1216, 1, 64]
    - [96, 10254.5]
  - - [1472, 1216, 1, 64]
    - [71, 10807.3]
  - - [1600, 1216, 1, 64]
    - [99, 10376.5]
  - - [192, 1344, 1, 64]
    - [53, 4652.13]
  - - [448, 1344, 1, 64]
    - [98, 7630.73]
  - - [704, 1344, 1, 64]
    - [73, 8776.13]
  - - [960, 1344, 1, 64]
    - [47, 9383.56]
  - - [1216, 1344, 1, 64]
    - [92, 10356.0]
  - - [64, 1472, 1, 64]
    - [16, 1976.82]
  - - [192, 1472, 1, 64]
    - [29, 4823.45]
  - - [320, 1472, 1, 64]
    - [117, 6625.62]
  - - [448, 1472, 1, 64]
    - [47, 7469.94]
  - - [576, 1472, 1, 64]
    - [71, 8545.48]
  - - [704, 1472, 1, 64]
    - [99, 9211.45]
  - - [832, 1472, 1, 64]
    - [152, 8613.3]
  - - [960, 1472, 1, 64]
    - [47, 9777.26]
  - - [1088, 1472, 1, 64]
    - [92, 10048.9]
  - - [1216, 1472, 1, 64]
    - [71, 10706.3]
  - - [192, 1600, 1, 64]
    - [54, 5173.89]
  - - [448, 1600, 1, 64]
    - [95, 8340.95]
  - - [704, 1600, 1, 64]
    - [95, 9362.29]
  - - [960, 1600, 1, 64]
    - [69, 10402.5]
  - - [1216, 1600, 1, 64]
    - [92, 10419.9]
  - - [64, 1728, 1, 64]
    - [22, 2483.47]
  - - [192, 1728, 1, 64]
    - [95, 5587.81]
  - - [320, 1728, 1, 64]
    - [95, 7777.9]
  - - [448, 1728, 1, 64]
    - [98, 8542.28]
  - - [576, 1728, 1, 64]
    - [99, 9035.6]
  - - [704, 1728, 1, 64]
    - [95, 9981.64]
  - - [832, 1728, 1, 64]
    - [92, 9840.91]
  - - [960, 1728, 1, 64]
    - [92, 10408.7]
  - - [1088, 1728, 1, 64]
    - [97, 10069.0]
  - - [192, 1856, 1, 64]
    - [151, 5495.55]
  - - [448, 1856, 1, 64]
    - [71, 8380.35]
  - - [704, 1856, 1, 64]
    - [101, 8943.74]
  - - [960, 1856, 1, 64]
    - [72, 10707.3]
  - - [64, 1984, 1, 64]
    - [149, 2579.83]
  - - [192, 1984, 1, 64]
    - [152, 5736.33]
  - - [320, 1984, 1, 64]
    - [95, 7321.14]
  - - [448, 1984, 1, 64]
    - [72, 8618.98]
  - - [576, 1984, 1, 64]
    - [95, 9316.97]
  - - [704, 1984, 1, 64]
    - [69, 9360.33]
  - - [832, 1984, 1, 64]
    - [71, 10109.5]
  - - [960, 1984, 1, 64]
    - [72, 11234.7]
  - - [192, 64, 1, 256]
    - [106, 1233.62]
  - - [448, 64, 1, 256]
    - [16, 2575.45]
  - - [704, 64, 1, 256]
    - [7, 3443.09]
  - - [960, 64, 1, 256]
    - [56, 4626.07]
  - - [1216, 64, 1, 256]
    - [81, 5692.27]
  - - [1472, 64, 1, 256]
    - [64, 5811.39]
  - - [1728, 64, 1, 256]
    - [27, 6822.06]
  - - [1984, 64, 1, 256]
    - [84, 7304.69]
  - - [64, 192, 1, 256]
    - [56, 1258.29]
  - - [192, 192, 1, 256]
    - [56, 3254.2]
  - - [320, 192, 1, 256]
    - [113, 4695.12]
  - - [448, 192, 1, 256]
    - [39, 5437.06]
  - - [576, 192, 1, 256]
    - [67, 6990.51]
  - - [704, 192, 1, 256]
    - [115, 7689.56]
  - - [832, 192, 1, 256]
    - [84, 9189.77]
  - - [960, 192, 1, 256]
    - [29, 9532.51]
  - - [1088, 192, 1, 256]
    - [41, 11026.3]
  - - [1216, 192, 1, 256]
    - [41, 12074.5]
  - - [1344, 192, 1, 256]
    - [47, 11902.8]
  - - [1472, 192, 1, 256]
    - [41, 12474.4]
  - - [1600, 192, 1, 256]
    - [41, 13559.2]
  - - [1728, 192, 1, 256]
    - [47, 15032.7]
  - - [1856, 192, 1, 256]
    - [41, 14833.5]
  - - [1984, 192, 1, 256]
    - [41, 14236.1]
  - - [192, 320, 1, 256]
    - [56, 4626.07]
  - - [448, 320, 1, 256]
    - [84, 8247.23]
  - - [704, 320, 1, 256]
    - [85, 10485.8]
  - - [960, 320, 1, 256]
    - [146, 12582.9]
  - - [1216, 320, 1, 256]
    - [69, 15208.4]
  - - [1472, 320, 1, 256]
    - [69, 16295.4]
  - - [64, 448, 1, 256]
    - [109, 2575.45]
  - - [192, 448, 1, 256]
    - [27, 5306.05]
  - - [320, 448, 1, 256]
    - [115, 8635.33]
  - - [448, 448, 1, 256]
    - [33, 9880.81]
  - - [576, 448, 1, 256]
    - [52, 10829.6]
  - - [704, 448, 1, 256]
    - [33, 12815.9]
  - - [832, 448, 1, 256]
    - [70, 13161.4]
  - - [960, 448, 1, 256]
    - [104, 15082.3]
  - - [1088, 448, 1, 256]
    - [69, 16100.7]
  - - [192, 576, 1, 256]
    - [67, 6990.51]
  - - [448, 576, 1, 256]
    - [41, 11488.7]
  - - [704, 576, 1, 256]
    - [41, 15610.4]
  - - [64, 704, 1, 256]
    - [7, 3443.09]
  - - [192, 704, 1, 256]
    - [115, 8238.81]
  - - [320, 704, 1, 256]
    - [41, 10985.1]
  - - [448, 704, 1, 256]
    - [33, 12918.5]
  - - [576, 704, 1, 256]
    - [70, 14220.4]
  - - [192, 832, 1, 256]
    - [115, 8794.51]
  - - [448, 832, 1, 256]
    - [47, 12894.7]
  - - [64, 960, 1, 256]
    - [7, 4695.12]
  - - [192, 960, 1, 256]
    - [41, 9629.78]
  - - [320, 960, 1, 256]
    - [41, 13329.4]
  - - [448, 960, 1, 256]
    - [41, 14979.7]
  - - [192, 1088, 1, 256]
    - [152, 10186.2]
  - - [448, 1088, 1, 256]
    - [47, 16527.2]
  - - [64, 1216, 1, 256]
    - [81, 5692.27]
  - - [192, 1216, 1, 256]
    - [41, 11384.5]
  - - [320, 1216, 1, 256]
    - [41, 13282.0]
  - - [192, 1344, 1, 256]
    - [47, 11796.5]
  - - [64, 1472, 1, 256]
    - [22, 5544.19]
  - - [192, 1472, 1, 256]
    - [41, 11764.5]
  - - [320, 1472, 1, 256]
    - [41, 16078.2]
  - - [192, 1600, 1, 256]
    - [47, 13107.2]
  - - [64, 1728, 1, 256]
    - [29, 6905.26]
  - - [192, 1728, 1, 256]
    - [47, 15166.9]
  - - [192, 1856, 1, 256]
    - [41, 14833.5]
  - - [64, 1984, 1, 256]
    - [152, 7648.44]
  - - [192, 1984, 1, 256]
    - [47, 13358.6]
  - - [192, 64, 1, 512]
    - [106, 2132.7]
  - - [448, 64, 1, 512]
    - [81, 4021.94]
  - - [704, 64, 1, 512]
    - [56, 4961.0]
  - - [960, 64, 1, 512]
    - [84, 7069.05]
  - - [1216, 64, 1, 512]
    - [82, 8569.01]
  - - [1472, 64, 1, 512]
    - [16, 8039.08]
  - - [1728, 64, 1, 512]
    - [27, 9933.88]
  - - [1984, 64, 1, 512]
    - [84, 10571.0]
  - - [64, 192, 1, 512]
    - [16, 2132.7]
  - - [192, 192, 1, 512]
    - [16, 5171.06]
  - - [320, 192, 1, 512]
    - [67, 6990.51]
  - - [448, 192, 1, 512]
    - [41, 7935.17]
  - - [576, 192, 1, 512]
    - [29, 10202.4]
  - - [704, 192, 1, 512]
    - [84, 11345.2]
  - - [832, 192, 1, 512]
    - [84, 13191.8]
  - - [960, 192, 1, 512]
    - [41, 13776.9]
  - - [1088, 192, 1, 512]
    - [41, 15728.6]
  - - [1216, 192, 1, 512]
    - [41, 17076.8]
  - - [192, 320, 1, 512]
    - [56, 6990.51]
  - - [448, 320, 1, 512]
    - [84, 12032.8]
  - - [704, 320, 1, 512]
    - [85, 14883.0]
  - - [64, 448, 1, 512]
    - [138, 4021.94]
  - - [192, 448, 1, 512]
    - [27, 7726.35]
  - - [320, 448, 1, 512]
    - [116, 11650.8]
  - - [448, 448, 1, 512]
    - [41, 14076.8]
  - - [192, 576, 1, 512]
    - [74, 10295.1]
  - - [64, 704, 1, 512]
    - [16, 5183.97]
  - - [192, 704, 1, 512]
    - [84, 11345.2]
  - - [320, 704, 1, 512]
    - [41, 15586.9]
  - - [192, 832, 1, 512]
    - [84, 13086.2]
  - - [64, 960, 1, 512]
    - [80, 7963.87]
  - - [192, 960, 1, 512]
    - [41, 13878.2]
  - - [192, 1088, 1, 512]
    - [41, 14752.4]
  - - [64, 1216, 1, 512]
    - [63, 8131.81]
  - - [192, 1216, 1, 512]
    - [41, 16375.0]
  - - [64, 1472, 1, 512]
    - [39, 8316.29]
  - - [64, 1728, 1, 512]
    - [41, 10021.8]
  - - [64, 1984, 1, 512]
    - [84, 9925.45]
  - - [192, 64, 1, 1024]
    - [127, 3106.89]
  - - [448, 64, 1, 1024]
    - [28, 5646.18]
  - - [704, 64, 1, 1024]
    - [84, 6990.51]
  - - [960, 64, 1, 1024]
    - [27, 9460.84]
  - - [1216, 64, 1, 1024]
    - [85, 11633.8]
  - - [1472, 64, 1, 1024]
    - [27, 10778.7]
  - - [1728, 64, 1, 1024]
    - [27, 12796.2]
  - - [64, 192, 1, 1024]
    - [16, 3032.03]
  - - [192, 192, 1, 1024]
    - [81, 6990.51]
  - - [320, 192, 1, 1024]
    - [113, 9679.16]
  - - [448, 192, 1, 1024]
    - [46, 11292.4]
  - - [576, 192, 1, 1024]
    - [43, 13726.8]
  - - [192, 320, 1, 1024]
    - [84, 9460.84]
  - - [64, 448, 1, 1024]
    - [106, 5646.18]
  - - [192, 448, 1, 1024]
    - [46, 10182.7]
  - - [192, 576, 1, 1024]
    - [41, 13726.8]
  - - [64, 704, 1, 1024]
    - [67, 6990.51]
  - - [64, 960, 1, 1024]
    - [29, 9252.14]
  - - [64, 1216, 1, 1024]
    - [22, 10992.0]
  - - [64, 1472, 1, 1024]
    - [41, 11025.0]
  - - [64, 1728, 1, 1024]
    - [41, 13016.8]
  - - [192, 64, 1, 2048]
    - [28, 4703.89]
  - - [448, 64, 1, 2048]
    - [28, 8448.96]
  - - [704, 64, 1, 2048]
    - [26, 9415.78]
  - - [64, 192, 1, 2048]
    - [138, 4338.94]
  - - [192, 192, 1, 2048]
    - [109, 9378.57]
  - - [64, 448, 1, 2048]
    - [66, 7675.85]
  - - [64, 704, 1, 2048]
    - [46, 10252.7]
  - - [192, 64, 1, 4096]
    - [28, 6494.41]
  - - [448, 64, 1, 4096]
    - [28, 11685.6]
  - - [64, 192, 1, 4096]
    - [20, 6138.01]
  - - [64, 448, 1, 4096]
    - [45, 10924.7]
  - - [128, 64, 1, 64]
    - [1, 213.995]
  - - [256, 64, 1, 64]
    - [17, 436.907]
  - - [384, 64, 1, 64]
    - [137, 699.051]
  - - [512, 64, 1, 64]
    - [134, 911.805]
  - - [640, 64, 1, 64]
    - [142, 1139.76]
  - - [768, 64, 1, 64]
    - [25, 1209.9]
  - - [896, 64, 1, 64]
    - [16, 1468.01]
  - - [1024, 64, 1, 64]
    - [22, 1677.72]
  - - [64, 128, 1, 64]
    - [12, 238.313]
  - - [128, 128, 1, 64]
    - [139, 436.907]
  - - [192, 128, 1, 64]
    - [58, 669.304]
  - - [256, 128, 1, 64]
    - [17, 892.405]
  - - [320, 128, 1, 64]
    - [23, 1139.76]
  - - [384, 128, 1, 64]
    - [139, 1283.97]
  - - [448, 128, 1, 64]
    - [16, 1468.01]
  - - [512, 128, 1, 64]
    - [24, 1677.72]
  - - [576, 128, 1, 64]
    - [21, 1850.43]
  - - [640, 128, 1, 64]
    - [21, 2056.03]
  - - [704, 128, 1, 64]
    - [22, 1954.97]
  - - [768, 128, 1, 64]
    - [21, 2207.53]
  - - [832, 128, 1, 64]
    - [21, 2434.19]
  - - [896, 128, 1, 64]
    - [21, 2621.44]
  - - [960, 128, 1, 64]
    - [24, 2808.69]
  - - [1024, 128, 1, 64]
    - [152, 2796.2]
  - - [128, 192, 1, 64]
    - [133, 655.36]
  - - [256, 192, 1, 64]
    - [22, 1283.97]
  - - [384, 192, 1, 64]
    - [21, 1814.84]
  - - [512, 192, 1, 64]
    - [21, 2207.53]
  - - [640, 192, 1, 64]
    - [30, 2859.75]
  - - [768, 192, 1, 64]
    - [124, 3311.29]
  - - [896, 192, 1, 64]
    - [39, 3670.02]
  - - [1024, 192, 1, 64]
    - [124, 3813.0]
  - - [64, 256, 1, 64]
    - [19, 487.71]
  - - [128, 256, 1, 64]
    - [16, 911.805]
  - - [192, 256, 1, 64]
    - [27, 1283.97]
  - - [256, 256, 1, 64]
    - [130, 1711.96]
  - - [320, 256, 1, 64]
    - [149, 2097.15]
  - - [384, 256, 1, 64]
    - [21, 2207.53]
  - - [448, 256, 1, 64]
    - [24, 2575.45]
  - - [512, 256, 1, 64]
    - [76, 2995.93]
  - - [576, 256, 1, 64]
    - [84, 3199.05]
  - - [640, 256, 1, 64]
    - [152, 3615.78]
  - - [704, 256, 1, 64]
    - [21, 3495.25]
  - - [768, 256, 1, 64]
    - [124, 3994.58]
  - - [832, 256, 1, 64]
    - [152, 3894.71]
  - - [896, 256, 1, 64]
    - [85, 4587.52]
  - - [960, 256, 1, 64]
    - [151, 4430.6]
  - - [1024, 256, 1, 64]
    - [104, 4793.49]
  - - [128, 320, 1, 64]
    - [150, 1139.76]
  - - [256, 320, 1, 64]
    - [21, 2056.03]
  - - [384, 320, 1, 64]
    - [27, 2808.69]
  - - [512, 320, 1, 64]
    - [83, 3276.8]
  - - [640, 320, 1, 64]
    - [85, 3855.06]
  - - [768, 320, 1, 64]
    - [100, 4915.2]
  - - [896, 320, 1, 64]
    - [75, 4959.48]
  - - [1024, 320, 1, 64]
    - [124, 5667.98]
  - - [64, 384, 1, 64]
    - [106, 699.051]
  - - [128, 384, 1, 64]
    - [106, 1283.97]
  - - [192, 384, 1, 64]
    - [24, 1850.43]
  - - [256, 384, 1, 64]
    - [29, 2287.8]
  - - [320, 384, 1, 64]
    - [21, 2808.69]
  - - [384, 384, 1, 64]
    - [83, 3254.2]
  - - [448, 384, 1, 64]
    - [67, 3609.85]
  - - [512, 384, 1, 64]
    - [33, 3871.67]
  - - [576, 384, 1, 64]
    - [42, 4355.62]
  - - [640, 384, 1, 64]
    - [41, 4559.03]
  - - [704, 384, 1, 64]
    - [29, 4873.66]
  - - [768, 384, 1, 64]
    - [90, 5101.18]
  - - [832, 384, 1, 64]
    - [98, 5679.79]
  - - [896, 384, 1, 64]
    - [42, 5872.03]
  - - [960, 384, 1, 64]
    - [47, 6049.48]
  - - [1024, 384, 1, 64]
    - [92, 6064.05]
  - - [128, 448, 1, 64]
    - [81, 1468.01]
  - - [256, 448, 1, 64]
    - [21, 2621.44]
  - - [384, 448, 1, 64]
    - [21, 3440.64]
  - - [512, 448, 1, 64]
    - [124, 4448.5]
  - - [640, 448, 1, 64]
    - [92, 5242.88]
  - - [768, 448, 1, 64]
    - [124, 5719.51]
  - - [896, 448, 1, 64]
    - [104, 6672.76]
  - - [1024, 448, 1, 64]
    - [103, 6908.27]
  - - [64, 512, 1, 64]
    - [56, 911.805]
  - - [128, 512, 1, 64]
    - [22, 1553.45]
  - - [192, 512, 1, 64]
    - [22, 2246.95]
  - - [256, 512, 1, 64]
    - [84, 2892.62]
  - - [320, 512, 1, 64]
    - [84, 3554.49]
  - - [384, 512, 1, 64]
    - [124, 3932.16]
  - - [448, 512, 1, 64]
    - [152, 4317.67]
  - - [512, 512, 1, 64]
    - [87, 4534.38]
  - - [576, 512, 1, 64]
    - [30, 5033.16]
  - - [640, 512, 1, 64]
    - [92, 5667.98]
  - - [704, 512, 1, 64]
    - [152, 5558.72]
  - - [768, 512, 1, 64]
    - [104, 6536.58]
  - - [832, 512, 1, 64]
    - [152, 5991.86]
  - - [896, 512, 1, 64]
    - [87, 7340.03]
  - - [960, 512, 1, 64]
    - [70, 7401.71]
  - - [1024, 512, 1, 64]
    - [96, 7540.32]
  - - [128, 576, 1, 64]
    - [149, 1887.44]
  - - [256, 576, 1, 64]
    - [83, 3254.2]
  - - [384, 576, 1, 64]
    - [124, 4355.62]
  - - [512, 576, 1, 64]
    - [92, 5242.88]
  - - [640, 576, 1, 64]
    - [32, 6291.46]
  - - [768, 576, 1, 64]
    - [92, 6905.26]
  - - [896, 576, 1, 64]
    - [92, 7422.5]
  - - [1024, 576, 1, 64]
    - [92, 7864.32]
  - - [64, 640, 1, 64]
    - [16, 1092.27]
  - - [128, 640, 1, 64]
    - [21, 2016.49]
  - - [192, 640, 1, 64]
    - [21, 2759.41]
  - - [256, 640, 1, 64]
    - [76, 3679.21]
  - - [320, 640, 1, 64]
    - [38, 3971.88]
  - - [384, 640, 1, 64]
    - [124, 4839.58]
  - - [448, 640, 1, 64]
    - [54, 4893.35]
  - - [512, 640, 1, 64]
    - [92, 5825.42]
  - - [576, 640, 1, 64]
    - [72, 5754.38]
  - - [640, 640, 1, 64]
    - [69, 6721.64]
  - - [704, 640, 1, 64]
    - [152, 6135.29]
  - - [768, 640, 1, 64]
    - [92, 7767.23]
  - - [832, 640, 1, 64]
    - [103, 6682.1]
  - - [896, 640, 1, 64]
    - [69, 8436.82]
  - - [960, 640, 1, 64]
    - [72, 7635.26]
  - - [1024, 640, 1, 64]
    - [69, 8473.34]
  - - [128, 704, 1, 64]
    - [21, 2097.15]
  - - [256, 704, 1, 64]
    - [100, 3661.69]
  - - [384, 704, 1, 64]
    - [104, 4943.29]
  - - [512, 704, 1, 64]
    - [124, 5840.17]
  - - [640, 704, 1, 64]
    - [104, 7300.21]
  - - [768, 704, 1, 64]
    - [104, 7689.56]
  - - [896, 704, 1, 64]
    - [96, 8498.98]
  - - [1024, 704, 1, 64]
    - [92, 8623.8]
  - - [64, 768, 1, 64]
    - [16, 1283.97]
  - - [128, 768, 1, 64]
    - [22, 2246.95]
  - - [192, 768, 1, 64]
    - [27, 2949.12]
  - - [256, 768, 1, 64]
    - [100, 3932.16]
  - - [320, 768, 1, 64]
    - [152, 4839.58]
  - - [384, 768, 1, 64]
    - [88, 5242.88]
  - - [448, 768, 1, 64]
    - [42, 5719.51]
  - - [512, 768, 1, 64]
    - [91, 6138.01]
  - - [576, 768, 1, 64]
    - [47, 6508.4]
  - - [640, 768, 1, 64]
    - [92, 7864.32]
  - - [704, 768, 1, 64]
    - [98, 7208.96]
  - - [768, 768, 1, 64]
    - [72, 8388.61]
  - - [832, 768, 1, 64]
    - [104, 7864.32]
  - - [896, 768, 1, 64]
    - [71, 9175.04]
  - - [960, 768, 1, 64]
    - [72, 10039.6]
  - - [1024, 768, 1, 64]
    - [79, 9320.68]
  - - [128, 832, 1, 64]
    - [63, 2434.19]
  - - [256, 832, 1, 64]
    - [100, 4259.84]
  - - [384, 832, 1, 64]
    - [146, 5452.6]
  - - [512, 832, 1, 64]
    - [124, 6491.18]
  - - [640, 832, 1, 64]
    - [92, 7658.14]
  - - [768, 832, 1, 64]
    - [103, 7940.67]
  - - [896, 832, 1, 64]
    - [96, 9001.93]
  - - [1024, 832, 1, 64]
    - [71, 8388.61]
  - - [64, 896, 1, 64]
    - [153, 1411.54]
  - - [128, 896, 1, 64]
    - [130, 2669.1]
  - - [192, 896, 1, 64]
    - [152, 3286.58]
  - - [256, 896, 1, 64]
    - [100, 4516.94]
  - - [320, 896, 1, 64]
    - [30, 4959.48]
  - - [384, 896, 1, 64]
    - [124, 5719.51]
  - - [448, 896, 1, 64]
    - [152, 6044.73]
  - - [512, 896, 1, 64]
    - [101, 6749.45]
  - - [576, 896, 1, 64]
    - [72, 7340.03]
  - - [640, 896, 1, 64]
    - [92, 8340.95]
  - - [704, 896, 1, 64]
    - [72, 7475.96]
  - - [768, 896, 1, 64]
    - [72, 9175.04]
  - - [832, 896, 1, 64]
    - [92, 8596.43]
  - - [896, 896, 1, 64]
    - [73, 9694.38]
  - - [960, 896, 1, 64]
    - [72, 9330.55]
  - - [1024, 896, 1, 64]
    - [73, 9548.01]
  - - [128, 960, 1, 64]
    - [67, 2859.75]
  - - [256, 960, 1, 64]
    - [42, 4626.07]
  - - [384, 960, 1, 64]
    - [42, 6208.67]
  - - [512, 960, 1, 64]
    - [92, 7489.83]
  - - [640, 960, 1, 64]
    - [69, 8836.31]
  - - [768, 960, 1, 64]
    - [71, 9074.22]
  - - [896, 960, 1, 64]
    - [93, 9830.4]
  - - [1024, 960, 1, 64]
    - [71, 10230.0]
  - - [64, 1024, 1, 64]
    - [22, 1421.8]
  - - [128, 1024, 1, 64]
    - [84, 2943.37]
  - - [192, 1024, 1, 64]
    - [152, 3932.16]
  - - [256, 1024, 1, 64]
    - [92, 4793.49]
  - - [320, 1024, 1, 64]
    - [152, 5242.88]
  - - [384, 1024, 1, 64]
    - [124, 6371.09]
  - - [448, 1024, 1, 64]
    - [41, 6314.01]
  - - [512, 1024, 1, 64]
    - [92, 7294.44]
  - - [576, 1024, 1, 64]
    - [72, 8388.61]
  - - [640, 1024, 1, 64]
    - [104, 8924.05]
  - - [704, 1024, 1, 64]
    - [92, 8165.9]
  - - [768, 1024, 1, 64]
    - [96, 9407.78]
  - - [832, 1024, 1, 64]
    - [71, 8938.68]
  - - [896, 1024, 1, 64]
    - [71, 9320.68]
  - - [960, 1024, 1, 64]
    - [72, 10313.9]
  - - [1024, 1024, 1, 64]
    - [99, 9193.0]
  - - [128, 64, 1, 256]
    - [127, 838.861]
  - - [256, 64, 1, 256]
    - [7, 1582.76]
  - - [384, 64, 1, 256]
    - [16, 2207.53]
  - - [512, 64, 1, 256]
    - [16, 2892.62]
  - - [640, 64, 1, 256]
    - [81, 3615.78]
  - - [768, 64, 1, 256]
    - [22, 3700.86]
  - - [896, 64, 1, 256]
    - [56, 4317.67]
  - - [1024, 64, 1, 256]
    - [21, 4660.34]
  - - [64, 128, 1, 256]
    - [16, 838.861]
  - - [128, 128, 1, 256]
    - [16, 1677.72]
  - - [192, 128, 1, 256]
    - [128, 2287.8]
  - - [256, 128, 1, 256]
    - [56, 2892.62]
  - - [320, 128, 1, 256]
    - [56, 3554.49]
  - - [384, 128, 1, 256]
    - [85, 3756.09]
  - - [448, 128, 1, 256]
    - [56, 4382.11]
  - - [512, 128, 1, 256]
    - [83, 4934.48]
  - - [576, 128, 1, 256]
    - [81, 5470.83]
  - - [640, 128, 1, 256]
    - [130, 6078.7]
  - - [704, 128, 1, 256]
    - [22, 5695.97]
  - - [768, 128, 1, 256]
    - [29, 6213.78]
  - - [832, 128, 1, 256]
    - [27, 6491.18]
  - - [896, 128, 1, 256]
    - [22, 6827.94]
  - - [960, 128, 1, 256]
    - [27, 7489.83]
  - - [1024, 128, 1, 256]
    - [100, 7713.66]
  - - [128, 192, 1, 256]
    - [16, 2246.95]
  - - [256, 192, 1, 256]
    - [39, 3595.12]
  - - [384, 192, 1, 256]
    - [22, 5101.18]
  - - [512, 192, 1, 256]
    - [29, 6452.78]
  - - [640, 192, 1, 256]
    - [67, 7864.32]
  - - [768, 192, 1, 256]
    - [76, 8778.78]
  - - [896, 192, 1, 256]
    - [29, 8987.79]
  - - [1024, 192, 1, 256]
    - [41, 10066.3]
  - - [64, 256, 1, 256]
    - [11, 1644.83]
  - - [128, 256, 1, 256]
    - [107, 2843.6]
  - - [192, 256, 1, 256]
    - [7, 3700.86]
  - - [320, 256, 1, 256]
    - [21, 5825.42]
  - - [384, 256, 1, 256]
    - [85, 6213.78]
  - - [448, 256, 1, 256]
    - [63, 6990.51]
  - - [512, 256, 1, 256]
    - [85, 7626.01]
  - - [576, 256, 1, 256]
    - [84, 8482.86]
  - - [640, 256, 1, 256]
    - [85, 9532.51]
  - - [704, 256, 1, 256]
    - [41, 9136.11]
  - - [768, 256, 1, 256]
    - [33, 9966.66]
  - - [832, 256, 1, 256]
    - [41, 10691.4]
  - - [896, 256, 1, 256]
    - [124, 11402.0]
  - - [960, 256, 1, 256]
    - [72, 11439.0]
  - - [1024, 256, 1, 256]
    - [88, 11983.7]
  - - [128, 320, 1, 256]
    - [81, 3615.78]
  - - [256, 320, 1, 256]
    - [85, 5667.98]
  - - [384, 320, 1, 256]
    - [22, 7231.56]
  - - [512, 320, 1, 256]
    - [85, 9425.4]
  - - [640, 320, 1, 256]
    - [54, 10280.2]
  - - [768, 320, 1, 256]
    - [85, 11870.7]
  - - [896, 320, 1, 256]
    - [77, 12991.2]
  - - [1024, 320, 1, 256]
    - [69, 14463.1]
  - - [64, 384, 1, 256]
    - [138, 2207.53]
  - - [128, 384, 1, 256]
    - [113, 3813.0]
  - - [192, 384, 1, 256]
    - [142, 5470.83]
  - - [256, 384, 1, 256]
    - [39, 6138.01]
  - - [320, 384, 1, 256]
    - [41, 7864.32]
  - - [384, 384, 1, 256]
    - [115, 8778.78]
  - - [448, 384, 1, 256]
    - [67, 9080.45]
  - - [512, 384, 1, 256]
    - [41, 10377.7]
  - - [576, 384, 1, 256]
    - [41, 11674.9]
  - - [640, 384, 1, 256]
    - [121, 12710.0]
  - - [704, 384, 1, 256]
    - [41, 11729.8]
  - - [768, 384, 1, 256]
    - [47, 13852.7]
  - - [832, 384, 1, 256]
    - [41, 13862.5]
  - - [896, 384, 1, 256]
    - [33, 14803.4]
  - - [960, 384, 1, 256]
    - [47, 16556.5]
  - - [1024, 384, 1, 256]
    - [71, 15252.0]
  - - [128, 448, 1, 256]
    - [7, 4317.67]
  - - [256, 448, 1, 256]
    - [149, 6908.27]
  - - [384, 448, 1, 256]
    - [27, 9175.04]
  - - [512, 448, 1, 256]
    - [85, 10975.7]
  - - [640, 448, 1, 256]
    - [89, 13225.3]
  - - [768, 448, 1, 256]
    - [33, 13870.9]
  - - [896, 448, 1, 256]
    - [104, 14785.7]
  - - [1024, 448, 1, 256]
    - [104, 16311.2]
  - - [64, 512, 1, 256]
    - [11, 2892.62]
  - - [128, 512, 1, 256]
    - [81, 4934.48]
  - - [192, 512, 1, 256]
    - [67, 6213.78]
  - - [256, 512, 1, 256]
    - [84, 7895.16]
  - - [320, 512, 1, 256]
    - [84, 9218.25]
  - - [384, 512, 1, 256]
    - [85, 9586.98]
  - - [448, 512, 1, 256]
    - [115, 11184.8]
  - - [512, 512, 1, 256]
    - [77, 11877.7]
  - - [576, 512, 1, 256]
    - [70, 12376.6]
  - - [640, 512, 1, 256]
    - [88, 14979.7]
  - - [704, 512, 1, 256]
    - [70, 12554.4]
  - - [768, 512, 1, 256]
    - [70, 16236.0]
  - - [832, 512, 1, 256]
    - [75, 14837.0]
  - - [896, 512, 1, 256]
    - [101, 16540.9]
  - - [128, 576, 1, 256]
    - [22, 5551.28]
  - - [256, 576, 1, 256]
    - [152, 8778.78]
  - - [384, 576, 1, 256]
    - [41, 11555.7]
  - - [512, 576, 1, 256]
    - [77, 13245.2]
  - - [640, 576, 1, 256]
    - [41, 15345.0]
  - - [768, 576, 1, 256]
    - [71, 17158.5]
  - - [64, 640, 1, 256]
    - [109, 3615.78]
  - - [128, 640, 1, 256]
    - [85, 6168.09]
  - - [192, 640, 1, 256]
    - [22, 7489.83]
  - - [256, 640, 1, 256]
    - [84, 9532.51]
  - - [320, 640, 1, 256]
    - [38, 10280.2]
  - - [384, 640, 1, 256]
    - [152, 12216.4]
  - - [448, 640, 1, 256]
    - [41, 11744.1]
  - - [512, 640, 1, 256]
    - [77, 14979.7]
  - - [576, 640, 1, 256]
    - [70, 15345.0]
  - - [640, 640, 1, 256]
    - [69, 18558.9]
  - - [704, 640, 1, 256]
    - [41, 15379.1]
  - - [128, 704, 1, 256]
    - [67, 5558.72]
  - - [256, 704, 1, 256]
    - [29, 8958.71]
  - - [384, 704, 1, 256]
    - [78, 12469.6]
  - - [512, 704, 1, 256]
    - [33, 14417.9]
  - - [640, 704, 1, 256]
    - [104, 16596.2]
  - - [64, 768, 1, 256]
    - [67, 3647.22]
  - - [128, 768, 1, 256]
    - [67, 6213.78]
  - - [192, 768, 1, 256]
    - [151, 8482.86]
  - - [256, 768, 1, 256]
    - [123, 10485.8]
  - - [320, 768, 1, 256]
    - [41, 12839.7]
  - - [384, 768, 1, 256]
    - [77, 13481.7]
  - - [448, 768, 1, 256]
    - [41, 14803.4]
  - - [512, 768, 1, 256]
    - [71, 15728.6]
  - - [576, 768, 1, 256]
    - [70, 17975.6]
  - - [128, 832, 1, 256]
    - [82, 6491.18]
  - - [256, 832, 1, 256]
    - [41, 10287.9]
  - - [384, 832, 1, 256]
    - [77, 14736.7]
  - - [512, 832, 1, 256]
    - [96, 15146.1]
  - - [64, 896, 1, 256]
    - [56, 4317.67]
  - - [128, 896, 1, 256]
    - [63, 7074.73]
  - - [192, 896, 1, 256]
    - [27, 8897.01]
  - - [256, 896, 1, 256]
    - [33, 11079.3]
  - - [320, 896, 1, 256]
    - [52, 11935.0]
  - - [384, 896, 1, 256]
    - [70, 14439.4]
  - - [448, 896, 1, 256]
    - [72, 13701.4]
  - - [512, 896, 1, 256]
    - [73, 16425.2]
  - - [128, 960, 1, 256]
    - [29, 7580.07]
  - - [256, 960, 1, 256]
    - [121, 12839.7]
  - - [384, 960, 1, 256]
    - [47, 16556.5]
  - - [64, 1024, 1, 256]
    - [130, 4934.48]
  - - [128, 1024, 1, 256]
    - [76, 7626.01]
  - - [192, 1024, 1, 256]
    - [152, 9773.14]
  - - [256, 1024, 1, 256]
    - [75, 12427.6]
  - - [320, 1024, 1, 256]
    - [41, 12807.0]
  - - [384, 1024, 1, 256]
    - [70, 16502.2]
  - - [448, 1024, 1, 256]
    - [41, 15870.3]
  - - [128, 64, 1, 512]
    - [125, 1446.31]
  - - [256, 64, 1, 512]
    - [16, 2581.11]
  - - [384, 64, 1, 512]
    - [138, 3355.44]
  - - [512, 64, 1, 512]
    - [109, 4596.5]
  - - [640, 64, 1, 512]
    - [82, 5667.98]
  - - [768, 64, 1, 512]
    - [27, 5530.95]
  - - [896, 64, 1, 512]
    - [16, 6181.08]
  - - [1024, 64, 1, 512]
    - [85, 6990.51]
  - - [64, 128, 1, 512]
    - [125, 1497.97]
  - - [128, 128, 1, 512]
    - [56, 2796.2]
  - - [192, 128, 1, 512]
    - [109, 3544.48]
  - - [256, 128, 1, 512]
    - [109, 4596.5]
  - - [320, 128, 1, 512]
    - [80, 6078.7]
  - - [384, 128, 1, 512]
    - [56, 5592.41]
  - - [448, 128, 1, 512]
    - [56, 6452.78]
  - - [512, 128, 1, 512]
    - [84, 7139.24]
  - - [576, 128, 1, 512]
    - [84, 8118.01]
  - - [640, 128, 1, 512]
    - [85, 8924.05]
  - - [704, 128, 1, 512]
    - [22, 8094.27]
  - - [768, 128, 1, 512]
    - [27, 8830.11]
  - - [832, 128, 1, 512]
    - [29, 9320.68]
  - - [896, 128, 1, 512]
    - [85, 10037.7]
  - - [960, 128, 1, 512]
    - [27, 11336.0]
  - - [1024, 128, 1, 512]
    - [85, 11471.6]
  - - [128, 192, 1, 512]
    - [138, 3595.12]
  - - [256, 192, 1, 512]
    - [56, 5592.41]
  - - [384, 192, 1, 512]
    - [151, 8206.25]
  - - [512, 192, 1, 512]
    - [123, 9407.78]
  - - [640, 192, 1, 512]
    - [29, 11234.7]
  - - [768, 192, 1, 512]
    - [85, 12582.9]
  - - [896, 192, 1, 512]
    - [41, 13048.9]
  - - [1024, 192, 1, 512]
    - [33, 14588.9]
  - - [64, 256, 1, 512]
    - [56, 2750.36]
  - - [128, 256, 1, 512]
    - [109, 4660.34]
  - - [192, 256, 1, 512]
    - [56, 5592.41]
  - - [256, 256, 1, 512]
    - [84, 7294.44]
  - - [320, 256, 1, 512]
    - [84, 9020.01]
  - - [384, 256, 1, 512]
    - [27, 8830.11]
  - - [448, 256, 1, 512]
    - [27, 10037.7]
  - - [512, 256, 1, 512]
    - [83, 11374.4]
  - - [576, 256, 1, 512]
    - [84, 12177.0]
  - - [640, 256, 1, 512]
    - [122, 14098.5]
  - - [704, 256, 1, 512]
    - [41, 12996.4]
  - - [768, 256, 1, 512]
    - [70, 14177.9]
  - - [832, 256, 1, 512]
    - [41, 14637.8]
  - - [896, 256, 1, 512]
    - [85, 15153.6]
  - - [128, 320, 1, 512]
    - [81, 5825.42]
  - - [256, 320, 1, 512]
    - [83, 9320.68]
  - - [384, 320, 1, 512]
    - [27, 11037.6]
  - - [512, 320, 1, 512]
    - [85, 13981.0]
  - - [640, 320, 1, 512]
    - [69, 15307.7]
  - - [64, 384, 1, 512]
    - [7, 3355.44]
  - - [128, 384, 1, 512]
    - [84, 5785.25]
  - - [192, 384, 1, 512]
    - [84, 8118.01]
  - - [256, 384, 1, 512]
    - [41, 9235.16]
  - - [320, 384, 1, 512]
    - [41, 11336.0]
  - - [384, 384, 1, 512]
    - [85, 12688.7]
  - - [448, 384, 1, 512]
    - [41, 13048.9]
  - - [512, 384, 1, 512]
    - [123, 14380.5]
  - - [576, 384, 1, 512]
    - [41, 15620.2]
  - - [128, 448, 1, 512]
    - [56, 6382.64]
  - - [256, 448, 1, 512]
    - [22, 10124.2]
  - - [384, 448, 1, 512]
    - [27, 12318.9]
  - - [512, 448, 1, 512]
    - [41, 15870.3]
  - - [64, 512, 1, 512]
    - [109, 4725.98]
  - - [128, 512, 1, 512]
    - [84, 7216.01]
  - - [192, 512, 1, 512]
    - [29, 8987.79]
  - - [256, 512, 1, 512]
    - [85, 11471.6]
  - - [320, 512, 1, 512]
    - [84, 13640.0]
  - - [384, 512, 1, 512]
    - [33, 13884.6]
  - - [448, 512, 1, 512]
    - [151, 14588.9]
  - - [128, 576, 1, 512]
    - [85, 8118.01]
  - - [256, 576, 1, 512]
    - [76, 12582.9]
  - - [384, 576, 1, 512]
    - [41, 16532.3]
  - - [64, 640, 1, 512]
    - [56, 5518.82]
  - - [128, 640, 1, 512]
    - [81, 8830.11]
  - - [192, 640, 1, 512]
    - [27, 10663.5]
  - - [256, 640, 1, 512]
    - [76, 14218.0]
  - - [320, 640, 1, 512]
    - [41, 14169.9]
  - - [128, 704, 1, 512]
    - [29, 7954.71]
  - - [256, 704, 1, 512]
    - [33, 12640.4]
  - - [64, 768, 1, 512]
    - [67, 6138.01]
  - - [128, 768, 1, 512]
    - [41, 9235.16]
  - - [192, 768, 1, 512]
    - [151, 12276.0]
  - - [256, 768, 1, 512]
    - [41, 15024.4]
  - - [128, 832, 1, 512]
    - [29, 9482.77]
  - - [256, 832, 1, 512]
    - [33, 15690.9]
  - - [64, 896, 1, 512]
    - [56, 6524.47]
  - - [128, 896, 1, 512]
    - [29, 10124.2]
  - - [192, 896, 1, 512]
    - [27, 12318.9]
  - - [256, 896, 1, 512]
    - [33, 16425.2]
  - - [128, 960, 1, 512]
    - [41, 11336.0]
  - - [64, 1024, 1, 512]
    - [84, 7294.44]
  - - [128, 1024, 1, 512]
    - [83, 11374.4]
  - - [192, 1024, 1, 512]
    - [41, 13884.6]
  - - [128, 64, 1, 1024]
    - [133, 2330.17]
  - - [256, 64, 1, 1024]
    - [56, 4247.4]
  - - [384, 64, 1, 1024]
    - [28, 4934.48]
  - - [512, 64, 1, 1024]
    - [81, 6331.02]
  - - [640, 64, 1, 1024]
    - [138, 8388.61]
  - - [768, 64, 1, 1024]
    - [84, 7864.32]
  - - [896, 64, 1, 1024]
    - [84, 8830.11]
  - - [1024, 64, 1, 1024]
    - [85, 9868.95]
  - - [64, 128, 1, 1024]
    - [138, 2236.96]
  - - [128, 128, 1, 1024]
    - [56, 4247.4]
  - - [192, 128, 1, 1024]
    - [109, 4839.58]
  - - [256, 128, 1, 1024]
    - [109, 6644.44]
  - - [320, 128, 1, 1024]
    - [81, 7989.15]
  - - [384, 128, 1, 1024]
    - [27, 7743.33]
  - - [448, 128, 1, 1024]
    - [84, 8964.92]
  - - [512, 128, 1, 1024]
    - [84, 10168.0]
  - - [576, 128, 1, 1024]
    - [84, 11353.0]
  - - [640, 128, 1, 1024]
    - [84, 12807.0]
  - - [704, 128, 1, 1024]
    - [29, 10426.5]
  - - [768, 128, 1, 1024]
    - [33, 11504.4]
  - - [832, 128, 1, 1024]
    - [29, 12184.6]
  - - [896, 128, 1, 1024]
    - [27, 12835.0]
  - - [128, 192, 1, 1024]
    - [138, 5084.0]
  - - [256, 192, 1, 1024]
    - [46, 7864.32]
  - - [384, 192, 1, 1024]
    - [84, 11439.0]
  - - [512, 192, 1, 1024]
    - [41, 12128.1]
  - - [64, 256, 1, 1024]
    - [56, 4194.3]
  - - [128, 256, 1, 1024]
    - [81, 6391.32]
  - - [192, 256, 1, 1024]
    - [112, 7803.36]
  - - [256, 256, 1, 1024]
    - [84, 10168.0]
  - - [320, 256, 1, 1024]
    - [84, 12427.6]
  - - [384, 256, 1, 1024]
    - [43, 11570.5]
  - - [448, 256, 1, 1024]
    - [27, 13048.9]
  - - [128, 320, 1, 1024]
    - [81, 7989.15]
  - - [256, 320, 1, 1024]
    - [84, 12336.2]
  - - [64, 384, 1, 1024]
    - [81, 4703.89]
  - - [128, 384, 1, 1024]
    - [46, 7926.24]
  - - [192, 384, 1, 1024]
    - [84, 11184.8]
  - - [256, 384, 1, 1024]
    - [74, 12055.5]
  - - [128, 448, 1, 1024]
    - [67, 8764.22]
  - - [256, 448, 1, 1024]
    - [121, 13498.9]
  - - [64, 512, 1, 1024]
    - [81, 6271.86]
  - - [128, 512, 1, 1024]
    - [84, 9942.05]
  - - [192, 512, 1, 1024]
    - [41, 11439.0]
  - - [128, 576, 1, 1024]
    - [84, 11268.3]
  - - [64, 640, 1, 1024]
    - [80, 8559.8]
  - - [128, 640, 1, 1024]
    - [83, 12427.6]
  - - [128, 704, 1, 1024]
    - [43, 10855.8]
  - - [64, 768, 1, 1024]
    - [67, 7864.32]
  - - [128, 768, 1, 1024]
    - [121, 11705.0]
  - - [128, 832, 1, 1024]
    - [43, 12905.6]
  - - [64, 896, 1, 1024]
    - [16, 8635.33]
  - - [128, 896, 1, 1024]
    - [41, 13655.9]
  - - [64, 1024, 1, 1024]
    - [22, 9451.95]
  - - [128, 64, 1, 2048]
    - [20, 3423.92]
  - - [256, 64, 1, 2048]
    - [16, 5687.19]
  - - [384, 64, 1, 2048]
    - [28, 7190.24]
  - - [512, 64, 1, 2048]
    - [109, 8285.04]
  - - [640, 64, 1, 2048]
    - [81, 10230.0]
  - - [768, 64, 1, 2048]
    - [50, 10016.2]
  - - [896, 64, 1, 2048]
    - [50, 11803.1]
  - - [64, 128, 1, 2048]
    - [20, 3423.92]
  - - [128, 128, 1, 2048]
    - [138, 5639.4]
  - - [192, 128, 1, 2048]
    - [28, 7294.44]
  - - [256, 128, 1, 2048]
    - [81, 8234.22]
  - - [320, 128, 1, 2048]
    - [80, 11491.2]
  - - [384, 128, 1, 2048]
    - [50, 10219.6]
  - - [448, 128, 1, 2048]
    - [50, 11402.0]
  - - [128, 192, 1, 2048]
    - [45, 7456.54]
  - - [256, 192, 1, 2048]
    - [45, 11504.4]
  - - [64, 256, 1, 2048]
    - [138, 5546.19]
  - - [128, 256, 1, 2048]
    - [81, 8285.04]
  - - [192, 256, 1, 2048]
    - [45, 11637.4]
  - - [128, 320, 1, 2048]
    - [81, 10420.6]
  - - [64, 384, 1, 2048]
    - [45, 7139.24]
  - - [128, 384, 1, 2048]
    - [46, 11773.5]
  - - [128, 448, 1, 2048]
    - [45, 12170.0]
  - - [64, 512, 1, 2048]
    - [81, 7989.15]
  - - [64, 640, 1, 2048]
    - [56, 9754.2]
  - - [64, 768, 1, 2048]
    - [45, 10766.1]
  - - [64, 896, 1, 2048]
    - [46, 11292.4]
  - - [128, 64, 1, 4096]
    - [20, 4971.03]
  - - [256, 64, 1, 4096]
    - [26, 7415.34]
  - - [384, 64, 1, 4096]
    - [28, 9917.57]
  - - [64, 128, 1, 4096]
    - [20, 5008.12]
  - - [128, 128, 1, 4096]
    - [65, 7540.32]
  - - [192, 128, 1, 4096]
    - [28, 9917.57]
  - - [128, 192, 1, 4096]
    - [45, 9966.66]
  - - [64, 256, 1, 4096]
    - [65, 7498.2]
  - - [64, 384, 1, 4096]
    - [45, 9632.85]
  - - [1, 1, 1, 1]
    - [17, 0.00037037]
  - - [2, 2, 1, 2]
    - [19, 0.00290909]
  - - [4, 2, 1, 2]
    - [17, 0.00571429]
  - - [6, 2, 1, 2]
    - [17, 0.00857143]
  - - [8, 2, 1, 2]
    - [16, 0.0116364]
  - - [10, 2, 1, 2]
    - [9, 0.0140351]
  - - [12, 2, 1, 2]
    - [16, 0.0171429]
  - - [14, 2, 1, 2]
    - [16, 0.0196491]
  - - [16, 2, 1, 2]
    - [8, 0.0232727]
  - - [2, 4, 1, 2]
    - [60, 0.00561404]
  - - [4, 4, 1, 2]
    - [19, 0.0114286]
  - - [6, 4, 1, 2]
    - [36, 0.0177778]
  - - [8, 4, 1, 2]
    - [19, 0.0232727]
  - - [10, 4, 1, 2]
    - [17, 0.0290909]
  - - [12, 4, 1, 2]
    - [35, 0.0349091]
  - - [14, 4, 1, 2]
    - [36, 0.04]
  - - [16, 4, 1, 2]
    - [16, 0.0465455]
  - - [2, 6, 1, 2]
    - [17, 0.00857143]
  - - [4, 6, 1, 2]
    - [18, 0.0177778]
  - - [6, 6, 1, 2]
    - [9, 0.0261818]
  - - [8, 6, 1, 2]
    - [16, 0.0342857]
  - - [10, 6, 1, 2]
    - [19, 0.0436364]
  - - [12, 6, 1, 2]
    - [35, 0.0523636]
  - - [14, 6, 1, 2]
    - [17, 0.0610909]
  - - [16, 6, 1, 2]
    - [35, 0.0698182]
  - - [2, 8, 1, 2]
    - [19, 0.0116364]
  - - [4, 8, 1, 2]
    - [19, 0.0232727]
  - - [6, 8, 1, 2]
    - [19, 0.0355556]
  - - [8, 8, 1, 2]
    - [17, 0.0465455]
  - - [10, 8, 1, 2]
    - [8, 0.0571429]
  - - [12, 8, 1, 2]
    - [1, 0.0673684]
  - - [14, 8, 1, 2]
    - [9, 0.0785965]
  - - [16, 8, 1, 2]
    - [16, 0.0930909]
  - - [2, 10, 1, 2]
    - [17, 0.0145455]
  - - [4, 10, 1, 2]
    - [17, 0.0296296]
  - - [6, 10, 1, 2]
    - [19, 0.0428571]
  - - [8, 10, 1, 2]
    - [7, 0.0592593]
  - - [10, 10, 1, 2]
    - [19, 0.0740741]
  - - [12, 10, 1, 2]
    - [18, 0.0888889]
  - - [14, 10, 1, 2]
    - [16, 0.101818]
  - - [16, 10, 1, 2]
    - [17, 0.118519]
  - - [2, 12, 1, 2]
    - [61, 0.0154839]
  - - [4, 12, 1, 2]
    - [1, 0.0342857]
  - - [6, 12, 1, 2]
    - [9, 0.0505263]
  - - [8, 12, 1, 2]
    - [11, 0.0698182]
  - - [10, 12, 1, 2]
    - [17, 0.0888889]
  - - [12, 12, 1, 2]
    - [18, 0.104727]
  - - [14, 12, 1, 2]
    - [11, 0.12]
  - - [16, 12, 1, 2]
    - [17, 0.142222]
  - - [2, 14, 1, 2]
    - [19, 0.0203636]
  - - [4, 14, 1, 2]
    - [9, 0.0407273]
  - - [6, 14, 1, 2]
    - [17, 0.06]
  - - [8, 14, 1, 2]
    - [17, 0.082963]
  - - [10, 14, 1, 2]
    - [16, 0.0982456]
  - - [12, 14, 1, 2]
    - [35, 0.122182]
  - - [14, 14, 1, 2]
    - [16, 0.137544]
  - - [16, 14, 1, 2]
    - [9, 0.157193]
  - - [2, 16, 1, 2]
    - [19, 0.0228571]
  - - [4, 16, 1, 2]
    - [9, 0.0441379]
  - - [6, 16, 1, 2]
    - [4, 0.0711111]
  - - [8, 16, 1, 2]
    - [8, 0.0930909]
  - - [10, 16, 1, 2]
    - [2, 0.116364]
  - - [12, 16, 1, 2]
    - [35, 0.137143]
  - - [14, 16, 1, 2]
    - [8, 0.16]
  - - [16, 16, 1, 2]
    - [17, 0.18963]
  - - [2, 2, 1, 4]
    - [19, 0.00592593]
  - - [4, 2, 1, 4]
    - [2, 0.0112281]
  - - [6, 2, 1, 4]
    - [18, 0.0177778]
  - - [8, 2, 1, 4]
    - [16, 0.0232727]
  - - [10, 2, 1, 4]
    - [2, 0.0285714]
  - - [12, 2, 1, 4]
    - [17, 0.0355556]
  - - [14, 2, 1, 4]
    - [18, 0.04]
  - - [16, 2, 1, 4]
    - [17, 0.0457143]
  - - [2, 4, 1, 4]
    - [18, 0.0118519]
  - - [4, 4, 1, 4]
    - [18, 0.0224561]
  - - [6, 4, 1, 4]
    - [1, 0.0331034]
  - - [8, 4, 1, 4]
    - [18, 0.0474074]
  - - [10, 4, 1, 4]
    - [7, 0.0581818]
  - - [12, 4, 1, 4]
    - [35, 0.0698182]
  - - [14, 4, 1, 4]
    - [36, 0.0814545]
  - - [16, 4, 1, 4]
    - [17, 0.0966038]
  - - [2, 6, 1, 4]
    - [19, 0.0171429]
  - - [4, 6, 1, 4]
    - [9, 0.0325424]
  - - [6, 6, 1, 4]
    - [3, 0.0505263]
  - - [8, 6, 1, 4]
    - [11, 0.0698182]
  - - [10, 6, 1, 4]
    - [36, 0.0872727]
  - - [12, 6, 1, 4]
    - [18, 0.104727]
  - - [14, 6, 1, 4]
    - [17, 0.122182]
  - - [16, 6, 1, 4]
    - [1, 0.137143]
  - - [2, 8, 1, 4]
    - [19, 0.0237037]
  - - [4, 8, 1, 4]
    - [57, 0.0449123]
  - - [6, 8, 1, 4]
    - [9, 0.0650847]
  - - [8, 8, 1, 4]
    - [1, 0.0898246]
  - - [10, 8, 1, 4]
    - [11, 0.114286]
  - - [12, 8, 1, 4]
    - [16, 0.137143]
  - - [14, 8, 1, 4]
    - [17, 0.165926]
  - - [16, 8, 1, 4]
    - [17, 0.186182]
  - - [2, 10, 1, 4]
    - [17, 0.0290909]
  - - [4, 10, 1, 4]
    - [2, 0.0551724]
  - - [6, 10, 1, 4]
    - [9, 0.0888889]
  - - [8, 10, 1, 4]
    - [1, 0.110345]
  - - [10, 10, 1, 4]
    - [16, 0.142857]
  - - [12, 10, 1, 4]
    - [2, 0.177778]
  - - [14, 10, 1, 4]
    - [16, 0.2]
  - - [16, 10, 1, 4]
    - [17, 0.237037]
  - - [2, 12, 1, 4]
    - [19, 0.0349091]
  - - [4, 12, 1, 4]
    - [17, 0.0698182]
  - - [6, 12, 1, 4]
    - [1, 0.101053]
  - - [8, 12, 1, 4]
    - [4, 0.139636]
  - - [10, 12, 1, 4]
    - [7, 0.171429]
  - - [12, 12, 1, 4]
    - [17, 0.205714]
  - - [14, 12, 1, 4]
    - [17, 0.248889]
  - - [16, 12, 1, 4]
    - [35, 0.279273]
  - - [2, 14, 1, 4]
    - [61, 0.04]
  - - [4, 14, 1, 4]
    - [35, 0.0772414]
  - - [6, 14, 1, 4]
    - [2, 0.115862]
  - - [8, 14, 1, 4]
    - [16, 0.165926]
  - - [10, 14, 1, 4]
    - [17, 0.203636]
  - - [12, 14, 1, 4]
    - [17, 0.244364]
  - - [14, 14, 1, 4]
    - [18, 0.285091]
  - - [16, 14, 1, 4]
    - [1, 0.32]
  - - [2, 16, 1, 4]
    - [2, 0.0449123]
  - - [4, 16, 1, 4]
    - [18, 0.0914286]
  - - [6, 16, 1, 4]
    - [17, 0.134737]
  - - [8, 16, 1, 4]
    - [7, 0.182857]
  - - [10, 16, 1, 4]
    - [1, 0.22069]
  - - [12, 16, 1, 4]
    - [19, 0.279273]
  - - [14, 16, 1, 4]
    - [7, 0.32]
  - - [16, 16, 1, 4]
    - [16, 0.365714]
  - - [2, 2, 1, 6]
    - [19, 0.00888889]
  - - [4, 2, 1, 6]
    - [9, 0.0171429]
  - - [6, 2, 1, 6]
    - [57, 0.0252632]
  - - [8, 2, 1, 6]
    - [8, 0.0355556]
  - - [10, 2, 1, 6]
    - [17, 0.0444444]
  - - [12, 2, 1, 6]
    - [35, 0.0523636]
  - - [14, 2, 1, 6]
    - [17, 0.0622222]
  - - [16, 2, 1, 6]
    - [17, 0.0711111]
  - - [2, 4, 1, 6]
    - [4, 0.0168421]
  - - [4, 4, 1, 6]
    - [18, 0.0342857]
  - - [6, 4, 1, 6]
    - [17, 0.0523636]
  - - [8, 4, 1, 6]
    - [17, 0.0711111]
  - - [10, 4, 1, 6]
    - [1, 0.0827586]
  - - [12, 4, 1, 6]
    - [2, 0.0993103]
  - - [14, 4, 1, 6]
    - [18, 0.122182]
  - - [16, 4, 1, 6]
    - [19, 0.142222]
  - - [2, 6, 1, 6]
    - [19, 0.0257143]
  - - [4, 6, 1, 6]
    - [4, 0.0523636]
  - - [6, 6, 1, 6]
    - [9, 0.0785455]
  - - [8, 6, 1, 6]
    - [35, 0.101053]
  - - [10, 6, 1, 6]
    - [17, 0.130909]
  - - [12, 6, 1, 6]
    - [35, 0.157091]
  - - [14, 6, 1, 6]
    - [17, 0.186667]
  - - [16, 6, 1, 6]
    - [36, 0.205714]
  - - [2, 8, 1, 6]
    - [19, 0.0349091]
  - - [4, 8, 1, 6]
    - [18, 0.0685714]
  - - [6, 8, 1, 6]
    - [3, 0.102857]
  - - [8, 8, 1, 6]
    - [16, 0.139636]
  - - [10, 8, 1, 6]
    - [9, 0.168421]
  - - [12, 8, 1, 6]
    - [9, 0.205714]
  - - [14, 8, 1, 6]
    - [9, 0.244364]
  - - [16, 8, 1, 6]
    - [16, 0.284444]
  - - [2, 10, 1, 6]
    - [9, 0.0436364]
  - - [4, 10, 1, 6]
    - [19, 0.0857143]
  - - [6, 10, 1, 6]
    - [19, 0.128571]
  - - [8, 10, 1, 6]
    - [9, 0.174545]
  - - [10, 10, 1, 6]
    - [8, 0.210526]
  - - [12, 10, 1, 6]
    - [35, 0.252632]
  - - [14, 10, 1, 6]
    - [18, 0.3]
  - - [16, 10, 1, 6]
    - [17, 0.355556]
  - - [2, 12, 1, 6]
    - [19, 0.0523636]
  - - [4, 12, 1, 6]
    - [9, 0.104727]
  - - [6, 12, 1, 6]
    - [4, 0.151579]
  - - [8, 12, 1, 6]
    - [1, 0.198621]
  - - [10, 12, 1, 6]
    - [18, 0.266667]
  - - [12, 12, 1, 6]
    - [16, 0.308571]
  - - [14, 12, 1, 6]
    - [17, 0.373333]
  - - [16, 12, 1, 6]
    - [17, 0.426667]
  - - [2, 14, 1, 6]
    - [19, 0.0610909]
  - - [4, 14, 1, 6]
    - [18, 0.122182]
  - - [6, 14, 1, 6]
    - [2, 0.18]
  - - [8, 14, 1, 6]
    - [16, 0.244364]
  - - [10, 14, 1, 6]
    - [2, 0.305455]
  - - [12, 14, 1, 6]
    - [36, 0.366545]
  - - [14, 14, 1, 6]
    - [17, 0.427636]
  - - [16, 14, 1, 6]
    - [9, 0.463448]
  - - [2, 16, 1, 6]
    - [19, 0.0698182]
  - - [4, 16, 1, 6]
    - [9, 0.137143]
  - - [6, 16, 1, 6]
    - [18, 0.174545]
  - - [8, 16, 1, 6]
    - [16, 0.274286]
  - - [10, 16, 1, 6]
    - [16, 0.342857]
  - - [12, 16, 1, 6]
    - [106, 0.390508]
  - - [14, 16, 1, 6]
    - [36, 0.463448]
  - - [16, 16, 1, 6]
    - [17, 0.558545]
  - - [2, 2, 1, 8]
    - [9, 0.0116364]
  - - [4, 2, 1, 8]
    - [2, 0.0232727]
  - - [6, 2, 1, 8]
    - [18, 0.0342857]
  - - [8, 2, 1, 8]
    - [1, 0.0457143]
  - - [10, 2, 1, 8]
    - [16, 0.0581818]
  - - [12, 2, 1, 8]
    - [17, 0.0711111]
  - - [14, 2, 1, 8]
    - [19, 0.082963]
  - - [16, 2, 1, 8]
    - [7, 0.0948148]
  - - [2, 4, 1, 8]
    - [17, 0.0232727]
  - - [4, 4, 1, 8]
    - [18, 0.0457143]
  - - [6, 4, 1, 8]
    - [18, 0.0673684]
  - - [8, 4, 1, 8]
    - [18, 0.0948148]
  - - [10, 4, 1, 8]
    - [19, 0.116364]
  - - [12, 4, 1, 8]
    - [135, 0.139636]
  - - [14, 4, 1, 8]
    - [17, 0.165926]
  - - [16, 4, 1, 8]
    - [36, 0.18963]
  - - [2, 6, 1, 8]
    - [19, 0.0355556]
  - - [4, 6, 1, 8]
    - [12, 0.0698182]
  - - [6, 6, 1, 8]
    - [17, 0.102857]
  - - [8, 6, 1, 8]
    - [16, 0.139636]
  - - [10, 6, 1, 8]
    - [17, 0.181132]
  - - [12, 6, 1, 8]
    - [17, 0.209455]
  - - [14, 6, 1, 8]
    - [17, 0.244364]
  - - [16, 6, 1, 8]
    - [16, 0.279273]
  - - [2, 8, 1, 8]
    - [18, 0.0474074]
  - - [4, 8, 1, 8]
    - [36, 0.0930909]
  - - [6, 8, 1, 8]
    - [19, 0.142222]
  - - [8, 8, 1, 8]
    - [16, 0.186182]
  - - [10, 8, 1, 8]
    - [18, 0.228571]
  - - [12, 8, 1, 8]
    - [17, 0.284444]
  - - [14, 8, 1, 8]
    - [9, 0.32]
  - - [16, 8, 1, 8]
    - [17, 0.365714]
  - - [2, 10, 1, 8]
    - [19, 0.0592593]
  - - [4, 10, 1, 8]
    - [19, 0.116364]
  - - [6, 10, 1, 8]
    - [19, 0.177778]
  - - [8, 10, 1, 8]
    - [11, 0.232727]
  - - [10, 10, 1, 8]
    - [17, 0.290909]
  - - [12, 10, 1, 8]
    - [36, 0.355556]
  - - [14, 10, 1, 8]
    - [16, 0.392982]
  - - [16, 10, 1, 8]
    - [35, 0.465455]
  - - [2, 12, 1, 8]
    - [19, 0.0685714]
  - - [4, 12, 1, 8]
    - [1, 0.134737]
  - - [6, 12, 1, 8]
    - [1, 0.195254]
  - - [8, 12, 1, 8]
    - [18, 0.284444]
  - - [10, 12, 1, 8]
    - [36, 0.342857]
  - - [12, 12, 1, 8]
    - [17, 0.411429]
  - - [14, 12, 1, 8]
    - [17, 0.497778]
  - - [16, 12, 1, 8]
    - [7, 0.558545]
  - - [2, 14, 1, 8]
    - [19, 0.0814545]
  - - [4, 14, 1, 8]
    - [17, 0.16]
  - - [6, 14, 1, 8]
    - [5, 0.235789]
  - - [8, 14, 1, 8]
    - [3, 0.325818]
  - - [10, 14, 1, 8]
    - [16, 0.407273]
  - - [12, 14, 1, 8]
    - [4, 0.488727]
  - - [14, 14, 1, 8]
    - [12, 0.550175]
  - - [16, 14, 1, 8]
    - [35, 0.651636]
  - - [2, 16, 1, 8]
    - [19, 0.0930909]
  - - [4, 16, 1, 8]
    - [4, 0.182857]
  - - [6, 16, 1, 8]
    - [2, 0.269474]
  - - [8, 16, 1, 8]
    - [17, 0.365714]
  - - [10, 16, 1, 8]
    - [19, 0.465455]
  - - [12, 16, 1, 8]
    - [35, 0.558545]
  - - [14, 16, 1, 8]
    - [17, 0.651636]
  - - [16, 16, 1, 8]
    - [17, 0.731429]
  - - [2, 2, 1, 10]
    - [17, 0.0142857]
  - - [4, 2, 1, 10]
    - [17, 0.0290909]
  - - [6, 2, 1, 10]
    - [18, 0.0428571]
  - - [8, 2, 1, 10]
    - [18, 0.0581818]
  - - [10, 2, 1, 10]
    - [2, 0.0701754]
  - - [12, 2, 1, 10]
    - [35, 0.0872727]
  - - [14, 2, 1, 10]
    - [1, 0.0982456]
  - - [16, 2, 1, 10]
    - [141, 0.116364]
  - - [2, 4, 1, 10]
    - [19, 0.0290909]
  - - [4, 4, 1, 10]
    - [9, 0.0551724]
  - - [6, 4, 1, 10]
    - [36, 0.0872727]
  - - [8, 4, 1, 10]
    - [7, 0.112281]
  - - [10, 4, 1, 10]
    - [16, 0.142857]
  - - [12, 4, 1, 10]
    - [17, 0.177778]
  - - [14, 4, 1, 10]
    - [16, 0.2]
  - - [16, 4, 1, 10]
    - [18, 0.237037]
  - - [2, 6, 1, 10]
    - [19, 0.0444444]
  - - [4, 6, 1, 10]
    - [9, 0.0842105]
  - - [6, 6, 1, 10]
    - [2, 0.126316]
  - - [8, 6, 1, 10]
    - [17, 0.177778]
  - - [10, 6, 1, 10]
    - [12, 0.214286]
  - - [12, 6, 1, 10]
    - [35, 0.261818]
  - - [14, 6, 1, 10]
    - [4, 0.305455]
  - - [16, 6, 1, 10]
    - [17, 0.362264]
  - - [2, 8, 1, 10]
    - [4, 0.0581818]
  - - [4, 8, 1, 10]
    - [19, 0.116364]
  - - [6, 8, 1, 10]
    - [8, 0.168421]
  - - [8, 8, 1, 10]
    - [16, 0.232727]
  - - [10, 8, 1, 10]
    - [17, 0.280702]
  - - [12, 8, 1, 10]
    - [35, 0.342857]
  - - [14, 8, 1, 10]
    - [2, 0.4]
  - - [16, 8, 1, 10]
    - [16, 0.465455]
  - - [2, 10, 1, 10]
    - [19, 0.0727273]
  - - [4, 10, 1, 10]
    - [9, 0.148148]
  - - [6, 10, 1, 10]
    - [19, 0.222222]
  - - [8, 10, 1, 10]
    - [7, 0.301887]
  - - [10, 10, 1, 10]
    - [8, 0.357143]
  - - [12, 10, 1, 10]
    - [17, 0.428571]
  - - [14, 10, 1, 10]
    - [19, 0.518519]
  - - [16, 10, 1, 10]
    - [1, 0.551724]
  - - [2, 12, 1, 10]
    - [9, 0.0857143]
  - - [4, 12, 1, 10]
    - [17, 0.174545]
  - - [6, 12, 1, 10]
    - [19, 0.261818]
  - - [8, 12, 1, 10]
    - [35, 0.349091]
  - - [10, 12, 1, 10]
    - [4, 0.421053]
  - - [12, 12, 1, 10]
    - [4, 0.523636]
  - - [14, 12, 1, 10]
    - [2, 0.6]
  - - [16, 12, 1, 10]
    - [17, 0.698182]
  - - [2, 14, 1, 10]
    - [18, 0.1]
  - - [4, 14, 1, 10]
    - [17, 0.203636]
  - - [6, 14, 1, 10]
    - [18, 0.294737]
  - - [8, 14, 1, 10]
    - [2, 0.392982]
  - - [10, 14, 1, 10]
    - [17, 0.509091]
  - - [12, 14, 1, 10]
    - [19, 0.610909]
  - - [14, 14, 1, 10]
    - [8, 0.642623]
  - - [16, 14, 1, 10]
    - [35, 0.814545]
  - - [2, 16, 1, 10]
    - [19, 0.114286]
  - - [4, 16, 1, 10]
    - [17, 0.228571]
  - - [6, 16, 1, 10]
    - [19, 0.342857]
  - - [8, 16, 1, 10]
    - [17, 0.457143]
  - - [10, 16, 1, 10]
    - [16, 0.571429]
  - - [12, 16, 1, 10]
    - [35, 0.685714]
  - - [14, 16, 1, 10]
    - [8, 0.8]
  - - [16, 16, 1, 10]
    - [17, 0.914286]
  - - [2, 2, 1, 12]
    - [19, 0.0177778]
  - - [4, 2, 1, 12]
    - [19, 0.0342857]
  - - [6, 2, 1, 12]
    - [17, 0.0505263]
  - - [8, 2, 1, 12]
    - [18, 0.0685714]
  - - [10, 2, 1, 12]
    - [16, 0.0857143]
  - - [12, 2, 1, 12]
    - [4, 0.102857]
  - - [14, 2, 1, 12]
    - [11, 0.117895]
  - - [16, 2, 1, 12]
    - [16, 0.142222]
  - - [2, 4, 1, 12]
    - [18, 0.0355556]
  - - [4, 4, 1, 12]
    - [19, 0.0711111]
  - - [6, 4, 1, 12]
    - [9, 0.0993103]
  - - [8, 4, 1, 12]
    - [17, 0.137143]
  - - [10, 4, 1, 12]
    - [36, 0.174545]
  - - [12, 4, 1, 12]
    - [18, 0.209455]
  - - [14, 4, 1, 12]
    - [19, 0.244364]
  - - [16, 4, 1, 12]
    - [4, 0.279273]
  - - [2, 6, 1, 12]
    - [36, 0.0472131]
  - - [4, 6, 1, 12]
    - [18, 0.101053]
  - - [6, 6, 1, 12]
    - [18, 0.157091]
  - - [8, 6, 1, 12]
    - [16, 0.209455]
  - - [10, 6, 1, 12]
    - [18, 0.261818]
  - - [12, 6, 1, 12]
    - [17, 0.303158]
  - - [14, 6, 1, 12]
    - [17, 0.373333]
  - - [16, 6, 1, 12]
    - [11, 0.411429]
  - - [2, 8, 1, 12]
    - [19, 0.0673684]
  - - [4, 8, 1, 12]
    - [19, 0.134737]
  - - [6, 8, 1, 12]
    - [2, 0.202105]
  - - [8, 8, 1, 12]
    - [2, 0.269474]
  - - [10, 8, 1, 12]
    - [5, 0.342857]
  - - [12, 8, 1, 12]
    - [17, 0.418909]
  - - [14, 8, 1, 12]
    - [1, 0.48]
  - - [16, 8, 1, 12]
    - [17, 0.538947]
  - - [2, 10, 1, 12]
    - [9, 0.0857143]
  - - [4, 10, 1, 12]
    - [2, 0.165517]
  - - [6, 10, 1, 12]
    - [19, 0.257143]
  - - [8, 10, 1, 12]
    - [16, 0.349091]
  - - [10, 10, 1, 12]
    - [17, 0.444444]
  - - [12, 10, 1, 12]
    - [18, 0.523636]
  - - [14, 10, 1, 12]
    - [8, 0.6]
  - - [16, 10, 1, 12]
    - [7, 0.698182]
  - - [2, 12, 1, 12]
    - [19, 0.106667]
  - - [4, 12, 1, 12]
    - [19, 0.202105]
  - - [6, 12, 1, 12]
    - [2, 0.314182]
  - - [8, 12, 1, 12]
    - [4, 0.418909]
  - - [10, 12, 1, 12]
    - [8, 0.533333]
  - - [12, 12, 1, 12]
    - [9, 0.617143]
  - - [14, 12, 1, 12]
    - [18, 0.72]
  - - [16, 12, 1, 12]
    - [17, 0.853333]
  - - [2, 14, 1, 12]
    - [61, 0.12]
  - - [4, 14, 1, 12]
    - [19, 0.231724]
  - - [6, 14, 1, 12]
    - [19, 0.353684]
  - - [8, 14, 1, 12]
    - [16, 0.48]
  - - [10, 14, 1, 12]
    - [18, 0.6]
  - - [12, 14, 1, 12]
    - [18, 0.733091]
  - - [14, 14, 1, 12]
    - [2, 0.811034]
  - - [16, 14, 1, 12]
    - [7, 0.977455]
  - - [2, 16, 1, 12]
    - [36, 0.132414]
  - - [4, 16, 1, 12]
    - [1, 0.264828]
  - - [6, 16, 1, 12]
    - [19, 0.426667]
  - - [8, 16, 1, 12]
    - [16, 0.548571]
  - - [10, 16, 1, 12]
    - [17, 0.698182]
  - - [12, 16, 1, 12]
    - [17, 0.822857]
  - - [14, 16, 1, 12]
    - [2, 0.926897]
  - - [16, 16, 1, 12]
    - [35, 1.09714]
  - - [2, 2, 1, 14]
    - [36, 0.0203636]
  - - [4, 2, 1, 14]
    - [17, 0.04]
  - - [6, 2, 1, 14]
    - [19, 0.0610909]
  - - [8, 2, 1, 14]
    - [18, 0.08]
  - - [10, 2, 1, 14]
    - [18, 0.103704]
  - - [12, 2, 1, 14]
    - [18, 0.12]
  - - [14, 2, 1, 14]
    - [9, 0.14]
  - - [16, 2, 1, 14]
    - [7, 0.165926]
  - - [2, 4, 1, 14]
    - [18, 0.0407273]
  - - [4, 4, 1, 14]
    - [18, 0.08]
  - - [6, 4, 1, 14]
    - [18, 0.122182]
  - - [8, 4, 1, 14]
    - [7, 0.162909]
  - - [10, 4, 1, 14]
    - [7, 0.203636]
  - - [12, 4, 1, 14]
    - [18, 0.244364]
  - - [14, 4, 1, 14]
    - [17, 0.29037]
  - - [16, 4, 1, 14]
    - [7, 0.338113]
  - - [2, 6, 1, 14]
    - [19, 0.0622222]
  - - [4, 6, 1, 14]
    - [19, 0.12]
  - - [6, 6, 1, 14]
    - [17, 0.18]
  - - [8, 6, 1, 14]
    - [17, 0.24]
  - - [10, 6, 1, 14]
    - [17, 0.305455]
  - - [12, 6, 1, 14]
    - [17, 0.366545]
  - - [14, 6, 1, 14]
    - [16, 0.42]
  - - [16, 6, 1, 14]
    - [11, 0.48]
  - - [2, 8, 1, 14]
    - [19, 0.0814545]
  - - [4, 8, 1, 14]
    - [18, 0.157193]
  - - [6, 8, 1, 14]
    - [18, 0.235789]
  - - [8, 8, 1, 14]
    - [1, 0.308966]
  - - [10, 8, 1, 14]
    - [17, 0.414815]
  - - [12, 8, 1, 14]
    - [17, 0.48]
  - - [14, 8, 1, 14]
    - [17, 0.591698]
  - - [16, 8, 1, 14]
    - [17, 0.651636]
  - - [2, 10, 1, 14]
    - [19, 0.1]
  - - [4, 10, 1, 14]
    - [18, 0.196491]
  - - [6, 10, 1, 14]
    - [19, 0.294737]
  - - [8, 10, 1, 14]
    - [17, 0.407273]
  - - [10, 10, 1, 14]
    - [19, 0.518519]
  - - [12, 10, 1, 14]
    - [7, 0.610909]
  - - [14, 10, 1, 14]
    - [17, 0.725926]
  - - [16, 10, 1, 14]
    - [11, 0.814545]
  - - [2, 12, 1, 14]
    - [36, 0.12]
  - - [4, 12, 1, 14]
    - [19, 0.24]
  - - [6, 12, 1, 14]
    - [12, 0.36]
  - - [8, 12, 1, 14]
    - [19, 0.48]
  - - [10, 12, 1, 14]
    - [18, 0.622222]
  - - [12, 12, 1, 14]
    - [35, 0.72]
  - - [14, 12, 1, 14]
    - [3, 0.825263]
  - - [16, 12, 1, 14]
    - [17, 0.96]
  - - [2, 14, 1, 14]
    - [19, 0.14]
  - - [4, 14, 1, 14]
    - [12, 0.275088]
  - - [6, 14, 1, 14]
    - [9, 0.427636]
  - - [8, 14, 1, 14]
    - [7, 0.570182]
  - - [10, 14, 1, 14]
    - [17, 0.712727]
  - - [12, 14, 1, 14]
    - [19, 0.871111]
  - - [14, 14, 1, 14]
    - [17, 1.0163]
  - - [16, 14, 1, 14]
    - [1, 1.08138]
  - - [2, 16, 1, 14]
    - [4, 0.157193]
  - - [4, 16, 1, 14]
    - [18, 0.314386]
  - - [6, 16, 1, 14]
    - [18, 0.48]
  - - [8, 16, 1, 14]
    - [35, 0.64]
  - - [10, 16, 1, 14]
    - [19, 0.8]
  - - [12, 16, 1, 14]
    - [8, 0.977455]
  - - [14, 16, 1, 14]
    - [2, 1.10035]
  - - [16, 16, 1, 14]
    - [16, 1.28]
  - - [2, 2, 1, 16]
    - [19, 0.0228571]
  - - [4, 2, 1, 16]
    - [19, 0.0457143]
  - - [6, 2, 1, 16]
    - [18, 0.0698182]
  - - [8, 2, 1, 16]
    - [19, 0.0948148]
  - - [10, 2, 1, 16]
    - [36, 0.116364]
  - - [12, 2, 1, 16]
    - [17, 0.137143]
  - - [14, 2, 1, 16]
    - [17, 0.165926]
  - - [16, 2, 1, 16]
    - [11, 0.182857]
  - - [2, 4, 1, 16]
    - [9, 0.0449123]
  - - [4, 4, 1, 16]
    - [19, 0.0898246]
  - - [6, 4, 1, 16]
    - [18, 0.139636]
  - - [8, 4, 1, 16]
    - [18, 0.182857]
  - - [10, 4, 1, 16]
    - [2, 0.22069]
  - - [12, 4, 1, 16]
    - [12, 0.269474]
  - - [14, 4, 1, 16]
    - [17, 0.32]
  - - [16, 4, 1, 16]
    - [18, 0.372364]
  - - [2, 6, 1, 16]
    - [4, 0.0698182]
  - - [4, 6, 1, 16]
    - [57, 0.132414]
  - - [6, 6, 1, 16]
    - [19, 0.209455]
  - - [8, 6, 1, 16]
    - [19, 0.284444]
  - - [10, 6, 1, 16]
    - [136, 0.349091]
  - - [12, 6, 1, 16]
    - [19, 0.434717]
  - - [14, 6, 1, 16]
    - [18, 0.497778]
  - - [16, 6, 1, 16]
    - [19, 0.568889]
  - - [2, 8, 1, 16]
    - [19, 0.0914286]
  - - [4, 8, 1, 16]
    - [18, 0.179649]
  - - [6, 8, 1, 16]
    - [2, 0.264828]
  - - [8, 8, 1, 16]
    - [17, 0.379259]
  - - [10, 8, 1, 16]
    - [8, 0.465455]
  - - [12, 8, 1, 16]
    - [8, 0.558545]
  - - [14, 8, 1, 16]
    - [19, 0.651636]
  - - [16, 8, 1, 16]
    - [7, 0.758519]
  - - [2, 10, 1, 16]
    - [2, 0.114286]
  - - [4, 10, 1, 16]
    - [19, 0.237037]
  - - [6, 10, 1, 16]
    - [57, 0.342857]
  - - [8, 10, 1, 16]
    - [19, 0.474074]
  - - [10, 10, 1, 16]
    - [19, 0.571429]
  - - [12, 10, 1, 16]
    - [18, 0.698182]
  - - [14, 10, 1, 16]
    - [16, 0.8]
  - - [16, 10, 1, 16]
    - [16, 0.898246]
  - - [2, 12, 1, 16]
    - [19, 0.137143]
  - - [4, 12, 1, 16]
    - [19, 0.274286]
  - - [6, 12, 1, 16]
    - [17, 0.418909]
  - - [8, 12, 1, 16]
    - [18, 0.568889]
  - - [10, 12, 1, 16]
    - [16, 0.685714]
  - - [12, 12, 1, 16]
    - [35, 0.822857]
  - - [14, 12, 1, 16]
    - [1, 0.926897]
  - - [16, 12, 1, 16]
    - [11, 1.09714]
  - - [2, 14, 1, 16]
    - [9, 0.16]
  - - [4, 14, 1, 16]
    - [19, 0.32]
  - - [6, 14, 1, 16]
    - [9, 0.48]
  - - [8, 14, 1, 16]
    - [19, 0.651636]
  - - [10, 14, 1, 16]
    - [18, 0.772414]
  - - [12, 14, 1, 16]
    - [35, 0.977455]
  - - [14, 14, 1, 16]
    - [11, 1.10035]
  - - [16, 14, 1, 16]
    - [16, 1.28]
  - - [2, 16, 1, 16]
    - [18, 0.167869]
  - - [4, 16, 1, 16]
    - [2, 0.359298]
  - - [6, 16, 1, 16]
    - [19, 0.548571]
  - - [8, 16, 1, 16]
    - [17, 0.731429]
  - - [10, 16, 1, 16]
    - [2, 0.930909]
  - - [12, 16, 1, 16]
    - [17, 1.11709]
  - - [14, 16, 1, 16]
    - [19, 1.30327]
  - - [16, 16, 1, 16]
    - [17, 1.48945]
  - - [2, 2, 1, 1024]
    - [62, 1.0639]
  - - [4, 2, 1, 1024]
    - [62, 2.27556]
  - - [6, 2, 1, 1024]
    - [62, 3.41333]
  - - [8, 2, 1, 1024]
    - [20, 4.55111]
  - - [10, 2, 1, 1024]
    - [62, 4.99512]
  - - [12, 2, 1, 1024]
    - [59, 5.78259]
  - - [14, 2, 1, 1024]
    - [20, 7.74919]
  - - [16, 2, 1, 1024]
    - [20, 9.23042]
  - - [2, 4, 1, 1024]
    - [62, 2.10051]
  - - [4, 4, 1, 1024]
    - [62, 4.42811]
  - - [6, 4, 1, 1024]
    - [62, 6.73315]
  - - [8, 4, 1, 1024]
    - [20, 9.23042]
  - - [10, 4, 1, 1024]
    - [20, 11.0703]
  - - [12, 4, 1, 1024]
    - [20, 11.9883]
  - - [14, 4, 1, 1024]
    - [13, 14.336]
  - - [16, 4, 1, 1024]
    - [62, 15.7918]
  - - [2, 6, 1, 1024]
    - [62, 3.15077]
  - - [4, 6, 1, 1024]
    - [62, 6.64216]
  - - [6, 6, 1, 1024]
    - [0, 9.10222]
  - - [8, 6, 1, 1024]
    - [20, 13.6533]
  - - [10, 6, 1, 1024]
    - [20, 16.384]
  - - [12, 6, 1, 1024]
    - [13, 18.2044]
  - - [14, 6, 1, 1024]
    - [20, 23.2476]
  - - [16, 6, 1, 1024]
    - [20, 27.3067]
  - - [2, 8, 1, 1024]
    - [0, 3.56174]
  - - [4, 8, 1, 1024]
    - [62, 8.97753]
  - - [6, 8, 1, 1024]
    - [62, 13.2843]
  - - [8, 8, 1, 1024]
    - [20, 18.2044]
  - - [10, 8, 1, 1024]
    - [13, 22.1405]
  - - [12, 8, 1, 1024]
    - [20, 26.5686]
  - - [14, 8, 1, 1024]
    - [20, 30.9968]
  - - [16, 8, 1, 1024]
    - [59, 32.3635]
  - - [2, 10, 1, 1024]
    - [62, 5.12]
  - - [4, 10, 1, 1024]
    - [62, 11.0703]
  - - [6, 10, 1, 1024]
    - [62, 16.8329]
  - - [8, 10, 1, 1024]
    - [20, 22.4438]
  - - [10, 10, 1, 1024]
    - [20, 27.3067]
  - - [12, 10, 1, 1024]
    - [20, 33.2108]
  - - [14, 10, 1, 1024]
    - [20, 38.7459]
  - - [16, 10, 1, 1024]
    - [20, 45.5111]
  - - [2, 12, 1, 1024]
    - [62, 6.30154]
  - - [4, 12, 1, 1024]
    - [62, 13.4663]
  - - [6, 12, 1, 1024]
    - [62, 20.1995]
  - - [8, 12, 1, 1024]
    - [20, 25.5335]
  - - [10, 12, 1, 1024]
    - [0, 29.9707]
  - - [12, 12, 1, 1024]
    - [13, 39.853]
  - - [14, 12, 1, 1024]
    - [20, 41.959]
  - - [16, 12, 1, 1024]
    - [59, 46.2607]
  - - [2, 14, 1, 1024]
    - [62, 7.74919]
  - - [4, 14, 1, 1024]
    - [62, 15.2917]
  - - [6, 14, 1, 1024]
    - [62, 23.2476]
  - - [8, 14, 1, 1024]
    - [20, 29.0349]
  - - [10, 14, 1, 1024]
    - [20, 38.7459]
  - - [12, 14, 1, 1024]
    - [20, 46.4951]
  - - [14, 14, 1, 1024]
    - [0, 50.176]
  - - [16, 14, 1, 1024]
    - [20, 62.8427]
  - - [2, 16, 1, 1024]
    - [62, 8.40205]
  - - [4, 16, 1, 1024]
    - [62, 17.7124]
  - - [6, 16, 1, 1024]
    - [0, 23.4057]
  - - [8, 16, 1, 1024]
    - [62, 29.7891]
  - - [10, 16, 1, 1024]
    - [20, 43.6907]
  - - [12, 16, 1, 1024]
    - [20, 53.1373]
  - - [14, 16, 1, 1024]
    - [20, 61.1669]
  - - [16, 16, 1, 1024]
    - [20, 71.8203]
  - - [2, 2, 1, 2048]
    - [62, 1.90512]
  - - [4, 2, 1, 2048]
    - [62, 3.48596]
  - - [6, 2, 1, 2048]
    - [62, 5.64966]
  - - [8, 2, 1, 2048]
    - [13, 7.9922]
  - - [10, 2, 1, 2048]
    - [20, 9.86988]
  - - [12, 2, 1, 2048]
    - [20, 11.8439]
  - - [14, 2, 1, 2048]
    - [20, 13.8178]
  - - [16, 2, 1, 2048]
    - [20, 16.1817]
  - - [2, 4, 1, 2048]
    - [62, 3.2768]
  - - [4, 4, 1, 2048]
    - [62, 7.71012]
  - - [6, 4, 1, 2048]
    - [62, 11.5652]
  - - [8, 4, 1, 2048]
    - [20, 15.9844]
  - - [10, 4, 1, 2048]
    - [20, 19.9805]
  - - [12, 4, 1, 2048]
    - [20, 23.6877]
  - - [14, 4, 1, 2048]
    - [20, 27.3067]
  - - [16, 4, 1, 2048]
    - [20, 31.9688]
  - - [2, 6, 1, 2048]
    - [62, 5.58545]
  - - [4, 6, 1, 2048]
    - [62, 11.4307]
  - - [6, 6, 1, 2048]
    - [62, 17.146]
  - - [8, 6, 1, 2048]
    - [20, 23.9766]
  - - [10, 6, 1, 2048]
    - [20, 29.6096]
  - - [12, 6, 1, 2048]
    - [20, 35.1086]
  - - [14, 6, 1, 2048]
    - [20, 41.4535]
  - - [16, 6, 1, 2048]
    - [20, 48.5452]
  - - [2, 8, 1, 2048]
    - [62, 6.5536]
  - - [4, 8, 1, 2048]
    - [62, 15.0657]
  - - [6, 8, 1, 2048]
    - [0, 20.48]
  - - [8, 8, 1, 2048]
    - [20, 30.1315]
  - - [10, 8, 1, 2048]
    - [20, 39.0095]
  - - [12, 8, 1, 2048]
    - [20, 47.3754]
  - - [14, 8, 1, 2048]
    - [0, 46.3386]
  - - [16, 8, 1, 2048]
    - [13, 64.7269]
  - - [2, 10, 1, 2048]
    - [62, 9.0022]
  - - [4, 10, 1, 2048]
    - [62, 18.8322]
  - - [6, 10, 1, 2048]
    - [62, 28.2483]
  - - [8, 10, 1, 2048]
    - [13, 39.961]
  - - [10, 10, 1, 2048]
    - [20, 48.7619]
  - - [12, 10, 1, 2048]
    - [20, 58.5143]
  - - [14, 10, 1, 2048]
    - [20, 69.0892]
  - - [16, 10, 1, 2048]
    - [20, 79.922]
  - - [2, 12, 1, 2048]
    - [62, 10.8026]
  - - [4, 12, 1, 2048]
    - [62, 22.8614]
  - - [6, 12, 1, 2048]
    - [62, 33.5127]
  - - [8, 12, 1, 2048]
    - [20, 48.5452]
  - - [10, 12, 1, 2048]
    - [20, 59.2193]
  - - [12, 12, 1, 2048]
    - [13, 70.2171]
  - - [14, 12, 1, 2048]
    - [13, 75.6185]
  - - [16, 12, 1, 2048]
    - [20, 95.9063]
  - - [2, 14, 1, 2048]
    - [62, 12.4661]
  - - [4, 14, 1, 2048]
    - [62, 25.7726]
  - - [6, 14, 1, 2048]
    - [62, 40.0074]
  - - [8, 14, 1, 2048]
    - [20, 55.9454]
  - - [10, 14, 1, 2048]
    - [20, 65.1636]
  - - [12, 14, 1, 2048]
    - [20, 76.4587]
  - - [14, 14, 1, 2048]
    - [13, 95.5733]
  - - [16, 14, 1, 2048]
    - [20, 111.891]
  - - [2, 16, 1, 2048]
    - [0, 13.2396]
  - - [4, 16, 1, 2048]
    - [62, 30.1315]
  - - [6, 16, 1, 2048]
    - [62, 45.7228]
  - - [8, 16, 1, 2048]
    - [20, 64.7269]
  - - [10, 16, 1, 2048]
    - [20, 79.922]
  - - [12, 16, 1, 2048]
    - [20, 94.7508]
  - - [14, 16, 1, 2048]
    - [20, 109.227]
  - - [16, 16, 1, 2048]
    - [20, 127.875]
  - - [2, 2, 1, 4096]
    - [62, 2.62144]
  - - [4, 2, 1, 4096]
    - [62, 5.85143]
  - - [6, 2, 1, 4096]
    - [62, 8.77714]
  - - [8, 2, 1, 4096]
    - [20, 13.2396]
  - - [10, 2, 1, 4096]
    - [20, 16.384]
  - - [12, 2, 1, 4096]
    - [20, 19.4661]
  - - [14, 2, 1, 4096]
    - [20, 22.4878]
  - - [16, 2, 1, 4096]
    - [20, 24.9661]
  - - [2, 4, 1, 4096]
    - [62, 5.79965]
  - - [4, 4, 1, 4096]
    - [62, 11.8083]
  - - [6, 4, 1, 4096]
    - [62, 17.5543]
  - - [8, 4, 1, 4096]
    - [20, 26.2144]
  - - [10, 4, 1, 4096]
    - [13, 31.8136]
  - - [12, 4, 1, 4096]
    - [20, 38.9323]
  - - [14, 4, 1, 4096]
    - [13, 42.874]
  - - [16, 4, 1, 4096]
    - [20, 51.9097]
  - - [2, 6, 1, 4096]
    - [62, 8.69947]
  - - [4, 6, 1, 4096]
    - [62, 17.5543]
  - - [6, 6, 1, 4096]
    - [62, 26.3314]
  - - [8, 6, 1, 4096]
    - [20, 38.9323]
  - - [10, 6, 1, 4096]
    - [20, 48.1882]
  - - [12, 6, 1, 4096]
    - [20, 58.3984]
  - - [14, 6, 1, 4096]
    - [20, 67.4635]
  - - [16, 6, 1, 4096]
    - [20, 77.1012]
  - - [2, 8, 1, 4096]
    - [62, 10.1606]
  - - [4, 8, 1, 4096]
    - [62, 23.6166]
  - - [6, 8, 1, 4096]
    - [62, 34.1927]
  - - [8, 8, 1, 4096]
    - [13, 48.9989]
  - - [10, 8, 1, 4096]
    - [20, 64.251]
  - - [12, 8, 1, 4096]
    - [13, 73.4983]
  - - [14, 8, 1, 4096]
    - [20, 89.9514]
  - - [16, 8, 1, 4096]
    - [13, 103.819]
  - - [2, 10, 1, 4096]
    - [62, 13.3203]
  - - [4, 10, 1, 4096]
    - [62, 29.5207]
  - - [6, 10, 1, 4096]
    - [62, 43.8857]
  - - [8, 10, 1, 4096]
    - [20, 64.8871]
  - - [10, 10, 1, 4096]
    - [20, 80.3137]
  - - [12, 10, 1, 4096]
    - [20, 97.3307]
  - - [14, 10, 1, 4096]
    - [20, 111.348]
  - - [16, 10, 1, 4096]
    - [20, 131.072]
  - - [2, 12, 1, 4096]
    - [62, 15.36]
  - - [4, 12, 1, 4096]
    - [62, 31.4573]
  - - [6, 12, 1, 4096]
    - [62, 52.6629]
  - - [8, 12, 1, 4096]
    - [20, 78.6432]
  - - [10, 12, 1, 4096]
    - [20, 96.3765]
  - - [12, 12, 1, 4096]
    - [20, 115.652]
  - - [14, 12, 1, 4096]
    - [20, 134.927]
  - - [16, 12, 1, 4096]
    - [20, 155.729]
  - - [2, 14, 1, 4096]
    - [62, 17.7811]
  - - [4, 14, 1, 4096]
    - [62, 41.329]
  - - [6, 14, 1, 4096]
    - [62, 55.9454]
  - - [8, 14, 1, 4096]
    - [20, 91.7504]
  - - [10, 14, 1, 4096]
    - [20, 112.439]
  - - [12, 14, 1, 4096]
    - [20, 134.927]
  - - [14, 14, 1, 4096]
    - [20, 157.415]
  - - [16, 14, 1, 4096]
    - [20, 181.684]
  - - [2, 16, 1, 4096]
    - [62, 21.3125]
  - - [4, 16, 1, 4096]
    - [62, 41.943]
  - - [6, 16, 1, 4096]
    - [62, 68.9853]
  - - [8, 16, 1, 4096]
    - [20, 103.819]
  - - [10, 16, 1, 4096]
    - [20, 127.254]
  - - [12, 16, 1, 4096]
    - [13, 152.705]
  - - [14, 16, 1, 4096]
    - [20, 178.156]
  - - [16, 16, 1, 4096]
    - [20, 207.639]
  - - [64, 4096, 1, 64]
    - [151, 4247.4]
  - - [320, 4096, 1, 64]
    - [92, 8603.7]
  - - [64, 4096, 1, 256]
    - [29, 10245.6]
  - - [4096, 64, 1, 64]
    - [100, 4596.5]
  - - [4096, 320, 1, 64]
    - [92, 9020.01]
  - - [4096, 64, 1, 256]
    - [146, 11278.8]
  - - [64, 64, 1, 8192]
    - [59, 4503.95]
  - - [64, 128, 1, 8192]
    - [20, 6644.44]
  - - [64, 8192, 1, 64]
    - [95, 6710.89]
  - - [64, 8192, 1, 128]
    - [98, 10016.2]
  - - [128, 64, 1, 8192]
    - [20, 6677.5]
  - - [128, 8192, 1, 64]
    - [97, 9130.46]
  - - [8192, 64, 1, 64]
    - [124, 6918.44]
  - - [8192, 64, 1, 128]
    - [102, 11001.5]
  - - [8192, 128, 1, 64]
    - [104, 8184.01]
  - - [64, 1, 1, 64]
    - [2, 1.67184]
  - - [64, 16, 1, 64]
    - [137, 30.4819]
  - - [64, 32, 1, 64]
    - [16, 60.9637]
  - - [1, 1, 1, 64]
    - [61, 0.0228571]
  - - [16, 1, 1, 64]
    - [16, 0.372364]
  - - [32, 1, 1, 64]
    - [35, 0.910222]
  - - [64, 1, 1, 1]
    - [5, 0.027234]
  - - [64, 1, 1, 16]
    - [1, 0.435745]
  - - [64, 1, 1, 32]
    - [2, 0.853333]
  - - [1, 16, 1, 64]
    - [3, 0.347119]
  - - [16, 16, 1, 64]
    - [16, 5.64966]
  - - [32, 16, 1, 64]
    - [4, 13.3747]
  - - [64, 16, 1, 1]
    - [144, 0.465455]
  - - [64, 16, 1, 16]
    - [136, 7.8019]
  - - [64, 16, 1, 32]
    - [2, 14.247]
  - - [1, 32, 1, 64]
    - [12, 0.8192]
  - - [16, 32, 1, 64]
    - [137, 14.8945]
  - - [32, 32, 1, 64]
    - [133, 29.7891]
  - - [64, 32, 1, 1]
    - [56, 0.930909]
  - - [64, 32, 1, 16]
    - [136, 15.6038]
  - - [64, 32, 1, 32]
    - [141, 31.2076]
  - - [1, 1, 1, 1]
    - [36, 0.000357143]
  - - [1, 1, 1, 16]
    - [17, 0.00592593]
  - - [1, 1, 1, 32]
    - [36, 0.0116364]
  - - [16, 1, 1, 1]
    - [17, 0.00592593]
  - - [16, 1, 1, 16]
    - [7, 0.0914286]
  - - [16, 1, 1, 32]
    - [11, 0.186182]
  - - [32, 1, 1, 1]
    - [35, 0.0142222]
  - - [32, 1, 1, 16]
    - [140, 0.193208]
  - - [32, 1, 1, 32]
    - [125, 0.417959]
  - - [1, 16, 1, 1]
    - [36, 0.00571429]
  - - [1, 16, 1, 16]
    - [36, 0.0898246]
  - - [1, 16, 1, 32]
    - [17, 0.182857]
  - - [16, 16, 1, 1]
    - [16, 0.0930909]
  - - [16, 16, 1, 16]
    - [12, 1.46286]
  - - [16, 16, 1, 32]
    - [11, 3.03407]
  - - [32, 16, 1, 1]
    - [35, 0.222609]
  - - [32, 16, 1, 16]
    - [133, 3.2768]
  - - [32, 16, 1, 32]
    - [140, 6.30154]
  - - [1, 32, 1, 1]
    - [19, 0.0112281]
  - - [1, 32, 1, 16]
    - [8, 0.222609]
  - - [1, 32, 1, 32]
    - [8, 0.435745]
  - - [16, 32, 1, 1]
    - [9, 0.222609]
  - - [16, 32, 1, 16]
    - [134, 3.64089]
  - - [16, 32, 1, 32]
    - [10, 7.44727]
  - - [32, 32, 1, 1]
    - [11, 0.465455]
  - - [32, 32, 1, 16]
    - [136, 7.62047]
  - - [32, 32, 1, 32]
    - [106, 15.2409]
  - - [1, 64, 1, 64]
    - [19, 1.48945]
  - - [16, 64, 1, 64]
    - [19, 29.1271]
  - - [32, 64, 1, 64]
    - [18, 60.9637]
  - - [1, 64, 1, 1]
    - [12, 0.0278261]
  - - [1, 64, 1, 16]
    - [17, 0.445217]
  - - [1, 64, 1, 32]
    - [19, 0.930909]
  - - [16, 64, 1, 1]
    - [16, 0.455111]
  - - [16, 64, 1, 16]
    - [136, 7.44727]
  - - [16, 64, 1, 32]
    - [2, 13.9438]
  - - [32, 64, 1, 1]
    - [35, 0.930909]
  - - [32, 64, 1, 16]
    - [16, 14.8945]
  - - [32, 64, 1, 32]
    - [16, 31.2076]
  - - [64, 64, 1, 1]
    - [4, 1.74298]
  - - [64, 64, 1, 16]
    - [36, 29.7891]
  - - [64, 64, 1, 32]
    - [19, 62.4152]
  - - [256, 1, 1, 256]
    - [11, 25.2062]
  - - [256, 16, 1, 256]
    - [7, 374.491]
  - - [256, 32, 1, 256]
    - [137, 838.861]
  - - [1, 1, 1, 256]
    - [0, 0.0731429]
  - - [16, 1, 1, 256]
    - [7, 1.30032]
  - - [32, 1, 1, 256]
    - [125, 3.2768]
  - - [256, 1, 1, 1]
    - [17, 0.116364]
  - - [256, 1, 1, 16]
    - [36, 1.86182]
  - - [256, 1, 1, 32]
    - [7, 3.72364]
  - - [1, 16, 1, 256]
    - [62, 1.26031]
  - - [16, 16, 1, 256]
    - [56, 20.48]
  - - [32, 16, 1, 256]
    - [125, 54.6133]
  - - [256, 16, 1, 1]
    - [110, 1.86182]
  - - [256, 16, 1, 16]
    - [131, 29.7891]
  - - [256, 16, 1, 32]
    - [106, 60.9637]
  - - [1, 32, 1, 256]
    - [57, 2.52062]
  - - [16, 32, 1, 256]
    - [125, 52.4288]
  - - [32, 32, 1, 256]
    - [125, 106.998]
  - - [256, 32, 1, 1]
    - [16, 3.81023]
  - - [256, 32, 1, 16]
    - [56, 60.9637]
  - - [256, 32, 1, 32]
    - [16, 124.83]
  - - [1, 256, 1, 256]
    - [18, 24.7306]
  - - [16, 256, 1, 256]
    - [125, 427.99]
  - - [32, 256, 1, 256]
    - [137, 855.98]
  - - [1, 256, 1, 1]
    - [3, 0.113778]
  - - [1, 256, 1, 16]
    - [57, 1.82044]
  - - [1, 256, 1, 32]
    - [18, 3.81023]
  - - [16, 256, 1, 1]
    - [2, 1.78087]
  - - [16, 256, 1, 16]
    - [4, 27.8877]
  - - [16, 256, 1, 32]
    - [36, 60.9637]
  - - [32, 256, 1, 1]
    - [106, 3.15077]
  - - [32, 256, 1, 16]
    - [35, 59.5782]
  - - [32, 256, 1, 32]
    - [106, 124.83]
  - - [256, 256, 1, 1]
    - [24, 27.8877]
  - - [256, 256, 1, 16]
    - [22, 381.3]
  - - [256, 256, 1, 32]
    - [21, 911.805]
  - - [512, 1, 1, 512]
    - [16, 84.5626]
  - - [512, 16, 1, 512]
    - [106, 1421.8]
  - - [512, 32, 1, 512]
    - [56, 2542.0]
  - - [1, 1, 1, 512]
    - [62, 0.152836]
  - - [16, 1, 1, 512]
    - [13, 2.44537]
  - - [32, 1, 1, 512]
    - [125, 5.5539]
  - - [512, 1, 1, 1]
    - [7, 0.2048]
  - - [512, 1, 1, 16]
    - [7, 3.56174]
  - - [512, 1, 1, 32]
    - [80, 7.44727]
  - - [1, 16, 1, 512]
    - [0, 2.07392]
  - - [16, 16, 1, 512]
    - [20, 38.5506]
  - - [32, 16, 1, 512]
    - [125, 93.6229]
  - - [512, 16, 1, 1]
    - [1, 3.2768]
  - - [512, 16, 1, 16]
    - [136, 60.9637]
  - - [512, 16, 1, 32]
    - [12, 124.83]
  - - [1, 32, 1, 512]
    - [62, 4.89075]
  - - [16, 32, 1, 512]
    - [125, 91.9804]
  - - [32, 32, 1, 512]
    - [125, 169.125]
  - - [512, 32, 1, 1]
    - [16, 7.62047]
  - - [512, 32, 1, 16]
    - [136, 124.83]
  - - [512, 32, 1, 32]
    - [16, 249.661]
  - - [1, 512, 1, 512]
    - [18, 75.9838]
  - - [16, 512, 1, 512]
    - [133, 1331.53]
  - - [32, 512, 1, 512]
    - [138, 2621.44]
  - - [1, 512, 1, 1]
    - [4, 0.217872]
  - - [1, 512, 1, 16]
    - [36, 3.56174]
  - - [1, 512, 1, 32]
    - [3, 6.97191]
  - - [16, 512, 1, 1]
    - [18, 3.56174]
  - - [16, 512, 1, 16]
    - [18, 59.5782]
  - - [16, 512, 1, 32]
    - [35, 121.927]
  - - [32, 512, 1, 1]
    - [16, 7.44727]
  - - [32, 512, 1, 16]
    - [17, 119.156]
  - - [32, 512, 1, 32]
    - [16, 243.855]
  - - [512, 512, 1, 1]
    - [146, 81.92]
  - - [512, 512, 1, 16]
    - [146, 1353.0]
  - - [512, 512, 1, 32]
    - [15, 2504.06]
  - - [1024, 1, 1, 1024]
    - [56, 255.75]
  - - [1024, 16, 1, 1024]
    - [56, 3901.68]
  - - [1024, 32, 1, 1024]
    - [81, 6331.02]
  - - [1, 1, 1, 1024]
    - [62, 0.280548]
  - - [16, 1, 1, 1024]
    - [59, 4.48877]
  - - [32, 1, 1, 1024]
    - [20, 9.10222]
  - - [1024, 1, 1, 1]
    - [134, 0.465455]
  - - [1024, 1, 1, 16]
    - [134, 7.44727]
  - - [1024, 1, 1, 32]
    - [11, 14.8945]
  - - [1, 16, 1, 1024]
    - [62, 4.42811]
  - - [16, 16, 1, 1024]
    - [59, 66.3656]
  - - [32, 16, 1, 1024]
    - [125, 141.699]
  - - [1024, 16, 1, 1]
    - [6, 6.5536]
  - - [1024, 16, 1, 16]
    - [12, 119.156]
  - - [1024, 16, 1, 32]
    - [80, 243.855]
  - - [1, 32, 1, 1024]
    - [62, 8.62316]
  - - [16, 32, 1, 1024]
    - [125, 151.968]
  - - [32, 32, 1, 1024]
    - [125, 275.941]
  - - [1024, 32, 1, 1]
    - [18, 14.8945]
  - - [1024, 32, 1, 16]
    - [8, 205.603]
  - - [1024, 32, 1, 32]
    - [7, 476.625]
  - - [1, 1024, 1, 1024]
    - [36, 188.933]
  - - [16, 1024, 1, 1024]
    - [35, 3389.34]
  - - [32, 1024, 1, 1024]
    - [16, 6100.81]
  - - [1, 1024, 1, 1]
    - [36, 0.401569]
  - - [1, 1024, 1, 16]
    - [36, 7.12348]
  - - [1, 1024, 1, 32]
    - [37, 13.9438]
  - - [16, 1024, 1, 1]
    - [35, 7.44727]
  - - [16, 1024, 1, 16]
    - [35, 119.156]
  - - [16, 1024, 1, 32]
    - [36, 238.313]
  - - [32, 1024, 1, 1]
    - [18, 14.5636]
  - - [32, 1024, 1, 16]
    - [136, 233.017]
  - - [32, 1024, 1, 32]
    - [36, 476.625]
  - - [1024, 1024, 1, 1]
    - [99, 170.5]
  - - [1024, 1024, 1, 16]
    - [97, 2601.12]
  - - [1024, 1024, 1, 32]
    - [105, 5162.22]
  - - [2048, 1, 1, 2048]
    - [56, 487.71]
  - - [2048, 16, 1, 2048]
    - [56, 7626.01]
  - - [1, 1, 1, 2048]
    - [62, 0.431158]
  - - [16, 1, 1, 2048]
    - [13, 7.9922]
  - - [32, 1, 1, 2048]
    - [20, 16.1817]
  - - [2048, 1, 1, 1]
    - [141, 0.871489]
  - - [2048, 1, 1, 16]
    - [136, 13.9438]
  - - [2048, 1, 1, 32]
    - [12, 28.4939]
  - - [1, 16, 1, 2048]
    - [62, 7.62047]
  - - [16, 16, 1, 2048]
    - [20, 127.875]
  - - [32, 16, 1, 2048]
    - [20, 252.669]
  - - [2048, 16, 1, 1]
    - [12, 14.247]
  - - [2048, 16, 1, 16]
    - [7, 227.951]
  - - [2048, 16, 1, 32]
    - [80, 466.034]
  - - [1, 32, 1, 2048]
    - [62, 15.2409]
  - - [16, 32, 1, 2048]
    - [20, 227.951]
  - - [32, 32, 1, 2048]
    - [20, 517.815]
  - - [2048, 32, 1, 1]
    - [21, 26.7494]
  - - [2048, 32, 1, 16]
    - [24, 427.99]
  - - [2048, 32, 1, 32]
    - [23, 806.597]
  - - [1, 2048, 1, 2048]
    - [4, 395.689]
  - - [16, 2048, 1, 2048]
    - [68, 6611.71]
  - - [1, 2048, 1, 1]
    - [36, 0.803137]
  - - [1, 2048, 1, 16]
    - [36, 13.9438]
  - - [1, 2048, 1, 32]
    - [36, 23.4057]
  - - [16, 2048, 1, 1]
    - [36, 14.247]
  - - [16, 2048, 1, 16]
    - [36, 227.951]
  - - [16, 2048, 1, 32]
    - [35, 466.034]
  - - [32, 2048, 1, 1]
    - [16, 24.2726]
  - - [32, 2048, 1, 16]
    - [17, 395.689]
  - - [32, 2048, 1, 32]
    - [16, 806.597]
  - - [2048, 2048, 1, 1]
    - [99, 246.724]
  - - [2048, 2048, 1, 16]
    - [146, 4067.2]
  - - [3072, 1, 1, 3072]
    - [13, 593.534]
  - - [1, 1, 1, 3072]
    - [62, 0.574206]
  - - [16, 1, 1, 3072]
    - [20, 10.3478]
  - - [32, 1, 1, 3072]
    - [20, 20.9157]
  - - [3072, 1, 1, 1]
    - [25, 1.07789]
  - - [3072, 1, 1, 16]
    - [136, 20.062]
  - - [3072, 1, 1, 32]
    - [9, 37.8092]
  - - [1, 16, 1, 3072]
    - [62, 9.18729]
  - - [16, 16, 1, 3072]
    - [20, 172.842]
  - - [32, 16, 1, 3072]
    - [13, 317.75]
  - - [3072, 16, 1, 1]
    - [11, 19.6608]
  - - [3072, 16, 1, 16]
    - [136, 320.993]
  - - [3072, 16, 1, 32]
    - [11, 593.534]
  - - [1, 32, 1, 3072]
    - [62, 18.0374]
  - - [16, 32, 1, 3072]
    - [20, 345.684]
  - - [32, 32, 1, 3072]
    - [20, 691.369]
  - - [3072, 32, 1, 1]
    - [21, 37.0958]
  - - [3072, 32, 1, 16]
    - [25, 616.809]
  - - [3072, 32, 1, 32]
    - [22, 1233.62]
  - - [1, 3072, 1, 3072]
    - [36, 457.006]
  - - [1, 3072, 1, 1]
    - [36, 1.2288]
  - - [1, 3072, 1, 16]
    - [36, 19.6608]
  - - [1, 3072, 1, 32]
    - [37, 35.1086]
  - - [16, 3072, 1, 1]
    - [18, 16.949]
  - - [16, 3072, 1, 16]
    - [36, 314.573]
  - - [16, 3072, 1, 32]
    - [35, 542.367]
  - - [32, 3072, 1, 1]
    - [39, 37.0958]
  - - [32, 3072, 1, 16]
    - [39, 582.542]
  - - [32, 3072, 1, 32]
    - [16, 1123.47]
  - - [3072, 3072, 1, 1]
    - [97, 313.008]
  - - [4096, 1, 1, 4096]
    - [7, 633.102]
  - - [1, 1, 1, 4096]
    - [62, 0.700171]
  - - [16, 1, 1, 4096]
    - [20, 13.2396]
  - - [32, 1, 1, 4096]
    - [20, 26.2144]
  - - [4096, 1, 1, 1]
    - [15, 1.48945]
  - - [4096, 1, 1, 16]
    - [11, 22.2156]
  - - [4096, 1, 1, 32]
    - [11, 46.8114]
  - - [1, 16, 1, 4096]
    - [62, 11.2027]
  - - [16, 16, 1, 4096]
    - [20, 207.639]
  - - [32, 16, 1, 4096]
    - [13, 395.689]
  - - [4096, 16, 1, 1]
    - [14, 25.2062]
  - - [4096, 16, 1, 16]
    - [136, 403.298]
  - - [4096, 16, 1, 32]
    - [11, 791.378]
  - - [1, 32, 1, 4096]
    - [62, 22.2156]
  - - [16, 32, 1, 4096]
    - [13, 411.206]
  - - [32, 32, 1, 4096]
    - [20, 838.861]
  - - [4096, 32, 1, 1]
    - [85, 45.9902]
  - - [4096, 32, 1, 16]
    - [25, 665.763]
  - - [4096, 32, 1, 32]
    - [14, 1471.69]
  - - [1, 4096, 1, 4096]
    - [36, 482.104]
  - - [1, 4096, 1, 1]
    - [36, 1.46286]
  - - [1, 4096, 1, 16]
    - [36, 23.4057]
  - - [1, 4096, 1, 32]
    - [36, 47.6625]
  - - [16, 4096, 1, 1]
    - [36, 24.2726]
  - - [16, 4096, 1, 16]
    - [35, 374.491]
  - - [16, 4096, 1, 32]
    - [35, 776.723]
  - - [32, 4096, 1, 1]
    - [37, 40.96]
  - - [32, 4096, 1, 16]
    - [136, 635.501]
  - - [32, 4096, 1, 32]
    - [37, 1421.8]
  - - [4096, 4096, 1, 1]
    - [97, 311.844]
  - - [320, 1, 1, 64]
    - [16, 9.30909]
  - - [320, 16, 1, 64]
    - [6, 133.747]
  - - [320, 32, 1, 64]
    - [148, 304.819]
  - - [320, 1, 1, 1]
    - [11, 0.145455]
  - - [320, 1, 1, 16]
    - [136, 2.32727]
  - - [320, 1, 1, 32]
    - [140, 4.55111]
  - - [320, 16, 1, 1]
    - [35, 2.13333]
  - - [320, 16, 1, 16]
    - [136, 37.2364]
  - - [320, 16, 1, 32]
    - [106, 78.019]
  - - [320, 32, 1, 1]
    - [12, 4.65455]
  - - [320, 32, 1, 16]
    - [1, 65.536]
  - - [320, 32, 1, 32]
    - [7, 156.038]
  - - [320, 64, 1, 1]
    - [16, 9.52558]
  - - [320, 64, 1, 16]
    - [136, 152.409]
  - - [320, 64, 1, 32]
    - [6, 278.877]
  - - [576, 1, 1, 64]
    - [9, 16.7564]
  - - [576, 16, 1, 64]
    - [6, 268.102]
  - - [576, 32, 1, 64]
    - [16, 548.673]
  - - [576, 1, 1, 1]
    - [16, 0.261818]
  - - [576, 1, 1, 16]
    - [135, 4.18909]
  - - [576, 1, 1, 32]
    - [9, 8.57302]
  - - [576, 16, 1, 1]
    - [6, 4.096]
  - - [576, 16, 1, 16]
    - [136, 68.5842]
  - - [576, 16, 1, 32]
    - [136, 134.051]
  - - [576, 32, 1, 1]
    - [139, 8.37818]
  - - [576, 32, 1, 16]
    - [136, 137.168]
  - - [576, 32, 1, 32]
    - [24, 250.989]
  - - [576, 64, 1, 1]
    - [22, 16.384]
  - - [576, 64, 1, 16]
    - [142, 262.144]
  - - [576, 64, 1, 32]
    - [11, 536.204]
  - - [832, 1, 1, 64]
    - [80, 23.6658]
  - - [832, 16, 1, 64]
    - [11, 396.264]
  - - [832, 32, 1, 64]
    - [11, 681.574]
  - - [832, 1, 1, 1]
    - [7, 0.378182]
  - - [832, 1, 1, 16]
    - [7, 6.05091]
  - - [832, 1, 1, 32]
    - [80, 12.3833]
  - - [832, 16, 1, 1]
    - [9, 6.05091]
  - - [832, 16, 1, 16]
    - [9, 88.7467]
  - - [832, 16, 1, 32]
    - [11, 198.132]
  - - [832, 32, 1, 1]
    - [21, 11.8329]
  - - [832, 32, 1, 16]
    - [11, 170.394]
  - - [832, 32, 1, 32]
    - [2, 334.105]
  - - [832, 64, 1, 1]
    - [22, 20.8816]
  - - [832, 64, 1, 16]
    - [136, 362.54]
  - - [832, 64, 1, 32]
    - [24, 740.842]
  - - [1088, 1, 1, 64]
    - [145, 31.6509]
  - - [1088, 16, 1, 64]
    - [134, 506.415]
  - - [1088, 32, 1, 64]
    - [16, 968.793]
  - - [1088, 1, 1, 1]
    - [153, 0.494545]
  - - [1088, 1, 1, 16]
    - [136, 7.91273]
  - - [1088, 1, 1, 32]
    - [2, 14.5067]
  - - [1088, 16, 1, 1]
    - [23, 6.9632]
  - - [1088, 16, 1, 16]
    - [25, 113.685]
  - - [1088, 16, 1, 32]
    - [106, 232.107]
  - - [1088, 32, 1, 1]
    - [22, 15.4738]
  - - [1088, 32, 1, 16]
    - [22, 247.58]
  - - [1088, 32, 1, 32]
    - [141, 518.192]
  - - [1088, 64, 1, 1]
    - [23, 28.4212]
  - - [1088, 64, 1, 16]
    - [24, 454.74]
  - - [1088, 64, 1, 32]
    - [21, 948.18]
  - - [1344, 1, 1, 64]
    - [8, 35.84]
  - - [1344, 16, 1, 64]
    - [131, 539.708]
  - - [1344, 32, 1, 64]
    - [153, 1146.88]
  - - [1344, 1, 1, 1]
    - [8, 0.584348]
  - - [1344, 1, 1, 16]
    - [136, 9.55733]
  - - [1344, 1, 1, 32]
    - [148, 16.2294]
  - - [1344, 16, 1, 1]
    - [153, 8.43294]
  - - [1344, 16, 1, 16]
    - [136, 156.393]
  - - [1344, 16, 1, 32]
    - [7, 312.785]
  - - [1344, 32, 1, 1]
    - [22, 17.92]
  - - [1344, 32, 1, 16]
    - [18, 286.72]
  - - [1344, 32, 1, 32]
    - [18, 529.329]
  - - [1344, 64, 1, 1]
    - [21, 32.4589]
  - - [1344, 64, 1, 16]
    - [23, 519.342]
  - - [1344, 64, 1, 32]
    - [27, 1101.0]
  - - [1600, 1, 1, 64]
    - [12, 42.6667]
  - - [1600, 16, 1, 64]
    - [11, 728.178]
  - - [1600, 32, 1, 64]
    - [106, 1310.72]
  - - [1600, 1, 1, 1]
    - [106, 0.680851]
  - - [1600, 1, 1, 16]
    - [7, 11.1304]
  - - [1600, 1, 1, 32]
    - [9, 19.3208]
  - - [1600, 16, 1, 1]
    - [9, 9.84615]
  - - [1600, 16, 1, 16]
    - [106, 178.087]
  - - [1600, 16, 1, 32]
    - [136, 321.255]
  - - [1600, 32, 1, 1]
    - [22, 21.3333]
  - - [1600, 32, 1, 16]
    - [136, 341.333]
  - - [1600, 32, 1, 32]
    - [21, 697.191]
  - - [1600, 64, 1, 1]
    - [21, 38.6415]
  - - [1600, 64, 1, 16]
    - [22, 595.782]
  - - [1600, 64, 1, 32]
    - [23, 1285.02]
  - - [1856, 1, 1, 64]
    - [9, 43.9941]
  - - [1856, 16, 1, 64]
    - [80, 730.978]
  - - [1856, 32, 1, 64]
    - [16, 1520.44]
  - - [1856, 1, 1, 1]
    - [141, 0.773333]
  - - [1856, 1, 1, 16]
    - [136, 12.6366]
  - - [1856, 1, 1, 32]
    - [18, 22.8431]
  - - [1856, 16, 1, 1]
    - [55, 12.6366]
  - - [1856, 16, 1, 16]
    - [136, 215.971]
  - - [1856, 16, 1, 32]
    - [80, 358.593]
  - - [1856, 32, 1, 1]
    - [11, 22.8431]
  - - [1856, 32, 1, 16]
    - [25, 395.947]
  - - [1856, 32, 1, 32]
    - [22, 808.742]
  - - [1856, 64, 1, 1]
    - [23, 45.6862]
  - - [1856, 64, 1, 16]
    - [25, 717.186]
  - - [1856, 64, 1, 32]
    - [142, 1407.81]
  - - [2112, 1, 1, 64]
    - [55, 55.1706]
  - - [2112, 16, 1, 64]
    - [11, 901.12]
  - - [2112, 32, 1, 64]
    - [142, 1544.78]
  - - [2112, 1, 1, 1]
    - [21, 0.782222]
  - - [2112, 1, 1, 16]
    - [12, 13.2518]
  - - [2112, 1, 1, 32]
    - [12, 29.3843]
  - - [2112, 16, 1, 1]
    - [12, 14.6922]
  - - [2112, 16, 1, 16]
    - [136, 245.76]
  - - [2112, 16, 1, 32]
    - [141, 432.538]
  - - [2112, 32, 1, 1]
    - [22, 25.5034]
  - - [2112, 32, 1, 16]
    - [24, 441.365]
  - - [2112, 32, 1, 32]
    - [21, 920.293]
  - - [2112, 64, 1, 1]
    - [22, 46.6097]
  - - [2112, 64, 1, 16]
    - [21, 709.078]
  - - [2112, 64, 1, 32]
    - [21, 1491.51]
  - - [2368, 1, 1, 64]
    - [12, 61.858]
  - - [2368, 16, 1, 64]
    - [7, 1031.84]
  - - [2368, 32, 1, 64]
    - [63, 1901.83]
  - - [2368, 1, 1, 1]
    - [80, 0.893585]
  - - [2368, 1, 1, 16]
    - [12, 16.1226]
  - - [2368, 1, 1, 32]
    - [80, 32.2451]
  - - [2368, 16, 1, 1]
    - [136, 16.473]
  - - [2368, 16, 1, 16]
    - [12, 263.569]
  - - [2368, 16, 1, 32]
    - [136, 527.137]
  - - [2368, 32, 1, 1]
    - [21, 30.929]
  - - [2368, 32, 1, 16]
    - [21, 494.864]
  - - [2368, 32, 1, 32]
    - [82, 1031.84]
  - - [2368, 64, 1, 1]
    - [21, 51.3736]
  - - [2368, 64, 1, 16]
    - [122, 808.277]
  - - [2368, 64, 1, 32]
    - [25, 1672.3]
  - - [2624, 1, 1, 64]
    - [136, 64.5908]
  - - [2624, 16, 1, 64]
    - [80, 977.082]
  - - [2624, 32, 1, 64]
    - [22, 1885.6]
  - - [2624, 1, 1, 1]
    - [80, 1.02902]
  - - [2624, 1, 1, 16]
    - [12, 16.7936]
  - - [2624, 1, 1, 32]
    - [10, 33.5872]
  - - [2624, 16, 1, 1]
    - [10, 15.5496]
  - - [2624, 16, 1, 16]
    - [136, 279.893]
  - - [2624, 16, 1, 32]
    - [11, 506.977]
  - - [2624, 32, 1, 1]
    - [24, 32.2954]
  - - [2624, 32, 1, 16]
    - [25, 516.726]
  - - [2624, 32, 1, 32]
    - [21, 1074.79]
  - - [2624, 64, 1, 1]
    - [27, 58.9249]
  - - [2624, 64, 1, 16]
    - [151, 839.68]
  - - [2624, 64, 1, 32]
    - [24, 1761.95]
  - - [2880, 1, 1, 64]
    - [80, 70.8923]
  - - [2880, 16, 1, 64]
    - [106, 1179.65]
  - - [2880, 32, 1, 64]
    - [27, 2144.81]
  - - [2880, 1, 1, 1]
    - [12, 0.993103]
  - - [2880, 1, 1, 16]
    - [12, 18.432]
  - - [2880, 1, 1, 32]
    - [6, 35.4462]
  - - [2880, 16, 1, 1]
    - [12, 18.8082]
  - - [2880, 16, 1, 16]
    - [136, 307.2]
  - - [2880, 16, 1, 32]
    - [11, 627.472]
  - - [2880, 32, 1, 1]
    - [82, 30.2164]
  - - [2880, 32, 1, 16]
    - [25, 556.438]
  - - [2880, 32, 1, 32]
    - [27, 1179.65]
  - - [2880, 64, 1, 1]
    - [25, 60.4328]
  - - [2880, 64, 1, 16]
    - [27, 1034.78]
  - - [2880, 64, 1, 32]
    - [27, 1966.08]
  - - [3136, 1, 1, 64]
    - [11, 77.1938]
  - - [3136, 16, 1, 64]
    - [10, 1167.73]
  - - [3136, 32, 1, 64]
    - [21, 2293.76]
  - - [3136, 1, 1, 1]
    - [80, 1.2298]
  - - [3136, 1, 1, 16]
    - [12, 20.0704]
  - - [3136, 1, 1, 32]
    - [9, 37.8687]
  - - [3136, 16, 1, 1]
    - [11, 20.0704]
  - - [3136, 16, 1, 16]
    - [136, 341.624]
  - - [3136, 16, 1, 32]
    - [11, 669.013]
  - - [3136, 32, 1, 1]
    - [21, 37.1674]
  - - [3136, 32, 1, 16]
    - [21, 573.44]
  - - [3136, 32, 1, 32]
    - [21, 1235.1]
  - - [3136, 64, 1, 1]
    - [25, 65.8046]
  - - [3136, 64, 1, 16]
    - [25, 1019.45]
  - - [3136, 64, 1, 32]
    - [151, 2038.9]
  - - [3392, 1, 1, 64]
    - [7, 81.92]
  - - [3392, 16, 1, 64]
    - [134, 1362.12]
  - - [3392, 32, 1, 64]
    - [149, 2481.01]
  - - [3392, 1, 1, 1]
    - [8, 1.30462]
  - - [3392, 1, 1, 16]
    - [136, 21.7088]
  - - [3392, 1, 1, 32]
    - [10, 40.2015]
  - - [3392, 16, 1, 1]
    - [136, 21.2831]
  - - [3392, 16, 1, 16]
    - [136, 354.429]
  - - [3392, 16, 1, 32]
    - [80, 681.06]
  - - [3392, 32, 1, 1]
    - [25, 40.96]
  - - [3392, 32, 1, 16]
    - [25, 667.963]
  - - [3392, 32, 1, 32]
    - [24, 1240.5]
  - - [3392, 64, 1, 1]
    - [25, 66.7963]
  - - [3392, 64, 1, 16]
    - [85, 1102.67]
  - - [3392, 64, 1, 32]
    - [151, 2240.91]
  - - [3648, 1, 1, 64]
    - [9, 86.4711]
  - - [3648, 16, 1, 64]
    - [7, 1409.64]
  - - [3648, 32, 1, 64]
    - [21, 2668.25]
  - - [3648, 1, 1, 1]
    - [9, 1.43059]
  - - [3648, 1, 1, 16]
    - [8, 22.8894]
  - - [3648, 1, 1, 32]
    - [9, 47.6473]
  - - [3648, 16, 1, 1]
    - [134, 23.3472]
  - - [3648, 16, 1, 16]
    - [136, 389.12]
  - - [3648, 16, 1, 32]
    - [11, 778.24]
  - - [3648, 32, 1, 1]
    - [23, 41.6914]
  - - [3648, 32, 1, 16]
    - [21, 644.061]
  - - [3648, 32, 1, 32]
    - [22, 1409.64]
  - - [3648, 64, 1, 1]
    - [85, 75.3135]
  - - [3648, 64, 1, 16]
    - [126, 1185.89]
  - - [3648, 64, 1, 32]
    - [85, 2410.03]
  - - [3904, 1, 1, 64]
    - [9, 86.1572]
  - - [3904, 16, 1, 64]
    - [11, 1427.75]
  - - [3904, 32, 1, 64]
    - [149, 2579.16]
  - - [3904, 1, 1, 1]
    - [141, 1.41964]
  - - [3904, 1, 1, 16]
    - [7, 21.9172]
  - - [3904, 1, 1, 32]
    - [11, 45.4284]
  - - [3904, 16, 1, 1]
    - [12, 22.3086]
  - - [3904, 16, 1, 16]
    - [136, 344.629]
  - - [3904, 16, 1, 32]
    - [80, 740.314]
  - - [3904, 32, 1, 1]
    - [22, 41.6427]
  - - [3904, 32, 1, 16]
    - [21, 666.283]
  - - [3904, 32, 1, 32]
    - [21, 1402.7]
  - - [3904, 64, 1, 1]
    - [85, 72.422]
  - - [3904, 64, 1, 16]
    - [151, 1142.2]
  - - [3904, 64, 1, 32]
    - [21, 2284.4]
  - - [1, 320, 1, 64]
    - [19, 8.90435]
  - - [16, 320, 1, 64]
    - [133, 152.409]
  - - [32, 320, 1, 64]
    - [1, 257.004]
  - - [1, 320, 1, 1]
    - [36, 0.13913]
  - - [1, 320, 1, 16]
    - [3, 2.17872]
  - - [1, 320, 1, 32]
    - [9, 4.55111]
  - - [16, 320, 1, 1]
    - [36, 2.32727]
  - - [16, 320, 1, 16]
    - [136, 38.1023]
  - - [16, 320, 1, 32]
    - [10, 74.4727]
  - - [32, 320, 1, 1]
    - [35, 4.26667]
  - - [32, 320, 1, 16]
    - [136, 76.2047]
  - - [32, 320, 1, 32]
    - [1, 131.072]
  - - [64, 320, 1, 1]
    - [16, 9.30909]
  - - [64, 320, 1, 16]
    - [55, 148.945]
  - - [64, 320, 1, 32]
    - [16, 312.076]
  - - [320, 320, 1, 1]
    - [23, 39.3846]
  - - [320, 320, 1, 16]
    - [25, 618.264]
  - - [320, 320, 1, 32]
    - [142, 1285.02]
  - - [576, 320, 1, 1]
    - [27, 61.44]
  - - [576, 320, 1, 16]
    - [27, 999.702]
  - - [576, 320, 1, 32]
    - [38, 2069.56]
  - - [832, 320, 1, 1]
    - [54, 83.2]
  - - [832, 320, 1, 16]
    - [54, 1310.72]
  - - [832, 320, 1, 32]
    - [54, 2704.66]
  - - [1088, 320, 1, 1]
    - [54, 98.0732]
  - - [1088, 320, 1, 16]
    - [31, 1505.56]
  - - [1088, 320, 1, 32]
    - [54, 3094.76]
  - - [1344, 320, 1, 1]
    - [146, 110.277]
  - - [1344, 320, 1, 16]
    - [104, 1720.32]
  - - [1344, 320, 1, 32]
    - [146, 3484.19]
  - - [1600, 320, 1, 1]
    - [105, 116.364]
  - - [1600, 320, 1, 16]
    - [146, 1927.53]
  - - [1600, 320, 1, 32]
    - [105, 3640.89]
  - - [1856, 320, 1, 1]
    - [104, 129.113]
  - - [1856, 320, 1, 16]
    - [146, 2159.71]
  - - [1856, 320, 1, 32]
    - [146, 4223.43]
  - - [2112, 320, 1, 1]
    - [101, 143.796]
  - - [2112, 320, 1, 16]
    - [146, 2325.47]
  - - [2112, 320, 1, 32]
    - [146, 4459.15]
  - - [2368, 320, 1, 1]
    - [146, 162.959]
  - - [2368, 320, 1, 16]
    - [146, 2607.35]
  - - [2368, 320, 1, 32]
    - [146, 5159.22]
  - - [2624, 320, 1, 1]
    - [124, 138.79]
  - - [2624, 320, 1, 16]
    - [146, 2257.96]
  - - [2624, 320, 1, 32]
    - [124, 4441.28]
  - - [2880, 320, 1, 1]
    - [104, 152.331]
  - - [2880, 320, 1, 16]
    - [124, 2378.32]
  - - [2880, 320, 1, 32]
    - [124, 4915.2]
  - - [3136, 320, 1, 1]
    - [73, 155.584]
  - - [3136, 320, 1, 16]
    - [99, 2489.35]
  - - [3136, 320, 1, 32]
    - [105, 4902.69]
  - - [3392, 320, 1, 1]
    - [105, 160.806]
  - - [3392, 320, 1, 16]
    - [105, 2553.98]
  - - [3392, 320, 1, 32]
    - [105, 5145.79]
  - - [3648, 320, 1, 1]
    - [102, 150.627]
  - - [3648, 320, 1, 16]
    - [146, 2425.68]
  - - [3648, 320, 1, 32]
    - [90, 4728.55]
  - - [3904, 320, 1, 1]
    - [90, 162.244]
  - - [3904, 320, 1, 16]
    - [146, 2647.48]
  - - [3904, 320, 1, 32]
    - [75, 5158.32]
  - - [1, 576, 1, 64]
    - [60, 15.6868]
  - - [16, 576, 1, 64]
    - [133, 268.102]
  - - [32, 576, 1, 64]
    - [16, 536.204]
  - - [1, 576, 1, 1]
    - [18, 0.256]
  - - [1, 576, 1, 16]
    - [36, 4.096]
  - - [1, 576, 1, 32]
    - [36, 8.37818]
  - - [16, 576, 1, 1]
    - [36, 4.18909]
  - - [16, 576, 1, 16]
    - [36, 67.0255]
  - - [16, 576, 1, 32]
    - [4, 140.434]
  - - [32, 576, 1, 1]
    - [17, 8.37818]
  - - [32, 576, 1, 16]
    - [17, 137.168]
  - - [32, 576, 1, 32]
    - [16, 280.869]
  - - [64, 576, 1, 1]
    - [18, 16.384]
  - - [64, 576, 1, 16]
    - [136, 262.144]
  - - [64, 576, 1, 32]
    - [35, 524.288]
  - - [320, 576, 1, 1]
    - [31, 65.8286]
  - - [320, 576, 1, 16]
    - [31, 1053.26]
  - - [320, 576, 1, 32]
    - [29, 2144.81]
  - - [576, 576, 1, 1]
    - [31, 92.16]
  - - [576, 576, 1, 16]
    - [42, 1561.3]
  - - [576, 576, 1, 32]
    - [117, 3169.2]
  - - [832, 576, 1, 1]
    - [42, 118.329]
  - - [832, 576, 1, 16]
    - [42, 1966.08]
  - - [832, 576, 1, 32]
    - [117, 3983.23]
  - - [1088, 576, 1, 1]
    - [95, 139.264]
  - - [1088, 576, 1, 16]
    - [98, 2179.78]
  - - [1088, 576, 1, 32]
    - [98, 4312.69]
  - - [1344, 576, 1, 1]
    - [146, 164.711]
  - - [1344, 576, 1, 16]
    - [146, 2815.07]
  - - [1344, 576, 1, 32]
    - [146, 5215.29]
  - - [1600, 576, 1, 1]
    - [99, 157.538]
  - - [1600, 576, 1, 16]
    - [93, 2586.95]
  - - [1600, 576, 1, 32]
    - [79, 5041.23]
  - - [1856, 576, 1, 1]
    - [99, 181.196]
  - - [1856, 576, 1, 16]
    - [99, 2874.77]
  - - [1856, 576, 1, 32]
    - [97, 5517.71]
  - - [2112, 576, 1, 1]
    - [98, 177.593]
  - - [2112, 576, 1, 16]
    - [98, 2862.38]
  - - [2112, 576, 1, 32]
    - [95, 5853.89]
  - - [2368, 576, 1, 1]
    - [104, 173.754]
  - - [2368, 576, 1, 16]
    - [146, 2929.33]
  - - [2368, 576, 1, 32]
    - [104, 5490.19]
  - - [2624, 576, 1, 1]
    - [92, 190.116]
  - - [2624, 576, 1, 16]
    - [146, 3161.15]
  - - [2624, 576, 1, 32]
    - [92, 6008.15]
  - - [2880, 576, 1, 1]
    - [146, 192.893]
  - - [2880, 576, 1, 16]
    - [146, 3276.8]
  - - [2880, 576, 1, 32]
    - [146, 6032.29]
  - - [3136, 576, 1, 1]
    - [96, 189.145]
  - - [3136, 576, 1, 16]
    - [146, 3074.61]
  - - [3136, 576, 1, 32]
    - [93, 5959.05]
  - - [3392, 576, 1, 1]
    - [97, 198.355]
  - - [3392, 576, 1, 16]
    - [146, 3325.6]
  - - [3392, 576, 1, 32]
    - [104, 6129.54]
  - - [3648, 576, 1, 1]
    - [97, 210.125]
  - - [3648, 576, 1, 16]
    - [146, 3312.31]
  - - [3648, 576, 1, 32]
    - [97, 6528.15]
  - - [3904, 576, 1, 1]
    - [97, 226.0]
  - - [3904, 576, 1, 16]
    - [146, 3580.03]
  - - [3904, 576, 1, 32]
    - [98, 6693.82]
  - - [1, 832, 1, 64]
    - [36, 23.6658]
  - - [16, 832, 1, 64]
    - [36, 387.258]
  - - [32, 832, 1, 64]
    - [16, 757.305]
  - - [1, 832, 1, 1]
    - [4, 0.3328]
  - - [1, 832, 1, 16]
    - [36, 5.78783]
  - - [1, 832, 1, 32]
    - [36, 11.5757]
  - - [16, 832, 1, 1]
    - [36, 5.91644]
  - - [16, 832, 1, 16]
    - [36, 96.8145]
  - - [16, 832, 1, 32]
    - [36, 212.992]
  - - [32, 832, 1, 1]
    - [35, 11.8329]
  - - [32, 832, 1, 16]
    - [136, 193.629]
  - - [32, 832, 1, 32]
    - [16, 387.258]
  - - [64, 832, 1, 1]
    - [136, 21.7339]
  - - [64, 832, 1, 16]
    - [24, 362.54]
  - - [64, 832, 1, 32]
    - [17, 668.21]
  - - [320, 832, 1, 1]
    - [31, 81.92]
  - - [320, 832, 1, 16]
    - [31, 1290.86]
  - - [320, 832, 1, 32]
    - [31, 2581.72]
  - - [576, 832, 1, 1]
    - [124, 108.916]
  - - [576, 832, 1, 16]
    - [146, 1870.17]
  - - [576, 832, 1, 32]
    - [47, 3651.29]
  - - [832, 832, 1, 1]
    - [95, 141.27]
  - - [832, 832, 1, 16]
    - [146, 2488.9]
  - - [832, 832, 1, 32]
    - [92, 4663.4]
  - - [1088, 832, 1, 1]
    - [99, 149.622]
  - - [1088, 832, 1, 16]
    - [99, 2475.8]
  - - [1088, 832, 1, 32]
    - [99, 4748.67]
  - - [1344, 832, 1, 1]
    - [97, 183.313]
  - - [1344, 832, 1, 16]
    - [99, 3084.71]
  - - [1344, 832, 1, 32]
    - [99, 5463.0]
  - - [1600, 832, 1, 1]
    - [92, 170.667]
  - - [1600, 832, 1, 16]
    - [146, 2897.85]
  - - [1600, 832, 1, 32]
    - [96, 5426.55]
  - - [1856, 832, 1, 1]
    - [146, 195.467]
  - - [1856, 832, 1, 16]
    - [146, 3338.79]
  - - [1856, 832, 1, 32]
    - [146, 6138.4]
  - - [2112, 832, 1, 1]
    - [96, 190.998]
  - - [2112, 832, 1, 16]
    - [146, 3158.98]
  - - [2112, 832, 1, 32]
    - [146, 5857.28]
  - - [2368, 832, 1, 1]
    - [99, 196.037]
  - - [2368, 832, 1, 16]
    - [146, 3249.77]
  - - [2368, 832, 1, 32]
    - [92, 6062.08]
  - - [2624, 832, 1, 1]
    - [97, 210.934]
  - - [2624, 832, 1, 16]
    - [146, 3458.48]
  - - [2624, 832, 1, 32]
    - [99, 6590.7]
  - - [2880, 832, 1, 1]
    - [146, 214.902]
  - - [2880, 832, 1, 16]
    - [146, 3704.21]
  - - [2880, 832, 1, 32]
    - [146, 6755.69]
  - - [3136, 832, 1, 1]
    - [104, 217.429]
  - - [3136, 832, 1, 16]
    - [146, 3508.1]
  - - [3136, 832, 1, 32]
    - [146, 6397.92]
  - - [3392, 832, 1, 1]
    - [146, 217.926]
  - - [3392, 832, 1, 16]
    - [146, 3583.67]
  - - [3392, 832, 1, 32]
    - [96, 6664.84]
  - - [3648, 832, 1, 1]
    - [97, 222.354]
  - - [3648, 832, 1, 16]
    - [146, 3764.51]
  - - [3648, 832, 1, 32]
    - [92, 6863.91]
  - - [3904, 832, 1, 1]
    - [99, 236.227]
  - - [3904, 832, 1, 16]
    - [146, 3997.7]
  - - [3904, 832, 1, 32]
    - [146, 7345.59]
  - - [1, 1088, 1, 64]
    - [36, 29.6306]
  - - [16, 1088, 1, 64]
    - [36, 495.161]
  - - [32, 1088, 1, 64]
    - [16, 948.18]
  - - [1, 1088, 1, 1]
    - [36, 0.462979]
  - - [1, 1088, 1, 16]
    - [36, 7.5687]
  - - [1, 1088, 1, 32]
    - [3, 15.1374]
  - - [16, 1088, 1, 1]
    - [4, 6.69538]
  - - [16, 1088, 1, 16]
    - [36, 126.604]
  - - [16, 1088, 1, 32]
    - [19, 247.58]
  - - [32, 1088, 1, 1]
    - [16, 13.6533]
  - - [32, 1088, 1, 16]
    - [136, 247.58]
  - - [32, 1088, 1, 32]
    - [18, 495.161]
  - - [64, 1088, 1, 1]
    - [24, 29.0133]
  - - [64, 1088, 1, 16]
    - [24, 454.74]
  - - [64, 1088, 1, 32]
    - [21, 928.427]
  - - [320, 1088, 1, 1]
    - [31, 96.7111]
  - - [320, 1088, 1, 16]
    - [31, 1465.94]
  - - [320, 1088, 1, 32]
    - [31, 3094.76]
  - - [576, 1088, 1, 1]
    - [98, 136.237]
  - - [576, 1088, 1, 16]
    - [95, 2046.33]
  - - [576, 1088, 1, 32]
    - [92, 4266.81]
  - - [832, 1088, 1, 1]
    - [99, 154.738]
  - - [832, 1088, 1, 16]
    - [98, 2393.96]
  - - [832, 1088, 1, 32]
    - [98, 4748.67]
  - - [1088, 1088, 1, 1]
    - [90, 154.738]
  - - [1088, 1088, 1, 16]
    - [146, 2648.94]
  - - [1088, 1088, 1, 32]
    - [75, 4984.19]
  - - [1344, 1088, 1, 1]
    - [104, 182.784]
  - - [1344, 1088, 1, 16]
    - [146, 3183.18]
  - - [1344, 1088, 1, 32]
    - [92, 5885.87]
  - - [1600, 1088, 1, 1]
    - [92, 183.242]
  - - [1600, 1088, 1, 16]
    - [146, 2963.06]
  - - [1600, 1088, 1, 32]
    - [79, 5742.85]
  - - [1856, 1088, 1, 1]
    - [99, 197.973]
  - - [1856, 1088, 1, 16]
    - [99, 3167.57]
  - - [1856, 1088, 1, 32]
    - [99, 6213.32]
  - - [2112, 1088, 1, 1]
    - [104, 209.85]
  - - [2112, 1088, 1, 16]
    - [146, 3518.25]
  - - [2112, 1088, 1, 32]
    - [92, 6654.42]
  - - [2368, 1088, 1, 1]
    - [92, 219.267]
  - - [2368, 1088, 1, 16]
    - [146, 3615.98]
  - - [2368, 1088, 1, 32]
    - [146, 6730.15]
  - - [2624, 1088, 1, 1]
    - [92, 221.311]
  - - [2624, 1088, 1, 16]
    - [146, 3713.71]
  - - [2624, 1088, 1, 32]
    - [146, 6792.36]
  - - [2880, 1088, 1, 1]
    - [97, 232.97]
  - - [2880, 1088, 1, 16]
    - [146, 3963.24]
  - - [2880, 1088, 1, 32]
    - [92, 7345.79]
  - - [3136, 1088, 1, 1]
    - [99, 232.899]
  - - [3136, 1088, 1, 16]
    - [146, 3844.47]
  - - [3136, 1088, 1, 32]
    - [146, 6998.91]
  - - [3392, 1088, 1, 1]
    - [146, 238.867]
  - - [3392, 1088, 1, 16]
    - [146, 3949.69]
  - - [3392, 1088, 1, 32]
    - [104, 7157.33]
  - - [3648, 1088, 1, 1]
    - [146, 241.278]
  - - [3648, 1088, 1, 16]
    - [146, 3944.37]
  - - [3904, 1088, 1, 1]
    - [97, 251.334]
  - - [3904, 1088, 1, 16]
    - [146, 4094.03]
  - - [1, 1344, 1, 64]
    - [4, 31.2785]
  - - [16, 1344, 1, 64]
    - [36, 598.372]
  - - [32, 1344, 1, 64]
    - [80, 1123.47]
  - - [1, 1344, 1, 1]
    - [4, 0.56]
  - - [1, 1344, 1, 16]
    - [36, 8.96]
  - - [1, 1344, 1, 32]
    - [36, 18.6991]
  - - [16, 1344, 1, 1]
    - [35, 9.34957]
  - - [16, 1344, 1, 16]
    - [36, 152.917]
  - - [16, 1344, 1, 32]
    - [35, 305.835]
  - - [32, 1344, 1, 1]
    - [18, 17.92]
  - - [32, 1344, 1, 16]
    - [136, 286.72]
  - - [32, 1344, 1, 32]
    - [16, 585.641]
  - - [64, 1344, 1, 1]
    - [22, 31.8578]
  - - [64, 1344, 1, 16]
    - [21, 529.329]
  - - [64, 1344, 1, 32]
    - [31, 1101.0]
  - - [320, 1344, 1, 1]
    - [74, 110.277]
  - - [320, 1344, 1, 16]
    - [53, 1885.28]
  - - [320, 1344, 1, 32]
    - [74, 3621.73]
  - - [576, 1344, 1, 1]
    - [95, 146.065]
  - - [576, 1344, 1, 16]
    - [98, 2337.04]
  - - [576, 1344, 1, 32]
    - [95, 4954.52]
  - - [832, 1344, 1, 1]
    - [99, 183.313]
  - - [832, 1344, 1, 16]
    - [97, 2817.53]
  - - [832, 1344, 1, 32]
    - [99, 5635.06]
  - - [1088, 1344, 1, 1]
    - [104, 185.098]
  - - [1088, 1344, 1, 16]
    - [146, 3140.45]
  - - [1088, 1344, 1, 32]
    - [92, 5849.09]
  - - [1344, 1344, 1, 1]
    - [72, 194.23]
  - - [1344, 1344, 1, 16]
    - [93, 3042.25]
  - - [1344, 1344, 1, 32]
    - [93, 6021.12]
  - - [1600, 1344, 1, 1]
    - [99, 218.315]
  - - [1600, 1344, 1, 16]
    - [146, 3423.52]
  - - [1600, 1344, 1, 32]
    - [97, 6584.96]
  - - [1856, 1344, 1, 1]
    - [97, 218.813]
  - - [1856, 1344, 1, 16]
    - [146, 3547.68]
  - - [1856, 1344, 1, 32]
    - [98, 6971.43]
  - - [2112, 1344, 1, 1]
    - [99, 223.506]
  - - [2112, 1344, 1, 16]
    - [48, 3534.35]
  - - [2112, 1344, 1, 32]
    - [146, 6582.09]
  - - [2368, 1344, 1, 1]
    - [97, 241.105]
  - - [2368, 1344, 1, 16]
    - [146, 3993.84]
  - - [2368, 1344, 1, 32]
    - [97, 7274.5]
  - - [2624, 1344, 1, 1]
    - [97, 248.356]
  - - [2624, 1344, 1, 16]
    - [97, 3891.48]
  - - [2624, 1344, 1, 32]
    - [97, 7599.53]
  - - [2880, 1344, 1, 1]
    - [97, 264.213]
  - - [2880, 1344, 1, 16]
    - [97, 4128.77]
  - - [2880, 1344, 1, 32]
    - [99, 7717.32]
  - - [3136, 1344, 1, 1]
    - [97, 254.67]
  - - [3136, 1344, 1, 16]
    - [99, 4038.12]
  - - [3392, 1344, 1, 1]
    - [99, 266.599]
  - - [3392, 1344, 1, 16]
    - [97, 4228.5]
  - - [3648, 1344, 1, 1]
    - [99, 276.22]
  - - [3648, 1344, 1, 16]
    - [97, 4310.25]
  - - [3904, 1344, 1, 1]
    - [97, 275.432]
  - - [3904, 1344, 1, 16]
    - [97, 4316.28]
  - - [1, 1600, 1, 64]
    - [4, 35.3103]
  - - [16, 1600, 1, 64]
    - [35, 682.667]
  - - [32, 1600, 1, 64]
    - [16, 1260.31]
  - - [1, 1600, 1, 1]
    - [36, 0.680851]
  - - [1, 1600, 1, 16]
    - [36, 10.8936]
  - - [1, 1600, 1, 32]
    - [4, 20.898]
  - - [16, 1600, 1, 1]
    - [36, 11.3778]
  - - [16, 1600, 1, 16]
    - [36, 178.087]
  - - [16, 1600, 1, 32]
    - [35, 364.089]
  - - [32, 1600, 1, 1]
    - [18, 20.898]
  - - [32, 1600, 1, 16]
    - [16, 327.68]
  - - [32, 1600, 1, 32]
    - [17, 655.36]
  - - [64, 1600, 1, 1]
    - [21, 38.6415]
  - - [64, 1600, 1, 16]
    - [22, 618.264]
  - - [64, 1600, 1, 32]
    - [142, 1213.63]
  - - [320, 1600, 1, 1]
    - [95, 113.778]
  - - [320, 1600, 1, 16]
    - [146, 1927.53]
  - - [320, 1600, 1, 32]
    - [98, 3947.95]
  - - [576, 1600, 1, 1]
    - [72, 166.054]
  - - [576, 1600, 1, 16]
    - [72, 2564.45]
  - - [576, 1600, 1, 32]
    - [99, 4956.5]
  - - [832, 1600, 1, 1]
    - [48, 170.667]
  - - [832, 1600, 1, 16]
    - [146, 2878.27]
  - - [832, 1600, 1, 32]
    - [92, 5392.2]
  - - [1088, 1600, 1, 1]
    - [146, 187.183]
  - - [1088, 1600, 1, 16]
    - [146, 3044.02]
  - - [1088, 1600, 1, 32]
    - [93, 5772.6]
  - - [1344, 1600, 1, 1]
    - [97, 210.824]
  - - [1344, 1600, 1, 16]
    - [146, 3423.52]
  - - [1344, 1600, 1, 32]
    - [97, 6584.96]
  - - [1600, 1600, 1, 1]
    - [98, 208.98]
  - - [1600, 1600, 1, 16]
    - [146, 3385.12]
  - - [1600, 1600, 1, 32]
    - [146, 6229.66]
  - - [1856, 1600, 1, 1]
    - [146, 220.788]
  - - [1856, 1600, 1, 16]
    - [146, 3726.56]
  - - [1856, 1600, 1, 32]
    - [146, 6886.03]
  - - [2112, 1600, 1, 1]
    - [97, 237.972]
  - - [2112, 1600, 1, 16]
    - [97, 3780.92]
  - - [2112, 1600, 1, 32]
    - [97, 7233.07]
  - - [2368, 1600, 1, 1]
    - [97, 250.086]
  - - [2368, 1600, 1, 16]
    - [99, 3988.21]
  - - [2368, 1600, 1, 32]
    - [99, 7303.71]
  - - [2624, 1600, 1, 1]
    - [99, 248.426]
  - - [2624, 1600, 1, 16]
    - [146, 4083.55]
  - - [2880, 1600, 1, 1]
    - [97, 261.818]
  - - [2880, 1600, 1, 16]
    - [99, 4153.69]
  - - [3136, 1600, 1, 1]
    - [99, 266.186]
  - - [3136, 1600, 1, 16]
    - [99, 4270.3]
  - - [3392, 1600, 1, 1]
    - [99, 262.818]
  - - [3392, 1600, 1, 16]
    - [99, 4184.83]
  - - [3648, 1600, 1, 1]
    - [99, 268.359]
  - - [3648, 1600, 1, 16]
    - [146, 4333.59]
  - - [3904, 1600, 1, 1]
    - [97, 283.283]
  - - [3904, 1600, 1, 16]
    - [146, 4501.91]
  - - [1, 1856, 1, 64]
    - [4, 46.582]
  - - [16, 1856, 1, 64]
    - [133, 844.686]
  - - [32, 1856, 1, 64]
    - [16, 1490.62]
  - - [1, 1856, 1, 1]
    - [36, 0.773333]
  - - [1, 1856, 1, 16]
    - [36, 11.4215]
  - - [1, 1856, 1, 32]
    - [17, 19.4728]
  - - [16, 1856, 1, 1]
    - [35, 10.6057]
  - - [16, 1856, 1, 16]
    - [36, 206.581]
  - - [16, 1856, 1, 32]
    - [144, 387.866]
  - - [32, 1856, 1, 1]
    - [16, 23.7568]
  - - [32, 1856, 1, 16]
    - [36, 387.866]
  - - [32, 1856, 1, 32]
    - [16, 791.893]
  - - [64, 1856, 1, 1]
    - [21, 43.9941]
  - - [64, 1856, 1, 16]
    - [25, 717.186]
  - - [64, 1856, 1, 32]
    - [24, 1434.37]
  - - [320, 1856, 1, 1]
    - [98, 131.982]
  - - [320, 1856, 1, 16]
    - [98, 2159.71]
  - - [320, 1856, 1, 32]
    - [98, 4525.1]
  - - [576, 1856, 1, 1]
    - [99, 178.176]
  - - [576, 1856, 1, 16]
    - [99, 2611.43]
  - - [576, 1856, 1, 32]
    - [98, 5345.28]
  - - [832, 1856, 1, 1]
    - [146, 183.832]
  - - [832, 1856, 1, 16]
    - [146, 3069.2]
  - - [832, 1856, 1, 32]
    - [92, 5745.83]
  - - [1088, 1856, 1, 1]
    - [97, 200.928]
  - - [1088, 1856, 1, 16]
    - [146, 3214.85]
  - - [1088, 1856, 1, 32]
    - [97, 6124.98]
  - - [1344, 1856, 1, 1]
    - [146, 211.395]
  - - [1344, 1856, 1, 16]
    - [146, 3563.52]
  - - [1344, 1856, 1, 32]
    - [146, 6437.33]
  - - [1600, 1856, 1, 1]
    - [94, 216.759]
  - - [1600, 1856, 1, 16]
    - [146, 3626.99]
  - - [1600, 1856, 1, 32]
    - [94, 6692.06]
  - - [1856, 1856, 1, 1]
    - [97, 248.717]
  - - [1856, 1856, 1, 16]
    - [97, 3881.39]
  - - [1856, 1856, 1, 32]
    - [97, 7524.34]
  - - [2112, 1856, 1, 1]
    - [99, 240.483]
  - - [2112, 1856, 1, 16]
    - [146, 3824.27]
  - - [2368, 1856, 1, 1]
    - [99, 258.53]
  - - [2368, 1856, 1, 16]
    - [97, 4112.29]
  - - [2624, 1856, 1, 1]
    - [97, 269.814]
  - - [2624, 1856, 1, 16]
    - [97, 4246.45]
  - - [2880, 1856, 1, 1]
    - [99, 272.718]
  - - [2880, 1856, 1, 16]
    - [146, 4297.71]
  - - [3136, 1856, 1, 1]
    - [99, 272.619]
  - - [3136, 1856, 1, 16]
    - [97, 4262.09]
  - - [3392, 1856, 1, 1]
    - [99, 271.36]
  - - [3392, 1856, 1, 16]
    - [146, 4323.13]
  - - [3648, 1856, 1, 1]
    - [99, 269.212]
  - - [3648, 1856, 1, 16]
    - [99, 4412.67]
  - - [3904, 1856, 1, 1]
    - [97, 285.269]
  - - [3904, 1856, 1, 16]
    - [97, 4537.5]
  - - [1, 2112, 1, 64]
    - [36, 51.9877]
  - - [16, 2112, 1, 64]
    - [35, 920.293]
  - - [32, 2112, 1, 64]
    - [39, 1601.99]
  - - [1, 2112, 1, 1]
    - [4, 0.782222]
  - - [1, 2112, 1, 16]
    - [36, 14.08]
  - - [1, 2112, 1, 32]
    - [36, 29.3843]
  - - [16, 2112, 1, 1]
    - [36, 14.6922]
  - - [16, 2112, 1, 16]
    - [36, 200.249]
  - - [16, 2112, 1, 32]
    - [4, 460.146]
  - - [32, 2112, 1, 1]
    - [36, 24.576]
  - - [32, 2112, 1, 16]
    - [16, 393.216]
  - - [32, 2112, 1, 32]
    - [16, 831.803]
  - - [64, 2112, 1, 1]
    - [30, 49.152]
  - - [64, 2112, 1, 16]
    - [31, 772.389]
  - - [64, 2112, 1, 32]
    - [31, 1572.86]
  - - [320, 2112, 1, 1]
    - [98, 143.796]
  - - [320, 2112, 1, 16]
    - [98, 2300.73]
  - - [320, 2112, 1, 32]
    - [95, 4505.6]
  - - [576, 2112, 1, 1]
    - [95, 177.593]
  - - [576, 2112, 1, 16]
    - [98, 2820.9]
  - - [576, 2112, 1, 32]
    - [98, 5682.98]
  - - [832, 2112, 1, 1]
    - [93, 184.967]
  - - [832, 2112, 1, 16]
    - [146, 2959.47]
  - - [832, 2112, 1, 32]
    - [93, 5857.28]
  - - [1088, 2112, 1, 1]
    - [97, 222.015]
  - - [1088, 2112, 1, 16]
    - [146, 3535.16]
  - - [1088, 2112, 1, 32]
    - [97, 6840.13]
  - - [1344, 2112, 1, 1]
    - [48, 227.082]
  - - [1344, 2112, 1, 16]
    - [48, 3590.23]
  - - [1344, 2112, 1, 32]
    - [97, 6534.74]
  - - [1600, 2112, 1, 1]
    - [97, 240.512]
  - - [1600, 2112, 1, 16]
    - [99, 3861.94]
  - - [1600, 2112, 1, 32]
    - [97, 7457.54]
  - - [1856, 2112, 1, 1]
    - [98, 244.229]
  - - [1856, 2112, 1, 16]
    - [146, 3994.77]
  - - [2112, 2112, 1, 1]
    - [97, 260.09]
  - - [2112, 2112, 1, 16]
    - [97, 4125.36]
  - - [2368, 2112, 1, 1]
    - [97, 272.546]
  - - [2368, 2112, 1, 16]
    - [97, 4325.38]
  - - [2624, 2112, 1, 1]
    - [97, 274.351]
  - - [2624, 2112, 1, 16]
    - [146, 4304.38]
  - - [2880, 2112, 1, 1]
    - [97, 292.431]
  - - [2880, 2112, 1, 16]
    - [99, 4623.32]
  - - [3136, 2112, 1, 1]
    - [97, 284.87]
  - - [3136, 2112, 1, 16]
    - [99, 4538.4]
  - - [3392, 2112, 1, 1]
    - [97, 295.419]
  - - [3392, 2112, 1, 16]
    - [97, 4640.59]
  - - [3648, 2112, 1, 1]
    - [97, 291.84]
  - - [3648, 2112, 1, 16]
    - [97, 4678.3]
  - - [3904, 2112, 1, 1]
    - [99, 308.234]
  - - [1, 2368, 1, 64]
    - [36, 52.2593]
  - - [16, 2368, 1, 64]
    - [35, 1031.84]
  - - [32, 2368, 1, 64]
    - [16, 1701.64]
  - - [1, 2368, 1, 1]
    - [37, 0.861091]
  - - [1, 2368, 1, 16]
    - [4, 14.858]
  - - [1, 2368, 1, 32]
    - [36, 32.2451]
  - - [16, 2368, 1, 1]
    - [35, 16.473]
  - - [16, 2368, 1, 16]
    - [35, 242.483]
  - - [16, 2368, 1, 32]
    - [36, 440.879]
  - - [32, 2368, 1, 1]
    - [36, 27.5549]
  - - [32, 2368, 1, 16]
    - [16, 440.879]
  - - [32, 2368, 1, 32]
    - [16, 898.086]
  - - [64, 2368, 1, 1]
    - [31, 53.1761]
  - - [64, 2368, 1, 16]
    - [25, 836.149]
  - - [64, 2368, 1, 32]
    - [31, 1672.3]
  - - [320, 2368, 1, 1]
    - [98, 144.335]
  - - [320, 2368, 1, 16]
    - [98, 2309.36]
  - - [320, 2368, 1, 32]
    - [98, 4618.73]
  - - [576, 2368, 1, 1]
    - [104, 168.391]
  - - [576, 2368, 1, 16]
    - [92, 2694.26]
  - - [576, 2368, 1, 32]
    - [92, 5355.46]
  - - [832, 2368, 1, 1]
    - [99, 194.106]
  - - [832, 2368, 1, 16]
    - [146, 3249.77]
  - - [832, 2368, 1, 32]
    - [97, 5975.89]
  - - [1088, 2368, 1, 1]
    - [97, 212.048]
  - - [1088, 2368, 1, 16]
    - [146, 3464.05]
  - - [1088, 2368, 1, 32]
    - [94, 6317.57]
  - - [1344, 2368, 1, 1]
    - [99, 228.143]
  - - [1344, 2368, 1, 16]
    - [146, 3857.69]
  - - [1344, 2368, 1, 32]
    - [146, 7248.61]
  - - [1600, 2368, 1, 1]
    - [95, 232.442]
  - - [1600, 2368, 1, 16]
    - [146, 3923.68]
  - - [1600, 2368, 1, 32]
    - [98, 7216.76]
  - - [1856, 2368, 1, 1]
    - [99, 256.269]
  - - [1856, 2368, 1, 16]
    - [99, 3950.57]
  - - [2112, 2368, 1, 1]
    - [99, 268.162]
  - - [2112, 2368, 1, 16]
    - [97, 4189.5]
  - - [2368, 2368, 1, 1]
    - [99, 277.595]
  - - [2368, 2368, 1, 16]
    - [146, 4344.74]
  - - [2624, 2368, 1, 1]
    - [99, 281.797]
  - - [2624, 2368, 1, 16]
    - [97, 4458.21]
  - - [2880, 2368, 1, 1]
    - [97, 282.981]
  - - [2880, 2368, 1, 16]
    - [97, 4537.11]
  - - [3136, 2368, 1, 1]
    - [97, 287.831]
  - - [3136, 2368, 1, 16]
    - [99, 4543.66]
  - - [3392, 2368, 1, 1]
    - [97, 288.93]
  - - [3648, 2368, 1, 1]
    - [97, 294.326]
  - - [3904, 2368, 1, 1]
    - [99, 302.113]
  - - [1, 2624, 1, 64]
    - [36, 63.3721]
  - - [16, 2624, 1, 64]
    - [133, 1074.79]
  - - [32, 2624, 1, 64]
    - [141, 1761.95]
  - - [1, 2624, 1, 1]
    - [36, 0.954182]
  - - [1, 2624, 1, 16]
    - [36, 16.4643]
  - - [1, 2624, 1, 32]
    - [36, 33.5872]
  - - [16, 2624, 1, 1]
    - [35, 16.7936]
  - - [16, 2624, 1, 16]
    - [140, 263.429]
  - - [16, 2624, 1, 32]
    - [35, 559.787]
  - - [32, 2624, 1, 1]
    - [17, 29.9886]
  - - [32, 2624, 1, 16]
    - [39, 471.399]
  - - [32, 2624, 1, 32]
    - [37, 977.082]
  - - [64, 2624, 1, 1]
    - [31, 55.9787]
  - - [64, 2624, 1, 16]
    - [31, 880.976]
  - - [64, 2624, 1, 32]
    - [30, 1821.68]
  - - [320, 2624, 1, 1]
    - [95, 154.07]
  - - [320, 2624, 1, 16]
    - [98, 2442.71]
  - - [320, 2624, 1, 32]
    - [95, 4885.41]
  - - [576, 2624, 1, 1]
    - [146, 177.815]
  - - [576, 2624, 1, 16]
    - [146, 3022.85]
  - - [576, 2624, 1, 32]
    - [104, 5656.79]
  - - [832, 2624, 1, 1]
    - [97, 209.92]
  - - [832, 2624, 1, 16]
    - [146, 3391.33]
  - - [832, 2624, 1, 32]
    - [97, 6529.1]
  - - [1088, 2624, 1, 1]
    - [97, 222.172]
  - - [1088, 2624, 1, 16]
    - [146, 3596.74]
  - - [1088, 2624, 1, 32]
    - [146, 6644.16]
  - - [1344, 2624, 1, 1]
    - [99, 243.218]
  - - [1344, 2624, 1, 16]
    - [97, 3761.77]
  - - [1344, 2624, 1, 32]
    - [99, 7328.12]
  - - [1600, 2624, 1, 1]
    - [97, 243.386]
  - - [1600, 2624, 1, 16]
    - [146, 3882.91]
  - - [1856, 2624, 1, 1]
    - [99, 261.134]
  - - [1856, 2624, 1, 16]
    - [146, 4166.97]
  - - [2112, 2624, 1, 1]
    - [99, 267.079]
  - - [2112, 2624, 1, 16]
    - [97, 4314.85]
  - - [2368, 2624, 1, 1]
    - [99, 281.16]
  - - [2368, 2624, 1, 16]
    - [146, 4468.23]
  - - [2624, 2624, 1, 1]
    - [99, 282.767]
  - - [2624, 2624, 1, 16]
    - [146, 4478.29]
  - - [2880, 2624, 1, 1]
    - [99, 290.101]
  - - [2880, 2624, 1, 16]
    - [146, 4597.49]
  - - [3136, 2624, 1, 1]
    - [97, 291.287]
  - - [3392, 2624, 1, 1]
    - [99, 298.678]
  - - [3648, 2624, 1, 1]
    - [99, 299.604]
  - - [3904, 2624, 1, 1]
    - [99, 284.558]
  - - [1, 2880, 1, 64]
    - [36, 60.4328]
  - - [16, 2880, 1, 64]
    - [137, 1203.72]
  - - [32, 2880, 1, 64]
    - [39, 2106.51]
  - - [1, 2880, 1, 1]
    - [36, 1.12941]
  - - [1, 2880, 1, 16]
    - [36, 18.0706]
  - - [1, 2880, 1, 32]
    - [36, 32.9143]
  - - [16, 2880, 1, 1]
    - [35, 18.432]
  - - [16, 2880, 1, 16]
    - [36, 294.912]
  - - [16, 2880, 1, 32]
    - [35, 614.4]
  - - [32, 2880, 1, 1]
    - [39, 34.1333]
  - - [32, 2880, 1, 16]
    - [39, 546.133]
  - - [32, 2880, 1, 32]
    - [39, 1112.88]
  - - [64, 2880, 1, 1]
    - [31, 64.6737]
  - - [64, 2880, 1, 16]
    - [30, 1016.94]
  - - [64, 2880, 1, 32]
    - [31, 2106.51]
  - - [320, 2880, 1, 1]
    - [95, 154.891]
  - - [320, 2880, 1, 16]
    - [98, 2586.95]
  - - [320, 2880, 1, 32]
    - [98, 4834.62]
  - - [576, 2880, 1, 1]
    - [99, 178.374]
  - - [576, 2880, 1, 16]
    - [146, 2885.01]
  - - [576, 2880, 1, 32]
    - [92, 5416.75]
  - - [832, 2880, 1, 1]
    - [97, 214.902]
  - - [832, 2880, 1, 16]
    - [146, 3438.44]
  - - [832, 2880, 1, 32]
    - [95, 6667.58]
  - - [1088, 2880, 1, 1]
    - [97, 228.718]
  - - [1088, 2880, 1, 16]
    - [146, 3798.11]
  - - [1088, 2880, 1, 32]
    - [99, 7036.5]
  - - [1344, 2880, 1, 1]
    - [99, 247.33]
  - - [1344, 2880, 1, 16]
    - [146, 3932.16]
  - - [1344, 2880, 1, 32]
    - [95, 7575.72]
  - - [1600, 2880, 1, 1]
    - [97, 261.818]
  - - [1600, 2880, 1, 16]
    - [97, 4153.69]
  - - [1856, 2880, 1, 1]
    - [97, 268.607]
  - - [1856, 2880, 1, 16]
    - [99, 4286.94]
  - - [2112, 2880, 1, 1]
    - [97, 284.232]
  - - [2112, 2880, 1, 16]
    - [97, 4526.56]
  - - [2368, 2880, 1, 1]
    - [97, 291.446]
  - - [2368, 2880, 1, 16]
    - [97, 4565.58]
  - - [2624, 2880, 1, 1]
    - [99, 295.2]
  - - [2624, 2880, 1, 16]
    - [99, 4623.86]
  - - [2880, 2880, 1, 1]
    - [99, 302.715]
  - - [3136, 2880, 1, 1]
    - [97, 302.569]
  - - [3392, 2880, 1, 1]
    - [97, 311.113]
  - - [3648, 2880, 1, 1]
    - [99, 285.108]
  - - [3904, 2880, 1, 1]
    - [97, 300.228]
  - - [1, 3136, 1, 64]
    - [36, 74.3348]
  - - [16, 3136, 1, 64]
    - [35, 1235.1]
  - - [32, 3136, 1, 64]
    - [16, 2071.78]
  - - [1, 3136, 1, 1]
    - [36, 1.2298]
  - - [1, 3136, 1, 16]
    - [36, 17.3021]
  - - [1, 3136, 1, 32]
    - [36, 34.0176]
  - - [16, 3136, 1, 1]
    - [35, 17.0088]
  - - [16, 3136, 1, 16]
    - [36, 308.775]
  - - [16, 3136, 1, 32]
    - [36, 669.013]
  - - [32, 3136, 1, 1]
    - [17, 35.2112]
  - - [32, 3136, 1, 16]
    - [16, 553.666]
  - - [32, 3136, 1, 32]
    - [16, 1126.76]
  - - [64, 3136, 1, 1]
    - [151, 64.7432]
  - - [64, 3136, 1, 16]
    - [25, 1019.45]
  - - [64, 3136, 1, 32]
    - [21, 2038.9]
  - - [320, 3136, 1, 1]
    - [98, 164.511]
  - - [320, 3136, 1, 16]
    - [99, 2589.73]
  - - [320, 3136, 1, 32]
    - [95, 5221.57]
  - - [576, 3136, 1, 1]
    - [72, 188.16]
  - - [576, 3136, 1, 16]
    - [72, 2964.24]
  - - [576, 3136, 1, 32]
    - [97, 5639.29]
  - - [832, 3136, 1, 1]
    - [97, 207.901]
  - - [832, 3136, 1, 16]
    - [146, 3508.1]
  - - [832, 3136, 1, 32]
    - [97, 6472.32]
  - - [1088, 3136, 1, 1]
    - [97, 241.128]
  - - [1088, 3136, 1, 16]
    - [99, 3871.74]
  - - [1088, 3136, 1, 32]
    - [99, 7278.87]
  - - [1344, 3136, 1, 1]
    - [99, 247.928]
  - - [1344, 3136, 1, 16]
    - [146, 4038.12]
  - - [1600, 3136, 1, 1]
    - [98, 250.88]
  - - [1600, 3136, 1, 16]
    - [146, 4014.08]
  - - [1856, 3136, 1, 1]
    - [99, 270.089]
  - - [1856, 3136, 1, 16]
    - [99, 4311.42]
  - - [2112, 3136, 1, 1]
    - [99, 280.052]
  - - [2112, 3136, 1, 16]
    - [99, 4415.49]
  - - [2368, 3136, 1, 1]
    - [97, 292.364]
  - - [2368, 3136, 1, 16]
    - [99, 4650.36]
  - - [2624, 3136, 1, 1]
    - [99, 293.364]
  - - [2880, 3136, 1, 1]
    - [99, 300.056]
  - - [3136, 3136, 1, 1]
    - [97, 297.564]
  - - [3392, 3136, 1, 1]
    - [97, 287.495]
  - - [3648, 3136, 1, 1]
    - [97, 293.337]
  - - [3904, 3136, 1, 1]
    - [99, 301.55]
  - - [1, 3392, 1, 64]
    - [36, 74.8579]
  - - [16, 3392, 1, 64]
    - [36, 1240.5]
  - - [32, 3392, 1, 64]
    - [39, 2315.61]
  - - [1, 3392, 1, 1]
    - [36, 1.3302]
  - - [1, 3392, 1, 16]
    - [36, 20.8738]
  - - [1, 3392, 1, 32]
    - [36, 43.4176]
  - - [16, 3392, 1, 1]
    - [36, 22.6133]
  - - [16, 3392, 1, 16]
    - [36, 284.706]
  - - [16, 3392, 1, 32]
    - [36, 723.627]
  - - [32, 3392, 1, 1]
    - [39, 37.429]
  - - [32, 3392, 1, 16]
    - [39, 609.37]
  - - [32, 3392, 1, 32]
    - [16, 1177.43]
  - - [64, 3392, 1, 1]
    - [151, 65.7842]
  - - [64, 3392, 1, 16]
    - [25, 1068.74]
  - - [64, 3392, 1, 32]
    - [21, 2137.48]
  - - [320, 3392, 1, 1]
    - [98, 168.285]
  - - [320, 3392, 1, 16]
    - [98, 2611.58]
  - - [320, 3392, 1, 32]
    - [98, 5427.2]
  - - [576, 3392, 1, 1]
    - [97, 193.445]
  - - [576, 3392, 1, 16]
    - [146, 3095.12]
  - - [576, 3392, 1, 32]
    - [97, 5982.9]
  - - [832, 3392, 1, 1]
    - [99, 217.088]
  - - [832, 3392, 1, 16]
    - [146, 3583.67]
  - - [832, 3392, 1, 32]
    - [92, 6764.69]
  - - [1088, 3392, 1, 1]
    - [99, 237.331]
  - - [1088, 3392, 1, 16]
    - [146, 3834.28]
  - - [1088, 3392, 1, 32]
    - [98, 7245.15]
  - - [1344, 3392, 1, 1]
    - [99, 255.398]
  - - [1344, 3392, 1, 16]
    - [99, 4086.36]
  - - [1600, 3392, 1, 1]
    - [99, 259.055]
  - - [1600, 3392, 1, 16]
    - [146, 4125.19]
  - - [1856, 3392, 1, 1]
    - [99, 274.915]
  - - [1856, 3392, 1, 16]
    - [146, 4351.14]
  - - [2112, 3392, 1, 1]
    - [99, 286.556]
  - - [2112, 3392, 1, 16]
    - [97, 4530.53]
  - - [2368, 3392, 1, 1]
    - [99, 294.222]
  - - [2624, 3392, 1, 1]
    - [97, 295.211]
  - - [2880, 3392, 1, 1]
    - [99, 309.144]
  - - [3136, 3392, 1, 1]
    - [97, 285.565]
  - - [3392, 3392, 1, 1]
    - [97, 294.263]
  - - [3648, 3392, 1, 1]
    - [97, 294.619]
  - - [3904, 3392, 1, 1]
    - [99, 304.773]
  - - [1, 3648, 1, 64]
    - [36, 86.4711]
  - - [16, 3648, 1, 64]
    - [35, 1409.64]
  - - [32, 3648, 1, 64]
    - [39, 2668.25]
  - - [1, 3648, 1, 1]
    - [36, 1.43059]
  - - [1, 3648, 1, 16]
    - [36, 22.8894]
  - - [1, 3648, 1, 32]
    - [36, 45.7788]
  - - [16, 3648, 1, 1]
    - [36, 23.3472]
  - - [16, 3648, 1, 16]
    - [36, 373.555]
  - - [16, 3648, 1, 32]
    - [35, 778.24]
  - - [32, 3648, 1, 1]
    - [39, 37.059]
  - - [32, 3648, 1, 16]
    - [16, 602.508]
  - - [32, 3648, 1, 32]
    - [39, 1436.75]
  - - [64, 3648, 1, 1]
    - [117, 75.3135]
  - - [64, 3648, 1, 16]
    - [40, 1167.36]
  - - [64, 3648, 1, 32]
    - [40, 2334.72]
  - - [320, 3648, 1, 1]
    - [95, 169.183]
  - - [320, 3648, 1, 16]
    - [98, 2829.96]
  - - [320, 3648, 1, 32]
    - [98, 5659.93]
  - - [576, 3648, 1, 1]
    - [48, 209.079]
  - - [576, 3648, 1, 16]
    - [47, 3232.69]
  - - [576, 3648, 1, 32]
    - [98, 6225.92]
  - - [832, 3648, 1, 1]
    - [97, 235.282]
  - - [832, 3648, 1, 16]
    - [146, 3678.95]
  - - [832, 3648, 1, 32]
    - [99, 7063.59]
  - - [1088, 3648, 1, 1]
    - [99, 249.624]
  - - [1088, 3648, 1, 16]
    - [146, 3884.06]
  - - [1344, 3648, 1, 1]
    - [99, 271.629]
  - - [1344, 3648, 1, 16]
    - [97, 4228.93]
  - - [1600, 3648, 1, 1]
    - [97, 273.386]
  - - [1600, 3648, 1, 16]
    - [97, 4333.59]
  - - [1856, 3648, 1, 1]
    - [99, 285.082]
  - - [1856, 3648, 1, 16]
    - [99, 4467.26]
  - - [2112, 3648, 1, 1]
    - [97, 294.068]
  - - [2112, 3648, 1, 16]
    - [97, 4625.64]
  - - [2368, 3648, 1, 1]
    - [97, 304.708]
  - - [2624, 3648, 1, 1]
    - [99, 304.852]
  - - [2880, 3648, 1, 1]
    - [97, 283.187]
  - - [3136, 3648, 1, 1]
    - [97, 299.48]
  - - [3392, 3648, 1, 1]
    - [99, 303.657]
  - - [3648, 3648, 1, 1]
    - [97, 305.929]
  - - [3904, 3648, 1, 1]
    - [97, 316.133]
  - - [1, 3904, 1, 64]
    - [36, 84.6969]
  - - [16, 3904, 1, 64]
    - [68, 1402.7]
  - - [32, 3904, 1, 64]
    - [16, 2317.5]
  - - [1, 3904, 1, 1]
    - [36, 1.30133]
  - - [1, 3904, 1, 16]
    - [36, 22.7142]
  - - [1, 3904, 1, 32]
    - [36, 45.4284]
  - - [16, 3904, 1, 1]
    - [36, 20.48]
  - - [16, 3904, 1, 16]
    - [36, 338.788]
  - - [16, 3904, 1, 32]
    - [35, 768.788]
  - - [32, 3904, 1, 1]
    - [17, 39.04]
  - - [32, 3904, 1, 16]
    - [37, 677.576]
  - - [32, 3904, 1, 32]
    - [54, 1249.28]
  - - [64, 3904, 1, 1]
    - [29, 75.7139]
  - - [64, 3904, 1, 16]
    - [30, 1193.34]
  - - [64, 3904, 1, 32]
    - [31, 2317.5]
  - - [320, 3904, 1, 1]
    - [95, 155.19]
  - - [320, 3904, 1, 16]
    - [146, 2595.91]
  - - [320, 3904, 1, 32]
    - [92, 4905.15]
  - - [576, 3904, 1, 1]
    - [99, 206.303]
  - - [576, 3904, 1, 16]
    - [146, 3331.41]
  - - [576, 3904, 1, 32]
    - [98, 6482.75]
  - - [832, 3904, 1, 1]
    - [97, 234.522]
  - - [832, 3904, 1, 16]
    - [146, 3725.45]
  - - [832, 3904, 1, 32]
    - [97, 7168.28]
  - - [1088, 3904, 1, 1]
    - [97, 247.671]
  - - [1088, 3904, 1, 16]
    - [97, 3928.37]
  - - [1344, 3904, 1, 1]
    - [99, 259.751]
  - - [1344, 3904, 1, 16]
    - [146, 4125.39]
  - - [1600, 3904, 1, 1]
    - [97, 267.512]
  - - [1600, 3904, 1, 16]
    - [95, 4155.61]
  - - [1856, 3904, 1, 1]
    - [97, 286.963]
  - - [1856, 3904, 1, 16]
    - [146, 4528.64]
  - - [2112, 3904, 1, 1]
    - [99, 291.867]
  - - [2368, 3904, 1, 1]
    - [99, 306.623]
  - - [2624, 3904, 1, 1]
    - [99, 281.431]
  - - [2880, 3904, 1, 1]
    - [97, 295.882]
  - - [3136, 3904, 1, 1]
    - [99, 297.159]
  - - [3392, 3904, 1, 1]
    - [99, 300.963]
  - - [3648, 3904, 1, 1]
    - [97, 306.605]
  - - [3904, 3904, 1, 1]
    - [99, 313.928]
  - - [64, 1, 1, 256]
    - [125, 6.4251]
  - - [64, 16, 1, 256]
    - [131, 95.3251]
  - - [64, 32, 1, 256]
    - [2, 190.65]
  - - [1, 64, 1, 256]
    - [18, 6.06815]
  - - [16, 64, 1, 256]
    - [140, 106.998]
  - - [32, 64, 1, 256]
    - [125, 190.65]
  - - [320, 1, 1, 256]
    - [125, 32.768]
  - - [320, 16, 1, 256]
    - [56, 524.288]
  - - [320, 32, 1, 256]
    - [106, 1028.02]
  - - [576, 1, 1, 256]
    - [11, 56.7138]
  - - [576, 16, 1, 256]
    - [7, 857.926]
  - - [576, 32, 1, 256]
    - [11, 1685.21]
  - - [832, 1, 1, 256]
    - [7, 81.92]
  - - [832, 16, 1, 256]
    - [11, 1363.15]
  - - [832, 32, 1, 256]
    - [7, 2310.42]
  - - [1088, 1, 1, 256]
    - [7, 105.105]
  - - [1088, 16, 1, 256]
    - [7, 1747.63]
  - - [1088, 32, 1, 256]
    - [7, 3021.32]
  - - [1344, 1, 1, 256]
    - [127, 118.643]
  - - [1344, 16, 1, 256]
    - [56, 1931.59]
  - - [1344, 32, 1, 256]
    - [7, 3286.58]
  - - [1600, 1, 1, 256]
    - [80, 138.847]
  - - [1600, 16, 1, 256]
    - [106, 2148.72]
  - - [1600, 32, 1, 256]
    - [56, 3912.6]
  - - [1856, 1, 1, 256]
    - [80, 161.063]
  - - [1856, 16, 1, 256]
    - [7, 2621.44]
  - - [1856, 32, 1, 256]
    - [81, 4538.61]
  - - [2112, 1, 1, 256]
    - [56, 177.27]
  - - [2112, 16, 1, 256]
    - [56, 2932.46]
  - - [2112, 32, 1, 256]
    - [81, 5014.93]
  - - [2368, 1, 1, 256]
    - [56, 195.551]
  - - [2368, 16, 1, 256]
    - [7, 3287.91]
  - - [2368, 32, 1, 256]
    - [130, 5622.8]
  - - [2624, 1, 1, 256]
    - [7, 191.927]
  - - [2624, 16, 1, 256]
    - [11, 3070.83]
  - - [2624, 32, 1, 256]
    - [63, 5179.71]
  - - [2880, 1, 1, 256]
    - [56, 207.685]
  - - [2880, 16, 1, 256]
    - [56, 3419.27]
  - - [2880, 32, 1, 256]
    - [64, 5617.37]
  - - [3136, 1, 1, 256]
    - [7, 226.145]
  - - [3136, 16, 1, 256]
    - [7, 3777.96]
  - - [3136, 32, 1, 256]
    - [22, 5974.44]
  - - [3392, 1, 1, 256]
    - [56, 241.209]
  - - [3392, 16, 1, 256]
    - [56, 4086.36]
  - - [3392, 32, 1, 256]
    - [22, 6777.38]
  - - [3648, 1, 1, 256]
    - [7, 266.825]
  - - [3648, 16, 1, 256]
    - [7, 4331.07]
  - - [3648, 32, 1, 256]
    - [27, 6869.98]
  - - [3904, 1, 1, 256]
    - [15, 243.762]
  - - [3904, 16, 1, 256]
    - [7, 4100.2]
  - - [3904, 32, 1, 256]
    - [22, 6332.98]
  - - [1, 320, 1, 256]
    - [61, 29.2571]
  - - [16, 320, 1, 256]
    - [137, 524.288]
  - - [32, 320, 1, 256]
    - [125, 1048.58]
  - - [1, 576, 1, 256]
    - [61, 51.7389]
  - - [16, 576, 1, 256]
    - [133, 962.978]
  - - [32, 576, 1, 256]
    - [16, 1850.43]
  - - [1, 832, 1, 256]
    - [36, 64.543]
  - - [16, 832, 1, 256]
    - [125, 1285.99]
  - - [32, 832, 1, 256]
    - [16, 2391.49]
  - - [1, 1088, 1, 256]
    - [36, 96.0441]
  - - [16, 1088, 1, 256]
    - [133, 1650.54]
  - - [32, 1088, 1, 256]
    - [16, 3073.41]
  - - [1, 1344, 1, 256]
    - [18, 98.304]
  - - [16, 1344, 1, 256]
    - [137, 1898.28]
  - - [32, 1344, 1, 256]
    - [39, 3286.58]
  - - [1, 1600, 1, 256]
    - [36, 122.269]
  - - [16, 1600, 1, 256]
    - [125, 2259.86]
  - - [32, 1600, 1, 256]
    - [16, 3640.89]
  - - [1, 1856, 1, 256]
    - [4, 133.841]
  - - [16, 1856, 1, 256]
    - [133, 2269.31]
  - - [32, 1856, 1, 256]
    - [19, 4223.43]
  - - [1, 2112, 1, 256]
    - [36, 148.129]
  - - [16, 2112, 1, 256]
    - [133, 2621.44]
  - - [32, 2112, 1, 256]
    - [39, 4271.98]
  - - [1, 2368, 1, 256]
    - [4, 180.958]
  - - [16, 2368, 1, 256]
    - [4, 2939.19]
  - - [32, 2368, 1, 256]
    - [37, 4731.38]
  - - [1, 2624, 1, 256]
    - [36, 167.936]
  - - [16, 2624, 1, 256]
    - [133, 2866.11]
  - - [32, 2624, 1, 256]
    - [16, 4941.57]
  - - [1, 2880, 1, 256]
    - [36, 184.32]
  - - [16, 2880, 1, 256]
    - [140, 3145.73]
  - - [32, 2880, 1, 256]
    - [54, 5423.67]
  - - [1, 3136, 1, 256]
    - [36, 198.226]
  - - [16, 3136, 1, 256]
    - [68, 3336.38]
  - - [32, 3136, 1, 256]
    - [16, 5773.06]
  - - [1, 3392, 1, 256]
    - [36, 217.088]
  - - [16, 3392, 1, 256]
    - [4, 3517.38]
  - - [32, 3392, 1, 256]
    - [39, 6462.15]
  - - [1, 3648, 1, 256]
    - [36, 230.59]
  - - [16, 3648, 1, 256]
    - [35, 3984.59]
  - - [32, 3648, 1, 256]
    - [39, 7115.34]
  - - [1, 3904, 1, 256]
    - [36, 217.266]
  - - [16, 3904, 1, 256]
    - [35, 3514.46]
  - - [32, 3904, 1, 256]
    - [37, 5814.83]
  - - [64, 1, 1, 512]
    - [125, 11.1078]
  - - [64, 16, 1, 512]
    - [125, 187.246]
  - - [64, 32, 1, 512]
    - [125, 374.491]
  - - [1, 64, 1, 512]
    - [5, 9.10222]
  - - [16, 64, 1, 512]
    - [125, 187.246]
  - - [32, 64, 1, 512]
    - [125, 367.921]
  - - [320, 1, 1, 512]
    - [125, 55.539]
  - - [320, 16, 1, 512]
    - [125, 919.804]
  - - [320, 32, 1, 512]
    - [56, 1747.63]
  - - [576, 1, 1, 512]
    - [125, 95.1329]
  - - [576, 16, 1, 512]
    - [138, 1572.86]
  - - [576, 32, 1, 512]
    - [7, 3094.16]
  - - [832, 1, 1, 512]
    - [56, 139.667]
  - - [832, 16, 1, 512]
    - [107, 2234.67]
  - - [832, 32, 1, 512]
    - [16, 3635.06]
  - - [1088, 1, 1, 512]
    - [11, 182.641]
  - - [1088, 16, 1, 512]
    - [134, 2970.97]
  - - [1088, 32, 1, 512]
    - [81, 5021.35]
  - - [1344, 1, 1, 512]
    - [56, 185.981]
  - - [1344, 16, 1, 512]
    - [147, 3058.35]
  - - [1344, 32, 1, 512]
    - [16, 4735.5]
  - - [1600, 1, 1, 512]
    - [80, 221.405]
  - - [1600, 16, 1, 512]
    - [127, 3692.17]
  - - [1600, 32, 1, 512]
    - [56, 5637.51]
  - - [1856, 1, 1, 512]
    - [7, 253.406]
  - - [1856, 16, 1, 512]
    - [7, 4109.28]
  - - [1856, 32, 1, 512]
    - [16, 6269.84]
  - - [2112, 1, 1, 512]
    - [56, 277.268]
  - - [2112, 16, 1, 512]
    - [7, 4493.9]
  - - [2112, 32, 1, 512]
    - [150, 6990.51]
  - - [2368, 1, 1, 512]
    - [7, 303.104]
  - - [2368, 16, 1, 512]
    - [56, 4911.05]
  - - [2368, 32, 1, 512]
    - [22, 7607.32]
  - - [2624, 1, 1, 512]
    - [7, 279.893]
  - - [2624, 16, 1, 512]
    - [56, 4573.58]
  - - [2624, 32, 1, 512]
    - [27, 7286.71]
  - - [2880, 1, 1, 512]
    - [7, 300.931]
  - - [2880, 16, 1, 512]
    - [11, 4966.94]
  - - [2880, 32, 1, 512]
    - [27, 7930.41]
  - - [3136, 1, 1, 512]
    - [7, 324.37]
  - - [3136, 16, 1, 512]
    - [7, 5352.11]
  - - [3136, 32, 1, 512]
    - [22, 8563.37]
  - - [3392, 1, 1, 512]
    - [7, 350.849]
  - - [3392, 16, 1, 512]
    - [148, 5729.33]
  - - [3392, 32, 1, 512]
    - [22, 9262.42]
  - - [3648, 1, 1, 512]
    - [7, 369.857]
  - - [3648, 16, 1, 512]
    - [134, 5917.71]
  - - [3648, 32, 1, 512]
    - [27, 10045.2]
  - - [3904, 1, 1, 512]
    - [7, 344.629]
  - - [3904, 16, 1, 512]
    - [7, 5562.01]
  - - [3904, 32, 1, 512]
    - [85, 9072.79]
  - - [1, 320, 1, 512]
    - [5, 47.4899]
  - - [16, 320, 1, 512]
    - [125, 936.229]
  - - [32, 320, 1, 512]
    - [138, 1807.89]
  - - [1, 576, 1, 512]
    - [18, 85.4817]
  - - [16, 576, 1, 512]
    - [125, 1599.52]
  - - [32, 576, 1, 512]
    - [138, 2995.93]
  - - [1, 832, 1, 512]
    - [4, 113.596]
  - - [16, 832, 1, 512]
    - [125, 2163.73]
  - - [32, 832, 1, 512]
    - [80, 3540.65]
  - - [1, 1088, 1, 512]
    - [36, 141.027]
  - - [16, 1088, 1, 512]
    - [133, 2700.88]
  - - [32, 1088, 1, 512]
    - [16, 4570.72]
  - - [1, 1344, 1, 512]
    - [36, 149.593]
  - - [16, 1344, 1, 512]
    - [125, 3016.45]
  - - [32, 1344, 1, 512]
    - [39, 4786.98]
  - - [1, 1600, 1, 512]
    - [36, 176.172]
  - - [16, 1600, 1, 512]
    - [125, 3591.01]
  - - [32, 1600, 1, 512]
    - [16, 5577.53]
  - - [1, 1856, 1, 512]
    - [4, 206.581]
  - - [16, 1856, 1, 512]
    - [137, 3535.9]
  - - [32, 1856, 1, 512]
    - [16, 6401.83]
  - - [1, 2112, 1, 512]
    - [36, 227.651]
  - - [16, 2112, 1, 512]
    - [68, 3844.78]
  - - [32, 2112, 1, 512]
    - [16, 6234.78]
  - - [1, 2368, 1, 512]
    - [36, 255.245]
  - - [16, 2368, 1, 512]
    - [68, 4408.79]
  - - [32, 2368, 1, 512]
    - [16, 6866.78]
  - - [1, 2624, 1, 512]
    - [36, 246.512]
  - - [16, 2624, 1, 512]
    - [36, 3944.18]
  - - [32, 2624, 1, 512]
    - [39, 7348.99]
  - - [1, 2880, 1, 512]
    - [36, 265.686]
  - - [16, 2880, 1, 512]
    - [36, 4250.98]
  - - [32, 2880, 1, 512]
    - [39, 8135.5]
  - - [1, 3136, 1, 512]
    - [4, 294.611]
  - - [16, 3136, 1, 512]
    - [35, 4893.35]
  - - [32, 3136, 1, 512]
    - [54, 8091.37]
  - - [1, 3392, 1, 512]
    - [36, 307.381]
  - - [16, 3392, 1, 512]
    - [4, 5098.58]
  - - [32, 3392, 1, 512]
    - [39, 9262.42]
  - - [1, 3648, 1, 512]
    - [36, 324.831]
  - - [16, 3648, 1, 512]
    - [35, 5336.5]
  - - [32, 3648, 1, 512]
    - [39, 10045.2]
  - - [1, 3904, 1, 512]
    - [36, 302.856]
  - - [16, 3904, 1, 512]
    - [36, 4920.24]
  - - [32, 3904, 1, 512]
    - [54, 8253.31]
  - - [64, 1, 1, 1024]
    - [125, 18.7246]
  - - [64, 16, 1, 1024]
    - [125, 308.405]
  - - [64, 32, 1, 1024]
    - [125, 599.186]
  - - [1, 64, 1, 1024]
    - [62, 15.9844]
  - - [16, 64, 1, 1024]
    - [133, 283.399]
  - - [32, 64, 1, 1024]
    - [125, 607.87]
  - - [320, 1, 1, 1024]
    - [125, 91.0222]
  - - [320, 16, 1, 1024]
    - [125, 1497.97]
  - - [320, 32, 1, 1024]
    - [125, 2872.81]
  - - [576, 1, 1, 1024]
    - [125, 151.237]
  - - [576, 16, 1, 1024]
    - [138, 2550.59]
  - - [576, 32, 1, 1024]
    - [56, 4718.59]
  - - [832, 1, 1, 1024]
    - [56, 210.362]
  - - [832, 16, 1, 1024]
    - [131, 3451.01]
  - - [832, 32, 1, 1024]
    - [109, 5242.88]
  - - [1088, 1, 1, 1024]
    - [56, 271.735]
  - - [1088, 16, 1, 1024]
    - [132, 4295.37]
  - - [1088, 32, 1, 1024]
    - [81, 6726.71]
  - - [1344, 1, 1, 1024]
    - [138, 283.764]
  - - [1344, 16, 1, 1024]
    - [138, 4194.3]
  - - [1344, 32, 1, 1024]
    - [28, 6723.69]
  - - [1600, 1, 1, 1024]
    - [141, 303.407]
  - - [1600, 16, 1, 1024]
    - [138, 4766.25]
  - - [1600, 32, 1, 1024]
    - [16, 7436.71]
  - - [1856, 1, 1, 1024]
    - [141, 339.383]
  - - [1856, 16, 1, 1024]
    - [80, 5479.05]
  - - [1856, 32, 1, 1024]
    - [27, 8814.12]
  - - [2112, 1, 1, 1024]
    - [7, 376.12]
  - - [2112, 16, 1, 1024]
    - [7, 6179.11]
  - - [2112, 32, 1, 1024]
    - [22, 9480.28]
  - - [2368, 1, 1, 1024]
    - [7, 421.71]
  - - [2368, 16, 1, 1024]
    - [110, 6806.55]
  - - [2368, 32, 1, 1024]
    - [22, 10629.4]
  - - [2624, 1, 1, 1024]
    - [131, 375.801]
  - - [2624, 16, 1, 1024]
    - [80, 6322.3]
  - - [2624, 32, 1, 1024]
    - [27, 9553.69]
  - - [2880, 1, 1, 1024]
    - [11, 409.6]
  - - [2880, 16, 1, 1024]
    - [56, 6508.4]
  - - [2880, 32, 1, 1024]
    - [27, 10485.8]
  - - [3136, 1, 1, 1024]
    - [56, 449.128]
  - - [3136, 16, 1, 1024]
    - [56, 7236.65]
  - - [3136, 32, 1, 1024]
    - [85, 10874.1]
  - - [3392, 1, 1, 1024]
    - [56, 482.418]
  - - [3392, 16, 1, 1024]
    - [56, 7772.66]
  - - [3392, 32, 1, 1024]
    - [27, 12214.2]
  - - [3648, 1, 1, 1024]
    - [56, 518.827]
  - - [3648, 16, 1, 1024]
    - [7, 8418.15]
  - - [3648, 32, 1, 1024]
    - [27, 13431.2]
  - - [3904, 1, 1, 1024]
    - [7, 451.717]
  - - [3904, 16, 1, 1024]
    - [56, 7394.58]
  - - [1, 320, 1, 1024]
    - [62, 77.1012]
  - - [16, 320, 1, 1024]
    - [133, 1398.1]
  - - [32, 320, 1, 1024]
    - [125, 2621.44]
  - - [1, 576, 1, 1024]
    - [18, 126.844]
  - - [16, 576, 1, 1024]
    - [125, 2451.22]
  - - [32, 576, 1, 1024]
    - [16, 4548.04]
  - - [1, 832, 1, 1024]
    - [36, 154.903]
  - - [16, 832, 1, 1024]
    - [144, 3133.68]
  - - [32, 832, 1, 1024]
    - [138, 5048.7]
  - - [1, 1088, 1, 1024]
    - [36, 197.188]
  - - [16, 1088, 1, 1024]
    - [68, 3792.72]
  - - [32, 1088, 1, 1024]
    - [16, 6366.35]
  - - [1, 1344, 1, 1024]
    - [36, 199.457]
  - - [16, 1344, 1, 1024]
    - [68, 3523.22]
  - - [32, 1344, 1, 1024]
    - [16, 6429.23]
  - - [1, 1600, 1, 1024]
    - [4, 242.726]
  - - [16, 1600, 1, 1024]
    - [68, 4161.02]
  - - [32, 1600, 1, 1024]
    - [16, 7489.83]
  - - [1, 1856, 1, 1024]
    - [36, 279.492]
  - - [16, 1856, 1, 1024]
    - [68, 4788.77]
  - - [32, 1856, 1, 1024]
    - [16, 8688.2]
  - - [1, 2112, 1, 1024]
    - [36, 298.302]
  - - [16, 2112, 1, 1024]
    - [68, 5406.72]
  - - [32, 2112, 1, 1024]
    - [16, 8238.81]
  - - [1, 2368, 1, 1024]
    - [4, 364.636]
  - - [16, 2368, 1, 1024]
    - [68, 5923.25]
  - - [32, 2368, 1, 1024]
    - [16, 9348.75]
  - - [1, 2624, 1, 1024]
    - [36, 314.266]
  - - [16, 2624, 1, 1024]
    - [36, 5211.1]
  - - [32, 2624, 1, 1024]
    - [39, 9500.91]
  - - [1, 2880, 1, 1024]
    - [4, 344.926]
  - - [16, 2880, 1, 1024]
    - [36, 5617.37]
  - - [32, 2880, 1, 1024]
    - [39, 10485.8]
  - - [1, 3136, 1, 1024]
    - [36, 367.002]
  - - [16, 3136, 1, 1024]
    - [36, 6080.5]
  - - [32, 3136, 1, 1024]
    - [54, 10485.8]
  - - [1, 3392, 1, 1024]
    - [36, 399.242]
  - - [16, 3392, 1, 1024]
    - [68, 6616.02]
  - - [32, 3392, 1, 1024]
    - [39, 11951.5]
  - - [1, 3648, 1, 1024]
    - [36, 426.92]
  - - [16, 3648, 1, 1024]
    - [36, 7031.63]
  - - [32, 3648, 1, 1024]
    - [39, 12716.8]
  - - [1, 3904, 1, 1024]
    - [36, 388.126]
  - - [16, 3904, 1, 1024]
    - [36, 6301.79]
  - - [64, 1, 1, 2048]
    - [13, 31.9688]
  - - [64, 16, 1, 2048]
    - [20, 511.5]
  - - [64, 32, 1, 2048]
    - [13, 975.42]
  - - [1, 64, 1, 2048]
    - [62, 29.7891]
  - - [16, 64, 1, 2048]
    - [13, 505.338]
  - - [32, 64, 1, 2048]
    - [20, 902.001]
  - - [320, 1, 1, 2048]
    - [13, 157.918]
  - - [320, 16, 1, 2048]
    - [59, 2356.35]
  - - [320, 32, 1, 2048]
    - [20, 4236.67]
  - - [576, 1, 1, 2048]
    - [13, 231.304]
  - - [576, 16, 1, 2048]
    - [138, 3370.42]
  - - [576, 32, 1, 2048]
    - [134, 6291.46]
  - - [832, 1, 1, 2048]
    - [56, 274.828]
  - - [832, 16, 1, 2048]
    - [56, 4433.0]
  - - [832, 32, 1, 2048]
    - [28, 7520.82]
  - - [1088, 1, 1, 2048]
    - [132, 348.16]
  - - [1088, 16, 1, 2048]
    - [132, 5892.82]
  - - [1088, 32, 1, 2048]
    - [81, 8642.81]
  - - [1344, 1, 1, 2048]
    - [128, 369.465]
  - - [1344, 16, 1, 2048]
    - [128, 5911.44]
  - - [1344, 32, 1, 2048]
    - [28, 9896.67]
  - - [1600, 1, 1, 2048]
    - [138, 407.056]
  - - [1600, 16, 1, 2048]
    - [56, 6168.09]
  - - [1600, 32, 1, 2048]
    - [26, 9845.78]
  - - [1856, 1, 1, 2048]
    - [138, 447.187]
  - - [1856, 16, 1, 2048]
    - [56, 7154.99]
  - - [1856, 32, 1, 2048]
    - [28, 11210.6]
  - - [2112, 1, 1, 2048]
    - [56, 500.043]
  - - [2112, 16, 1, 2048]
    - [56, 8047.21]
  - - [2368, 1, 1, 2048]
    - [56, 560.655]
  - - [2368, 16, 1, 2048]
    - [56, 8918.92]
  - - [2624, 1, 1, 2048]
    - [141, 509.379]
  - - [2624, 16, 1, 2048]
    - [56, 7476.8]
  - - [2880, 1, 1, 2048]
    - [56, 508.469]
  - - [2880, 16, 1, 2048]
    - [56, 8206.25]
  - - [3136, 1, 1, 2048]
    - [56, 551.29]
  - - [3136, 16, 1, 2048]
    - [7, 8858.66]
  - - [3392, 1, 1, 2048]
    - [56, 598.863]
  - - [3392, 16, 1, 2048]
    - [56, 9540.69]
  - - [3648, 1, 1, 2048]
    - [56, 641.296]
  - - [3648, 16, 1, 2048]
    - [56, 10305.0]
  - - [3904, 1, 1, 2048]
    - [56, 551.406]
  - - [1, 320, 1, 2048]
    - [62, 118.083]
  - - [16, 320, 1, 2048]
    - [125, 2118.34]
  - - [32, 320, 1, 2048]
    - [20, 4236.67]
  - - [1, 576, 1, 2048]
    - [62, 161.596]
  - - [16, 576, 1, 2048]
    - [125, 3254.2]
  - - [32, 576, 1, 2048]
    - [16, 5634.14]
  - - [1, 832, 1, 2048]
    - [4, 207.797]
  - - [16, 832, 1, 2048]
    - [68, 3894.71]
  - - [32, 832, 1, 2048]
    - [16, 6303.58]
  - - [1, 1088, 1, 2048]
    - [36, 250.362]
  - - [16, 1088, 1, 2048]
    - [68, 5021.35]
  - - [32, 1088, 1, 2048]
    - [16, 8148.93]
  - - [1, 1344, 1, 2048]
    - [4, 257.244]
  - - [16, 1344, 1, 2048]
    - [68, 4382.11]
  - - [32, 1344, 1, 2048]
    - [16, 7726.35]
  - - [1, 1600, 1, 2048]
    - [4, 300.624]
  - - [16, 1600, 1, 2048]
    - [68, 5190.97]
  - - [32, 1600, 1, 2048]
    - [16, 9198.04]
  - - [1, 1856, 1, 2048]
    - [4, 351.953]
  - - [16, 1856, 1, 2048]
    - [68, 6021.53]
  - - [32, 1856, 1, 2048]
    - [16, 10623.1]
  - - [1, 2112, 1, 2048]
    - [4, 398.652]
  - - [16, 2112, 1, 2048]
    - [68, 6818.33]
  - - [1, 2368, 1, 2048]
    - [4, 444.923]
  - - [16, 2368, 1, 2048]
    - [68, 7570.21]
  - - [1, 2624, 1, 2048]
    - [36, 385.23]
  - - [16, 2624, 1, 2048]
    - [36, 6141.66]
  - - [1, 2880, 1, 2048]
    - [36, 415.369]
  - - [16, 2880, 1, 2048]
    - [68, 6716.86]
  - - [1, 3136, 1, 2048]
    - [36, 447.563]
  - - [16, 3136, 1, 2048]
    - [36, 7313.91]
  - - [1, 3392, 1, 2048]
    - [4, 487.496]
  - - [16, 3392, 1, 2048]
    - [36, 7910.96]
  - - [1, 3648, 1, 2048]
    - [36, 517.031]
  - - [16, 3648, 1, 2048]
    - [36, 8388.61]
  - - [1, 3904, 1, 2048]
    - [36, 447.921]
  - - [64, 1, 1, 4096]
    - [20, 51.4008]
  - - [64, 16, 1, 4096]
    - [20, 822.413]
  - - [64, 32, 1, 4096]
    - [20, 1677.72]
  - - [1, 64, 1, 4096]
    - [62, 44.0578]
  - - [16, 64, 1, 4096]
    - [59, 783.982]
  - - [32, 64, 1, 4096]
    - [20, 1677.72]
  - - [320, 1, 1, 4096]
    - [59, 218.453]
  - - [320, 16, 1, 4096]
    - [59, 3679.21]
  - - [320, 32, 1, 4096]
    - [20, 6034.97]
  - - [576, 1, 1, 4096]
    - [13, 323.191]
  - - [576, 16, 1, 4096]
    - [59, 5242.88]
  - - [576, 32, 1, 4096]
    - [26, 8342.26]
  - - [832, 1, 1, 4096]
    - [13, 393.974]
  - - [832, 16, 1, 4096]
    - [13, 6024.97]
  - - [832, 32, 1, 4096]
    - [28, 10587.6]
  - - [1088, 1, 1, 4096]
    - [56, 447.884]
  - - [1088, 16, 1, 4096]
    - [56, 7166.15]
  - - [1344, 1, 1, 4096]
    - [13, 456.848]
  - - [1344, 16, 1, 4096]
    - [13, 7161.01]
  - - [1600, 1, 1, 4096]
    - [153, 512.0]
  - - [1600, 16, 1, 4096]
    - [13, 8004.4]
  - - [1856, 1, 1, 4096]
    - [13, 526.102]
  - - [1856, 16, 1, 4096]
    - [13, 8657.28]
  - - [2112, 1, 1, 4096]
    - [56, 580.587]
  - - [2368, 1, 1, 4096]
    - [56, 646.622]
  - - [2624, 1, 1, 4096]
    - [106, 570.181]
  - - [2880, 1, 1, 4096]
    - [13, 611.217]
  - - [3136, 1, 1, 4096]
    - [13, 626.588]
  - - [3392, 1, 1, 4096]
    - [56, 676.089]
  - - [3648, 1, 1, 4096]
    - [56, 730.67]
  - - [3904, 1, 1, 4096]
    - [59, 648.713]
  - - [1, 320, 1, 4096]
    - [62, 172.463]
  - - [16, 320, 1, 4096]
    - [20, 2833.99]
  - - [32, 320, 1, 4096]
    - [20, 5949.37]
  - - [1, 576, 1, 4096]
    - [62, 213.511]
  - - [16, 576, 1, 4096]
    - [20, 3700.86]
  - - [32, 576, 1, 4096]
    - [20, 7475.0]
  - - [1, 832, 1, 4096]
    - [4, 250.579]
  - - [16, 832, 1, 4096]
    - [68, 4620.84]
  - - [32, 832, 1, 4096]
    - [20, 8077.92]
  - - [1, 1088, 1, 4096]
    - [4, 327.68]
  - - [16, 1088, 1, 4096]
    - [68, 5991.86]
  - - [1, 1344, 1, 4096]
    - [46, 300.001]
  - - [16, 1344, 1, 4096]
    - [125, 5338.21]
  - - [1, 1600, 1, 4096]
    - [4, 339.565]
  - - [16, 1600, 1, 4096]
    - [68, 5957.82]
  - - [1, 1856, 1, 4096]
    - [4, 403.298]
  - - [16, 1856, 1, 4096]
    - [68, 6833.42]
  - - [1, 2112, 1, 4096]
    - [4, 456.504]
  - - [1, 2368, 1, 4096]
    - [4, 510.491]
  - - [1, 2624, 1, 4096]
    - [36, 416.585]
  - - [1, 2880, 1, 4096]
    - [36, 453.711]
  - - [1, 3136, 1, 4096]
    - [36, 500.782]
  - - [1, 3392, 1, 4096]
    - [4, 529.281]
  - - [1, 3648, 1, 4096]
    - [36, 573.597]
  - - [1, 3904, 1, 4096]
    - [36, 480.204]
  - - [192, 1, 1, 64]
    - [6, 5.12]
  - - [192, 16, 1, 64]
    - [7, 85.4817]
  - - [192, 32, 1, 64]
    - [145, 182.891]
  - - [192, 1, 1, 1]
    - [16, 0.0853333]
  - - [192, 1, 1, 16]
    - [16, 1.39636]
  - - [192, 1, 1, 32]
    - [16, 2.79273]
  - - [192, 16, 1, 1]
    - [106, 1.42884]
  - - [192, 16, 1, 16]
    - [6, 21.3704]
  - - [192, 16, 1, 32]
    - [80, 46.8114]
  - - [192, 32, 1, 1]
    - [16, 2.79273]
  - - [192, 32, 1, 16]
    - [5, 40.96]
  - - [192, 32, 1, 32]
    - [6, 89.3673]
  - - [192, 64, 1, 1]
    - [9, 5.71535]
  - - [192, 64, 1, 16]
    - [11, 91.4456]
  - - [192, 64, 1, 32]
    - [35, 182.891]
  - - [448, 1, 1, 64]
    - [11, 12.7431]
  - - [448, 16, 1, 64]
    - [11, 208.524]
  - - [448, 32, 1, 64]
    - [16, 417.047]
  - - [448, 1, 1, 1]
    - [1, 0.186667]
  - - [448, 1, 1, 16]
    - [6, 2.92571]
  - - [448, 1, 1, 32]
    - [8, 6.66791]
  - - [448, 16, 1, 1]
    - [11, 3.33395]
  - - [448, 16, 1, 16]
    - [136, 53.3433]
  - - [448, 16, 1, 32]
    - [8, 93.6229]
  - - [448, 32, 1, 1]
    - [6, 6.10043]
  - - [448, 32, 1, 16]
    - [11, 104.262]
  - - [448, 32, 1, 32]
    - [141, 187.246]
  - - [448, 64, 1, 1]
    - [22, 13.0327]
  - - [448, 64, 1, 16]
    - [21, 187.246]
  - - [448, 64, 1, 32]
    - [11, 352.886]
  - - [704, 1, 1, 64]
    - [56, 20.48]
  - - [704, 16, 1, 64]
    - [11, 335.3]
  - - [704, 32, 1, 64]
    - [139, 576.717]
  - - [704, 1, 1, 1]
    - [106, 0.32]
  - - [704, 1, 1, 16]
    - [7, 5.12]
  - - [704, 1, 1, 32]
    - [9, 10.0124]
  - - [704, 16, 1, 1]
    - [141, 5.12]
  - - [704, 16, 1, 16]
    - [7, 83.8251]
  - - [704, 16, 1, 32]
    - [11, 160.199]
  - - [704, 32, 1, 1]
    - [19, 10.0124]
  - - [704, 32, 1, 16]
    - [18, 153.382]
  - - [704, 32, 1, 32]
    - [6, 313.433]
  - - [704, 64, 1, 1]
    - [25, 17.669]
  - - [704, 64, 1, 16]
    - [24, 300.373]
  - - [704, 64, 1, 32]
    - [21, 613.529]
  - - [960, 1, 1, 64]
    - [12, 27.3067]
  - - [960, 16, 1, 64]
    - [80, 457.228]
  - - [960, 32, 1, 64]
    - [12, 854.817]
  - - [960, 1, 1, 1]
    - [136, 0.446512]
  - - [960, 1, 1, 16]
    - [10, 6.26939]
  - - [960, 1, 1, 32]
    - [12, 13.9636]
  - - [960, 16, 1, 1]
    - [136, 7.14419]
  - - [960, 16, 1, 16]
    - [7, 114.307]
  - - [960, 16, 1, 32]
    - [7, 223.418]
  - - [960, 32, 1, 1]
    - [18, 13.3565]
  - - [960, 32, 1, 16]
    - [8, 204.8]
  - - [960, 32, 1, 32]
    - [133, 393.216]
  - - [960, 64, 1, 1]
    - [21, 23.6308]
  - - [960, 64, 1, 16]
    - [22, 401.241]
  - - [960, 64, 1, 32]
    - [16, 836.63]
  - - [1216, 1, 1, 64]
    - [56, 33.8365]
  - - [1216, 16, 1, 64]
    - [11, 565.993]
  - - [1216, 32, 1, 64]
    - [16, 1082.77]
  - - [1216, 1, 1, 1]
    - [106, 0.552727]
  - - [1216, 1, 1, 16]
    - [55, 8.84364]
  - - [1216, 1, 1, 32]
    - [24, 16.2133]
  - - [1216, 16, 1, 1]
    - [56, 9.0493]
  - - [1216, 16, 1, 16]
    - [7, 144.789]
  - - [1216, 16, 1, 32]
    - [7, 276.708]
  - - [1216, 32, 1, 1]
    - [142, 16.9183]
  - - [1216, 32, 1, 16]
    - [136, 282.996]
  - - [1216, 32, 1, 32]
    - [11, 565.993]
  - - [1216, 64, 1, 1]
    - [25, 32.4267]
  - - [1216, 64, 1, 16]
    - [23, 518.827]
  - - [1216, 64, 1, 32]
    - [22, 1082.77]
  - - [1472, 1, 1, 64]
    - [106, 39.2533]
  - - [1472, 16, 1, 64]
    - [140, 669.924]
  - - [1472, 32, 1, 64]
    - [139, 1230.47]
  - - [1472, 1, 1, 1]
    - [80, 0.600816]
  - - [1472, 1, 1, 16]
    - [11, 10.0221]
  - - [1472, 1, 1, 32]
    - [106, 20.9351]
  - - [1472, 16, 1, 1]
    - [106, 10.0221]
  - - [1472, 16, 1, 16]
    - [12, 163.84]
  - - [1472, 16, 1, 32]
    - [106, 295.555]
  - - [1472, 32, 1, 1]
    - [22, 19.6267]
  - - [1472, 32, 1, 16]
    - [12, 289.871]
  - - [1472, 32, 1, 32]
    - [21, 641.416]
  - - [1472, 64, 1, 1]
    - [18, 33.0554]
  - - [1472, 64, 1, 16]
    - [22, 548.119]
  - - [1472, 64, 1, 32]
    - [37, 1096.24]
  - - [1728, 1, 1, 64]
    - [110, 46.08]
  - - [1728, 16, 1, 64]
    - [56, 769.336]
  - - [1728, 32, 1, 64]
    - [11, 1387.82]
  - - [1728, 1, 1, 1]
    - [106, 0.735319]
  - - [1728, 1, 1, 16]
    - [12, 12.0209]
  - - [1728, 1, 1, 32]
    - [8, 24.0417]
  - - [1728, 16, 1, 1]
    - [11, 12.0209]
  - - [1728, 16, 1, 16]
    - [136, 201.076]
  - - [1728, 16, 1, 32]
    - [80, 411.505]
  - - [1728, 32, 1, 1]
    - [25, 20.8664]
  - - [1728, 32, 1, 16]
    - [136, 376.483]
  - - [1728, 32, 1, 32]
    - [22, 752.967]
  - - [1728, 64, 1, 1]
    - [24, 40.96]
  - - [1728, 64, 1, 16]
    - [142, 667.725]
  - - [1728, 64, 1, 32]
    - [27, 1415.58]
  - - [1984, 1, 1, 64]
    - [145, 51.8269]
  - - [1984, 16, 1, 64]
    - [56, 864.517]
  - - [1984, 32, 1, 64]
    - [22, 1625.29]
  - - [1984, 1, 1, 1]
    - [7, 0.862609]
  - - [1984, 1, 1, 16]
    - [10, 12.4486]
  - - [1984, 1, 1, 32]
    - [12, 28.2169]
  - - [1984, 16, 1, 1]
    - [56, 13.5081]
  - - [1984, 16, 1, 16]
    - [6, 216.129]
  - - [1984, 16, 1, 32]
    - [57, 390.695]
  - - [1984, 32, 1, 1]
    - [22, 25.9135]
  - - [1984, 32, 1, 16]
    - [23, 423.253]
  - - [1984, 32, 1, 32]
    - [21, 864.517]
  - - [1984, 64, 1, 1]
    - [25, 43.7848]
  - - [1984, 64, 1, 16]
    - [23, 677.205]
  - - [1984, 64, 1, 32]
    - [21, 1477.54]
  - - [1, 192, 1, 64]
    - [57, 5.34261]
  - - [16, 192, 1, 64]
    - [2, 80.2482]
  - - [32, 192, 1, 64]
    - [16, 182.891]
  - - [1, 192, 1, 1]
    - [4, 0.0853333]
  - - [1, 192, 1, 16]
    - [57, 1.33565]
  - - [1, 192, 1, 32]
    - [19, 2.79273]
  - - [16, 192, 1, 1]
    - [35, 1.39636]
  - - [16, 192, 1, 16]
    - [35, 22.3418]
  - - [16, 192, 1, 32]
    - [36, 46.8114]
  - - [32, 192, 1, 1]
    - [7, 2.79273]
  - - [32, 192, 1, 16]
    - [136, 45.7228]
  - - [32, 192, 1, 32]
    - [36, 93.6229]
  - - [64, 192, 1, 1]
    - [18, 5.58545]
  - - [64, 192, 1, 16]
    - [16, 89.3673]
  - - [64, 192, 1, 32]
    - [9, 170.963]
  - - [192, 192, 1, 1]
    - [12, 14.1785]
  - - [192, 192, 1, 16]
    - [136, 262.144]
  - - [192, 192, 1, 32]
    - [17, 462.607]
  - - [320, 192, 1, 1]
    - [23, 25.6]
  - - [320, 192, 1, 16]
    - [23, 409.6]
  - - [320, 192, 1, 32]
    - [31, 873.813]
  - - [448, 192, 1, 1]
    - [30, 33.7318]
  - - [448, 192, 1, 16]
    - [25, 529.329]
  - - [448, 192, 1, 32]
    - [22, 1019.45]
  - - [576, 192, 1, 1]
    - [31, 44.2368]
  - - [576, 192, 1, 16]
    - [30, 693.911]
  - - [576, 192, 1, 32]
    - [27, 1415.58]
  - - [704, 192, 1, 1]
    - [29, 48.2743]
  - - [704, 192, 1, 16]
    - [30, 786.432]
  - - [704, 192, 1, 32]
    - [21, 1544.78]
  - - [832, 192, 1, 1]
    - [31, 57.0514]
  - - [832, 192, 1, 16]
    - [151, 851.968]
  - - [832, 192, 1, 32]
    - [31, 1858.84]
  - - [960, 192, 1, 1]
    - [21, 59.4581]
  - - [960, 192, 1, 16]
    - [31, 1034.78]
  - - [960, 192, 1, 32]
    - [29, 2144.81]
  - - [1088, 192, 1, 1]
    - [30, 68.4905]
  - - [1088, 192, 1, 16]
    - [31, 1095.85]
  - - [1088, 192, 1, 32]
    - [151, 2122.12]
  - - [1216, 192, 1, 1]
    - [117, 76.5482]
  - - [1216, 192, 1, 16]
    - [41, 1266.29]
  - - [1216, 192, 1, 32]
    - [42, 2532.58]
  - - [1344, 192, 1, 1]
    - [31, 81.92]
  - - [1344, 192, 1, 16]
    - [31, 1251.14]
  - - [1344, 192, 1, 32]
    - [31, 2502.28]
  - - [1472, 192, 1, 1]
    - [31, 86.9612]
  - - [1472, 192, 1, 16]
    - [31, 1292.0]
  - - [1472, 192, 1, 32]
    - [40, 2826.24]
  - - [1600, 192, 1, 1]
    - [31, 93.0909]
  - - [1600, 192, 1, 16]
    - [31, 1512.37]
  - - [1600, 192, 1, 32]
    - [41, 2849.39]
  - - [1728, 192, 1, 1]
    - [117, 99.0376]
  - - [1728, 192, 1, 16]
    - [117, 1608.61]
  - - [1728, 192, 1, 32]
    - [47, 3266.72]
  - - [1856, 192, 1, 1]
    - [117, 107.985]
  - - [1856, 192, 1, 16]
    - [42, 1606.09]
  - - [1856, 192, 1, 32]
    - [41, 3455.53]
  - - [1984, 192, 1, 1]
    - [117, 102.954]
  - - [1984, 192, 1, 16]
    - [117, 1625.29]
  - - [1984, 192, 1, 32]
    - [118, 3250.59]
  - - [192, 320, 1, 1]
    - [21, 25.0776]
  - - [192, 320, 1, 16]
    - [24, 385.506]
  - - [192, 320, 1, 32]
    - [16, 771.012]
  - - [448, 320, 1, 1]
    - [25, 48.5966]
  - - [448, 320, 1, 16]
    - [151, 790.952]
  - - [448, 320, 1, 32]
    - [54, 1609.66]
  - - [704, 320, 1, 1]
    - [151, 72.671]
  - - [704, 320, 1, 16]
    - [151, 1126.4]
  - - [704, 320, 1, 32]
    - [151, 2288.56]
  - - [960, 320, 1, 1]
    - [54, 84.1644]
  - - [960, 320, 1, 16]
    - [38, 1365.33]
  - - [960, 320, 1, 32]
    - [38, 2769.13]
  - - [1216, 320, 1, 1]
    - [54, 108.089]
  - - [1216, 320, 1, 16]
    - [54, 1660.25]
  - - [1216, 320, 1, 32]
    - [54, 3411.46]
  - - [1472, 320, 1, 1]
    - [146, 120.779]
  - - [1472, 320, 1, 16]
    - [124, 1816.06]
  - - [1472, 320, 1, 32]
    - [92, 3632.12]
  - - [1728, 320, 1, 1]
    - [69, 124.261]
  - - [1728, 320, 1, 16]
    - [146, 2106.51]
  - - [1728, 320, 1, 32]
    - [105, 4067.75]
  - - [1984, 320, 1, 1]
    - [146, 139.534]
  - - [1984, 320, 1, 16]
    - [146, 2362.34]
  - - [1984, 320, 1, 32]
    - [90, 4465.09]
  - - [1, 448, 1, 64]
    - [36, 12.4661]
  - - [16, 448, 1, 64]
    - [1, 179.903]
  - - [32, 448, 1, 64]
    - [68, 382.293]
  - - [1, 448, 1, 1]
    - [36, 0.194783]
  - - [1, 448, 1, 16]
    - [36, 3.11652]
  - - [1, 448, 1, 32]
    - [17, 6.23304]
  - - [16, 448, 1, 1]
    - [140, 2.8672]
  - - [16, 448, 1, 16]
    - [9, 48.8034]
  - - [16, 448, 1, 32]
    - [35, 109.227]
  - - [32, 448, 1, 1]
    - [18, 6.51636]
  - - [32, 448, 1, 16]
    - [17, 106.687]
  - - [32, 448, 1, 32]
    - [36, 218.453]
  - - [64, 448, 1, 1]
    - [9, 12.7431]
  - - [64, 448, 1, 16]
    - [36, 191.147]
  - - [64, 448, 1, 32]
    - [11, 417.047]
  - - [192, 448, 1, 1]
    - [24, 33.7318]
  - - [192, 448, 1, 16]
    - [25, 529.329]
  - - [192, 448, 1, 32]
    - [21, 1058.66]
  - - [320, 448, 1, 1]
    - [25, 48.5966]
  - - [320, 448, 1, 16]
    - [31, 790.952]
  - - [320, 448, 1, 32]
    - [25, 1581.9]
  - - [448, 448, 1, 1]
    - [151, 62.72]
  - - [448, 448, 1, 16]
    - [25, 1019.45]
  - - [448, 448, 1, 32]
    - [21, 2071.78]
  - - [576, 448, 1, 1]
    - [31, 79.3994]
  - - [576, 448, 1, 16]
    - [31, 1251.14]
  - - [576, 448, 1, 32]
    - [151, 2393.49]
  - - [704, 448, 1, 1]
    - [31, 87.6089]
  - - [704, 448, 1, 16]
    - [31, 1421.49]
  - - [704, 448, 1, 32]
    - [31, 2883.58]
  - - [832, 448, 1, 1]
    - [53, 100.739]
  - - [832, 448, 1, 16]
    - [146, 1569.41]
  - - [832, 448, 1, 32]
    - [53, 3267.82]
  - - [960, 448, 1, 1]
    - [52, 116.238]
  - - [960, 448, 1, 16]
    - [53, 1787.35]
  - - [960, 448, 1, 32]
    - [52, 3484.19]
  - - [1088, 448, 1, 1]
    - [53, 121.856]
  - - [1088, 448, 1, 16]
    - [146, 1856.85]
  - - [1088, 448, 1, 32]
    - [52, 3758.45]
  - - [1216, 448, 1, 1]
    - [52, 129.707]
  - - [1216, 448, 1, 16]
    - [53, 2075.31]
  - - [1216, 448, 1, 32]
    - [52, 4054.09]
  - - [1344, 448, 1, 1]
    - [96, 135.306]
  - - [1344, 448, 1, 16]
    - [146, 2293.76]
  - - [1344, 448, 1, 32]
    - [90, 4234.63]
  - - [1472, 448, 1, 1]
    - [146, 149.876]
  - - [1472, 448, 1, 16]
    - [146, 2425.59]
  - - [1472, 448, 1, 32]
    - [146, 4538.19]
  - - [1600, 448, 1, 1]
    - [91, 149.333]
  - - [1600, 448, 1, 16]
    - [92, 2340.57]
  - - [1600, 448, 1, 32]
    - [146, 4932.82]
  - - [1728, 448, 1, 1]
    - [146, 170.142]
  - - [1728, 448, 1, 16]
    - [146, 2880.54]
  - - [1728, 448, 1, 32]
    - [94, 5215.29]
  - - [1856, 448, 1, 1]
    - [73, 145.875]
  - - [1856, 448, 1, 16]
    - [73, 2334.0]
  - - [1856, 448, 1, 32]
    - [124, 4509.77]
  - - [1984, 448, 1, 1]
    - [93, 150.649]
  - - [1984, 448, 1, 16]
    - [146, 2312.41]
  - - [1984, 448, 1, 32]
    - [124, 4780.27]
  - - [192, 576, 1, 1]
    - [27, 42.5354]
  - - [192, 576, 1, 16]
    - [24, 655.36]
  - - [192, 576, 1, 32]
    - [27, 1415.58]
  - - [448, 576, 1, 1]
    - [42, 83.2413]
  - - [448, 576, 1, 16]
    - [31, 1270.39]
  - - [448, 576, 1, 32]
    - [31, 2540.78]
  - - [704, 576, 1, 1]
    - [42, 109.596]
  - - [704, 576, 1, 16]
    - [42, 1707.39]
  - - [704, 576, 1, 32]
    - [117, 3604.48]
  - - [960, 576, 1, 1]
    - [47, 141.785]
  - - [960, 576, 1, 16]
    - [47, 2328.25]
  - - [960, 576, 1, 32]
    - [47, 4656.51]
  - - [1216, 576, 1, 1]
    - [146, 155.648]
  - - [1216, 576, 1, 16]
    - [146, 2668.25]
  - - [1216, 576, 1, 32]
    - [98, 4768.79]
  - - [1472, 576, 1, 1]
    - [98, 161.499]
  - - [1472, 576, 1, 16]
    - [98, 2444.32]
  - - [1472, 576, 1, 32]
    - [98, 4844.98]
  - - [1728, 576, 1, 1]
    - [99, 168.7]
  - - [1728, 576, 1, 16]
    - [99, 2676.51]
  - - [1728, 576, 1, 32]
    - [98, 5221.39]
  - - [1984, 576, 1, 1]
    - [99, 198.745]
  - - [1984, 576, 1, 16]
    - [97, 2973.1]
  - - [1984, 576, 1, 32]
    - [99, 5669.63]
  - - [1, 704, 1, 64]
    - [4, 18.3902]
  - - [16, 704, 1, 64]
    - [35, 335.3]
  - - [32, 704, 1, 64]
    - [133, 655.36]
  - - [1, 704, 1, 1]
    - [4, 0.293333]
  - - [1, 704, 1, 16]
    - [19, 4.41725]
  - - [1, 704, 1, 32]
    - [36, 10.24]
  - - [16, 704, 1, 1]
    - [36, 5.12]
  - - [16, 704, 1, 16]
    - [35, 80.0996]
  - - [16, 704, 1, 32]
    - [35, 167.65]
  - - [32, 704, 1, 1]
    - [17, 10.0124]
  - - [32, 704, 1, 16]
    - [136, 163.84]
  - - [32, 704, 1, 32]
    - [16, 320.398]
  - - [64, 704, 1, 1]
    - [22, 19.1728]
  - - [64, 704, 1, 16]
    - [136, 306.764]
  - - [64, 704, 1, 32]
    - [16, 588.487]
  - - [192, 704, 1, 1]
    - [31, 45.8197]
  - - [192, 704, 1, 16]
    - [25, 733.115]
  - - [192, 704, 1, 32]
    - [21, 1517.68]
  - - [320, 704, 1, 1]
    - [151, 71.5175]
  - - [320, 704, 1, 16]
    - [151, 1201.49]
  - - [320, 704, 1, 32]
    - [151, 2252.8]
  - - [448, 704, 1, 1]
    - [151, 84.1045]
  - - [448, 704, 1, 16]
    - [31, 1401.74]
  - - [448, 704, 1, 32]
    - [30, 2655.93]
  - - [576, 704, 1, 1]
    - [31, 103.975]
  - - [576, 704, 1, 16]
    - [146, 1707.39]
  - - [576, 704, 1, 32]
    - [151, 3555.1]
  - - [704, 704, 1, 1]
    - [53, 118.004]
  - - [704, 704, 1, 16]
    - [146, 1844.15]
  - - [704, 704, 1, 32]
    - [105, 3731.7]
  - - [832, 704, 1, 1]
    - [146, 127.332]
  - - [832, 704, 1, 16]
    - [146, 2129.92]
  - - [832, 704, 1, 32]
    - [146, 4211.98]
  - - [960, 704, 1, 1]
    - [47, 140.8]
  - - [960, 704, 1, 16]
    - [146, 2350.75]
  - - [960, 704, 1, 32]
    - [47, 4505.6]
  - - [1088, 704, 1, 1]
    - [146, 157.928]
  - - [1088, 704, 1, 16]
    - [92, 2402.99]
  - - [1088, 704, 1, 32]
    - [96, 4668.66]
  - - [1216, 704, 1, 1]
    - [72, 150.187]
  - - [1216, 704, 1, 16]
    - [72, 2361.56]
  - - [1216, 704, 1, 32]
    - [93, 4604.04]
  - - [1344, 704, 1, 1]
    - [98, 152.609]
  - - [1344, 704, 1, 16]
    - [98, 2402.99]
  - - [1344, 704, 1, 32]
    - [98, 4805.97]
  - - [1472, 704, 1, 1]
    - [97, 164.49]
  - - [1472, 704, 1, 16]
    - [97, 2590.72]
  - - [1472, 704, 1, 32]
    - [97, 5101.73]
  - - [1600, 704, 1, 1]
    - [98, 164.438]
  - - [1600, 704, 1, 16]
    - [98, 2611.94]
  - - [1600, 704, 1, 32]
    - [105, 5461.33]
  - - [1728, 704, 1, 1]
    - [48, 162.202]
  - - [1728, 704, 1, 16]
    - [146, 2760.88]
  - - [1728, 704, 1, 32]
    - [90, 5190.45]
