projects/hipsparselt/library/src/hcc_detail/rocsparselt/src/spmm/Tensile/Logic/asm_full/gfx950/Equality/gfx950_Cijk_Ailk_Bljk_BBS_BH_Bias_FDMN_SPB_A_S_SAV.yaml
- {MinimumRequiredVersion: 5.0.0}
- gfx950
- gfx950
- [Device 75a3, Device 75a0]
    SolutionIndex: 0
    SolutionNameMin: Cijk_Ailk_Bljk_BBS_BH_Bias_FDMN_SPB_A_S_SAV_MT16x64x128_MI16x16x1_SN_LDSB1_AFC1_AG0_AFEM1_AFEM1_ASEM8_CLR1_CADS0_DTLA0_DTLB0_DTVA0_DTVB0_DTVSM0_DPLBn1_EPS1_ELFLR0_EMLLn1_FDSI0_GRPM1_GRVWA8_GRVWB8_GSU2_GSUAMBSK_GSUC0_GSUWGMRR0_GLS0_ISA950_IU1_K1_LDSTI0_LBSPPA256_LBSPPB256_LBSPPM0_LPA16_LPB8_LPM0_LRVW8_LWPMn1_MIAV0_MIWT1_2_MO40_MGRIPMn1_NTn1_NTA0_NTB0_NTC0_NTD4_NTM0_NEPBS16_NLCA1_NLCB1_ONLL1_PGR2_PLR1_PKA1_SGROBn1_SIA3_SS1_SU0_SUM0_SUS0_SPO0_SRVW0_SSO0_SVW1_SK0_SKFTR0_SKXCCM0_SGRO0_TIN0_TLDS1_TLDSM0_ULSGRO0_USL1_UIOFGRO0_USFGROn1_VSn1_VWA1_VWB2_WSGRA0_WSGRB0_WS64_WG16_8_1_WGM1_WGMXCC8_WGMXCCGn1
    SolutionIndex: 1
    SolutionNameMin: Cijk_Ailk_Bljk_BBS_BH_Bias_FDMN_SPB_A_S_SAV_MT16x64x256_MI16x16x1_SN_LDSB0_AFC1_AG0_AFEM1_AFEM1_ASEM8_CLR1_CADS0_DTLA0_DTLB0_DTVA0_DTVB0_DTVSM0_DPLBn1_EPS1_ELFLR0_EMLLn1_FDSI0_GRPM1_GRVWA8_GRVWB8_GSU4_GSUAMBSK_GSUC0_GSUWGMRR0_GLS0_ISA950_IU1_K1_LDSTI0_LBSPPA256_LBSPPB512_LBSPPM0_LPA16_LPB8_LPM0_LRVW8_LWPMn1_MIAV0_MIWT1_2_MO40_MGRIPMn1_NTn1_NTA0_NTB0_NTC0_NTD4_NTM0_NEPBS16_NLCA1_NLCB1_ONLL1_PGR2_PLR1_PKA1_SGROBn1_SIA3_SS1_SU0_SUM0_SUS0_SPO0_SRVW0_SSO0_SVW1_SK0_SKFTR0_SKXCCM0_SGRO0_TIN0_TLDS1_TLDSM0_ULSGRO0_USL1_UIOFGRO0_USFGROn1_VSn1_VWA1_VWB2_WSGRA0_WSGRB0_WS64_WG16_8_1_WGM1_WGMXCC8_WGMXCCGn1
    SolutionIndex: 2
    SolutionNameMin: Cijk_Ailk_Bljk_BBS_BH_Bias_FDMN_SPB_A_S_SAV_MT128x16x128_MI16x16x1_SN_LDSB1_AFC1_AG0_AFEM1_AFEM1_ASEM8_CLR1_CADS0_DTLA0_DTLB0_DTVA0_DTVB0_DTVSM0_DPLBn1_EPS1_ELFLR0_EMLLn1_FDSI0_GRPM1_GRVWA8_GRVWB8_GSU2_GSUAMBSK_GSUC0_GSUWGMRR0_GLS0_ISA950_IU1_K1_LDSTI0_LBSPPA2048_LBSPPB128_LBSPPM0_LPA0_LPB8_LPM0_LRVW8_LWPMn1_MIAV0_MIWT4_1_MO40_MGRIPMn1_NTn1_NTA0_NTB0_NTC0_NTD4_NTM0_NEPBS16_NLCA1_NLCB1_ONLL1_PGR2_PLR1_PKA1_SGROBn1_SIA3_SS1_SU0_SUM0_SUS0_SPO0_SRVW0_SSO0_SVW4_SK0_SKFTR0_SKXCCM0_SGRO0_TIN0_TLDS1_TLDSM0_ULSGRO0_USL1_UIOFGRO0_USFGROn1_VSn1_VWA4_VWB1_WSGRA0_WSGRB0_WS64_WG32_4_1_WGM1_WGMXCC8_WGMXCCGn1
    SolutionIndex: 3
    SolutionNameMin: Cijk_Ailk_Bljk_BBS_BH_Bias_FDMN_SPB_A_S_SAV_MT128x16x128_MI16x16x1_SN_LDSB1_AFC1_AG0_AFEM1_AFEM1_ASEM8_CLR1_CADS0_DTLA0_DTLB0_DTVA0_DTVB0_DTVSM0_DPLBn1_EPS1_ELFLR0_EMLLn1_FDSI0_GRPM1_GRVWA8_GRVWB8_GSU8_GSUAMBSK_GSUC0_GSUWGMRR0_GLS0_ISA950_IU1_K1_LDSTI0_LBSPPA2048_LBSPPB128_LBSPPM0_LPA0_LPB8_LPM0_LRVW8_LWPMn1_MIAV0_MIWT4_1_MO40_MGRIPMn1_NTn1_NTA0_NTB0_NTC0_NTD4_NTM0_NEPBS16_NLCA1_NLCB1_ONLL1_PGR2_PLR1_PKA1_SGROBn1_SIA3_SS1_SU0_SUM0_SUS0_SPO0_SRVW0_SSO0_SVW4_SK0_SKFTR0_SKXCCM0_SGRO0_TIN0_TLDS1_TLDSM0_ULSGRO0_USL1_UIOFGRO0_USFGROn1_VSn1_VWA4_VWB1_WSGRA0_WSGRB0_WS64_WG32_4_1_WGM1_WGMXCC8_WGMXCCGn1
    SolutionIndex: 4
    SolutionNameMin: Cijk_Ailk_Bljk_BBS_BH_Bias_FDMN_SPB_A_S_SAV_MT256x256x64_MI32x32x1_SN_LDSB0_AFC1_AG0_AFEM1_AFEM1_ASEM8_CLR1_CADS0_DTLA0_DTLB0_DTVA0_DTVB0_DTVSM0_DPLBn1_EPS1_ELFLR0_EMLLn1_FDSI0_GRPM1_GRVWA8_GRVWB8_GSU1_GSUAMB_GSUC0_GSUWGMRR0_GLS0_ISA950_IU1_K1_LDSTI0_LBSPPA0_LBSPPB256_LBSPPM0_LPA0_LPB8_LPM0_LRVW8_LWPMn1_MIAV0_MIWT4_4_MO40_MGRIPMn1_NTn1_NTA0_NTB0_NTC0_NTD4_NTM0_NEPBS0_NLCA1_NLCB1_ONLL1_PGR2_PLR1_PKA1_SGROBn1_SIA3_SS1_SU0_SUM0_SUS0_SPO0_SRVW0_SSO0_SVW4_SK0_SKFTR0_SKXCCM0_SGRO0_TIN0_TLDS1_TLDSM0_ULSGRO0_USL1_UIOFGRO0_USFGROn1_VSn1_VWA4_VWB4_WSGRA0_WSGRB0_WS64_WG64_4_1_WGM8_WGMXCC8_WGMXCCGn1
    SolutionIndex: 5
    SolutionNameMin: Cijk_Ailk_Bljk_BBS_BH_Bias_FDMN_SPB_A_S_SAV_MT256x256x64_MI32x32x1_SN_LDSB0_AFC1_AG0_AFEM1_AFEM1_ASEM8_CLR1_CADS0_DTLA0_DTLB0_DTVA0_DTVB0_DTVSM0_DPLBn1_EPS1_ELFLR0_EMLLn1_FDSI0_GRPM1_GRVWA8_GRVWB8_GSU1_GSUAMB_GSUC0_GSUWGMRR0_GLS0_ISA950_IU1_K1_LDSTI0_LBSPPA0_LBSPPB256_LBSPPM0_LPA0_LPB8_LPM0_LRVW8_LWPMn1_MIAV0_MIWT2_8_MO40_MGRIPMn1_NTn1_NTA0_NTB0_NTC0_NTD4_NTM0_NEPBS0_NLCA1_NLCB1_ONLL1_PGR2_PLR1_PKA1_SGROBn1_SIA3_SS1_SU0_SUM0_SUS0_SPO0_SRVW0_SSO0_SVW2_SK0_SKFTR0_SKXCCM0_SGRO0_TIN0_TLDS1_TLDSM0_ULSGRO0_USL1_UIOFGRO0_USFGROn1_VSn1_VWA2_VWB4_WSGRA0_WSGRB0_WS64_WG128_2_1_WGM8_WGMXCC8_WGMXCCGn1
    SolutionIndex: 6
    SolutionNameMin: Cijk_Ailk_Bljk_BBS_BH_Bias_FDMN_SPB_A_S_SAV_MT256x256x64_MI32x32x1_SN_LDSB0_AFC1_AG0_AFEM1_AFEM1_ASEM8_CLR1_CADS0_DTLA0_DTLB0_DTVA0_DTVB0_DTVSM0_DPLBn1_EPS1_ELFLR0_EMLLn1_FDSI0_GRPM1_GRVWA8_GRVWB8_GSU1_GSUAMB_GSUC0_GSUWGMRR0_GLS0_ISA950_IU1_K1_LDSTI0_LBSPPA0_LBSPPB256_LBSPPM0_LPA0_LPB8_LPM0_LRVW8_LWPMn1_MIAV0_MIWT2_8_MO40_MGRIPMn1_NTn1_NTA0_NTB0_NTC0_NTD0_NTM0_NEPBS0_NLCA1_NLCB1_ONLL1_PGR2_PLR1_PKA1_SGROBn1_SIA3_SS1_SU0_SUM0_SUS0_SPO0_SRVW0_SSO0_SVW2_SK0_SKFTR0_SKXCCM0_SGRO0_TIN0_TLDS1_TLDSM0_ULSGRO0_USL1_UIOFGRO0_USFGROn1_VSn1_VWA2_VWB4_WSGRA0_WSGRB0_WS64_WG128_2_1_WGM8_WGMXCC8_WGMXCCGn1
    SolutionIndex: 7
    SolutionNameMin: Cijk_Ailk_Bljk_BBS_BH_Bias_FDMN_SPB_A_S_SAV_MT64x128x128_MI16x16x1_SN_LDSB0_AFC1_AG0_AFEM1_AFEM1_ASEM8_CLR1_CADS0_DTLA0_DTLB0_DTVA0_DTVB0_DTVSM0_DPLBn1_EPS1_ELFLR0_EMLLn1_FDSI0_GRPM1_GRVWA8_GRVWB8_GSU1_GSUAMB_GSUC0_GSUWGMRR0_GLS0_ISA950_IU1_K1_LDSTI0_LBSPPA1024_LBSPPB512_LBSPPM0_LPA32_LPB8_LPM0_LRVW8_LWPMn1_MIAV0_MIWT2_4_MO40_MGRIPMn1_NTn1_NTA0_NTB0_NTC0_NTD4_NTM0_NEPBS0_NLCA1_NLCB1_ONLL1_PGR2_PLR1_PKA1_SGROBn1_SIA3_SS1_SU0_SUM0_SUS0_SPO0_SRVW0_SSO0_SVW2_SK0_SKFTR0_SKXCCM0_SGRO0_TIN0_TLDS1_TLDSM0_ULSGRO0_USL1_UIOFGRO0_USFGROn1_VSn1_VWA2_VWB4_WSGRA0_WSGRB0_WS64_WG32_8_1_WGM1_WGMXCC8_WGMXCCGn1
    SolutionIndex: 8
    SolutionNameMin: Cijk_Ailk_Bljk_BBS_BH_Bias_FDMN_SPB_A_S_SAV_MT192x192x64_MI16x16x1_SN_LDSB0_AFC1_AG0_AFEM1_AFEM1_ASEM8_CLR0_CADS0_DTLA0_DTLB0_DTVA0_DTVB0_DTVSM0_DPLBn1_EPS1_ELFLR0_EMLLn1_FDSI0_GRPM1_GRVWA8_GRVWB8_GSU1_GSUAMB_GSUC0_GSUWGMRR0_GLS0_ISA950_IU1_K1_LDSTI0_LBSPPA3072_LBSPPB128_LBSPPM0_LPA32_LPB8_LPM0_LRVW8_LWPMn1_MIAV0_MIWT6_6_MO40_MGRIPMn1_NTn1_NTA0_NTB0_NTC0_NTD0_NTM0_NEPBS0_NLCA3_NLCB1_ONLL1_PGR2_PLR0_PKA1_SGROBn1_SIA3_SS1_SU0_SUM0_SUS0_SPO0_SRVW0_SSO0_SVW2_SK0_SKFTR0_SKXCCM0_SGRO0_TIN0_TLDS1_TLDSM0_ULSGRO0_USL1_UIOFGRO0_USFGROn1_VSn1_VWA2_VWB2_WSGRA0_WSGRB0_WS64_WG32_8_1_WGM8_WGMXCC8_WGMXCCGn1
    SolutionIndex: 9
    SolutionNameMin: Cijk_Ailk_Bljk_BBS_BH_Bias_FDMN_SPB_A_S_SAV_MT192x96x128_MI16x16x1_SN_LDSB1_AFC1_AG0_AFEM1_AFEM1_ASEM8_CLR1_CADS0_DTLA0_DTLB0_DTVA0_DTVB0_DTVSM0_DPLBn1_EPS1_ELFLR0_EMLLn1_FDSI0_GRPM1_GRVWA8_GRVWB8_GSU1_GSUAMB_GSUC0_GSUWGMRR0_GLS0_ISA950_IU1_K1_LDSTI0_LBSPPA3072_LBSPPB256_LBSPPM0_LPA16_LPB8_LPM0_LRVW8_LWPMn1_MIAV0_MIWT3_6_MO40_MGRIPMn1_NTn1_NTA0_NTB0_NTC0_NTD4_NTM0_NEPBS0_NLCA3_NLCB1_ONLL1_PGR2_PLR1_PKA1_SGROBn1_SIA3_SS1_SU0_SUM0_SUS0_SPO0_SRVW0_SSO0_SVW1_SK0_SKFTR0_SKXCCM0_SGRO0_TIN0_TLDS1_TLDSM0_ULSGRO0_USL1_UIOFGRO0_USFGROn1_VSn1_VWA1_VWB2_WSGRA0_WSGRB0_WS64_WG64_4_1_WGM8_WGMXCC8_WGMXCCGn1
    SolutionIndex: 10
    SolutionNameMin: Cijk_Ailk_Bljk_BBS_BH_Bias_FDMN_SPB_A_S_SAV_MT256x256x64_MI16x16x1_SN_LDSB0_AFC1_AG0_AFEM1_AFEM1_ASEM8_CLR0_CADS0_DTLA0_DTLB0_DTVA0_DTVB0_DTVSM0_DPLBn1_EPS1_ELFLR0_EMLLn1_FDSI0_GRPM1_GRVWA8_GRVWB8_GSU1_GSUAMB_GSUC0_GSUWGMRR0_GLS0_ISA950_IU1_K1_LDSTI0_LBSPPA4096_LBSPPB512_LBSPPM0_LPA0_LPB8_LPM0_LRVW8_LWPMn1_MIAV0_MIWT8_8_MO40_MGRIPMn1_NTn1_NTA0_NTB0_NTC0_NTD4_NTM0_NEPBS0_NLCA1_NLCB1_ONLL1_PGR2_PLR0_PKA1_SGROBn1_SIA3_SS1_SU0_SUM0_SUS0_SPO0_SRVW0_SSO0_SVW8_SK0_SKFTR0_SKXCCM0_SGRO0_TIN0_TLDS1_TLDSM0_ULSGRO0_USL1_UIOFGRO0_USFGROn1_VSn1_VWA8_VWB8_WSGRA0_WSGRB0_WS64_WG32_8_1_WGM8_WGMXCC8_WGMXCCGn1
    SolutionIndex: 11
    SolutionNameMin: Cijk_Ailk_Bljk_BBS_BH_Bias_FDMN_SPB_A_S_SAV_MT128x96x64_MI16x16x1_SN_LDSB1_AFC1_AG0_AFEM1_AFEM1_ASEM8_CLR0_CADS0_DTLA0_DTLB0_DTVA0_DTVB0_DTVSM0_DPLBn1_EPS1_ELFLR0_EMLLn1_FDSI0_GRPM1_GRVWA8_GRVWB8_GSU1_GSUAMB_GSUC0_GSUWGMRR0_GLS0_ISA950_IU1_K1_LDSTI0_LBSPPA2048_LBSPPB128_LBSPPM0_LPA0_LPB8_LPM0_LRVW8_LWPMn1_MIAV0_MIWT4_6_MO40_MGRIPMn1_NTn1_NTA0_NTB0_NTC0_NTD4_NTM0_NEPBS0_NLCA1_NLCB1_ONLL1_PGR2_PLR0_PKA1_SGROBn1_SIA3_SS1_SU0_SUM0_SUS0_SPO0_SRVW0_SSO0_SVW4_SK0_SKFTR0_SKXCCM0_SGRO0_TIN0_TLDS1_TLDSM0_ULSGRO0_USL1_UIOFGRO0_USFGROn1_VSn1_VWA4_VWB2_WSGRA0_WSGRB0_WS64_WG32_4_1_WGM8_WGMXCC1_WGMXCCGn1
    SolutionIndex: 12
    SolutionNameMin: Cijk_Ailk_Bljk_BBS_BH_Bias_FDMN_SPB_A_S_SAV_MT256x256x64_MI16x16x1_SN_LDSB0_AFC1_AG0_AFEM1_AFEM1_ASEM8_CLR0_CADS0_DTLA0_DTLB0_DTVA0_DTVB0_DTVSM0_DPLBn1_EPS1_ELFLR0_EMLLn1_FDSI0_GRPM1_GRVWA8_GRVWB8_GSU1_GSUAMB_GSUC0_GSUWGMRR0_GLS0_ISA950_IU1_K1_LDSTI0_LBSPPA4096_LBSPPB256_LBSPPM0_LPA0_LPB8_LPM0_LRVW8_LWPMn1_MIAV0_MIWT8_8_MO40_MGRIPMn1_NTn1_NTA0_NTB0_NTC0_NTD0_NTM0_NEPBS0_NLCA1_NLCB1_ONLL1_PGR2_PLR0_PKA1_SGROBn1_SIA3_SS1_SU0_SUM0_SUS0_SPO0_SRVW0_SSO0_SVW8_SK0_SKFTR0_SKXCCM0_SGRO0_TIN0_TLDS1_TLDSM0_ULSGRO0_USL1_UIOFGRO0_USFGROn1_VSn1_VWA8_VWB4_WSGRA0_WSGRB0_WS64_WG32_8_1_WGM8_WGMXCC8_WGMXCCGn1
    SolutionIndex: 13
    SolutionNameMin: Cijk_Ailk_Bljk_BBS_BH_Bias_FDMN_SPB_A_S_SAV_MT256x256x64_MI16x16x1_SN_LDSB0_AFC1_AG0_AFEM1_AFEM1_ASEM8_CLR0_CADS0_DTLA0_DTLB0_DTVA0_DTVB0_DTVSM0_DPLBn1_EPS1_ELFLR0_EMLLn1_FDSI0_GRPM1_GRVWA8_GRVWB8_GSU1_GSUAMB_GSUC0_GSUWGMRR0_GLS0_ISA950_IU1_K1_LDSTI0_LBSPPA4096_LBSPPB256_LBSPPM0_LPA0_LPB8_LPM0_LRVW8_LWPMn1_MIAV0_MIWT8_8_MO40_MGRIPMn1_NTn1_NTA0_NTB0_NTC0_NTD4_NTM0_NEPBS0_NLCA1_NLCB1_ONLL1_PGR2_PLR0_PKA1_SGROBn1_SIA3_SS1_SU0_SUM0_SUS0_SPO0_SRVW0_SSO0_SVW8_SK0_SKFTR0_SKXCCM0_SGRO0_TIN0_TLDS1_TLDSM0_ULSGRO0_USL1_UIOFGRO0_USFGROn1_VSn1_VWA8_VWB4_WSGRA0_WSGRB0_WS64_WG32_8_1_WGM8_WGMXCC8_WGMXCCGn1
    SolutionIndex: 14
    SolutionNameMin: Cijk_Ailk_Bljk_BBS_BH_Bias_FDMN_SPB_A_S_SAV_MT128x192x64_MI16x16x1_SN_LDSB1_AFC1_AG0_AFEM1_AFEM1_ASEM8_CLR0_CADS0_DTLA0_DTLB0_DTVA0_DTVB0_DTVSM0_DPLBn1_EPS1_ELFLR0_EMLLn1_FDSI0_GRPM1_GRVWA8_GRVWB8_GSU1_GSUAMB_GSUC0_GSUWGMRR0_GLS0_ISA950_IU1_K1_LDSTI0_LBSPPA2048_LBSPPB128_LBSPPM0_LPA0_LPB8_LPM0_LRVW8_LWPMn1_MIAV0_MIWT4_6_MO40_MGRIPMn1_NTn1_NTA0_NTB0_NTC0_NTD4_NTM0_NEPBS0_NLCA1_NLCB1_ONLL1_PGR2_PLR0_PKA1_SGROBn1_SIA3_SS1_SU0_SUM0_SUS0_SPO0_SRVW0_SSO0_SVW4_SK0_SKFTR0_SKXCCM0_SGRO0_TIN0_TLDS1_TLDSM0_ULSGRO0_USL1_UIOFGRO0_USFGROn1_VSn1_VWA4_VWB2_WSGRA0_WSGRB0_WS64_WG32_8_1_WGM1_WGMXCC1_WGMXCCGn1
    SolutionIndex: 15
    SolutionNameMin: Cijk_Ailk_Bljk_BBS_BH_Bias_FDMN_SPB_A_S_SAV_MT64x128x128_MI16x16x1_SN_LDSB0_AFC1_AG0_AFEM1_AFEM1_ASEM8_CLR1_CADS0_DTLA0_DTLB0_DTVA0_DTVB0_DTVSM0_DPLBn1_EPS1_ELFLR0_EMLLn1_FDSI0_GRPM1_GRVWA8_GRVWB8_GSU1_GSUAMB_GSUC0_GSUWGMRR0_GLS0_ISA950_IU1_K1_LDSTI0_LBSPPA1024_LBSPPB256_LBSPPM0_LPA0_LPB8_LPM0_LRVW8_LWPMn1_MIAV0_MIWT4_2_MO40_MGRIPMn1_NTn1_NTA0_NTB0_NTC0_NTD4_NTM0_NEPBS0_NLCA1_NLCB1_ONLL1_PGR2_PLR1_PKA1_SGROBn1_SIA3_SS1_SU0_SUM0_SUS0_SPO0_SRVW0_SSO0_SVW4_SK0_SKFTR0_SKXCCM0_SGRO0_TIN0_TLDS1_TLDSM0_ULSGRO0_USL1_UIOFGRO0_USFGROn1_VSn1_VWA4_VWB2_WSGRA0_WSGRB0_WS64_WG16_16_1_WGM1_WGMXCC8_WGMXCCGn1
    SolutionIndex: 16
    SolutionNameMin: Cijk_Ailk_Bljk_BBS_BH_Bias_FDMN_SPB_A_S_SAV_MT256x256x64_MI16x16x1_SN_LDSB0_AFC1_AG0_AFEM1_AFEM1_ASEM8_CLR0_CADS0_DTLA0_DTLB0_DTVA0_DTVB0_DTVSM0_DPLBn1_EPS1_ELFLR0_EMLLn1_FDSI0_GRPM1_GRVWA8_GRVWB8_GSU1_GSUAMB_GSUC0_GSUWGMRR0_GLS0_ISA950_IU1_K1_LDSTI0_LBSPPA4096_LBSPPB512_LBSPPM0_LPA0_LPB8_LPM0_LRVW8_LWPMn1_MIAV0_MIWT8_8_MO40_MGRIPMn1_NTn1_NTA0_NTB0_NTC0_NTD4_NTM0_NEPBS0_NLCA1_NLCB1_ONLL1_PGR2_PLR0_PKA1_SGROBn1_SIA3_SS1_SU0_SUM0_SUS0_SPO0_SRVW0_SSO0_SVW8_SK0_SKFTR0_SKXCCM0_SGRO0_TIN0_TLDS1_TLDSM0_ULSGRO0_USL1_UIOFGRO0_USFGROn1_VSn1_VWA8_VWB8_WSGRA0_WSGRB0_WS64_WG32_8_1_WGM8_WGMXCC1_WGMXCCGn1
    SolutionIndex: 17
    SolutionNameMin: Cijk_Ailk_Bljk_BBS_BH_Bias_FDMN_SPB_A_S_SAV_MT128x192x64_MI16x16x1_SN_LDSB0_AFC1_AG0_AFEM1_AFEM1_ASEM8_CLR0_CADS0_DTLA0_DTLB0_DTVA0_DTVB0_DTVSM0_DPLBn1_EPS1_ELFLR0_EMLLn1_FDSI0_GRPM1_GRVWA8_GRVWB8_GSU1_GSUAMB_GSUC0_GSUWGMRR0_GLS0_ISA950_IU1_K1_LDSTI0_LBSPPA2048_LBSPPB128_LBSPPM0_LPA0_LPB8_LPM0_LRVW8_LWPMn1_MIAV0_MIWT4_6_MO40_MGRIPMn1_NTn1_NTA0_NTB0_NTC0_NTD4_NTM0_NEPBS0_NLCA1_NLCB1_ONLL1_PGR2_PLR0_PKA1_SGROBn1_SIA3_SS1_SU0_SUM0_SUS0_SPO0_SRVW0_SSO0_SVW4_SK0_SKFTR0_SKXCCM0_SGRO0_TIN0_TLDS1_TLDSM0_ULSGRO0_USL1_UIOFGRO0_USFGROn1_VSn1_VWA4_VWB2_WSGRA0_WSGRB0_WS64_WG32_8_1_WGM1_WGMXCC8_WGMXCCGn1
    SolutionIndex: 18
    SolutionNameMin: Cijk_Ailk_Bljk_BBS_BH_Bias_FDMN_SPB_A_S_SAV_MT256x256x64_MI16x16x1_SN_LDSB0_AFC1_AG0_AFEM1_AFEM1_ASEM8_CLR0_CADS0_DTLA0_DTLB0_DTVA0_DTVB0_DTVSM0_DPLBn1_EPS1_ELFLR0_EMLLn1_FDSI0_GRPM1_GRVWA8_GRVWB8_GSU1_GSUAMB_GSUC0_GSUWGMRR0_GLS0_ISA950_IU1_K1_LDSTI0_LBSPPA4096_LBSPPB256_LBSPPM0_LPA0_LPB8_LPM0_LRVW8_LWPMn1_MIAV0_MIWT8_8_MO40_MGRIPMn1_NTn1_NTA0_NTB0_NTC0_NTD4_NTM0_NEPBS0_NLCA1_NLCB1_ONLL1_PGR2_PLR0_PKA1_SGROBn1_SIA3_SS1_SU0_SUM0_SUS0_SPO0_SRVW0_SSO0_SVW8_SK0_SKFTR0_SKXCCM0_SGRO0_TIN0_TLDS1_TLDSM0_ULSGRO0_USL1_UIOFGRO0_USFGROn1_VSn1_VWA8_VWB4_WSGRA0_WSGRB0_WS64_WG32_8_1_WGM1_WGMXCC8_WGMXCCGn1
    SolutionIndex: 19
    SolutionNameMin: Cijk_Ailk_Bljk_BBS_BH_Bias_FDMN_SPB_A_S_SAV_MT256x256x64_MI32x32x1_SN_LDSB0_AFC1_AG0_AFEM1_AFEM1_ASEM8_CLR1_CADS0_DTLA0_DTLB0_DTVA0_DTVB0_DTVSM0_DPLBn1_EPS1_ELFLR0_EMLLn1_FDSI0_GRPM1_GRVWA8_GRVWB8_GSU1_GSUAMB_GSUC0_GSUWGMRR0_GLS0_ISA950_IU1_K1_LDSTI0_LBSPPA0_LBSPPB256_LBSPPM0_LPA0_LPB8_LPM0_LRVW8_LWPMn1_MIAV0_MIWT4_4_MO40_MGRIPMn1_NTn1_NTA0_NTB0_NTC0_NTD4_NTM0_NEPBS0_NLCA1_NLCB1_ONLL1_PGR2_PLR1_PKA1_SGROBn1_SIA3_SS1_SU0_SUM0_SUS0_SPO0_SRVW0_SSO0_SVW4_SK0_SKFTR0_SKXCCM0_SGRO0_TIN0_TLDS1_TLDSM0_ULSGRO0_USL1_UIOFGRO0_USFGROn1_VSn1_VWA4_VWB4_WSGRA0_WSGRB0_WS64_WG64_4_1_WGM8_WGMXCC1_WGMXCCGn1
    SolutionIndex: 20
    SolutionNameMin: Cijk_Ailk_Bljk_BBS_BH_Bias_FDMN_SPB_A_S_SAV_MT256x256x64_MI32x32x1_SN_LDSB0_AFC1_AG0_AFEM1_AFEM1_ASEM8_CLR1_CADS0_DTLA0_DTLB0_DTVA0_DTVB0_DTVSM0_DPLBn1_EPS1_ELFLR0_EMLLn1_FDSI0_GRPM1_GRVWA8_GRVWB8_GSU1_GSUAMB_GSUC0_GSUWGMRR0_GLS0_ISA950_IU1_K1_LDSTI0_LBSPPA0_LBSPPB256_LBSPPM0_LPA0_LPB8_LPM0_LRVW8_LWPMn1_MIAV0_MIWT4_4_MO40_MGRIPMn1_NTn1_NTA0_NTB0_NTC0_NTD0_NTM0_NEPBS0_NLCA1_NLCB1_ONLL1_PGR2_PLR1_PKA1_SGROBn1_SIA3_SS1_SU0_SUM0_SUS0_SPO0_SRVW0_SSO0_SVW4_SK0_SKFTR0_SKXCCM0_SGRO0_TIN0_TLDS1_TLDSM0_ULSGRO0_USL1_UIOFGRO0_USFGROn1_VSn1_VWA4_VWB4_WSGRA0_WSGRB0_WS64_WG64_4_1_WGM1_WGMXCC8_WGMXCCGn1
    SolutionIndex: 21
    SolutionNameMin: Cijk_Ailk_Bljk_BBS_BH_Bias_FDMN_SPB_A_S_SAV_MT64x128x128_MI16x16x1_SN_LDSB0_AFC1_AG0_AFEM1_AFEM1_ASEM8_CLR1_CADS0_DTLA0_DTLB0_DTVA0_DTVB0_DTVSM0_DPLBn1_EPS1_ELFLR0_EMLLn1_FDSI0_GRPM1_GRVWA8_GRVWB8_GSU1_GSUAMB_GSUC0_GSUWGMRR0_GLS0_ISA950_IU1_K1_LDSTI0_LBSPPA1024_LBSPPB512_LBSPPM0_LPA32_LPB8_LPM0_LRVW8_LWPMn1_MIAV0_MIWT2_4_MO40_MGRIPMn1_NTn1_NTA0_NTB0_NTC0_NTD4_NTM0_NEPBS0_NLCA1_NLCB1_ONLL1_PGR2_PLR1_PKA1_SGROBn1_SIA3_SS1_SU0_SUM0_SUS0_SPO0_SRVW0_SSO0_SVW2_SK0_SKFTR0_SKXCCM0_SGRO0_TIN0_TLDS1_TLDSM0_ULSGRO0_USL1_UIOFGRO0_USFGROn1_VSn1_VWA2_VWB4_WSGRA0_WSGRB0_WS64_WG32_8_1_WGM1_WGMXCC1_WGMXCCGn1
    SolutionIndex: 22
    SolutionNameMin: Cijk_Ailk_Bljk_BBS_BH_Bias_FDMN_SPB_A_S_SAV_MT256x256x64_MI16x16x1_SN_LDSB0_AFC1_AG0_AFEM1_AFEM1_ASEM8_CLR0_CADS0_DTLA0_DTLB0_DTVA0_DTVB0_DTVSM0_DPLBn1_EPS1_ELFLR0_EMLLn1_FDSI0_GRPM1_GRVWA8_GRVWB8_GSU1_GSUAMB_GSUC0_GSUWGMRR0_GLS0_ISA950_IU1_K1_LDSTI0_LBSPPA4096_LBSPPB512_LBSPPM0_LPA0_LPB8_LPM0_LRVW8_LWPMn1_MIAV0_MIWT8_8_MO40_MGRIPMn1_NTn1_NTA0_NTB0_NTC0_NTD0_NTM0_NEPBS0_NLCA1_NLCB1_ONLL1_PGR2_PLR0_PKA1_SGROBn1_SIA3_SS1_SU0_SUM0_SUS0_SPO0_SRVW0_SSO0_SVW8_SK0_SKFTR0_SKXCCM0_SGRO0_TIN0_TLDS1_TLDSM0_ULSGRO0_USL1_UIOFGRO0_USFGROn1_VSn1_VWA8_VWB8_WSGRA0_WSGRB0_WS64_WG32_8_1_WGM8_WGMXCC8_WGMXCCGn1
    SolutionIndex: 23
    SolutionNameMin: Cijk_Ailk_Bljk_BBS_BH_Bias_FDMN_SPB_A_S_SAV_MT256x256x64_MI16x16x1_SN_LDSB0_AFC1_AG0_AFEM1_AFEM1_ASEM8_CLR0_CADS0_DTLA0_DTLB0_DTVA0_DTVB0_DTVSM0_DPLBn1_EPS1_ELFLR0_EMLLn1_FDSI0_GRPM1_GRVWA8_GRVWB8_GSU1_GSUAMB_GSUC0_GSUWGMRR0_GLS0_ISA950_IU1_K1_LDSTI0_LBSPPA4096_LBSPPB512_LBSPPM0_LPA0_LPB8_LPM0_LRVW8_LWPMn1_MIAV0_MIWT4_16_MO40_MGRIPMn1_NTn1_NTA0_NTB0_NTC0_NTD0_NTM0_NEPBS0_NLCA1_NLCB1_ONLL1_PGR2_PLR0_PKA1_SGROBn1_SIA3_SS1_SU0_SUM0_SUS0_SPO0_SRVW0_SSO0_SVW4_SK0_SKFTR0_SKXCCM0_SGRO0_TIN0_TLDS1_TLDSM0_ULSGRO0_USL1_UIOFGRO0_USFGROn1_VSn1_VWA4_VWB8_WSGRA0_WSGRB0_WS64_WG64_4_1_WGM8_WGMXCC8_WGMXCCGn1
    SolutionIndex: 24
    SolutionNameMin: Cijk_Ailk_Bljk_BBS_BH_Bias_FDMN_SPB_A_S_SAV_MT128x192x64_MI16x16x1_SN_LDSB0_AFC1_AG0_AFEM1_AFEM1_ASEM8_CLR0_CADS0_DTLA0_DTLB0_DTVA0_DTVB0_DTVSM0_DPLBn1_EPS1_ELFLR0_EMLLn1_FDSI0_GRPM1_GRVWA8_GRVWB8_GSU1_GSUAMB_GSUC0_GSUWGMRR0_GLS0_ISA950_IU1_K1_LDSTI0_LBSPPA2048_LBSPPB128_LBSPPM0_LPA0_LPB8_LPM0_LRVW8_LWPMn1_MIAV0_MIWT4_6_MO40_MGRIPMn1_NTn1_NTA0_NTB0_NTC0_NTD4_NTM0_NEPBS0_NLCA1_NLCB1_ONLL1_PGR2_PLR0_PKA1_SGROBn1_SIA3_SS1_SU0_SUM0_SUS0_SPO0_SRVW0_SSO0_SVW4_SK0_SKFTR0_SKXCCM0_SGRO0_TIN0_TLDS1_TLDSM0_ULSGRO0_USL1_UIOFGRO0_USFGROn1_VSn1_VWA4_VWB2_WSGRA0_WSGRB0_WS64_WG32_8_1_WGM8_WGMXCC8_WGMXCCGn1
    SolutionIndex: 25
    SolutionNameMin: Cijk_Ailk_Bljk_BBS_BH_Bias_FDMN_SPB_A_S_SAV_MT128x96x64_MI16x16x1_SN_LDSB1_AFC1_AG0_AFEM1_AFEM1_ASEM8_CLR0_CADS0_DTLA0_DTLB0_DTVA0_DTVB0_DTVSM0_DPLBn1_EPS1_ELFLR0_EMLLn1_FDSI0_GRPM1_GRVWA8_GRVWB8_GSU1_GSUAMB_GSUC0_GSUWGMRR0_GLS0_ISA950_IU1_K1_LDSTI0_LBSPPA2048_LBSPPB128_LBSPPM0_LPA0_LPB8_LPM0_LRVW8_LWPMn1_MIAV0_MIWT4_6_MO40_MGRIPMn1_NTn1_NTA0_NTB0_NTC0_NTD4_NTM0_NEPBS0_NLCA1_NLCB1_ONLL1_PGR2_PLR0_PKA1_SGROBn1_SIA3_SS1_SU0_SUM0_SUS0_SPO0_SRVW0_SSO0_SVW4_SK0_SKFTR0_SKXCCM0_SGRO0_TIN0_TLDS1_TLDSM0_ULSGRO0_USL1_UIOFGRO0_USFGROn1_VSn1_VWA4_VWB2_WSGRA0_WSGRB0_WS64_WG32_4_1_WGM1_WGMXCC1_WGMXCCGn1
    SolutionIndex: 26
    SolutionNameMin: Cijk_Ailk_Bljk_BBS_BH_Bias_FDMN_SPB_A_S_SAV_MT128x96x64_MI16x16x1_SN_LDSB0_AFC1_AG0_AFEM1_AFEM1_ASEM8_CLR0_CADS0_DTLA0_DTLB0_DTVA0_DTVB0_DTVSM0_DPLBn1_EPS1_ELFLR0_EMLLn1_FDSI0_GRPM1_GRVWA8_GRVWB8_GSU1_GSUAMB_GSUC0_GSUWGMRR0_GLS0_ISA950_IU1_K1_LDSTI0_LBSPPA2048_LBSPPB128_LBSPPM0_LPA0_LPB8_LPM0_LRVW8_LWPMn1_MIAV0_MIWT4_6_MO40_MGRIPMn1_NTn1_NTA0_NTB0_NTC0_NTD4_NTM0_NEPBS0_NLCA1_NLCB1_ONLL1_PGR2_PLR0_PKA1_SGROBn1_SIA3_SS1_SU0_SUM0_SUS0_SPO0_SRVW0_SSO0_SVW4_SK0_SKFTR0_SKXCCM0_SGRO0_TIN0_TLDS1_TLDSM0_ULSGRO0_USL1_UIOFGRO0_USFGROn1_VSn1_VWA4_VWB2_WSGRA0_WSGRB0_WS64_WG32_4_1_WGM1_WGMXCC1_WGMXCCGn1
    SolutionIndex: 27
    SolutionNameMin: Cijk_Ailk_Bljk_BBS_BH_Bias_FDMN_SPB_A_S_SAV_MT64x128x128_MI16x16x1_SN_LDSB0_AFC1_AG0_AFEM1_AFEM1_ASEM8_CLR1_CADS0_DTLA0_DTLB0_DTVA0_DTVB0_DTVSM0_DPLBn1_EPS1_ELFLR0_EMLLn1_FDSI0_GRPM1_GRVWA8_GRVWB8_GSU1_GSUAMB_GSUC0_GSUWGMRR0_GLS0_ISA950_IU1_K1_LDSTI0_LBSPPA1024_LBSPPB256_LBSPPM0_LPA0_LPB8_LPM0_LRVW8_LWPMn1_MIAV0_MIWT4_2_MO40_MGRIPMn1_NTn1_NTA0_NTB0_NTC0_NTD4_NTM0_NEPBS0_NLCA1_NLCB1_ONLL1_PGR2_PLR1_PKA1_SGROBn1_SIA3_SS1_SU0_SUM0_SUS0_SPO0_SRVW0_SSO0_SVW4_SK0_SKFTR0_SKXCCM0_SGRO0_TIN0_TLDS1_TLDSM0_ULSGRO0_USL1_UIOFGRO0_USFGROn1_VSn1_VWA4_VWB2_WSGRA0_WSGRB0_WS64_WG16_16_1_WGM1_WGMXCC1_WGMXCCGn1
    SolutionIndex: 28
    SolutionNameMin: Cijk_Ailk_Bljk_BBS_BH_Bias_FDMN_SPB_A_S_SAV_MT128x192x64_MI16x16x1_SN_LDSB0_AFC1_AG0_AFEM1_AFEM1_ASEM8_CLR0_CADS0_DTLA0_DTLB0_DTVA0_DTVB0_DTVSM0_DPLBn1_EPS1_ELFLR0_EMLLn1_FDSI0_GRPM1_GRVWA8_GRVWB8_GSU1_GSUAMB_GSUC0_GSUWGMRR0_GLS0_ISA950_IU1_K1_LDSTI0_LBSPPA2048_LBSPPB256_LBSPPM0_LPA32_LPB8_LPM0_LRVW8_LWPMn1_MIAV0_MIWT2_12_MO40_MGRIPMn1_NTn1_NTA0_NTB0_NTC0_NTD4_NTM0_NEPBS0_NLCA1_NLCB1_ONLL1_PGR2_PLR0_PKA1_SGROBn1_SIA3_SS1_SU0_SUM0_SUS0_SPO0_SRVW0_SSO0_SVW2_SK0_SKFTR0_SKXCCM0_SGRO0_TIN0_TLDS1_TLDSM0_ULSGRO0_USL1_UIOFGRO0_USFGROn1_VSn1_VWA2_VWB4_WSGRA0_WSGRB0_WS64_WG64_4_1_WGM1_WGMXCC1_WGMXCCGn1
    SolutionIndex: 29
    SolutionNameMin: Cijk_Ailk_Bljk_BBS_BH_Bias_FDMN_SPB_A_S_SAV_MT256x256x64_MI16x16x1_SN_LDSB0_AFC1_AG0_AFEM1_AFEM1_ASEM8_CLR0_CADS0_DTLA0_DTLB0_DTVA0_DTVB0_DTVSM0_DPLBn1_EPS1_ELFLR0_EMLLn1_FDSI0_GRPM1_GRVWA8_GRVWB8_GSU1_GSUAMB_GSUC0_GSUWGMRR0_GLS0_ISA950_IU1_K1_LDSTI0_LBSPPA4096_LBSPPB256_LBSPPM0_LPA0_LPB8_LPM0_LRVW8_LWPMn1_MIAV0_MIWT8_8_MO40_MGRIPMn1_NTn1_NTA0_NTB0_NTC0_NTD4_NTM0_NEPBS0_NLCA1_NLCB1_ONLL1_PGR2_PLR0_PKA1_SGROBn1_SIA3_SS1_SU0_SUM0_SUS0_SPO0_SRVW0_SSO0_SVW8_SK0_SKFTR0_SKXCCM0_SGRO0_TIN0_TLDS1_TLDSM0_ULSGRO0_USL1_UIOFGRO0_USFGROn1_VSn1_VWA8_VWB4_WSGRA0_WSGRB0_WS64_WG32_8_1_WGM1_WGMXCC1_WGMXCCGn1
    SolutionIndex: 30
    SolutionNameMin: Cijk_Ailk_Bljk_BBS_BH_Bias_FDMN_SPB_A_S_SAV_MT256x256x64_MI32x32x1_SN_LDSB0_AFC1_AG0_AFEM1_AFEM1_ASEM8_CLR1_CADS0_DTLA0_DTLB0_DTVA0_DTVB0_DTVSM0_DPLBn1_EPS1_ELFLR0_EMLLn1_FDSI0_GRPM1_GRVWA8_GRVWB8_GSU1_GSUAMB_GSUC0_GSUWGMRR0_GLS0_ISA950_IU1_K1_LDSTI0_LBSPPA0_LBSPPB256_LBSPPM0_LPA0_LPB8_LPM0_LRVW8_LWPMn1_MIAV0_MIWT4_4_MO40_MGRIPMn1_NTn1_NTA0_NTB0_NTC0_NTD0_NTM0_NEPBS0_NLCA1_NLCB1_ONLL1_PGR2_PLR1_PKA1_SGROBn1_SIA3_SS1_SU0_SUM0_SUS0_SPO0_SRVW0_SSO0_SVW4_SK0_SKFTR0_SKXCCM0_SGRO0_TIN0_TLDS1_TLDSM0_ULSGRO0_USL1_UIOFGRO0_USFGROn1_VSn1_VWA4_VWB4_WSGRA0_WSGRB0_WS64_WG64_4_1_WGM8_WGMXCC8_WGMXCCGn1
    SolutionIndex: 31
    SolutionNameMin: Cijk_Ailk_Bljk_BBS_BH_Bias_FDMN_SPB_A_S_SAV_MT256x256x64_MI32x32x1_SN_LDSB0_AFC1_AG0_AFEM1_AFEM1_ASEM8_CLR1_CADS0_DTLA0_DTLB0_DTVA0_DTVB0_DTVSM0_DPLBn1_EPS1_ELFLR0_EMLLn1_FDSI0_GRPM1_GRVWA8_GRVWB8_GSU1_GSUAMB_GSUC0_GSUWGMRR0_GLS0_ISA950_IU1_K1_LDSTI0_LBSPPA0_LBSPPB128_LBSPPM0_LPA0_LPB8_LPM0_LRVW8_LWPMn1_MIAV0_MIWT4_4_MO40_MGRIPMn1_NTn1_NTA0_NTB0_NTC0_NTD4_NTM0_NEPBS0_NLCA1_NLCB1_ONLL1_PGR2_PLR1_PKA1_SGROBn1_SIA3_SS1_SU0_SUM0_SUS0_SPO0_SRVW0_SSO0_SVW4_SK0_SKFTR0_SKXCCM0_SGRO0_TIN0_TLDS1_TLDSM0_ULSGRO0_USL1_UIOFGRO0_USFGROn1_VSn1_VWA4_VWB2_WSGRA0_WSGRB0_WS64_WG64_4_1_WGM8_WGMXCC8_WGMXCCGn1
    SolutionIndex: 32
    SolutionNameMin: Cijk_Ailk_Bljk_BBS_BH_Bias_FDMN_SPB_A_S_SAV_MT256x256x64_MI16x16x1_SN_LDSB0_AFC1_AG0_AFEM1_AFEM1_ASEM8_CLR0_CADS0_DTLA0_DTLB0_DTVA0_DTVB0_DTVSM0_DPLBn1_EPS0_ELFLR0_EMLLn1_FDSI0_GRPM1_GRVWA8_GRVWB8_GSUn1_GSUAMB_GSUC0_GSUWGMRR0_GLS0_ISA950_IU1_K1_LDSTI0_LBSPPA0_LBSPPB128_LBSPPM0_LPA0_LPB8_LPM0_LRVW8_LWPMn1_MIAV0_MIWT8_8_MO40_MGRIPMn1_NTn1_NTA0_NTB0_NTC0_NTD4_NTM0_NEPBS0_NLCA1_NLCB1_ONLL1_PGR2_PLR0_PKA1_SGROBn1_SIA3_SS1_SU8_SUM0_SUS256_SPO0_SRVW0_SSO0_SVW8_SK0_SKFTR0_SKXCCM0_SGRO0_TIN0_TLDS1_TLDSM1_ULSGRO0_USL1_UIOFGRO0_USFGROn1_VSn1_VWA8_VWB2_WSGRA0_WSGRB0_WS64_WG32_8_1_WGM8_WGMXCC8_WGMXCCGn1
    SolutionIndex: 33
    SolutionNameMin: Cijk_Ailk_Bljk_BBS_BH_Bias_FDMN_SPB_A_S_SAV_MT256x256x64_MI16x16x1_SN_LDSB0_AFC1_AG0_AFEM1_AFEM1_ASEM8_CLR0_CADS0_DTLA0_DTLB0_DTVA0_DTVB0_DTVSM0_DPLB0_EPS0_ELFLR0_EMLLn1_FDSI0_GRPM1_GRVWA8_GRVWB8_GSUn1_GSUAMB_GSUC0_GSUWGMRR0_GLS0_ISA950_IU1_K1_LDSTI0_LBSPPA0_LBSPPB128_LBSPPM0_LPA0_LPB8_LPM0_LRVW8_LWPMn1_MIAV0_MIWT4_16_MO40_MGRIPM1_NTn1_NTA0_NTB0_NTC0_NTD4_NTM0_NEPBS0_NLCA1_NLCB1_ONLL1_PGR2_PLR0_PKA1_SGROB0_SIA3_SS1_SU8_SUM0_SUS256_SPO0_SRVW0_SSO0_SVW4_SK0_SKFTR0_SKXCCM0_SGRO0_TIN0_TLDS1_TLDSM1_ULSGRO0_USL1_UIOFGRO0_USFGROn1_VSn1_VWA4_VWB2_WSGRA0_WSGRB0_WS64_WG64_4_1_WGM8_WGMXCC8_WGMXCCGn1
    SolutionIndex: 34
    SolutionNameMin: Cijk_Ailk_Bljk_BBS_BH_Bias_FDMN_SPB_A_S_SAV_MT256x256x64_MI32x32x1_SN_LDSB0_AFC1_AG0_AFEM1_AFEM1_ASEM8_CLR1_CADS0_DTLA0_DTLB0_DTVA0_DTVB0_DTVSM0_DPLB0_EPS0_ELFLR0_EMLLn1_FDSI0_GRPM1_GRVWA8_GRVWB8_GSUn1_GSUAMB_GSUC0_GSUWGMRR0_GLS0_ISA950_IU1_K1_LDSTI0_LBSPPA0_LBSPPB128_LBSPPM0_LPA0_LPB8_LPM0_LRVW8_LWPMn1_MIAV0_MIWT4_4_MO40_MGRIPM1_NTn1_NTA0_NTB0_NTC0_NTD4_NTM0_NEPBS0_NLCA1_NLCB1_ONLL1_PGR2_PLR1_PKA1_SGROB0_SIA3_SS1_SU0_SUM0_SUS0_SPO0_SRVW0_SSO0_SVW4_SK0_SKFTR0_SKXCCM0_SGRO0_TIN0_TLDS1_TLDSM1_ULSGRO0_USL1_UIOFGRO0_USFGROn1_VSn1_VWA4_VWB1_WSGRA0_WSGRB0_WS64_WG64_4_1_WGM1_WGMXCC1_WGMXCCGn1
    SolutionIndex: 35
    SolutionNameMin: Cijk_Ailk_Bljk_BBS_BH_Bias_FDMN_SPB_A_S_SAV_MT256x256x64_MI16x16x1_SN_LDSB0_AFC1_AG0_AFEM1_AFEM1_ASEM8_CLR0_CADS0_DTLA0_DTLB0_DTVA0_DTVB0_DTVSM0_DPLB0_EPS0_ELFLR0_EMLLn1_FDSI0_GRPM1_GRVWA8_GRVWB8_GSUn1_GSUAMB_GSUC0_GSUWGMRR0_GLS0_ISA950_IU1_K1_LDSTI0_LBSPPA0_LBSPPB256_LBSPPM0_LPA0_LPB8_LPM0_LRVW8_LWPMn1_MIAV0_MIWT8_8_MO40_MGRIPM1_NTn1_NTA0_NTB0_NTC0_NTD4_NTM0_NEPBS0_NLCA1_NLCB1_ONLL1_PGR2_PLR0_PKA1_SGROB0_SIA3_SS1_SU8_SUM0_SUS256_SPO0_SRVW0_SSO0_SVW8_SK0_SKFTR0_SKXCCM0_SGRO0_TIN0_TLDS1_TLDSM1_ULSGRO0_USL1_UIOFGRO0_USFGROn1_VSn1_VWA8_VWB4_WSGRA0_WSGRB0_WS64_WG32_8_1_WGM8_WGMXCC8_WGMXCCGn1
    SolutionIndex: 36
    SolutionNameMin: Cijk_Ailk_Bljk_BBS_BH_Bias_FDMN_SPB_A_S_SAV_MT256x256x64_MI16x16x1_SN_LDSB0_AFC1_AG0_AFEM1_AFEM1_ASEM8_CLR0_CADS0_DTLA0_DTLB0_DTVA0_DTVB0_DTVSM0_DPLB0_EPS0_ELFLR0_EMLLn1_FDSI0_GRPM1_GRVWA8_GRVWB8_GSUn1_GSUAMB_GSUC0_GSUWGMRR0_GLS0_ISA950_IU1_K1_LDSTI0_LBSPPA0_LBSPPB128_LBSPPM0_LPA0_LPB8_LPM0_LRVW8_LWPMn1_MIAV0_MIWT8_8_MO40_MGRIPM1_NTn1_NTA0_NTB0_NTC0_NTD4_NTM0_NEPBS0_NLCA1_NLCB1_ONLL1_PGR2_PLR0_PKA1_SGROB0_SIA3_SS1_SU8_SUM0_SUS256_SPO0_SRVW0_SSO0_SVW8_SK0_SKFTR0_SKXCCM0_SGRO0_TIN0_TLDS1_TLDSM1_ULSGRO0_USL1_UIOFGRO0_USFGROn1_VSn1_VWA8_VWB1_WSGRA0_WSGRB0_WS64_WG32_8_1_WGM1_WGMXCC1_WGMXCCGn1
    SolutionIndex: 37
    SolutionNameMin: Cijk_Ailk_Bljk_BBS_BH_Bias_FDMN_SPB_A_S_SAV_MT256x256x64_MI32x32x1_SN_LDSB0_AFC1_AG0_AFEM1_AFEM1_ASEM8_CLR1_CADS0_DTLA0_DTLB0_DTVA0_DTVB0_DTVSM0_DPLB0_EPS0_ELFLR0_EMLLn1_FDSI0_GRPM1_GRVWA2_GRVWB8_GSUn1_GSUAMB_GSUC0_GSUWGMRR0_GLS0_ISA950_IU1_K1_LDSTI0_LBSPPA0_LBSPPB128_LBSPPM0_LPA0_LPB8_LPM0_LRVW8_LWPMn1_MIAV0_MIWT4_4_MO40_MGRIPM1_NTn1_NTA0_NTB0_NTC0_NTD4_NTM0_NEPBS0_NLCA1_NLCB1_ONLL1_PGR2_PLR1_PKA1_SGROB0_SIA3_SS1_SU0_SUM0_SUS0_SPO0_SRVW0_SSO0_SVW4_SK0_SKFTR0_SKXCCM0_SGRO0_TIN0_TLDS1_TLDSM1_ULSGRO0_USL1_UIOFGRO0_USFGROn1_VSn1_VWA4_VWB2_WSGRA0_WSGRB0_WS64_WG64_4_1_WGM8_WGMXCC8_WGMXCCGn1
    SolutionIndex: 38
    SolutionNameMin: Cijk_Ailk_Bljk_BBS_BH_Bias_FDMN_SPB_A_S_SAV_MT256x256x64_MI16x16x1_SN_LDSB0_AFC1_AG0_AFEM1_AFEM1_ASEM8_CLR0_CADS0_DTLA0_DTLB0_DTVA0_DTVB0_DTVSM0_DPLB0_EPS0_ELFLR0_EMLLn1_FDSI0_GRPM1_GRVWA8_GRVWB8_GSUn1_GSUAMB_GSUC0_GSUWGMRR0_GLS0_ISA950_IU1_K1_LDSTI0_LBSPPA0_LBSPPB128_LBSPPM0_LPA0_LPB8_LPM0_LRVW8_LWPMn1_MIAV0_MIWT8_8_MO40_MGRIPM1_NTn1_NTA0_NTB0_NTC0_NTD4_NTM0_NEPBS0_NLCA1_NLCB1_ONLL1_PGR2_PLR0_PKA1_SGROB0_SIA3_SS1_SU0_SUM0_SUS0_SPO0_SRVW0_SSO0_SVW8_SK0_SKFTR0_SKXCCM0_SGRO0_TIN0_TLDS1_TLDSM1_ULSGRO0_USL1_UIOFGRO0_USFGROn1_VSn1_VWA8_VWB1_WSGRA0_WSGRB0_WS64_WG32_8_1_WGM8_WGMXCC8_WGMXCCGn1
    SolutionIndex: 39
    SolutionNameMin: Cijk_Ailk_Bljk_BBS_BH_Bias_FDMN_SPB_A_S_SAV_MT256x256x64_MI32x32x1_SN_LDSB0_AFC1_AG0_AFEM1_AFEM1_ASEM8_CLR1_CADS0_DTLA0_DTLB0_DTVA0_DTVB0_DTVSM0_DPLB0_EPS0_ELFLR0_EMLLn1_FDSI0_GRPM1_GRVWA2_GRVWB8_GSUn1_GSUAMB_GSUC0_GSUWGMRR0_GLS0_ISA950_IU1_K1_LDSTI0_LBSPPA0_LBSPPB128_LBSPPM0_LPA0_LPB8_LPM0_LRVW8_LWPMn1_MIAV0_MIWT4_4_MO40_MGRIPM1_NTn1_NTA0_NTB0_NTC0_NTD4_NTM0_NEPBS0_NLCA1_NLCB1_ONLL1_PGR2_PLR1_PKA1_SGROB0_SIA3_SS1_SU0_SUM0_SUS0_SPO0_SRVW0_SSO0_SVW4_SK0_SKFTR0_SKXCCM0_SGRO0_TIN0_TLDS1_TLDSM1_ULSGRO0_USL1_UIOFGRO0_USFGROn1_VSn1_VWA4_VWB1_WSGRA0_WSGRB0_WS64_WG64_4_1_WGM8_WGMXCC8_WGMXCCGn1
    SolutionIndex: 40
    SolutionNameMin: Cijk_Ailk_Bljk_BBS_BH_Bias_FDMN_SPB_A_S_SAV_MT256x256x64_MI16x16x1_SN_LDSB0_AFC1_AG0_AFEM1_AFEM1_ASEM8_CLR0_CADS0_DTLA0_DTLB0_DTVA0_DTVB0_DTVSM0_DPLB0_EPS0_ELFLR0_EMLLn1_FDSI0_GRPM1_GRVWA8_GRVWB8_GSUn1_GSUAMB_GSUC0_GSUWGMRR0_GLS0_ISA950_IU1_K1_LDSTI0_LBSPPA0_LBSPPB128_LBSPPM0_LPA0_LPB8_LPM0_LRVW8_LWPMn1_MIAV0_MIWT4_16_MO40_MGRIPM1_NTn1_NTA0_NTB0_NTC0_NTD4_NTM0_NEPBS0_NLCA1_NLCB1_ONLL1_PGR2_PLR0_PKA1_SGROB0_SIA3_SS1_SU16_SUM0_SUS256_SPO0_SRVW0_SSO0_SVW4_SK0_SKFTR0_SKXCCM0_SGRO0_TIN0_TLDS1_TLDSM1_ULSGRO0_USL1_UIOFGRO0_USFGROn1_VSn1_VWA4_VWB2_WSGRA0_WSGRB0_WS64_WG64_4_1_WGM8_WGMXCC8_WGMXCCGn1
    SolutionIndex: 41
    SolutionNameMin: Cijk_Ailk_Bljk_BBS_BH_Bias_FDMN_SPB_A_S_SAV_MT256x256x64_MI32x32x1_SN_LDSB0_AFC1_AG0_AFEM1_AFEM1_ASEM8_CLR1_CADS0_DTLA0_DTLB0_DTVA0_DTVB0_DTVSM0_DPLB0_EPS0_ELFLR0_EMLLn1_FDSI0_GRPM1_GRVWA8_GRVWB8_GSUn1_GSUAMB_GSUC0_GSUWGMRR0_GLS0_ISA950_IU1_K1_LDSTI0_LBSPPA0_LBSPPB128_LBSPPM0_LPA0_LPB8_LPM0_LRVW8_LWPMn1_MIAV0_MIWT4_4_MO40_MGRIPM1_NTn1_NTA0_NTB0_NTC0_NTD4_NTM0_NEPBS0_NLCA1_NLCB1_ONLL1_PGR2_PLR1_PKA1_SGROB0_SIA3_SS1_SU8_SUM0_SUS256_SPO0_SRVW0_SSO0_SVW4_SK0_SKFTR0_SKXCCM0_SGRO0_TIN0_TLDS1_TLDSM1_ULSGRO0_USL1_UIOFGRO0_USFGROn1_VSn1_VWA4_VWB2_WSGRA0_WSGRB0_WS64_WG64_4_1_WGM8_WGMXCC8_WGMXCCGn1
    SolutionIndex: 42
    SolutionNameMin: Cijk_Ailk_Bljk_BBS_BH_Bias_FDMN_SPB_A_S_SAV_MT256x256x64_MI32x32x1_SN_LDSB0_AFC1_AG0_AFEM1_AFEM1_ASEM8_CLR1_CADS0_DTLA0_DTLB0_DTVA0_DTVB0_DTVSM0_DPLB0_EPS0_ELFLR0_EMLLn1_FDSI0_GRPM1_GRVWA8_GRVWB8_GSUn1_GSUAMB_GSUC0_GSUWGMRR0_GLS0_ISA950_IU1_K1_LDSTI0_LBSPPA0_LBSPPB128_LBSPPM0_LPA0_LPB8_LPM0_LRVW8_LWPMn1_MIAV0_MIWT4_4_MO40_MGRIPM1_NTn1_NTA0_NTB0_NTC0_NTD4_NTM0_NEPBS0_NLCA1_NLCB1_ONLL1_PGR2_PLR1_PKA1_SGROB0_SIA3_SS1_SU0_SUM0_SUS0_SPO0_SRVW0_SSO0_SVW4_SK0_SKFTR0_SKXCCM0_SGRO0_TIN0_TLDS1_TLDSM1_ULSGRO0_USL1_UIOFGRO0_USFGROn1_VSn1_VWA4_VWB2_WSGRA0_WSGRB0_WS64_WG64_4_1_WGM1_WGMXCC1_WGMXCCGn1
    SolutionIndex: 43
    SolutionNameMin: Cijk_Ailk_Bljk_BBS_BH_Bias_FDMN_SPB_A_S_SAV_MT256x256x64_MI32x32x1_SN_LDSB0_AFC1_AG0_AFEM1_AFEM1_ASEM8_CLR1_CADS0_DTLA0_DTLB0_DTVA0_DTVB0_DTVSM0_DPLB0_EPS0_ELFLR0_EMLLn1_FDSI0_GRPM1_GRVWA2_GRVWB8_GSUn1_GSUAMB_GSUC0_GSUWGMRR0_GLS0_ISA950_IU1_K1_LDSTI0_LBSPPA0_LBSPPB128_LBSPPM0_LPA0_LPB8_LPM0_LRVW8_LWPMn1_MIAV0_MIWT4_4_MO40_MGRIPM1_NTn1_NTA0_NTB0_NTC0_NTD4_NTM0_NEPBS0_NLCA1_NLCB1_ONLL1_PGR2_PLR1_PKA1_SGROB0_SIA3_SS1_SU8_SUM0_SUS256_SPO0_SRVW0_SSO0_SVW4_SK0_SKFTR0_SKXCCM0_SGRO0_TIN0_TLDS1_TLDSM1_ULSGRO0_USL1_UIOFGRO0_USFGROn1_VSn1_VWA4_VWB2_WSGRA0_WSGRB0_WS64_WG64_4_1_WGM1_WGMXCC1_WGMXCCGn1
    SolutionIndex: 44
    SolutionNameMin: Cijk_Ailk_Bljk_BBS_BH_Bias_FDMN_SPB_A_S_SAV_MT256x256x64_MI16x16x1_SN_LDSB0_AFC1_AG0_AFEM1_AFEM1_ASEM8_CLR0_CADS0_DTLA0_DTLB0_DTVA0_DTVB0_DTVSM0_DPLB0_EPS0_ELFLR0_EMLLn1_FDSI0_GRPM1_GRVWA2_GRVWB8_GSUn1_GSUAMB_GSUC0_GSUWGMRR0_GLS0_ISA950_IU1_K1_LDSTI0_LBSPPA0_LBSPPB128_LBSPPM0_LPA0_LPB8_LPM0_LRVW8_LWPMn1_MIAV0_MIWT4_16_MO40_MGRIPM1_NTn1_NTA0_NTB0_NTC0_NTD4_NTM0_NEPBS0_NLCA1_NLCB1_ONLL1_PGR2_PLR0_PKA1_SGROB0_SIA3_SS1_SU8_SUM0_SUS256_SPO0_SRVW0_SSO0_SVW4_SK0_SKFTR0_SKXCCM0_SGRO0_TIN0_TLDS1_TLDSM1_ULSGRO0_USL1_UIOFGRO0_USFGROn1_VSn1_VWA4_VWB2_WSGRA0_WSGRB0_WS64_WG64_4_1_WGM8_WGMXCC8_WGMXCCGn1
    SolutionIndex: 45
    SolutionNameMin: Cijk_Ailk_Bljk_BBS_BH_Bias_FDMN_SPB_A_S_SAV_MT256x256x64_MI16x16x1_SN_LDSB0_AFC1_AG0_AFEM1_AFEM1_ASEM8_CLR0_CADS0_DTLA0_DTLB0_DTVA0_DTVB0_DTVSM0_DPLB0_EPS0_ELFLR0_EMLLn1_FDSI0_GRPM1_GRVWA2_GRVWB8_GSUn1_GSUAMB_GSUC0_GSUWGMRR0_GLS0_ISA950_IU1_K1_LDSTI0_LBSPPA0_LBSPPB128_LBSPPM0_LPA0_LPB8_LPM0_LRVW8_LWPMn1_MIAV0_MIWT4_16_MO40_MGRIPM1_NTn1_NTA0_NTB0_NTC0_NTD4_NTM0_NEPBS0_NLCA1_NLCB1_ONLL1_PGR2_PLR0_PKA1_SGROB0_SIA3_SS1_SU16_SUM0_SUS256_SPO0_SRVW0_SSO0_SVW4_SK0_SKFTR0_SKXCCM0_SGRO0_TIN0_TLDS1_TLDSM1_ULSGRO0_USL1_UIOFGRO0_USFGROn1_VSn1_VWA4_VWB2_WSGRA0_WSGRB0_WS64_WG64_4_1_WGM8_WGMXCC8_WGMXCCGn1
    SolutionIndex: 46
    SolutionNameMin: Cijk_Ailk_Bljk_BBS_BH_Bias_FDMN_SPB_A_S_SAV_MT256x256x64_MI16x16x1_SN_LDSB0_AFC1_AG0_AFEM1_AFEM1_ASEM8_CLR0_CADS0_DTLA0_DTLB0_DTVA0_DTVB0_DTVSM0_DPLB0_EPS0_ELFLR0_EMLLn1_FDSI0_GRPM1_GRVWA8_GRVWB8_GSUn1_GSUAMB_GSUC0_GSUWGMRR0_GLS0_ISA950_IU1_K1_LDSTI0_LBSPPA0_LBSPPB128_LBSPPM0_LPA0_LPB8_LPM0_LRVW8_LWPMn1_MIAV0_MIWT4_16_MO40_MGRIPM1_NTn1_NTA0_NTB0_NTC0_NTD0_NTM0_NEPBS0_NLCA1_NLCB1_ONLL1_PGR2_PLR0_PKA1_SGROB0_SIA3_SS1_SU8_SUM0_SUS256_SPO0_SRVW0_SSO0_SVW4_SK0_SKFTR0_SKXCCM0_SGRO0_TIN0_TLDS1_TLDSM1_ULSGRO0_USL1_UIOFGRO0_USFGROn1_VSn1_VWA4_VWB2_WSGRA0_WSGRB0_WS64_WG64_4_1_WGM8_WGMXCC8_WGMXCCGn1
    SolutionIndex: 47
    SolutionNameMin: Cijk_Ailk_Bljk_BBS_BH_Bias_FDMN_SPB_A_S_SAV_MT256x256x64_MI16x16x1_SN_LDSB0_AFC1_AG0_AFEM1_AFEM1_ASEM8_CLR0_CADS0_DTLA0_DTLB0_DTVA0_DTVB0_DTVSM0_DPLB0_EPS0_ELFLR0_EMLLn1_FDSI0_GRPM1_GRVWA8_GRVWB8_GSUn1_GSUAMB_GSUC0_GSUWGMRR0_GLS0_ISA950_IU1_K1_LDSTI0_LBSPPA0_LBSPPB128_LBSPPM0_LPA0_LPB8_LPM0_LRVW8_LWPMn1_MIAV0_MIWT8_8_MO40_MGRIPM1_NTn1_NTA0_NTB0_NTC0_NTD4_NTM0_NEPBS0_NLCA1_NLCB1_ONLL1_PGR2_PLR0_PKA1_SGROB0_SIA3_SS1_SU0_SUM0_SUS0_SPO0_SRVW0_SSO0_SVW8_SK0_SKFTR0_SKXCCM0_SGRO0_TIN0_TLDS1_TLDSM1_ULSGRO0_USL1_UIOFGRO0_USFGROn1_VSn1_VWA8_VWB2_WSGRA0_WSGRB0_WS64_WG32_8_1_WGM8_WGMXCC8_WGMXCCGn1
    SolutionIndex: 48
    SolutionNameMin: Cijk_Ailk_Bljk_BBS_BH_Bias_FDMN_SPB_A_S_SAV_MT256x256x64_MI16x16x1_SN_LDSB0_AFC1_AG0_AFEM1_AFEM1_ASEM8_CLR0_CADS0_DTLA0_DTLB0_DTVA0_DTVB0_DTVSM0_DPLB0_EPS0_ELFLR0_EMLLn1_FDSI0_GRPM1_GRVWA8_GRVWB8_GSUn1_GSUAMB_GSUC0_GSUWGMRR0_GLS0_ISA950_IU1_K1_LDSTI0_LBSPPA0_LBSPPB128_LBSPPM0_LPA0_LPB8_LPM0_LRVW8_LWPMn1_MIAV0_MIWT4_16_MO40_MGRIPM1_NTn1_NTA0_NTB0_NTC0_NTD4_NTM0_NEPBS0_NLCA1_NLCB1_ONLL1_PGR2_PLR0_PKA1_SGROB0_SIA3_SS1_SU0_SUM0_SUS0_SPO0_SRVW0_SSO0_SVW4_SK0_SKFTR0_SKXCCM0_SGRO0_TIN0_TLDS1_TLDSM1_ULSGRO0_USL1_UIOFGRO0_USFGROn1_VSn1_VWA4_VWB2_WSGRA0_WSGRB0_WS64_WG64_4_1_WGM1_WGMXCC1_WGMXCCGn1
    SolutionIndex: 49
    SolutionNameMin: Cijk_Ailk_Bljk_BBS_BH_Bias_FDMN_SPB_A_S_SAV_MT256x256x64_MI16x16x1_SN_LDSB0_AFC1_AG0_AFEM1_AFEM1_ASEM8_CLR0_CADS0_DTLA0_DTLB0_DTVA0_DTVB0_DTVSM0_DPLB0_EPS0_ELFLR0_EMLLn1_FDSI0_GRPM1_GRVWA8_GRVWB8_GSUn1_GSUAMB_GSUC0_GSUWGMRR0_GLS0_ISA950_IU1_K1_LDSTI0_LBSPPA4096_LBSPPB128_LBSPPM0_LPA32_LPB8_LPM0_LRVW8_LWPMn1_MIAV0_MIWT4_16_MO40_MGRIPM1_NTn1_NTA0_NTB0_NTC0_NTD4_NTM0_NEPBS0_NLCA1_NLCB1_ONLL1_PGR2_PLR0_PKA1_SGROB0_SIA3_SS1_SU8_SUM0_SUS256_SPO0_SRVW0_SSO0_SVW2_SK0_SKFTR0_SKXCCM0_SGRO0_TIN0_TLDS1_TLDSM1_ULSGRO0_USL1_UIOFGRO0_USFGROn1_VSn1_VWA2_VWB2_WSGRA0_WSGRB0_WS64_WG64_4_1_WGM1_WGMXCC1_WGMXCCGn1
    SolutionIndex: 50
    SolutionNameMin: Cijk_Ailk_Bljk_BBS_BH_Bias_FDMN_SPB_A_S_SAV_MT256x256x64_MI16x16x1_SN_LDSB0_AFC1_AG0_AFEM1_AFEM1_ASEM8_CLR0_CADS0_DTLA0_DTLB0_DTVA0_DTVB0_DTVSM0_DPLB0_EPS0_ELFLR0_EMLLn1_FDSI0_GRPM1_GRVWA8_GRVWB8_GSUn1_GSUAMB_GSUC0_GSUWGMRR0_GLS0_ISA950_IU1_K1_LDSTI0_LBSPPA0_LBSPPB128_LBSPPM0_LPA0_LPB8_LPM0_LRVW8_LWPMn1_MIAV0_MIWT4_16_MO40_MGRIPM1_NTn1_NTA0_NTB0_NTC0_NTD4_NTM0_NEPBS0_NLCA1_NLCB1_ONLL1_PGR2_PLR0_PKA1_SGROB0_SIA3_SS1_SU0_SUM0_SUS0_SPO0_SRVW0_SSO0_SVW4_SK0_SKFTR0_SKXCCM0_SGRO0_TIN0_TLDS1_TLDSM1_ULSGRO0_USL1_UIOFGRO0_USFGROn1_VSn1_VWA4_VWB2_WSGRA0_WSGRB0_WS64_WG64_4_1_WGM8_WGMXCC8_WGMXCCGn1
    SolutionIndex: 51
    SolutionNameMin: Cijk_Ailk_Bljk_BBS_BH_Bias_FDMN_SPB_A_S_SAV_MT256x256x64_MI32x32x1_SN_LDSB0_AFC1_AG0_AFEM1_AFEM1_ASEM8_CLR1_CADS0_DTLA0_DTLB0_DTVA0_DTVB0_DTVSM0_DPLB0_EPS0_ELFLR0_EMLLn1_FDSI0_GRPM1_GRVWA2_GRVWB8_GSUn1_GSUAMB_GSUC0_GSUWGMRR0_GLS0_ISA950_IU1_K1_LDSTI0_LBSPPA0_LBSPPB128_LBSPPM0_LPA0_LPB8_LPM0_LRVW8_LWPMn1_MIAV0_MIWT4_4_MO40_MGRIPM1_NTn1_NTA0_NTB0_NTC0_NTD0_NTM0_NEPBS0_NLCA1_NLCB1_ONLL1_PGR2_PLR1_PKA1_SGROB0_SIA3_SS1_SU8_SUM0_SUS256_SPO0_SRVW0_SSO0_SVW4_SK0_SKFTR0_SKXCCM0_SGRO0_TIN0_TLDS1_TLDSM1_ULSGRO0_USL1_UIOFGRO0_USFGROn1_VSn1_VWA4_VWB2_WSGRA0_WSGRB0_WS64_WG64_4_1_WGM8_WGMXCC8_WGMXCCGn1
    SolutionIndex: 52
    SolutionNameMin: Cijk_Ailk_Bljk_BBS_BH_Bias_FDMN_SPB_A_S_SAV_MT256x256x64_MI16x16x1_SN_LDSB0_AFC1_AG0_AFEM1_AFEM1_ASEM8_CLR0_CADS0_DTLA0_DTLB0_DTVA0_DTVB0_DTVSM0_DPLB0_EPS0_ELFLR0_EMLLn1_FDSI0_GRPM1_GRVWA8_GRVWB8_GSUn1_GSUAMB_GSUC0_GSUWGMRR0_GLS0_ISA950_IU1_K1_LDSTI0_LBSPPA0_LBSPPB256_LBSPPM0_LPA0_LPB8_LPM0_LRVW8_LWPMn1_MIAV0_MIWT8_8_MO40_MGRIPM1_NTn1_NTA0_NTB0_NTC0_NTD0_NTM0_NEPBS0_NLCA1_NLCB1_ONLL1_PGR2_PLR0_PKA1_SGROB0_SIA3_SS1_SU8_SUM0_SUS256_SPO0_SRVW0_SSO0_SVW8_SK0_SKFTR0_SKXCCM0_SGRO0_TIN0_TLDS1_TLDSM1_ULSGRO0_USL1_UIOFGRO0_USFGROn1_VSn1_VWA8_VWB4_WSGRA0_WSGRB0_WS64_WG32_8_1_WGM8_WGMXCC8_WGMXCCGn1
    SolutionIndex: 53
    SolutionNameMin: Cijk_Ailk_Bljk_BBS_BH_Bias_FDMN_SPB_A_S_SAV_MT256x256x64_MI16x16x1_SN_LDSB0_AFC1_AG0_AFEM1_AFEM1_ASEM8_CLR0_CADS0_DTLA0_DTLB0_DTVA0_DTVB0_DTVSM0_DPLB0_EPS0_ELFLR0_EMLLn1_FDSI0_GRPM1_GRVWA2_GRVWB8_GSUn1_GSUAMB_GSUC0_GSUWGMRR0_GLS0_ISA950_IU1_K1_LDSTI0_LBSPPA0_LBSPPB256_LBSPPM0_LPA0_LPB8_LPM0_LRVW8_LWPMn1_MIAV0_MIWT4_16_MO40_MGRIPM1_NTn1_NTA0_NTB0_NTC0_NTD0_NTM0_NEPBS0_NLCA1_NLCB1_ONLL1_PGR2_PLR0_PKA1_SGROB0_SIA3_SS1_SU0_SUM0_SUS0_SPO0_SRVW0_SSO0_SVW4_SK0_SKFTR0_SKXCCM0_SGRO0_TIN0_TLDS1_TLDSM1_ULSGRO0_USL1_UIOFGRO0_USFGROn1_VSn1_VWA4_VWB4_WSGRA0_WSGRB0_WS64_WG64_4_1_WGM1_WGMXCC1_WGMXCCGn1
    SolutionIndex: 54
    SolutionNameMin: Cijk_Ailk_Bljk_BBS_BH_Bias_FDMN_SPB_A_S_SAV_MT256x256x64_MI16x16x1_SN_LDSB0_AFC1_AG0_AFEM1_AFEM1_ASEM8_CLR0_CADS0_DTLA0_DTLB0_DTVA0_DTVB0_DTVSM0_DPLB0_EPS0_ELFLR0_EMLLn1_FDSI0_GRPM1_GRVWA2_GRVWB8_GSUn1_GSUAMB_GSUC0_GSUWGMRR0_GLS0_ISA950_IU1_K1_LDSTI0_LBSPPA0_LBSPPB128_LBSPPM0_LPA0_LPB8_LPM0_LRVW8_LWPMn1_MIAV0_MIWT4_16_MO40_MGRIPM1_NTn1_NTA0_NTB0_NTC0_NTD0_NTM0_NEPBS0_NLCA1_NLCB1_ONLL1_PGR2_PLR0_PKA1_SGROB0_SIA3_SS1_SU0_SUM0_SUS0_SPO0_SRVW0_SSO0_SVW4_SK0_SKFTR0_SKXCCM0_SGRO0_TIN0_TLDS1_TLDSM1_ULSGRO0_USL1_UIOFGRO0_USFGROn1_VSn1_VWA4_VWB2_WSGRA0_WSGRB0_WS64_WG64_4_1_WGM8_WGMXCC8_WGMXCCGn1
    SolutionIndex: 55
    SolutionNameMin: Cijk_Ailk_Bljk_BBS_BH_Bias_FDMN_SPB_A_S_SAV_MT192x256x64_MI16x16x1_SN_LDSB0_AFC1_AG0_AFEM1_AFEM1_ASEM8_CLR0_CADS0_DTLA0_DTLB0_DTVA0_DTVB0_DTVSM0_DPLB0_EPS0_ELFLR0_EMLLn1_FDSI0_GRPM1_GRVWA8_GRVWB8_GSUn1_GSUAMB_GSUC0_GSUWGMRR0_GLS0_ISA950_IU1_K1_LDSTI1_LBSPPA3072_LBSPPB128_LBSPPM0_LPA16_LPB8_LPM0_LRVW8_LWPMn1_MIAV0_MIWT6_8_MO40_MGRIPM1_NTn1_NTA0_NTB0_NTC0_NTD4_NTM0_NEPBS0_NLCA3_NLCB1_ONLL1_PGR2_PLR0_PKA1_SGROB0_SIA3_SS1_SU0_SUM0_SUS0_SPO0_SRVW0_SSO0_SVW1_SK0_SKFTR0_SKXCCM0_SGRO0_TIN0_TLDS1_TLDSM1_ULSGRO0_USL1_UIOFGRO0_USFGROn1_VSn1_VWA1_VWB1_WSGRA0_WSGRB0_WS64_WG32_8_1_WGM8_WGMXCC8_WGMXCCGn1
    SolutionIndex: 56
    SolutionNameMin: Cijk_Ailk_Bljk_BBS_BH_Bias_FDMN_SPB_A_S_SAV_MT192x192x64_MI16x16x1_SN_LDSB0_AFC1_AG0_AFEM1_AFEM1_ASEM8_CLR0_CADS0_DTLA0_DTLB0_DTVA0_DTVB0_DTVSM0_DPLB0_EPS0_ELFLR0_EMLLn1_FDSI0_GRPM1_GRVWA2_GRVWB8_GSUn1_GSUAMB_GSUC0_GSUWGMRR0_GLS0_ISA950_IU1_K1_LDSTI1_LBSPPA3072_LBSPPB128_LBSPPM0_LPA16_LPB8_LPM0_LRVW8_LWPMn1_MIAV0_MIWT6_6_MO40_MGRIPM1_NTn1_NTA0_NTB0_NTC0_NTD4_NTM0_NEPBS0_NLCA3_NLCB1_ONLL1_PGR2_PLR0_PKA1_SGROB0_SIA3_SS1_SU16_SUM0_SUS256_SPO0_SRVW0_SSO0_SVW1_SK0_SKFTR0_SKXCCM0_SGRO0_TIN0_TLDS1_TLDSM1_ULSGRO0_USL1_UIOFGRO0_USFGROn1_VSn1_VWA1_VWB1_WSGRA0_WSGRB0_WS64_WG32_8_1_WGM8_WGMXCC8_WGMXCCGn1
- - - [8, 14336, 1, 4096]
    - [0, 27.09]
  - - [8, 4096, 1, 14336]
    - [1, 25.13]
  - - [14336, 8, 1, 4096]
    - [2, 15.25]
  - - [4096, 8, 1, 14336]
    - [3, 15.2]
  - - [10240, 10240, 1, 2560]
    - [47, 629.99]
  - - [10240, 10240, 1, 3840]
    - [47, 657.06]
  - - [10240, 10240, 1, 5120]
    - [48, 670.5]
  - - [10240, 10240, 1, 6400]
    - [41, 658.21]
  - - [10240, 10240, 1, 7680]
    - [41, 660.35]
  - - [10240, 10240, 1, 8960]
    - [41, 690.02]
  - - [10240, 10240, 1, 10240]
    - [42, 681.22]
  - - [10240, 10240, 1, 11520]
    - [49, 655.76]
  - - [10240, 10240, 1, 12800]
    - [48, 632.65]
  - - [10240, 10240, 1, 14080]
    - [50, 626.58]
  - - [10240, 10240, 1, 15360]
    - [5, 599.98]
  - - [10240, 10240, 1, 16640]
    - [51, 613.4]
  - - [10240, 10240, 1, 17920]
    - [52, 612.15]
  - - [10240, 10240, 1, 19200]
    - [53, 612.85]
  - - [10240, 10240, 1, 20480]
    - [54, 621.2]
  - - [10240, 10240, 1, 21760]
    - [6, 603.36]
  - - [10240, 10240, 1, 23040]
    - [5, 600.59]
  - - [10240, 10240, 1, 24320]
    - [5, 600.48]
  - - [768, 1536, 1, 3072]
    - [7, 146.32]
  - - [768, 17664, 1, 3072]
    - [19, 557.02]
  - - [768, 196608, 1, 3072]
    - [20, 603.97]
  - - [768, 24576, 1, 3072]
    - [8, 437.92]
  - - [768, 6144, 1, 3072]
    - [9, 313.99]
  - - [768, 98304, 1, 3072]
    - [19, 570.31]
  - - [3072, 3072, 1, 10240]
    - [56, 516.07]
  - - [1536, 3072, 1, 768]
    - [11, 205.17]
  - - [3072, 17664, 1, 768]
    - [12, 389.6]
  - - [3072, 196608, 1, 768]
    - [10, 490.03]
  - - [3072, 24576, 1, 768]
    - [13, 430.31]
  - - [3072, 6144, 1, 768]
    - [14, 343.9]
  - - [3072, 98304, 1, 768]
    - [10, 481.83]
  - - [768, 1536, 1, 768]
    - [15, 85.7]
  - - [768, 17664, 1, 768]
    - [16, 363.69]
  - - [768, 196608, 1, 768]
    - [16, 479.35]
  - - [768, 24576, 1, 768]
    - [17, 349.78]
  - - [768, 6144, 1, 768]
    - [11, 205.12]
  - - [768, 98304, 1, 768]
    - [18, 431.5]
  - - [1536, 768, 1, 3072]
    - [21, 135.55]
  - - [17664, 768, 1, 3072]
    - [5, 487.78]
  - - [196608, 768, 1, 3072]
    - [23, 545.11]
  - - [24576, 768, 1, 3072]
    - [24, 389.25]
  - - [6144, 768, 1, 3072]
    - [25, 288.86]
  - - [98304, 768, 1, 3072]
    - [30, 524.52]
  - - [3072, 1536, 1, 768]
    - [26, 205.83]
  - - [17664, 3072, 1, 768]
    - [13, 390.83]
  - - [196608, 3072, 1, 768]
    - [22, 425.4]
  - - [24576, 3072, 1, 768]
    - [4, 429.54]
  - - [6144, 3072, 1, 768]
    - [14, 346.56]
  - - [98304, 3072, 1, 768]
    - [31, 480.9]
  - - [1536, 768, 1, 768]
    - [27, 84.3]
  - - [17664, 768, 1, 768]
    - [4, 357.32]
  - - [196608, 768, 1, 768]
    - [10, 428.23]
  - - [24576, 768, 1, 768]
    - [28, 319.16]
  - - [6144, 768, 1, 768]
    - [25, 201.72]
  - - [98304, 768, 1, 768]
    - [29, 401.76]
  - - [131072, 3840, 1, 1280]
    - [32, 538.74]
  - - [131072, 1280, 1, 5120]
    - [33, 631.0]
  - - [16384, 3072, 1, 1024]
    - [34, 561.89]
  - - [16384, 4096, 1, 1024]
    - [35, 561.41]
  - - [16384, 1024, 1, 1024]
    - [36, 514.59]
  - - [16384, 1024, 1, 4096]
    - [37, 610.86]
  - - [133120, 512, 1, 6144]
    - [38, 527.6]
  - - [20544, 512, 1, 6144]
    - [55, 491.02]
  - - [133120, 1024, 1, 6144]
    - [39, 596.72]
  - - [20544, 1024, 1, 6144]
    - [55, 521.91]
  - - [4096, 4096, 1, 10240]
    - [33, 701.19]
  - - [5120, 5120, 1, 10240]
    - [33, 649.61]
  - - [6144, 6144, 1, 10240]
    - [33, 625.05]
  - - [7168, 7168, 1, 10240]
    - [40, 628.37]
  - - [8192, 8192, 1, 10240]
    - [41, 724.58]
  - - [9216, 9216, 1, 10240]
    - [41, 680.81]
  - - [11264, 11264, 1, 10240]
    - [42, 692.76]
  - - [12288, 12288, 1, 10240]
    - [43, 695.24]
  - - [13312, 13312, 1, 10240]
    - [33, 656.03]
  - - [14336, 14336, 1, 10240]
    - [44, 632.97]
  - - [15360, 15360, 1, 10240]
    - [41, 632.28]
  - - [16384, 16384, 1, 10240]
    - [40, 679.01]
  - - [17408, 17408, 1, 10240]
    - [45, 632.74]
  - - [18432, 18432, 1, 10240]
    - [46, 634.42]
  - - [19456, 19456, 1, 10240]
    - [44, 646.03]
  - - [20480, 20480, 1, 10240]
    - [44, 662.61]
- null
- null
- DeviceEfficiency
- Equality
