projects/hipsparselt/library/src/hcc_detail/rocsparselt/src/spmm/Tensile/Logic/asm_full/gfx950/Equality/gfx950_Cijk_Alik_Bjlk_BBS_BH_Bias_FDMN_SPB_A_S_SAV.yaml
- {MinimumRequiredVersion: 5.0.0}
- gfx950
- gfx950
- [Device 75a3, Device 75a0]
    SolutionIndex: 0
    SolutionNameMin: Cijk_Alik_Bjlk_BBS_BH_Bias_FDMN_SPB_A_S_SAV_MT16x64x256_MI16x16x1_SN_LDSB0_AFC1_AG0_AFEM1_AFEM1_ASEM8_CLR1_CADS0_DTLA0_DTLB0_DTVA0_DTVB0_EPS1_FDSI0_GRPM1_GRVWA8_GRVWB8_GSU1_GSUAMBSK_GSUC0_GSUWGMRR0_GLS0_ISA950_IU1_K1_LDSTI0_LBSPPA512_LBSPPB1024_LBSPPM0_LPA16_LPB32_LPM0_LRVW8_LWPMn1_MIAV0_MIWT1_2_MO40_NTn1_NTA0_NTB0_NTC0_NTD0_NTM0_NEPBS16_NLCA1_NLCB1_ONLL1_PGR2_PLR1_PKA1_SIA3_SS1_SU0_SUM0_SUS512_SPO0_SRVW0_SSO0_SVW1_SK0_SKFTR0_SKXCCM0_TLDS1_ULSGRO0_USL1_UIOFGRO0_USFGROn1_VSn1_VWA1_VWB2_WSGRA0_WSGRB0_WS64_WG16_8_1_WGM1_WGMXCC1_WGMXCCGn1
    SolutionIndex: 1
    SolutionNameMin: Cijk_Alik_Bjlk_BBS_BH_Bias_FDMN_SPB_A_S_SAV_MT16x64x256_MI16x16x1_SN_LDSB0_AFC1_AG0_AFEM1_AFEM1_ASEM8_CLR1_CADS0_DTLA0_DTLB0_DTVA0_DTVB0_EPS1_FDSI0_GRPM1_GRVWA8_GRVWB8_GSU4_GSUAMBSK_GSUC0_GSUWGMRR0_GLS0_ISA950_IU1_K1_LDSTI0_LBSPPA512_LBSPPB1024_LBSPPM0_LPA16_LPB32_LPM0_LRVW8_LWPMn1_MIAV0_MIWT1_2_MO40_NTn1_NTA0_NTB0_NTC0_NTD0_NTM0_NEPBS16_NLCA1_NLCB1_ONLL1_PGR2_PLR1_PKA1_SIA3_SS1_SU0_SUM0_SUS512_SPO0_SRVW0_SSO0_SVW1_SK0_SKFTR0_SKXCCM0_TLDS1_ULSGRO0_USL1_UIOFGRO0_USFGROn1_VSn1_VWA1_VWB2_WSGRA0_WSGRB0_WS64_WG16_8_1_WGM1_WGMXCC8_WGMXCCGn1
    SolutionIndex: 2
    SolutionNameMin: Cijk_Alik_Bjlk_BBS_BH_Bias_FDMN_SPB_A_S_SAV_MT64x16x256_MI16x16x1_SN_LDSB1_AFC1_AG0_AFEM1_AFEM1_ASEM8_CLR1_CADS0_DTLA0_DTLB0_DTVA0_DTVB0_EPS1_FDSI0_GRPM1_GRVWA8_GRVWB8_GSU1_GSUAMB_GSUC0_GSUWGMRR0_GLS0_ISA950_IU1_K1_LDSTI0_LBSPPA1024_LBSPPB256_LBSPPM0_LPA16_LPB16_LPM0_LRVW8_LWPMn1_MIAV0_MIWT2_1_MO40_NTn1_NTA0_NTB0_NTC0_NTD0_NTM0_NEPBS0_NLCA1_NLCB1_ONLL1_PGR2_PLR1_PKA1_SIA3_SS1_SU0_SUM0_SUS512_SPO0_SRVW0_SSO0_SVW2_SK0_SKFTR0_SKXCCM0_TLDS1_ULSGRO0_USL1_UIOFGRO0_USFGROn1_VSn1_VWA2_VWB1_WSGRA0_WSGRB0_WS64_WG32_4_1_WGM1_WGMXCC1_WGMXCCGn1
    SolutionIndex: 3
    SolutionNameMin: Cijk_Alik_Bjlk_BBS_BH_Bias_FDMN_SPB_A_S_SAV_MT64x16x256_MI16x16x1_SN_LDSB1_AFC1_AG0_AFEM1_AFEM1_ASEM8_CLR1_CADS0_DTLA0_DTLB0_DTVA0_DTVB0_EPS1_FDSI0_GRPM1_GRVWA8_GRVWB8_GSU4_GSUAMBSK_GSUC0_GSUWGMRR0_GLS0_ISA950_IU1_K1_LDSTI0_LBSPPA1024_LBSPPB256_LBSPPM0_LPA16_LPB16_LPM0_LRVW8_LWPMn1_MIAV0_MIWT2_1_MO40_NTn1_NTA0_NTB0_NTC0_NTD4_NTM0_NEPBS16_NLCA1_NLCB1_ONLL1_PGR2_PLR1_PKA1_SIA3_SS1_SU0_SUM0_SUS512_SPO0_SRVW0_SSO0_SVW2_SK0_SKFTR0_SKXCCM0_TLDS1_ULSGRO0_USL1_UIOFGRO0_USFGROn1_VSn1_VWA2_VWB1_WSGRA0_WSGRB0_WS64_WG32_4_1_WGM1_WGMXCC1_WGMXCCGn1
    SolutionIndex: 4
    SolutionNameMin: Cijk_Alik_Bjlk_BBS_BH_Bias_FDMN_SPB_A_S_SAV_MT256x256x64_MI32x32x1_SN_LDSB0_AFC1_AG0_AFEM1_AFEM1_ASEM8_CLR1_CADS0_DTLA0_DTLB0_DTVA0_DTVB0_EPS1_FDSI0_GRPM1_GRVWA8_GRVWB8_GSU1_GSUAMB_GSUC0_GSUWGMRR0_GLS0_ISA950_IU1_K1_LDSTI0_LBSPPA1024_LBSPPB0_LBSPPM0_LPA8_LPB0_LPM0_LRVW8_LWPMn1_MIAV0_MIWT8_2_MO40_NTn1_NTA0_NTB0_NTC0_NTD4_NTM0_NEPBS0_NLCA1_NLCB1_ONLL1_PGR2_PLR1_PKA1_SIA3_SS1_SU0_SUM0_SUS128_SPO0_SRVW0_SSO0_SVW8_SK0_SKFTR0_SKXCCM0_TLDS1_ULSGRO0_USL1_UIOFGRO0_USFGROn1_VSn1_VWA8_VWB2_WSGRA0_WSGRB0_WS64_WG32_8_1_WGM8_WGMXCC8_WGMXCCGn1
    SolutionIndex: 5
    SolutionNameMin: Cijk_Alik_Bjlk_BBS_BH_Bias_FDMN_SPB_A_S_SAV_MT256x256x64_MI32x32x1_SN_LDSB0_AFC1_AG0_AFEM1_AFEM1_ASEM8_CLR1_CADS0_DTLA0_DTLB0_DTVA0_DTVB0_EPS1_FDSI0_GRPM1_GRVWA8_GRVWB8_GSU1_GSUAMB_GSUC0_GSUWGMRR0_GLS0_ISA950_IU1_K1_LDSTI0_LBSPPA512_LBSPPB0_LBSPPM0_LPA8_LPB0_LPM0_LRVW8_LWPMn1_MIAV0_MIWT4_4_MO40_NTn1_NTA0_NTB0_NTC0_NTD4_NTM0_NEPBS0_NLCA1_NLCB1_ONLL1_PGR2_PLR1_PKA1_SIA3_SS1_SU0_SUM0_SUS128_SPO0_SRVW0_SSO0_SVW4_SK0_SKFTR0_SKXCCM0_TLDS1_ULSGRO0_USL1_UIOFGRO0_USFGROn1_VSn1_VWA4_VWB4_WSGRA0_WSGRB0_WS64_WG64_4_1_WGM1_WGMXCC1_WGMXCCGn1
    SolutionIndex: 6
    SolutionNameMin: Cijk_Alik_Bjlk_BBS_BH_Bias_FDMN_SPB_A_S_SAV_MT256x256x64_MI32x32x1_SN_LDSB0_AFC1_AG0_AFEM1_AFEM1_ASEM8_CLR1_CADS0_DTLA0_DTLB0_DTVA0_DTVB0_EPS1_FDSI0_GRPM1_GRVWA8_GRVWB8_GSU1_GSUAMB_GSUC0_GSUWGMRR0_GLS0_ISA950_IU1_K1_LDSTI0_LBSPPA512_LBSPPB0_LBSPPM0_LPA8_LPB0_LPM0_LRVW8_LWPMn1_MIAV0_MIWT4_4_MO40_NTn1_NTA0_NTB0_NTC0_NTD4_NTM0_NEPBS0_NLCA1_NLCB1_ONLL1_PGR2_PLR1_PKA1_SIA3_SS1_SU0_SUM0_SUS128_SPO0_SRVW0_SSO0_SVW4_SK0_SKFTR0_SKXCCM0_TLDS1_ULSGRO0_USL1_UIOFGRO0_USFGROn1_VSn1_VWA4_VWB4_WSGRA0_WSGRB0_WS64_WG64_4_1_WGM8_WGMXCC8_WGMXCCGn1
    SolutionIndex: 7
    SolutionNameMin: Cijk_Alik_Bjlk_BBS_BH_Bias_FDMN_SPB_A_S_SAV_MT96x64x128_MI16x16x1_SN_LDSB0_AFC1_AG0_AFEM1_AFEM1_ASEM8_CLR1_CADS0_DTLA0_DTLB0_DTVA0_DTVB0_EPS1_FDSI0_GRPM1_GRVWA8_GRVWB8_GSU1_GSUAMB_GSUC0_GSUWGMRR0_GLS0_ISA950_IU1_K1_LDSTI0_LBSPPA512_LBSPPB1024_LBSPPM0_LPA16_LPB32_LPM0_LRVW8_LWPMn1_MIAV0_MIWT6_2_MO40_NTn1_NTA0_NTB0_NTC0_NTD4_NTM0_NEPBS0_NLCA1_NLCB1_ONLL1_PGR2_PLR1_PKA1_SIA3_SS1_SU0_SUM0_SUS256_SPO0_SRVW0_SSO0_SVW2_SK0_SKFTR0_SKXCCM0_TLDS1_ULSGRO0_USL1_UIOFGRO0_USFGROn1_VSn1_VWA2_VWB2_WSGRA0_WSGRB0_WS64_WG16_8_1_WGM8_WGMXCC8_WGMXCCGn1
    SolutionIndex: 8
    SolutionNameMin: Cijk_Alik_Bjlk_BBS_BH_Bias_FDMN_SPB_A_S_SAV_MT256x256x64_MI16x16x1_SN_LDSB0_AFC1_AG0_AFEM1_AFEM1_ASEM8_CLR0_CADS0_DTLA0_DTLB0_DTVA0_DTVB0_EPS1_FDSI0_GRPM1_GRVWA8_GRVWB8_GSU1_GSUAMB_GSUC0_GSUWGMRR0_GLS0_ISA950_IU1_K1_LDSTI0_LBSPPA1024_LBSPPB4096_LBSPPM0_LPA16_LPB0_LPM0_LRVW8_LWPMn1_MIAV0_MIWT8_8_MO40_NTn1_NTA0_NTB0_NTC0_NTD0_NTM0_NEPBS0_NLCA1_NLCB1_ONLL1_PGR2_PLR0_PKA1_SIA3_SS1_SU0_SUM0_SUS128_SPO0_SRVW0_SSO0_SVW8_SK0_SKFTR0_SKXCCM0_TLDS1_ULSGRO0_USL1_UIOFGRO0_USFGROn1_VSn1_VWA8_VWB8_WSGRA0_WSGRB0_WS64_WG32_8_1_WGM1_WGMXCC8_WGMXCCGn1
    SolutionIndex: 9
    SolutionNameMin: Cijk_Alik_Bjlk_BBS_BH_Bias_FDMN_SPB_A_S_SAV_MT192x128x128_MI16x16x1_SN_LDSB0_AFC1_AG0_AFEM1_AFEM1_ASEM8_CLR1_CADS0_DTLA0_DTLB0_DTVA0_DTVB0_EPS1_FDSI0_GRPM1_GRVWA8_GRVWB8_GSU1_GSUAMB_GSUC0_GSUWGMRR0_GLS0_ISA950_IU1_K1_LDSTI0_LBSPPA512_LBSPPB2048_LBSPPM0_LPA16_LPB0_LPM0_LRVW8_LWPMn1_MIAV0_MIWT6_4_MO40_NTn1_NTA0_NTB0_NTC0_NTD4_NTM0_NEPBS0_NLCA1_NLCB1_ONLL1_PGR2_PLR1_PKA1_SIA3_SS1_SU0_SUM0_SUS256_SPO0_SRVW0_SSO0_SVW2_SK0_SKFTR0_SKXCCM0_TLDS1_ULSGRO0_USL1_UIOFGRO0_USFGROn1_VSn1_VWA2_VWB4_WSGRA0_WSGRB0_WS64_WG32_8_1_WGM1_WGMXCC8_WGMXCCGn1
    SolutionIndex: 10
    SolutionNameMin: Cijk_Alik_Bjlk_BBS_BH_Bias_FDMN_SPB_A_S_SAV_MT192x128x128_MI16x16x1_SN_LDSB1_AFC1_AG0_AFEM1_AFEM1_ASEM8_CLR1_CADS0_DTLA0_DTLB0_DTVA0_DTVB0_EPS1_FDSI0_GRPM1_GRVWA8_GRVWB8_GSU1_GSUAMB_GSUC0_GSUWGMRR0_GLS0_ISA950_IU1_K1_LDSTI0_LBSPPA512_LBSPPB2048_LBSPPM0_LPA16_LPB0_LPM0_LRVW8_LWPMn1_MIAV0_MIWT6_4_MO40_NTn1_NTA0_NTB0_NTC0_NTD4_NTM0_NEPBS0_NLCA1_NLCB1_ONLL1_PGR2_PLR1_PKA1_SIA3_SS1_SU0_SUM0_SUS256_SPO0_SRVW0_SSO0_SVW2_SK0_SKFTR0_SKXCCM0_TLDS1_ULSGRO0_USL1_UIOFGRO0_USFGROn1_VSn1_VWA2_VWB4_WSGRA0_WSGRB0_WS64_WG32_8_1_WGM1_WGMXCC1_WGMXCCGn1
    SolutionIndex: 11
    SolutionNameMin: Cijk_Alik_Bjlk_BBS_BH_Bias_FDMN_SPB_A_S_SAV_MT192x128x64_MI16x16x1_SN_LDSB1_AFC1_AG0_AFEM1_AFEM1_ASEM8_CLR0_CADS0_DTLA0_DTLB0_DTVA0_DTVB0_EPS1_FDSI0_GRPM1_GRVWA8_GRVWB8_GSU1_GSUAMB_GSUC0_GSUWGMRR0_GLS0_ISA950_IU1_K1_LDSTI0_LBSPPA256_LBSPPB2048_LBSPPM0_LPA16_LPB0_LPM0_LRVW8_LWPMn1_MIAV0_MIWT6_4_MO40_NTn1_NTA0_NTB0_NTC0_NTD4_NTM0_NEPBS0_NLCA1_NLCB1_ONLL1_PGR2_PLR0_PKA1_SIA3_SS1_SU0_SUM0_SUS128_SPO0_SRVW0_SSO0_SVW2_SK0_SKFTR0_SKXCCM0_TLDS1_ULSGRO0_USL1_UIOFGRO0_USFGROn1_VSn1_VWA2_VWB4_WSGRA0_WSGRB0_WS64_WG32_8_1_WGM1_WGMXCC1_WGMXCCGn1
    SolutionIndex: 12
    SolutionNameMin: Cijk_Alik_Bjlk_BBS_BH_Bias_FDMN_SPB_A_S_SAV_MT64x128x128_MI16x16x1_SN_LDSB0_AFC1_AG0_AFEM1_AFEM1_ASEM8_CLR1_CADS0_DTLA0_DTLB0_DTVA0_DTVB0_EPS1_FDSI0_GRPM1_GRVWA8_GRVWB8_GSU1_GSUAMB_GSUC0_GSUWGMRR0_GLS0_ISA950_IU1_K1_LDSTI0_LBSPPA1024_LBSPPB2048_LBSPPM0_LPA16_LPB32_LPM0_LRVW8_LWPMn1_MIAV0_MIWT4_2_MO40_NTn1_NTA0_NTB0_NTC0_NTD4_NTM0_NEPBS0_NLCA1_NLCB1_ONLL1_PGR2_PLR1_PKA1_SIA3_SS1_SU0_SUM0_SUS256_SPO0_SRVW0_SSO0_SVW4_SK0_SKFTR0_SKXCCM0_TLDS1_ULSGRO0_USL1_UIOFGRO0_USFGROn1_VSn1_VWA4_VWB2_WSGRA0_WSGRB0_WS64_WG16_16_1_WGM1_WGMXCC1_WGMXCCGn1
    SolutionIndex: 13
    SolutionNameMin: Cijk_Alik_Bjlk_BBS_BH_Bias_FDMN_SPB_A_S_SAV_MT96x256x64_MI16x16x1_SN_LDSB0_AFC1_AG0_AFEM1_AFEM1_ASEM8_CLR0_CADS0_DTLA0_DTLB0_DTVA0_DTVB0_EPS1_FDSI0_GRPM1_GRVWA8_GRVWB8_GSU1_GSUAMB_GSUC0_GSUWGMRR0_GLS0_ISA950_IU1_K1_LDSTI0_LBSPPA256_LBSPPB4096_LBSPPM0_LPA16_LPB0_LPM0_LRVW8_LWPMn1_MIAV0_MIWT6_4_MO40_NTn1_NTA0_NTB0_NTC0_NTD4_NTM0_NEPBS0_NLCA1_NLCB1_ONLL1_PGR2_PLR0_PKA1_SIA3_SS1_SU0_SUM0_SUS128_SPO0_SRVW0_SSO0_SVW2_SK0_SKFTR0_SKXCCM0_TLDS1_ULSGRO0_USL1_UIOFGRO0_USFGROn1_VSn1_VWA2_VWB4_WSGRA0_WSGRB0_WS64_WG16_16_1_WGM1_WGMXCC8_WGMXCCGn1
    SolutionIndex: 14
    SolutionNameMin: Cijk_Alik_Bjlk_BBS_BH_Bias_FDMN_SPB_A_S_SAV_MT192x128x128_MI16x16x1_SN_LDSB1_AFC1_AG0_AFEM1_AFEM1_ASEM8_CLR1_CADS0_DTLA0_DTLB0_DTVA0_DTVB0_EPS1_FDSI0_GRPM1_GRVWA8_GRVWB8_GSU1_GSUAMB_GSUC0_GSUWGMRR0_GLS0_ISA950_IU1_K1_LDSTI0_LBSPPA512_LBSPPB2048_LBSPPM0_LPA16_LPB0_LPM0_LRVW8_LWPMn1_MIAV0_MIWT6_4_MO40_NTn1_NTA0_NTB0_NTC0_NTD4_NTM0_NEPBS0_NLCA1_NLCB1_ONLL1_PGR2_PLR1_PKA1_SIA3_SS1_SU0_SUM0_SUS256_SPO0_SRVW0_SSO0_SVW2_SK0_SKFTR0_SKXCCM0_TLDS1_ULSGRO0_USL1_UIOFGRO0_USFGROn1_VSn1_VWA2_VWB4_WSGRA0_WSGRB0_WS64_WG32_8_1_WGM1_WGMXCC8_WGMXCCGn1
    SolutionIndex: 15
    SolutionNameMin: Cijk_Alik_Bjlk_BBS_BH_Bias_FDMN_SPB_A_S_SAV_MT256x256x64_MI32x32x1_SN_LDSB0_AFC1_AG0_AFEM1_AFEM1_ASEM8_CLR1_CADS0_DTLA0_DTLB0_DTVA0_DTVB0_EPS1_FDSI0_GRPM1_GRVWA8_GRVWB8_GSU1_GSUAMB_GSUC0_GSUWGMRR0_GLS0_ISA950_IU1_K1_LDSTI0_LBSPPA512_LBSPPB0_LBSPPM0_LPA8_LPB0_LPM0_LRVW8_LWPMn1_MIAV0_MIWT4_4_MO40_NTn1_NTA0_NTB0_NTC0_NTD4_NTM0_NEPBS0_NLCA1_NLCB1_ONLL1_PGR2_PLR1_PKA1_SIA3_SS1_SU0_SUM0_SUS128_SPO0_SRVW0_SSO0_SVW4_SK0_SKFTR0_SKXCCM0_TLDS1_ULSGRO0_USL1_UIOFGRO0_USFGROn1_VSn1_VWA4_VWB4_WSGRA0_WSGRB0_WS64_WG64_4_1_WGM8_WGMXCC1_WGMXCCGn1
    SolutionIndex: 16
    SolutionNameMin: Cijk_Alik_Bjlk_BBS_BH_Bias_FDMN_SPB_A_S_SAV_MT192x384x64_MI32x32x1_SN_LDSB0_AFC1_AG0_AFEM1_AFEM1_ASEM8_CLR1_CADS0_DTLA0_DTLB0_DTVA0_DTVB0_EPS1_FDSI0_GRPM1_GRVWA8_GRVWB8_GSU1_GSUAMB_GSUC0_GSUWGMRR0_GLS0_ISA950_IU1_K1_LDSTI0_LBSPPA128_LBSPPB0_LBSPPM0_LPA8_LPB0_LPM0_LRVW8_LWPMn1_MIAV0_MIWT3_6_MO40_NTn1_NTA0_NTB0_NTC0_NTD4_NTM0_NEPBS0_NLCA1_NLCB3_ONLL1_PGR2_PLR1_PKA1_SIA3_SS1_SU0_SUM0_SUS128_SPO0_SRVW0_SSO0_SVW1_SK0_SKFTR0_SKXCCM0_TLDS1_ULSGRO0_USL1_UIOFGRO0_USFGROn1_VSn1_VWA1_VWB2_WSGRA0_WSGRB0_WS64_WG64_4_1_WGM8_WGMXCC8_WGMXCCGn1
    SolutionIndex: 17
    SolutionNameMin: Cijk_Alik_Bjlk_BBS_BH_Bias_FDMN_SPB_A_S_SAV_MT256x256x64_MI32x32x1_SN_LDSB0_AFC1_AG0_AFEM1_AFEM1_ASEM8_CLR1_CADS0_DTLA0_DTLB0_DTVA0_DTVB0_EPS1_FDSI0_GRPM1_GRVWA8_GRVWB8_GSU1_GSUAMB_GSUC0_GSUWGMRR0_GLS0_ISA950_IU1_K1_LDSTI0_LBSPPA1024_LBSPPB0_LBSPPM0_LPA8_LPB0_LPM0_LRVW8_LWPMn1_MIAV0_MIWT8_2_MO40_NTn1_NTA0_NTB0_NTC0_NTD4_NTM0_NEPBS0_NLCA1_NLCB1_ONLL1_PGR2_PLR1_PKA1_SIA3_SS1_SU0_SUM0_SUS128_SPO0_SRVW0_SSO0_SVW8_SK0_SKFTR0_SKXCCM0_TLDS1_ULSGRO0_USL1_UIOFGRO0_USFGROn1_VSn1_VWA8_VWB2_WSGRA0_WSGRB0_WS64_WG32_8_1_WGM1_WGMXCC1_WGMXCCGn1
    SolutionIndex: 18
    SolutionNameMin: Cijk_Alik_Bjlk_BBS_BH_Bias_FDMN_SPB_A_S_SAV_MT256x256x64_MI32x32x1_SN_LDSB1_AFC1_AG0_AFEM1_AFEM1_ASEM8_CLR1_CADS0_DTLA0_DTLB0_DTVA0_DTVB0_EPS1_FDSI0_GRPM1_GRVWA8_GRVWB8_GSU1_GSUAMB_GSUC0_GSUWGMRR0_GLS0_ISA950_IU1_K1_LDSTI0_LBSPPA1024_LBSPPB0_LBSPPM0_LPA8_LPB0_LPM0_LRVW8_LWPMn1_MIAV0_MIWT8_2_MO40_NTn1_NTA0_NTB0_NTC0_NTD4_NTM0_NEPBS0_NLCA1_NLCB1_ONLL1_PGR2_PLR1_PKA1_SIA3_SS1_SU0_SUM0_SUS128_SPO0_SRVW0_SSO0_SVW8_SK0_SKFTR0_SKXCCM0_TLDS1_ULSGRO0_USL1_UIOFGRO0_USFGROn1_VSn1_VWA8_VWB2_WSGRA0_WSGRB0_WS64_WG32_8_1_WGM8_WGMXCC8_WGMXCCGn1
    SolutionIndex: 19
    SolutionNameMin: Cijk_Alik_Bjlk_BBS_BH_Bias_FDMN_SPB_A_S_SAV_MT256x256x64_MI32x32x1_SN_LDSB0_AFC1_AG0_AFEM1_AFEM1_ASEM8_CLR1_CADS0_DTLA0_DTLB0_DTVA0_DTVB0_EPS1_FDSI0_GRPM1_GRVWA8_GRVWB8_GSU1_GSUAMB_GSUC0_GSUWGMRR0_GLS0_ISA950_IU1_K1_LDSTI0_LBSPPA1024_LBSPPB0_LBSPPM0_LPA8_LPB0_LPM0_LRVW8_LWPMn1_MIAV0_MIWT8_2_MO40_NTn1_NTA0_NTB0_NTC0_NTD4_NTM0_NEPBS0_NLCA1_NLCB1_ONLL1_PGR2_PLR1_PKA1_SIA3_SS1_SU0_SUM0_SUS128_SPO0_SRVW0_SSO0_SVW8_SK0_SKFTR0_SKXCCM0_TLDS1_ULSGRO0_USL1_UIOFGRO0_USFGROn1_VSn1_VWA8_VWB2_WSGRA0_WSGRB0_WS64_WG32_8_1_WGM1_WGMXCC8_WGMXCCGn1
    SolutionIndex: 20
    SolutionNameMin: Cijk_Alik_Bjlk_BBS_BH_Bias_FDMN_SPB_A_S_SAV_MT256x256x64_MI32x32x1_SN_LDSB0_AFC1_AG0_AFEM1_AFEM1_ASEM8_CLR1_CADS0_DTLA0_DTLB0_DTVA0_DTVB0_EPS1_FDSI0_GRPM1_GRVWA8_GRVWB8_GSU1_GSUAMB_GSUC0_GSUWGMRR0_GLS0_ISA950_IU1_K1_LDSTI0_LBSPPA1024_LBSPPB0_LBSPPM0_LPA8_LPB0_LPM0_LRVW8_LWPMn1_MIAV0_MIWT8_2_MO40_NTn1_NTA0_NTB0_NTC0_NTD4_NTM0_NEPBS0_NLCA1_NLCB1_ONLL1_PGR2_PLR1_PKA1_SIA3_SS1_SU0_SUM0_SUS128_SPO0_SRVW0_SSO0_SVW8_SK0_SKFTR0_SKXCCM0_TLDS1_ULSGRO0_USL1_UIOFGRO0_USFGROn1_VSn1_VWA8_VWB2_WSGRA0_WSGRB0_WS64_WG32_8_1_WGM8_WGMXCC1_WGMXCCGn1
    SolutionIndex: 21
    SolutionNameMin: Cijk_Alik_Bjlk_BBS_BH_Bias_FDMN_SPB_A_S_SAV_MT96x64x128_MI16x16x1_SN_LDSB0_AFC1_AG0_AFEM1_AFEM1_ASEM8_CLR1_CADS0_DTLA0_DTLB0_DTVA0_DTVB0_EPS1_FDSI0_GRPM1_GRVWA8_GRVWB8_GSU1_GSUAMB_GSUC0_GSUWGMRR0_GLS0_ISA950_IU1_K1_LDSTI0_LBSPPA256_LBSPPB1024_LBSPPM0_LPA16_LPB32_LPM0_LRVW8_LWPMn1_MIAV0_MIWT3_2_MO40_NTn1_NTA0_NTB0_NTC0_NTD4_NTM0_NEPBS0_NLCA1_NLCB1_ONLL1_PGR2_PLR1_PKA1_SIA3_SS1_SU0_SUM0_SUS256_SPO0_SRVW0_SSO0_SVW1_SK0_SKFTR0_SKXCCM0_TLDS1_ULSGRO0_USL1_UIOFGRO0_USFGROn1_VSn1_VWA1_VWB2_WSGRA0_WSGRB0_WS64_WG32_8_1_WGM1_WGMXCC1_WGMXCCGn1
    SolutionIndex: 22
    SolutionNameMin: Cijk_Alik_Bjlk_BBS_BH_Bias_FDMN_SPB_A_S_SAV_MT96x192x128_MI16x16x1_SN_LDSB0_AFC1_AG0_AFEM1_AFEM1_ASEM8_CLR1_CADS0_DTLA0_DTLB0_DTVA0_DTVB0_EPS1_FDSI0_GRPM1_GRVWA8_GRVWB8_GSU1_GSUAMB_GSUC0_GSUWGMRR0_GLS0_ISA950_IU1_K1_LDSTI0_LBSPPA256_LBSPPB3072_LBSPPM0_LPA16_LPB32_LPM0_LRVW8_LWPMn1_MIAV0_MIWT3_6_MO40_NTn1_NTA0_NTB0_NTC0_NTD4_NTM0_NEPBS0_NLCA1_NLCB3_ONLL1_PGR2_PLR1_PKA1_SIA3_SS1_SU0_SUM0_SUS256_SPO0_SRVW0_SSO0_SVW1_SK0_SKFTR0_SKXCCM0_TLDS1_ULSGRO0_USL1_UIOFGRO0_USFGROn1_VSn1_VWA1_VWB2_WSGRA0_WSGRB0_WS64_WG32_8_1_WGM1_WGMXCC1_WGMXCCGn1
    SolutionIndex: 23
    SolutionNameMin: Cijk_Alik_Bjlk_BBS_BH_Bias_FDMN_SPB_A_S_SAV_MT192x128x128_MI16x16x1_SN_LDSB0_AFC1_AG0_AFEM1_AFEM1_ASEM8_CLR1_CADS0_DTLA0_DTLB0_DTVA0_DTVB0_EPS1_FDSI0_GRPM1_GRVWA8_GRVWB8_GSU1_GSUAMB_GSUC0_GSUWGMRR0_GLS0_ISA950_IU1_K1_LDSTI0_LBSPPA512_LBSPPB2048_LBSPPM0_LPA16_LPB0_LPM0_LRVW8_LWPMn1_MIAV0_MIWT6_4_MO40_NTn1_NTA0_NTB0_NTC0_NTD4_NTM0_NEPBS0_NLCA1_NLCB1_ONLL1_PGR2_PLR1_PKA1_SIA3_SS1_SU0_SUM0_SUS256_SPO0_SRVW0_SSO0_SVW2_SK0_SKFTR0_SKXCCM0_TLDS1_ULSGRO0_USL1_UIOFGRO0_USFGROn1_VSn1_VWA2_VWB4_WSGRA0_WSGRB0_WS64_WG32_8_1_WGM1_WGMXCC1_WGMXCCGn1
    SolutionIndex: 24
    SolutionNameMin: Cijk_Alik_Bjlk_BBS_BH_Bias_FDMN_SPB_A_S_SAV_MT192x128x64_MI16x16x1_SN_LDSB1_AFC1_AG0_AFEM1_AFEM1_ASEM8_CLR0_CADS0_DTLA0_DTLB0_DTVA0_DTVB0_EPS1_FDSI0_GRPM1_GRVWA8_GRVWB8_GSU1_GSUAMB_GSUC0_GSUWGMRR0_GLS0_ISA950_IU1_K1_LDSTI0_LBSPPA256_LBSPPB2048_LBSPPM0_LPA16_LPB0_LPM0_LRVW8_LWPMn1_MIAV0_MIWT6_4_MO40_NTn1_NTA0_NTB0_NTC0_NTD4_NTM0_NEPBS0_NLCA1_NLCB1_ONLL1_PGR2_PLR0_PKA1_SIA3_SS1_SU0_SUM0_SUS128_SPO0_SRVW0_SSO0_SVW2_SK0_SKFTR0_SKXCCM0_TLDS1_ULSGRO0_USL1_UIOFGRO0_USFGROn1_VSn1_VWA2_VWB4_WSGRA0_WSGRB0_WS64_WG32_8_1_WGM8_WGMXCC8_WGMXCCGn1
    SolutionIndex: 25
    SolutionNameMin: Cijk_Alik_Bjlk_BBS_BH_Bias_FDMN_SPB_A_S_SAV_MT256x256x64_MI16x16x1_SN_LDSB0_AFC1_AG0_AFEM1_AFEM1_ASEM8_CLR0_CADS0_DTLA0_DTLB0_DTVA0_DTVB0_EPS1_FDSI0_GRPM1_GRVWA8_GRVWB8_GSU1_GSUAMB_GSUC0_GSUWGMRR0_GLS0_ISA950_IU1_K1_LDSTI0_LBSPPA1024_LBSPPB4096_LBSPPM0_LPA16_LPB0_LPM0_LRVW8_LWPMn1_MIAV0_MIWT8_8_MO40_NTn1_NTA0_NTB0_NTC0_NTD4_NTM0_NEPBS0_NLCA1_NLCB1_ONLL1_PGR2_PLR0_PKA1_SIA3_SS1_SU0_SUM0_SUS128_SPO0_SRVW0_SSO0_SVW8_SK0_SKFTR0_SKXCCM0_TLDS1_ULSGRO0_USL1_UIOFGRO0_USFGROn1_VSn1_VWA8_VWB8_WSGRA0_WSGRB0_WS64_WG32_8_1_WGM8_WGMXCC1_WGMXCCGn1
    SolutionIndex: 26
    SolutionNameMin: Cijk_Alik_Bjlk_BBS_BH_Bias_FDMN_SPB_A_S_SAV_MT256x256x64_MI16x16x1_SN_LDSB0_AFC1_AG0_AFEM1_AFEM1_ASEM8_CLR0_CADS0_DTLA0_DTLB0_DTVA0_DTVB0_EPS1_FDSI0_GRPM1_GRVWA8_GRVWB8_GSU1_GSUAMB_GSUC0_GSUWGMRR0_GLS0_ISA950_IU1_K1_LDSTI0_LBSPPA1024_LBSPPB4096_LBSPPM0_LPA16_LPB0_LPM0_LRVW8_LWPMn1_MIAV0_MIWT8_8_MO40_NTn1_NTA0_NTB0_NTC0_NTD4_NTM0_NEPBS0_NLCA1_NLCB1_ONLL1_PGR2_PLR0_PKA1_SIA3_SS1_SU0_SUM0_SUS128_SPO0_SRVW0_SSO0_SVW8_SK0_SKFTR0_SKXCCM0_TLDS1_ULSGRO0_USL1_UIOFGRO0_USFGROn1_VSn1_VWA8_VWB8_WSGRA0_WSGRB0_WS64_WG32_8_1_WGM8_WGMXCC8_WGMXCCGn1
    SolutionIndex: 27
    SolutionNameMin: Cijk_Alik_Bjlk_BBS_BH_Bias_FDMN_SPB_A_S_SAV_MT64x128x128_MI16x16x1_SN_LDSB0_AFC1_AG0_AFEM1_AFEM1_ASEM8_CLR1_CADS0_DTLA0_DTLB0_DTVA0_DTVB0_EPS1_FDSI0_GRPM1_GRVWA8_GRVWB8_GSU1_GSUAMB_GSUC0_GSUWGMRR0_GLS0_ISA950_IU1_K1_LDSTI0_LBSPPA1024_LBSPPB2048_LBSPPM0_LPA16_LPB32_LPM0_LRVW8_LWPMn1_MIAV0_MIWT4_2_MO40_NTn1_NTA0_NTB0_NTC0_NTD4_NTM0_NEPBS0_NLCA1_NLCB1_ONLL1_PGR2_PLR1_PKA1_SIA3_SS1_SU0_SUM0_SUS256_SPO0_SRVW0_SSO0_SVW4_SK0_SKFTR0_SKXCCM0_TLDS1_ULSGRO0_USL1_UIOFGRO0_USFGROn1_VSn1_VWA4_VWB2_WSGRA0_WSGRB0_WS64_WG16_16_1_WGM1_WGMXCC8_WGMXCCGn1
    SolutionIndex: 28
    SolutionNameMin: Cijk_Alik_Bjlk_BBS_BH_Bias_FDMN_SPB_A_S_SAV_MT256x256x64_MI32x32x1_SN_LDSB0_AFC1_AG0_AFEM1_AFEM1_ASEM8_CLR1_CADS0_DTLA0_DTLB0_DTVA0_DTVB0_EPS1_FDSI0_GRPM1_GRVWA8_GRVWB8_GSU1_GSUAMB_GSUC0_GSUWGMRR0_GLS0_ISA950_IU1_K1_LDSTI0_LBSPPA256_LBSPPB0_LBSPPM0_LPA8_LPB0_LPM0_LRVW8_LWPMn1_MIAV0_MIWT8_2_MO40_NTn1_NTA0_NTB0_NTC0_NTD4_NTM0_NEPBS0_NLCA1_NLCB1_ONLL1_PGR2_PLR1_PKA1_SIA3_SS1_SU0_SUM0_SUS128_SPO0_SRVW0_SSO0_SVW2_SK0_SKFTR0_SKXCCM0_TLDS1_ULSGRO0_USL1_UIOFGRO0_USFGROn1_VSn1_VWA2_VWB2_WSGRA0_WSGRB0_WS64_WG32_8_1_WGM8_WGMXCC8_WGMXCCGn1
    SolutionIndex: 29
    SolutionNameMin: Cijk_Alik_Bjlk_BBS_BH_Bias_FDMN_SPB_A_S_SAV_MT256x256x64_MI32x32x1_SN_LDSB0_AFC1_AG0_AFEM1_AFEM1_ASEM8_CLR1_CADS0_DTLA0_DTLB0_DTVA0_DTVB0_EPS1_FDSI0_GRPM1_GRVWA8_GRVWB8_GSU1_GSUAMB_GSUC0_GSUWGMRR0_GLS0_ISA950_IU1_K1_LDSTI0_LBSPPA1024_LBSPPB0_LBSPPM0_LPA8_LPB0_LPM0_LRVW8_LWPMn1_MIAV0_MIWT8_2_MO40_NTn1_NTA0_NTB0_NTC0_NTD0_NTM0_NEPBS0_NLCA1_NLCB1_ONLL1_PGR2_PLR1_PKA1_SIA3_SS1_SU0_SUM0_SUS128_SPO0_SRVW0_SSO0_SVW8_SK0_SKFTR0_SKXCCM0_TLDS1_ULSGRO0_USL1_UIOFGRO0_USFGROn1_VSn1_VWA8_VWB2_WSGRA0_WSGRB0_WS64_WG32_8_1_WGM8_WGMXCC8_WGMXCCGn1
    SolutionIndex: 30
    SolutionNameMin: Cijk_Alik_Bjlk_BBS_BH_Bias_FDMN_SPB_A_S_SAV_MT192x384x64_MI32x32x1_SN_LDSB0_AFC1_AG0_AFEM1_AFEM1_ASEM8_CLR1_CADS0_DTLA0_DTLB0_DTVA0_DTVB0_EPS1_FDSI0_GRPM1_GRVWA8_GRVWB8_GSU1_GSUAMB_GSUC0_GSUWGMRR0_GLS0_ISA950_IU1_K1_LDSTI0_LBSPPA128_LBSPPB0_LBSPPM0_LPA8_LPB0_LPM0_LRVW8_LWPMn1_MIAV0_MIWT3_6_MO40_NTn1_NTA0_NTB0_NTC0_NTD4_NTM0_NEPBS0_NLCA1_NLCB3_ONLL1_PGR2_PLR1_PKA1_SIA3_SS1_SU0_SUM0_SUS128_SPO0_SRVW0_SSO0_SVW1_SK0_SKFTR0_SKXCCM0_TLDS1_ULSGRO0_USL1_UIOFGRO0_USFGROn1_VSn1_VWA1_VWB2_WSGRA0_WSGRB0_WS64_WG64_4_1_WGM1_WGMXCC1_WGMXCCGn1
    SolutionIndex: 31
    SolutionNameMin: Cijk_Alik_Bjlk_BBS_BH_Bias_FDMN_SPB_A_S_SAV_MT192x256x64_MI32x32x1_SN_LDSB0_AFC1_AG0_AFEM1_AFEM1_ASEM8_CLR1_CADS0_DTLA0_DTLB0_DTVA0_DTVB0_EPS1_FDSI0_GRPM1_GRVWA8_GRVWB8_GSU1_GSUAMB_GSUC0_GSUWGMRR0_GLS0_ISA950_IU1_K1_LDSTI0_LBSPPA256_LBSPPB0_LBSPPM0_LPA8_LPB0_LPM0_LRVW8_LWPMn1_MIAV0_MIWT6_2_MO40_NTn1_NTA0_NTB0_NTC0_NTD4_NTM0_NEPBS0_NLCA1_NLCB1_ONLL1_PGR2_PLR1_PKA1_SIA3_SS1_SU0_SUM0_SUS128_SPO0_SRVW0_SSO0_SVW2_SK0_SKFTR0_SKXCCM0_TLDS1_ULSGRO0_USL1_UIOFGRO0_USFGROn1_VSn1_VWA2_VWB2_WSGRA0_WSGRB0_WS64_WG32_8_1_WGM8_WGMXCC8_WGMXCCGn1
    SolutionIndex: 32
    SolutionNameMin: Cijk_Alik_Bjlk_BBS_BH_Bias_FDMN_SPB_A_S_SAV_MT128x128x64_MI32x32x1_SN_LDSB0_AFC1_AG0_AFEM1_AFEM1_ASEM8_CLR1_CADS0_DTLA0_DTLB0_DTVA0_DTVB0_EPS1_FDSI0_GRPM1_GRVWA8_GRVWB8_GSU1_GSUAMB_GSUC0_GSUWGMRR0_GLS0_ISA950_IU1_K1_LDSTI0_LBSPPA512_LBSPPB0_LBSPPM0_LPA8_LPB0_LPM0_LRVW8_LWPMn1_MIAV0_MIWT4_2_MO40_NTn1_NTA0_NTB0_NTC0_NTD4_NTM0_NEPBS0_NLCA1_NLCB1_ONLL1_PGR2_PLR1_PKA1_SIA3_SS1_SU0_SUM0_SUS128_SPO0_SRVW0_SSO0_SVW4_SK0_SKFTR0_SKXCCM0_TLDS1_ULSGRO0_USL1_UIOFGRO0_USFGROn1_VSn1_VWA4_VWB2_WSGRA0_WSGRB0_WS64_WG32_4_1_WGM1_WGMXCC1_WGMXCCGn1
    SolutionIndex: 33
    SolutionNameMin: Cijk_Alik_Bjlk_BBS_BH_Bias_FDMN_SPB_A_S_SAV_MT256x256x64_MI32x32x1_SN_LDSB1_AFC1_AG0_AFEM1_AFEM1_ASEM8_CLR1_CADS0_DTLA0_DTLB0_DTVA0_DTVB0_EPS1_FDSI0_GRPM1_GRVWA8_GRVWB8_GSU1_GSUAMB_GSUC0_GSUWGMRR0_GLS0_ISA950_IU1_K1_LDSTI0_LBSPPA1024_LBSPPB0_LBSPPM0_LPA8_LPB0_LPM0_LRVW8_LWPMn1_MIAV0_MIWT8_2_MO40_NTn1_NTA0_NTB0_NTC0_NTD0_NTM0_NEPBS0_NLCA1_NLCB1_ONLL1_PGR2_PLR1_PKA1_SIA3_SS1_SU0_SUM0_SUS128_SPO0_SRVW0_SSO0_SVW8_SK0_SKFTR0_SKXCCM0_TLDS1_ULSGRO0_USL1_UIOFGRO0_USFGROn1_VSn1_VWA8_VWB2_WSGRA0_WSGRB0_WS64_WG32_8_1_WGM8_WGMXCC8_WGMXCCGn1
- - - [8, 14336, 1, 4096]
    - [0, 27.2]
  - - [8, 4096, 1, 14336]
    - [1, 25.59]
  - - [14336, 8, 1, 4096]
    - [2, 15.62]
  - - [4096, 8, 1, 14336]
    - [3, 15.12]
  - - [10240, 10240, 1, 2560]
    - [4, 629.73]
  - - [10240, 10240, 1, 3840]
    - [5, 669.41]
  - - [10240, 10240, 1, 5120]
    - [5, 679.72]
  - - [10240, 10240, 1, 6400]
    - [5, 685.73]
  - - [10240, 10240, 1, 7680]
    - [5, 690.94]
  - - [10240, 10240, 1, 8960]
    - [5, 711.42]
  - - [10240, 10240, 1, 10240]
    - [5, 700.83]
  - - [10240, 10240, 1, 11520]
    - [5, 684.08]
  - - [10240, 10240, 1, 12800]
    - [5, 661.6]
  - - [10240, 10240, 1, 14080]
    - [6, 654.27]
  - - [10240, 10240, 1, 15360]
    - [6, 654.23]
  - - [10240, 10240, 1, 16640]
    - [6, 659.69]
  - - [10240, 10240, 1, 17920]
    - [6, 653.1]
  - - [10240, 10240, 1, 19200]
    - [4, 633.92]
  - - [10240, 10240, 1, 20480]
    - [4, 654.11]
  - - [10240, 10240, 1, 21760]
    - [4, 658.72]
  - - [10240, 10240, 1, 23040]
    - [4, 652.98]
  - - [10240, 10240, 1, 24320]
    - [4, 646.16]
  - - [768, 1536, 1, 3072]
    - [7, 165.28]
  - - [768, 17664, 1, 3072]
    - [15, 597.23]
  - - [768, 196608, 1, 3072]
    - [8, 646.19]
  - - [768, 24576, 1, 3072]
    - [16, 592.63]
  - - [768, 6144, 1, 3072]
    - [9, 382.4]
  - - [768, 98304, 1, 3072]
    - [4, 620.49]
  - - [3072, 3072, 1, 10240]
    - [31, 530.86]
  - - [1536, 3072, 1, 768]
    - [10, 231.81]
  - - [3072, 17664, 1, 768]
    - [11, 419.17]
  - - [3072, 196608, 1, 768]
    - [17, 525.76]
  - - [3072, 24576, 1, 768]
    - [18, 452.21]
  - - [3072, 6144, 1, 768]
    - [11, 375.26]
  - - [3072, 98304, 1, 768]
    - [17, 526.54]
  - - [768, 1536, 1, 768]
    - [12, 94.29]
  - - [768, 17664, 1, 768]
    - [19, 396.89]
  - - [768, 196608, 1, 768]
    - [20, 519.83]
  - - [768, 24576, 1, 768]
    - [13, 367.27]
  - - [768, 6144, 1, 768]
    - [14, 229.81]
  - - [768, 98304, 1, 768]
    - [20, 463.64]
  - - [1536, 768, 1, 3072]
    - [21, 154.08]
  - - [17664, 768, 1, 3072]
    - [28, 509.64]
  - - [196608, 768, 1, 3072]
    - [29, 591.2]
  - - [24576, 768, 1, 3072]
    - [30, 533.64]
  - - [6144, 768, 1, 3072]
    - [22, 328.1]
  - - [98304, 768, 1, 3072]
    - [29, 557.89]
  - - [3072, 1536, 1, 768]
    - [23, 231.49]
  - - [17664, 3072, 1, 768]
    - [24, 412.27]
  - - [196608, 3072, 1, 768]
    - [25, 431.62]
  - - [24576, 3072, 1, 768]
    - [4, 463.96]
  - - [6144, 3072, 1, 768]
    - [24, 375.13]
  - - [98304, 3072, 1, 768]
    - [4, 524.52]
  - - [1536, 768, 1, 768]
    - [27, 90.42]
  - - [17664, 768, 1, 768]
    - [4, 374.76]
  - - [196608, 768, 1, 768]
    - [26, 436.2]
  - - [24576, 768, 1, 768]
    - [11, 355.28]
  - - [6144, 768, 1, 768]
    - [32, 215.35]
  - - [98304, 768, 1, 768]
    - [33, 388.94]
- null
- null
- DeviceEfficiency
- Equality
